image_name| comment_number| comment
4756089627.jpg| 0| Person wearing a red shirt , blue pants , and white shoes , sitting on curb with cellphone in hands in front of a parking lot of an industrial building .
4758944537.jpg| 0| The guy wearing sunglasses and a hat is singing into a microphone .
4759107378.jpg| 1| A woman checks her cellphone while sitting at a table with another woman .
4763195183.jpg| 0| A nicely dressed woman is looking at her phone while crouching by some windows with her luggage and purse sitting next to her .
4764102456.jpg| 1| A man taking a cellphone picture of a woman in white on a crowded street .
4764124511.jpg| 0| A man in plaid strums and guitar while singing into a microphone in stage .
4764136953.jpg| 1| Zoey Dashnell walks towards a microphone carrying a tambourine .
4767429078.jpg| 1| Outdoor musicians playing brass instruments like saxophone and trumpet .
476919777.jpg| 0| A woman with headphones holding a pen and paper while her feet are propped up on fence .
4769384377.jpg| 0| A woman in a white tank top and blue jean shorts talks on her cellphone while another woman in a blue tank top and gray slacks texts on her cellphone .
4774744625.jpg| 0| A man with a black hat and black shirt is talking on a cellphone and drinking a beer outside .
4774944903.jpg| 0| A young woman with an elaborate hairstyle sings into a microphone in an unspecified situation .
4776818689.jpg| 0| A woman with brown hair wearing sunglasses and a white floral headband stands in front of a microphone while a man in the background holds maracas and plays a drum set .
4779413689.jpg| 0| A man in a pink shirt , sitting on the edge of the telephone booth with his back to us .
4780200205.jpg| 0| A young man is looking around a corner while holding his phone in his hands .
4781005891.jpg| 1| A man in a tie is holding a microphone while the people around him are cheering .
4783274856.jpg| 1| An older woman in a kimono is listening to something with headphones .
478415357.jpg| 0| A woman with an umbrella listens on a mobile phone on the street in front of a graffiti-tagged wall .
4784187336.jpg| 1| A black man is standing with one leg on a short wall talking on his cellphone .
4784638712.jpg| 0| A dark-haired woman with glasses , wearing a white dress , black leggings , ballet flats , and a brown cardigan , holding a tote bag and looking at her phone while walking up a staircase .
4789495327.jpg| 0| A middle-aged woman with red-hair , a white shirt , and a silver beaded necklace is holding a yellow cellphone against her ear while talking .
4791890474.jpg| 0| A man holding a large brown bag stands in front of an entryway , by a large advertisement featuring a child wearing headphones .
4793562214.jpg| 2| A man wearing headphones walks past a wall with red and purple graffiti .
4797050581.jpg| 1| Many people are walking in a large public space , some are talking on cellphones .
4798986110.jpg| 0| A crowd of business travelers lined up at a busy terminal , with many Asian members , one listening to earbuds , and one checking his mobile phone .
4802545255.jpg| 0| A group of 3 girls and two guys standing or sitting around watching a man in a hat and gray shirt play the saxophone .
4803790464.jpg| 1| A man in a gladiator costume is using his cellphone on a busy street .
4804001379.jpg| 0| A redhead young lady walking down the street either listening to her radio or listening to someone on the phone .
4804610884.jpg| 2| A woman in a white shirt and red jeans is carrying a plastic bag and cellphone while walking along the street by art prints .
4806178660.jpg| 0| An African American woman wearing a straw-colored hat and white , fluffy dress is holding a microphone while a band plays behind her .
4807974587.jpg| 0| A man wearing glasses is speaking or singing into a microphone .
4808226861.jpg| 0| A man with long hair and a pink shirt is speaking into a microphone .
4808273728.jpg| 0| Two men and a woman are sitting at a table , the lady is holding a microphone and talking .
4808499283.jpg| 4| Pedestrian checking his cellphone .
4808564802.jpg| 0| A group of people stand facing the same direction while most look at their phones .
4809240949.jpg| 0| A young lady in a red dress with a guitar is playing and singing in the microphone .
4809260553.jpg| 1| A person in red clothing is playing a guitar in front of a microphone .
4809590488.jpg| 0| A woman in a red jacket plays guitar near a microphone and speaker .
4809779959.jpg| 0| A black lady is walking down the sidewalk has a Afro , wearing brown trimmed sunglasses in short gray dress a blue jean jacket carrying a black bag and talking on a cellphone
4809887792.jpg| 0| A young person in a red jumpsuit with white decorative buttons holds a wood grain finished guitar and sings into a microphone .
4810828117.jpg| 2| a man in blue shirt next to a woman in a red scarf talking on the phone
4810828521.jpg| 1| A man who is laying on the floor with headphones on and eyes closed .
4811861915.jpg| 0| A woman is talking on a cellphone on the curb in front of a restaurant .
"4813246656.jpg| 0| An older man in a dark suit is speaking into a microphone at a podium with an "" AMBUC "" banner ."
4813959713.jpg| 0| A black or African descendant woman wearing an orange blouse with large earrings is checking her or looking at her cellphone while carrying a bag next to a bag in a chair with a man behind her in a blue shirt .
4814400575.jpg| 2| A group of people are taking pictures with their phones .
4814948954.jpg| 2| The children sip their drinks together as the young boy makes a phone call .
4816535901.jpg| 0| A man on a bench talks on a cellphone while a man in a hat rides a motorized skateboard down the sidewalk .
4816813345.jpg| 1| A person is listening to music over their headphones while walking down a deserted street .
4817308418.jpg| 1| A man peers from behind the protective cage of a piece of heavy machinery while wearing protective headphones on his head .
4817877393.jpg| 0| A man wearing a top-hat , blue plaid pajama pants , a white shirt , and gold embroidered vest stands in front of an American Flag under a colorfully painted street-front , and speaks to a crowd from a microphone .
4818806718.jpg| 0| An asian woman and man stopping for a brief second to look at a cellphone .
4821256305.jpg| 0| A woman in a blue dress waits for the subway while talking on the phone and holding sunglasses .
4822495419.jpg| 0| A man standing in front of a shop that is closed wearing a bag and eating a yellow Popsicle talking on his cellphone .
4824069230.jpg| 0| Under the circular mirror , a guy checks his mobile phone while sitting alone at the restaurant table near the wall .
"4824278941.jpg| 0| A woman stands across the street from a building called "" Commodore Criterion "" looking at her cellphone ", which two other women cross the street .
4824548067.jpg| 0| A blond woman giving a piggyback ride to a blond girl in a pink coat and headphones .
4826375738.jpg| 0| A man wearing jeans and talking on the phone is standing on the sidewalk next to a blue spot on a building .
4826619341.jpg| 0| Guy in a dark suit , with a cigarette in his right hand while talking on the phone .
4826810171.jpg| 0| A shirtless man is singing into a microphone while a woman next to him plays an accordion .
4827958485.jpg| 0| A musician with a guitar on stage in front of a microphone gesturing to the crowd with the drummer in the background .
4828142606.jpg| 0| A man in a blue shirt is sitting on a doorstep talking on his cellphone .
482830610.jpg| 0| Woman on a train , reading and listening to headphones .
4829887976.jpg| 0| Well i think there amish but there carrying maybe a cellphone or walkie talkie .
4830075359.jpg| 0| a man in a black jacket talking into a microphone .
4830165439.jpg| 0| An elderly man stands at a podium ready to speak into the microphone .
4830848641.jpg| 0| A man in a red striped shirt talks in to a microphone .
4830853107.jpg| 4| A young Asian woman taking a picture with her camera phone .
4831015865.jpg| 0| This short-haired man checks for cellphone service while hiking with his two female companions .
4831324228.jpg| 0| A young man with a mohawk and a black Dio shirt wearing a backpack looks at his phone .
4834395459.jpg| 1| People are walking on the street , and the young tall guy wearing jeans and t-shirt is talking on the phone .
4835236623.jpg| 0| In the city a lady and man are on their phone while an Indian couple pass by .
4835922124.jpg| 2| Women playing on their cellphones on a marta train .
4837452125.jpg| 0| A woman holding a saxophone looks away from a building on a bright day .
4837491077.jpg| 0| A man stands on a transportation platform with earphones and a handheld electronic device .
483884616.jpg| 1| A woman is standing next to a microphone while a crowd gathers to watch .
4838853770.jpg| 4| A young man smiles and holds a cellphone in a greenhouse
4842087231.jpg| 1| A woman with a black shirt and black scarf looks at the camera while holding a cellphone .
4848778878.jpg| 0| A woman in an orange dress walks down the street with a cellphone in her hand .
4849234324.jpg| 0| A man stands outside the entrance to a business , using his cellphone while his briefcase and helmet sit on the ground .
4849250874.jpg| 1| A man is tattooing the arm of another man while the reflection of a man checks his phone .
4850651669.jpg| 0| A young girl with a fake mustache and face paint is riding on rollerskates while talking on her cellphone
4851351270.jpg| 1| A woman in a tan top and jeans is sitting on a bench wearing headphones .
4853218641.jpg| 0| A young teenage girl talking to her boyfriend on the phone about moving into another city
4853382595.jpg| 1| A girl on the phone among the tall cranes in the distance .
4857375236.jpg| 3| A man playing guitar sings into a microphone .
4857763702.jpg| 2| A man standing next to a bike taxi with headphones in his ears .
4857774876.jpg| 0| Closeup picture of a lady in a busy street talking on the phone .
4859164621.jpg| 0| There are four people talking in the phone booths .
4859995088.jpg| 2| A man in shorts and a orange shirt sits on the tailgate of a truck examining a phone .
4860096411.jpg| 1| A sumo wrestler rides the train while listening to headphones .
4860165875.jpg| 0| A blond man in a striped shirt , cutoff jean shorts and glasses walks down the street wearing a backpack and carrying a cellphone .
4860722428.jpg| 0| Three people , two dressed in black and one in floral Capris stand on a sidewalk talking to each other and texting on their cellphones .
4860806028.jpg| 3| A man wearing a baseball hate is checking his phone
4861969983.jpg| 0| An Asian woman in a black dress sitting down next to her purse and dog on a gravel wall looking at her phone .
4865390214.jpg| 0| A man wearing a white shirt is talking on the phone while a little girl wearing blue jeans stands behind him .
486894388.jpg| 0| Young man with short hair and a white shirt wearing headphones tilting his head sideways with his hand while seated in front of a computer screen inside of a room with books on the shelf .
4871515296.jpg| 0| A brown-haired young man wearing a green t-shirt plays a large xylophone outside .
4872533521.jpg| 0| A man , talking on a cellphone , passes a brick building , with a sign on it , repeating ," "" NEVER SLEEP AGAIN . """
4876043682.jpg| 0| A boy in a yellow t-shirt and pink sweater talks on a cellphone while riding a horse through a crowd of people who are looking on .
4878257186.jpg| 1| White male wearing a blue suit jacket stands and talks on his cellphone , while a man wearing black walks behind him carrying bags .
4878658676.jpg| 0| A man in shorts and a pink polo shirt , with a large black backpack and headphones , riding a bike .
4879539161.jpg| 0| A trio of male musicians are performing with one playing a guitar and singing into a microphone , another holding a harmonica , and the third playing a bass guitar .
4880140370.jpg| 0| Man in a black blazer singing or speaking into a microphone , may be a musician or public speaker .
4882407625.jpg| 1| A woman it talking on the phone behind a rack with the big blue plastic bottles .
48833369.jpg| 0| Two men standing on a stage one is holding note cards the other a microphone .
4884189834.jpg| 0| A man is standing on a scissor jack in front of a building holding a cellphone to his ear .
4885270143.jpg| 0| Three red telephone booths are lined up along a street where two people have stopped with their backs to the camera .
4887197185.jpg| 0| A man wearing a red name-brand shirt with stripes on it and red sun glass and a red hat has some kind of music player in his hand that he is listening to with blue earphones .
4887639158.jpg| 0| A woman in a blue tank top and shorts with a concerned look on her face sits on a bench holding a baby and a cellphone .
4888278371.jpg| 0| A woman talking on her cellphone and a man shopping at a small outside shop .
4888307519.jpg| 0| Many people are standing on the street and one young woman is wearing headphones and looking toward the camera .
4889455765.jpg| 4| A group of English musicians are walking down the street playing saxophones and other instruments .
48908641.jpg| 0| A band performs beneath colorful stage lights , the bass player singing into the microphone while the guitarist and drummer play in the background .
48909051.jpg| 0| A band performs a song with a saxophone , guitars , base , drums and a keyboard .
4891059394.jpg| 3| Women in a white shirt with a scarf walking while texting on her phone .
4893597664.jpg| 0| a fat man is listening to headphones sitting on his motorcycle
4894979931.jpg| 0| An older gentleman , wearing a royal blue suit jacket and blue slacks , holding a red microphone while standing on a stage .
4895028664.jpg| 0| A woman is taking a picture of something not in the shot with her phone .
4895768110.jpg| 0| Kids walking on the street , one blond girl wearing a white outfit drinking from a straw , one brown-haired girl in white shorts and dark top , turned around , holding her cellphone .
4895924026.jpg| 0| A stylish looking woman leans against a cafe wall smoking a cigarette and looking at her phone while a pregnant woman walks through the background .
4895977486.jpg| 0| Male in brown leather jacket and black slacks , looking down at his phone , leaning against a brown painted box .
4897359709.jpg| 3| A woman in a leopard print tank top is taking photos on her camera phone .
4898250461.jpg| 1| A man wearing a hat , zip-up , hooded sweater and jeans talks on a mobile phone .
4898538791.jpg| 1| Three young girls sitting on the ground outside by a tree talking and texting on a cellphone .
4900546628.jpg| 0| Two young men , one standing before a microphone and one sitting and drinking from a cup , are on stage , along with two paintings , a white screen , a lamp , and an Apple laptop .
4905858282.jpg| 0| An Asian boy wearing a red shirt with a shaved head that is dyed blond with a red heart is leaning on a counter , talking on a cellular phone .
4908835309.jpg| 3| A girl holding a phone is sitting next to a boy wearing a black hat .
4909669888.jpg| 0| A woman outside on the city streets wearing a black shirt talking on the phone .
4912348669.jpg| 0| An obese white male wearing a blue shirt and khaki shorts sits in front of fountain all while gabbing on phone .
4913169135.jpg| 2| attractive woman in glasses using text message in her cellphone .
4915029510.jpg| 0| A man reading a book on the sidewalk with just his blue pajamas and headphones while sitting on a chair .
4916780082.jpg| 0| A woman is talking on her phone while walking toward an East Asian style gate over a street , while a man on the sidewalk is reading a newspaper .
4920258622.jpg| 0| A blue eyed woman sitting in front of a microphone is smiling .
4920617810.jpg| 0| A woman with a ponytail taking pictures with her phone , standing in a crowd .
4921249499.jpg| 0| A man sitting with his head down on his arm and a roll of toilet paper and a cellphone sitting beside him .
4923272200.jpg| 0| A man is playing the saxophone in the street and some people are sitting on the curb next to the street by him .
4926690990.jpg| 2| Woman talks on her phone while picking up burritos .
4926735881.jpg| 0| A woman with short blond-hair smiling and singing into a microphone while a man in a striped shirt , further back , plays an acoustic guitar .
4927987115.jpg| 0| A white male wears a hat that features Jamaican colors , blue and white striped shirt , black jeans , and brown shoes sits in front of a microphone .
4928921729.jpg| 0| Multiple men fill the scene , one in a white button up shirt using his cellphone , the others wearing pink , orange , and green shirts engaged in various activities in the background .
4929777339.jpg| 0| A woman wearing a purple sweater looks at her cellphone while sitting down .
4931443661.jpg| 0| A man in an orange and white striped shirt sits on a boat holding his phone near his head .
4931775347.jpg| 0| A woman on a pay phone wearing a red skirt , white shirt , and a blue sweater wrapped around her shoulders .
4932737485.jpg| 0| A man in a tropical shirt with leis around his neck is holding a microphone .
4932963561.jpg| 0| A woman with a black jacket and headphones standing next to a building that is under construction .
4932970587.jpg| 2| A man in a black hat is holding a cellular phone in front of his face .
4933452716.jpg| 0| A man wearing a gold chain and a number thirteen jersey talks on his cellphone .
4933550892.jpg| 0| A woman wearing a black dress and green sweater is walking down the street looking at her cellphone .
4934743347.jpg| 0| A woman wearing red flip-flops site on a wall while listening to something with headphones .
4938776115.jpg| 0| A man without a shirt , sitting on a chair on a riverbank , talking on a cellphone .
4939705971.jpg| 0| Young woman with scrabble shoes and white rimmed sunglasses talks and smiles on cellphone while opening package .
4941197779.jpg| 0| A person on a cellphone stands at a window in a high ceiling room with black white an red tile .
4941680934.jpg| 1| A man wearing military clothing and carrying a rifle standing in alley and looking a phone
4948424467.jpg| 0| A man wearing a dark shirt and dark pants is holding a piece of paper and singing into a microphone with two musicians behind him .
4948440838.jpg| 0| A young woman in high heels and a short denim skirt stands holding a cellphone in front of a guard-rail on an urban street .
4948441067.jpg| 0| Several people are singing into microphones and drinking .
4948635454.jpg| 1| A person with tattoos is looking at a photo on a digital camera , or cellphone .
4950264280.jpg| 0| A woman in a white shirt and a skirt is singing into a microphone .
4952694407.jpg| 1| Eight people in blue shits and one woman on her cellphone that is wearing a black shirt and a skirt .
4956409145.jpg| 0| A blond woman in sunglasses and a surprised expression talks on a cellphone while another woman walks past in the foreground .
4958945147.jpg| 4| A man uses his phone on a bench in front of a truck .
4961215860.jpg| 0| A man talks on his mobile phone while pumping gas at a gas station .
4962418713.jpg| 3| A man talks on his cellphone in private .
4963375436.jpg| 1| A woman on a cellphone rests her leg on a building wall .
4964694718.jpg| 0| A young man stands outdoors in front of electronic equipment with his arms folded while another man in the background wears headphones .
4968358093.jpg| 2| A hard working man speaks his mind into his megaphone .
4971580944.jpg| 1| A woman is on the phone looking for something in her bag .
4975224628.jpg| 0| An asian man wearing a blue and white striped shirt speaks on the phone while he is sitting on a silver colored motorbike at a crosswalk .
4977178661.jpg| 0| Four bargemen on a boat two are repairing something while the other two are standing , one of the men is wearing a walkie talkie or phone .
4977719120.jpg| 1| A man is bicycling while talking on his cellphone .
4979318904.jpg| 0| An Asian young woman is walking outside carrying a book and wearing headphones .
4980100317.jpg| 0| A man in colorful orange and yellow clothes listens on a cellphone while crowds of people walk past the building behind him .
4981677799.jpg| 0| A man texts on his cellphone while walking his dog in a picturesque background .
498218245.jpg| 0| A man in a blue cap , black jacket , and jeans walks by a pay phone painted blue .
499340051.jpg| 1| A person is looking at the computer on a desk with a phone and a box .
5006148987.jpg| 0| A man in a brown uniform with his eyes closed speaking into a microphone while wearing a watch .
5024991277.jpg| 0| A bearded singer with black rimmed glasses singing into a microphone .
5033187903.jpg| 0| A dark-haired woman wearing a red polka-dotted dress is standing in front of a microphone .
503872649.jpg| 0| Adult woman wearing a white wedding dress is standing close to a woman wearing a dark purple suit coat , white blouse and a dark dress talking on her cellphone and touching a basket holding a bouquet of flowers .
5039758111.jpg| 0| A blond woman is holding a microphone while smiling and looking to her left .
5041370727.jpg| 1| A middle-aged man with long , curly red-hair wearing a dark vest , shirt and pants is holding a microphone in front of a black backdrop .
5045035726.jpg| 1| Man with black hat , holding microphone next to girl with red-hair looking at a book .
5056620714.jpg| 0| Man in jeans and white t-shirt , holding a microphone and being passed from person to person at concert .
5070037637.jpg| 0| A man with medium length curly hair , wearing a button down shirt and bracelets , sings into a microphone while he plays a guitar .
5077873899.jpg| 0| Man in all black with buzzed black hair and black earring stands with his right knee up and right hand on his knee and belts out into a microphone .
5090324042.jpg| 0| This man holds a teddy bear by the nostrils with one hand , and a microphone in the other .
5091113794.jpg| 0| A man with a mustache and a black shirt is playing the saxophone .
5091152801.jpg| 0| A heavily makeup-ed girl sings into a microphone that she grips with her fire engine red , claw like nails .
509985875.jpg| 0| A man is holding a saxophone in a public place as a woman and a child walk by in the background .
5103801187.jpg| 0| A man with wild hair , wearing a gray sweater is speaking into a microphone in front of an orange graphic that says Pop Tech .
5105522629.jpg| 0| Three men , in front of microphones , are playing their guitars , in front of the man in the middle is a child 's xylophone .
5108562132.jpg| 2| A female playing piano and singing into a microphone .
51148570.jpg| 1| Young children watch in awe as a man plays an instrument similar to a xylophone .
511814053.jpg| 0| Two men , one holding a white cup and the other holding a phone , stand inside a room during the daytime .
5135010022.jpg| 1| Man in white scarf playing a guitar while singing into a microphone , with a shirtless man at the drums in the background .
5144307872.jpg| 0| A dark-haired woman wearing a black dress sings into a microphone at a dark venue .
5167341516.jpg| 3| A woman is standing with a guitar in front of a microphone .
517054016.jpg| 0| A young woman , with frosted brown hair , is putting on lipstick , while listening to someone on her cellphone .
51780996.jpg| 0| A man in military dress is on the phone , while on a boat in water .
518602687.jpg| 0| man sitting in a studio in front of a piano singing into a microphone
5191256340.jpg| 0| A man with a grayish blue shirt , red and blue vest , black pants , sunglasses , and earphones is standing beside a red helicopter , while the door is open revealing the inside of the helicopter , with it 's pilot and other earphones hanging in the background .
5192505155.jpg| 0| A musician wearing a red scarf on his head and holding a microphone , wipes his face as he walks away from a smiling DJ .
5206587376.jpg| 1| A group of people sitting at stadium desks with headphones on with their hands raised .
5214515583.jpg| 0| Three men wearing leather apparel performing in a concert , two singing with microphones and the center artist playing the electric guitar , with lights shining on them , with large screen images behind them and a drum set in the background .
5236666873.jpg| 0| A vocalist installs his microphone for use later that evening .
5238123569.jpg| 0| A bearded male musician in a red flannel shirt is holding a microphone in front of a keyboard , while a female guitar player plays in the background .
5240342253.jpg| 1| A trio of singers , each with a microphone ; two are playing guitar and keyboard .
5241718422.jpg| 1| A man 's running on a treadmill with his headphones are on .
5244864049.jpg| 0| A man in a white shirt playing a white guitar standing in front of a microphone with the light casting a somewhat reddish hue on his shirt
5247590430.jpg| 1| The woman in black while playing guitar , steps up to the microphone and sings .
5250367535.jpg| 0| A woman in a blue coat and a white fisherman 's hat is on the phone while looking away from the gas pump .
5264507624.jpg| 1| Two men , in safety vests , are in a crane bucket working on telephone lines .
5265298056.jpg| 1| A group of teen-agers are seated in a circle around a big skin drum , but one is standing and talking on the cellphone .
528726853.jpg| 0| An oriental women with black sunglasses and a black shirt holding up a cellphone .
5293382329.jpg| 0| A man with long hair talking into a microphone as if on a stage .
