image_name| comment_number| comment
4567068658.jpg| 2| a group of children gather together on the beach and talk about what they see .
4567351269.jpg| 1| a man wearing a red clown nose stand talking to a man holding groceries on a busy city street .
4567711312.jpg| 0| A man with blond dreadlocks , wearing a clown t-shirt , is talking on the phone .
4569656361.jpg| 0| Woman in black and white striped scarf smokes a cigarette while talking with a blond man in a dark jacket .
4569657671.jpg| 2| Lady in black jacket , talking to man in black jacket .
4570406069.jpg| 2| A girl in a red shirt and a guy in a black shirt are sitting on the front porch talking .
4570980278.jpg| 0| Two women wearing jackets and jeans are walking through a park , apparently talking .
4571895229.jpg| 0| Several men are sitting around talking and laughing in an area that is filled with palm trees .
45756278.jpg| 1| A man wearing a blue shirt is talking to two men wearing orange and yellow work vest .
4584266011.jpg| 1| A photo shoot is talking place with a model standing under an umbrella .
4584359306.jpg| 0| Two women sit down in a cafeteria together , while a group of four people appear to talk on the other side of the room .
4584899392.jpg| 0| This shows a group of people some of whom are dressed in kimonos talking to other people while others are watching a fireworks display .
4587060991.jpg| 0| Two guys in front of a souvenir shop , with one guy in a red scarf talking on the phone .
4587844742.jpg| 0| Two blond females , one in a red striped tank top , the second in a blue tank top , sitting at a table , talking .
4587901777.jpg| 2| Some young adults are sitting outside on a patio talking .
4589627804.jpg| 1| A man wearing a bandanna and a woman who is holding a binder are talking on the street .
4590678523.jpg| 0| A man bent over talking to his child with , a toy in between his legs .
4591294546.jpg| 3| There is a woman in a funny looking hat talking to people .
4592281294.jpg| 0| A woman is talking to a child in a carriage that she is pushing .
4600972102.jpg| 0| A young European man with a glass of beer talking to an older man eating a large bag of Lays potato chips .
4603100449.jpg| 1| A small brunette woman looks unhappy as she talks to a tall blond girl , wearing zebra stripes , as they walk down the sidewalk .
4604151896.jpg| 0| A man in a yellow and blue jacket talking to a lady in a brown and white striped shirt .
4604364861.jpg| 0| The police officer riding a horse is talking to a man riding a bike .
4604410267.jpg| 0| A woman with a white jacket , leggings and blue boots walks down the street while talking on her cellphone .
4604969760.jpg| 2| Three girls in jackets walking on the sidewalk talking to each other .
4608645089.jpg| 0| A man with his head covered by a scarf looks opposite of the camera at other pedestrians walking by , while talking on cellphones .
461118477.jpg| 0| A young boy in blue and a young girl in pink play on bamboo stalks .
4611331470.jpg| 1| Two men one in shorts and a button-up shirt , and the other in a blue collared shirt , talking .
4612743480.jpg| 3| The two grandma is talking to each other .
4613887642.jpg| 3| Two women with bags sit on the sidewalk and talk .
4614283206.jpg| 2| A meeting room with a large screen , several people talking , and computers .
4615061039.jpg| 0| A man in a rust-colored hat and brown shirt , talking into a microphone .
4615250594.jpg| 1| Two elderly women sit together and talk with her flowers around her .
4615757994.jpg| 1| A man in a red cap singing ( or talking ) into a microphone during the day with trees in the background .
4617869592.jpg| 1| A group of people are sitting at a table outside having drinks and talking .
4617982332.jpg| 4| 3 people standing around a barbecue talking
4620399509.jpg| 0| An Asian female with a flowered print halter top white dress , wearing a bracelet and necklace and has long dark hair is walking down the street talking on a cellphone .
4621219089.jpg| 3| A woman in a sari is talking to a man in a white shirt .
4621831701.jpg| 0| A man is playing a guitar and talking or singing into a microphone .
4623188792.jpg| 2| Two men , on smoking , talk outside a street-side restaurant .
4625380993.jpg| 2| Two men wearing orange vests and white hard hats are talking .
4626192243.jpg| 3| A man with a beard is talking on the cellphone and standing next to someone who is lying down on the street .
4630825353.jpg| 1| A young woman lays in the middle of a walkway talking on the phone among a group of people .
4631831983.jpg| 3| There are many people talking and laughing wearing very colorful clothing .
4631915030.jpg| 1| A green sign in several languages mentions Facebook and Twitter , while people talk below in the sunlight .
4632504882.jpg| 3| Man talks into bullhorn while standing next to a bicycle with a flag .
4634063005.jpg| 3| A woman talks to a young girl over a counter .
463852657.jpg| 2| The girl shows the lamp to other person and she talks about how it glows .
4638560669.jpg| 0| An older , barefoot boy is talking to a younger , shirtless boy in flip flips in the middle of the street .
4641280657.jpg| 1| A woman talks on her cellphone while walking past a construction area .
4641899410.jpg| 4| Several asian men sit around and talk .
4642473548.jpg| 1| Four women are rowing down the stream in canoes with bamboo stalks and thatched houses on the sideline
4644628615.jpg| 1| A man is sitting on a bench talking on a mobile phone while other people stroll across a walkway above him .
4647908531.jpg| 0| A man in a green shirt , holding a bike in front of him , looking towards an officer talking to several young men .
4648122589.jpg| 0| A woman wearing a black blazer and several pieces of jewelry talking into a microphone while standing in front of a blue backdrop .
4652450030.jpg| 1| A lady with brown hair is talking to a man in front of a motorcycle .
4653315864.jpg| 0| A man talking to a woman while he is holding her arm on a street at night .
4653786114.jpg| 3| Three people wearing costumes are standing around talking .
4654943859.jpg| 1| Asian people talking in a group at a public business .
4655858969.jpg| 0| A woman in a white shirt and a blue vest walking down the sidewalk talking on the phone and drinking a frozen coffee .
4656357252.jpg| 1| The blind woman in the pink shirt is talking to a man outside of the cafe .
4658347592.jpg| 1| Two women are talking on cellphones while sitting on stone stairs .
4661097013.jpg| 1| A woman looks on as a man with folded arms is talking .
4661596520.jpg| 4| People are sitting in a circle and talking to each other .
4661610976.jpg| 1| A man in a light blueish , collared shirt is talking to a group of people .
4661621240.jpg| 3| Two adults talking after class .
4665446842.jpg| 2| A referee talking with a group of girls wearing helmets and rollerskates .
4665612496.jpg| 0| A man and a woman are talking while standing in the middle of a bridge while others prepare to walk past them .
4665880785.jpg| 1| A girl in a striped shirt is drinking from a bottle , while a girl behind her talks on a cellphone .
466761566.jpg| 2| Several men are talking on a street corner .
4668245701.jpg| 0| A man in a yellow shirt and jeans talks to a woman in a floral skirt and blue jacket while standing in front of a large stone building .
4668605108.jpg| 4| The woman is talking to someone .
4669422426.jpg| 1| A teacher is talking to a classroom full of children .
4671642676.jpg| 0| Men in hats talking on a busy street in front of a large blue Chase sign .
4672132178.jpg| 0| Several young people in baseball caps talk and laugh along a street lined with palm trees .
4673379446.jpg| 3| Two men with guitar cases are talking to each other .
4675845861.jpg| 0| A man wearing a blue shirt and blue pants is talking on his cellphone on a street .
4677106896.jpg| 3| A girl sitting on a bike talking to a young boy .
4677117650.jpg| 1| a little girl , by a fence , looks like she is talking on a cellphone .
4681388085.jpg| 2| Two men wearing sunglasses , one wearing a cowboy hat and both in blue shirts , sit and talk .
4682822726.jpg| 0| Man in black shirt and jeans , laughing and talking with girl in white .
4684507723.jpg| 0| Lighted night scene of a military uniformed guard standing outside behind metal street barriers , talking on a radio communications device , in front of a tank .
468604715.jpg| 4| A white male is talking on a microphone .
4686350232.jpg| 1| A man and a woman in green uniforms are talking in an alleyway .
4686365380.jpg| 0| Four people in a room sitting down while a woman in blue talks to another woman sitting behind her .
4688199930.jpg| 3| Three guys talking to each on the beach .
4688759944.jpg| 1| Man and woman sitting and talking near a small waterfall .
4689485382.jpg| 0| An indian lady wearing orange is at the market in front of a bunch of fabric on a table talking to the lady sitting down .
4690244023.jpg| 1| Five Asian teenagers are talking in a group outside a store .
4690256836.jpg| 4| Two people talking walk down the sidewalk .
4691807711.jpg| 0| A man wearing red sunglasses who is sitting down on the side of a water fountain talking on this cellphone , in a public place .
4691873312.jpg| 1| Many people in red sports jerseys walking and talking in a city street .
4692746525.jpg| 0| A large group of people holding signs and an elderly man with a red sports coat , multicolored tie and sailor cap talking with a young girl .
4693475539.jpg| 0| A man wearing black and talking on a cellphone walks past a public train stop which features a men 's fragrance ad on its side .
469386480.jpg| 2| A girl in a brown shirt talks on her phone while a girl and guy play guitar .
4694306241.jpg| 1| A man in a blue cap with a blue sweatshirt is talking on a microphone while a man without a shirt smiles .
4698463256.jpg| 0| There are five people in the picture , two guys talking near a sign for free advice , a man and women facing away and another man on a phone in the background .
4700549201.jpg| 1| On a narrow street lined with houses , some with red awnings , a man talks on his cellphone .
4701518180.jpg| 0| Dressed in high-waisted blue jeans ," boots and a blue shirt with a gold "" B "" on the front is talking on the phone ."
"4703377742.jpg| 0| People are gathered under a big red "" De Koninck "" umbrella while men in orange talk to the side ."
4704942917.jpg| 2| Two men in an art booth are talking to each other
4705913066.jpg| 2| A man is talking in front of a lady sitting behind a table .
470823831.jpg| 2| Street vendors talk to each other while others walk by .
470887785.jpg| 1| A middle eastern woman is talking into a microphone at a protest event .
4710757099.jpg| 3| Several different people sit underneath umbrellas , talking and drinking .
4711423549.jpg| 0| A man , talking on a cellphone , bicycles on the sidewalk , passing under a light-post with a hanging flower pot .
4711637472.jpg| 3| Two women sitting on some stairs and talking .
4716364657.jpg| 4| Two women talk while walking downtown .
4716736879.jpg| 0| An older gentleman wearing a black and red costume and top hat is talking to group of bystanders in front of a castle .
4716793596.jpg| 4| Young boys stop skateboarding to look at statue and talk .
4717130803.jpg| 0| Two old ladies sitting in lounging chairs facing each other , in front of steps talking .
4717481075.jpg| 1| These young ladies are sitting comfortable discussing their food or talking about the woman .
4718115322.jpg| 0| A woman in black talking to a woman in purple standing behind a long table of hats talking about hats .
4718118294.jpg| 1| Two women happily talk to a street vendor in a striped shirt .
4718134968.jpg| 4| People gather and talk in the street .
4718157654.jpg| 2| Man in a blue shirt at a food stand talks to two middle-aged women .
4718415992.jpg| 4| Construction workers stand on a structure talking .
4720749611.jpg| 0| A woman with a black purse and floral print blouse talks on her cellphone outside a city building while a man wearing shorts , muscle shirt and sneakers talks on his cellphone standing in the background behind her .
4721499513.jpg| 1| A couple talking together having drinks in a quiet booth .
4725078805.jpg| 0| A woman in a blue jacket talks on the phone a the boardwalk .
4725695244.jpg| 0| Two ladies are standing in the store and talking , and one is holding the stroller with a baby .
4726652809.jpg| 0| A woman in a purple dress talks on her cellphone and a man reads a book as a two-story bus passes by outside their window .
4726714032.jpg| 1| Nicely dressed woman pose for pictures or stand and talk , while passersby stroll by a fountain .
4728581339.jpg| 2| A woman wearing a hat is sitting on the ground talking on the phone .
4732510897.jpg| 4| A man in a suit is talking on a microphone .
473251659.jpg| 0| A group of people walking in the street , one talking on a cellphone , the man is explaining something .
4732721001.jpg| 0| A woman in pink pants , yellow top and straw hat is walking past a street market talking on a cellphone .
4733490834.jpg| 0| A young woman with blond-hair and a colorful bracelet talks on a cellphone on a windy day .
4734146340.jpg| 1| A man with a orange hat holding a stick is talking to a man wearing sunglasses and wearing a striped shirt .
4734535884.jpg| 3| Two people are sitting outside the restaurant talking .
4735401323.jpg| 1| There is a lady and a man sitting on a bench talking and watching people .
4736070650.jpg| 0| A businessman is talking on his cellphone while smoking a cigarette at an intersection under construction .
47376414.jpg| 2| Four people are in water talking with mountains in the background .
4739278155.jpg| 2| Two police officers are talking to two men who have a robot .
4740643779.jpg| 4| a man talking as he holds a red cloth .
4740975956.jpg| 0| Two policemen talking to a smiling man in dreadlocks on a very crowded street .
4741320398.jpg| 3| Two men are grilling and talking to another man .
4744178742.jpg| 1| A girl with a purple mohawk and a red tank top is pointing and talking to a shirtless guy outside of a building .
4744788268.jpg| 1| Some men in blue uniforms are talking with each other .
4746901297.jpg| 1| 3 old men sitting and talking to one another .
4748679197.jpg| 0| Two police officers are talking to a man sitting on a bench in front of a bus .
4749074780.jpg| 0| A man in a suit talking on a cellphone is walking behind a large sculpture of a pair of eyeglasses .
4751332425.jpg| 1| A girl in black talking on the phone standing in front of brick and a red curtain .
4751932433.jpg| 0| Two men wearing white coats and standing next to sheet talk to each other while a woman wearing a wicker hat and a white coat stands with sheep looks at a woman in a white coat and a man wearing a white coat and white hat both standing next to sheep .
4752074240.jpg| 1| Two nuns stand talking to a person .
4752463128.jpg| 0| A group of office workers sit in chairs in a circle and talk with each other .
4752799475.jpg| 0| Brown-haired girl wearing a green tank top , talking on a cellphone .
4753637884.jpg| 0| On a city street , several people are present , many of them talking and wearing casual outfits , including a man with white pants at the front of the picture who is walking with his back to the camera with a Canadian flag opened and draped down his back .
4754011554.jpg| 0| a bike is on its side in the middle of the road , and firefighters are talking to a man sitting on the curb
4754019742.jpg| 4| A man in a suit is talking in front of a camera .
4755277286.jpg| 1| A woman with purple hair and wearing only a cowboy hat , boots , and a guitar talks to two eclectically dressed women .
4759107378.jpg| 0| Several people are drinking and talking at an outdoor table of a restaurant .
4760482894.jpg| 0| Two women walking down a busy street talking to each other , passing a man in an orange shirt .
4761664623.jpg| 0| An Asian male in a blue jacket and jeans talking with a brown-haired girl sitting on the stairs .
4762117658.jpg| 2| People are standing outside talking next to a car .
4762649269.jpg| 0| A beautiful picture of the late Audrey Hepburn sits in the foreground , while a man and a woman talking on a bench sit in the background .
4763468073.jpg| 2| People are sitting and talking outside a bar in the afternoon .
4763472021.jpg| 2| Men and women are standing on the street talking and drinking .
4763797691.jpg| 2| Three friends stand by the river and talk about old stories .
4764080090.jpg| 2| Two people talk next to a flag with an eye illustration .
4764090898.jpg| 3| Man with cigar talking to other people in a crowd .
4767620642.jpg| 0| A man on a bike wearing a helmet talking to a man walking along side of him in front of a red smart car .
4769384377.jpg| 0| A woman in a white tank top and blue jean shorts talks on her cellphone while another woman in a blue tank top and gray slacks texts on her cellphone .
4771908421.jpg| 3| A man is talking about Hawaii .
4773842539.jpg| 2| A woman is standing and talking to a group of children .
4774482282.jpg| 3| A man and a woman with headbands are talking to kids with their hands raised .
4774744625.jpg| 0| A man with a black hat and black shirt is talking on a cellphone and drinking a beer outside .
4774963615.jpg| 1| A group of three bald men in red sitting on a railing , smoking and talking .
4775776532.jpg| 3| Two young women in black pants and white shirts sit on an electrical box and talk .
4778593226.jpg| 3| Two men waiting and talking on a city street .
4782619449.jpg| 3| Two , elderly gentlemen in kimonos are talking and laughing .
4783077148.jpg| 0| A man in a tank top and shorts is sitting talking to a woman dressed in a red dress , holding a bottle , outside of a building .
478415357.jpg| 2| A woman in brown boots talks on her cellphone and holds an umbrella .
4784187336.jpg| 1| A black man is standing with one leg on a short wall talking on his cellphone .
4784329487.jpg| 0| There is a group of children formed in a circle and talking , while one younger child , in a green shirt , stands singled out and observing .
4788243257.jpg| 1| Lady wearing orange top , brown pants sitting and talking with a lady upon a bench
4788431048.jpg| 2| A man and a woman , each on a bicycle , talk in front of a building .
4789495327.jpg| 0| A middle-aged woman with red-hair , a white shirt , and a silver beaded necklace is holding a yellow cellphone against her ear while talking .
478998804.jpg| 2| A maitre de is talking to people who are standing in line .
4791042801.jpg| 0| An older man with a gray braided beard holds his stomach while talking .
4797050581.jpg| 1| Many people are walking in a large public space , some are talking on cellphones .
4799951910.jpg| 2| Several old men sitting around talking and drinking .
4801623756.jpg| 4| People on the streets walking and talking
4801849846.jpg| 3| Man in pink shirt and tan pants talking a walk .
4804599874.jpg| 3| A group of people eating and talking around a table .
4805949658.jpg| 1| A group of men , with shirts off and some shirts on , are talking on this sunny day .
4808215685.jpg| 4| Two ladies are talking excitedly .
4808270734.jpg| 0| The lady with the brown shirt on is talking with the guy with the white shirt on the sidewalk .
4808273728.jpg| 0| Two men and a woman are sitting at a table , the lady is holding a microphone and talking .
4808499261.jpg| 0| two teen boys wearing black are talking to each other on their sidewalk .
4808564166.jpg| 2| A man wearing white is talking to a man wearing black while standing on a platform .
4808887200.jpg| 0| A large group of people eating and talking in big hall .
4809779959.jpg| 0| A black lady is walking down the sidewalk has a Afro , wearing brown trimmed sunglasses in short gray dress a blue jean jacket carrying a black bag and talking on a cellphone
4810828117.jpg| 2| a man in blue shirt next to a woman in a red scarf talking on the phone
4811454472.jpg| 1| A group of people consisting of 6 people are waiting somewhere while 4 of them are talking to each other .
4811861915.jpg| 0| A woman is talking on a cellphone on the curb in front of a restaurant .
4811895364.jpg| 4| Two men are talking in a house .
4812040741.jpg| 2| Two police talk together in the middle of the road .
4812991186.jpg| 4| 3 people sitting at a table talking
4813609768.jpg| 1| A elderly woman a blue shirt is listening to someone talking to her .
4814949606.jpg| 0| A man in a blue shirt hold his hand up while talking to two ladies in blue shirts .
4816535901.jpg| 0| A man on a bench talks on a cellphone while a man in a hat rides a motorized skateboard down the sidewalk .
4817877393.jpg| 2| A man standing in front of an American flag talks in to a microphone as others watch .
4818675994.jpg| 3| Two women in the middle of the street talking .
4818743912.jpg| 3| Two people are standing and talking with each other .
4820694014.jpg| 0| There are two people on a bench talking and in the background is a woman on a bike walking a dog .
4821256305.jpg| 0| A woman in a blue dress waits for the subway while talking on the phone and holding sunglasses .
4822495419.jpg| 0| A man standing in front of a shop that is closed wearing a bag and eating a yellow Popsicle talking on his cellphone .
482353373.jpg| 0| A girl in a petterned shirt is talking to a guy with a hat in a billiards room .
4826375738.jpg| 0| A man wearing jeans and talking on the phone is standing on the sidewalk next to a blue spot on a building .
4826547083.jpg| 0| A woman wearing sunglasses , white shorts and gray t-shirt is walking her dog and talking to another woman pushing a stroller .
4826619341.jpg| 0| Guy in a dark suit , with a cigarette in his right hand while talking on the phone .
4827152692.jpg| 1| Two older women are sitting on a bench and talking .
4827589646.jpg| 1| One woman in a denim jacket is smoking and talking to another woman in a black jacket .
4827958485.jpg| 2| The man is talking into the microphone while playing the guitar .
4828142606.jpg| 0| A man in a blue shirt is sitting on a doorstep talking on his cellphone .
4829887976.jpg| 0| Well i think there amish but there carrying maybe a cellphone or walkie talkie .
4830075359.jpg| 0| a man in a black jacket talking into a microphone .
4830215458.jpg| 4| Two women , one blond and one brunette , talking .
4830848641.jpg| 0| A man in a red striped shirt talks in to a microphone .
4831245697.jpg| 1| A man wearing a Blue shirt is talking to someone .
4831573541.jpg| 2| A man holding a pink cooler is talking to an older woman .
4834395459.jpg| 1| People are walking on the street , and the young tall guy wearing jeans and t-shirt is talking on the phone .
4835492560.jpg| 0| A young redheaded girl in a blue shirt is walking and talking with a boy in black Pearl Jam shirt .
4835750874.jpg| 0| A young man watches , as three young women talk to another young man , in front of a shop .
483925806.jpg| 1| Two elderly gentleman sitting in scooters talking to one another .
4844721608.jpg| 0| A woman in a wheelchair is talking to her friend while surrounded by other people walking in the park .
4845541718.jpg| 0| There are two people talking in a market filled with many fruits and foods .
4846324908.jpg| 2| Two women talking to one another while a man looks on .
4850651669.jpg| 0| A young girl with a fake mustache and face paint is riding on rollerskates while talking on her cellphone
4850764733.jpg| 3| Two young women walk next to each other and talk .
4851268802.jpg| 0| A man wearing a white shirt is talking to a woman wearing a green blouse on the street
4851434789.jpg| 2| People sit and talk on the ledge of stone public building
4851908792.jpg| 2| Two uniformed men on rollerblades talk to a hooded man in an alley .
4853218641.jpg| 0| A young teenage girl talking to her boyfriend on the phone about moving into another city
4853383129.jpg| 0| Two young blond women wearing summer dresses talk to a young blond man wearing a dress navy uniform , in front of a battleship .
485341861.jpg| 2| Two people talking to someone running for a position .
4854666133.jpg| 2| A boy and a girl are talking while hiking on a park trail together .
4857774876.jpg| 0| Closeup picture of a lady in a busy street talking on the phone .
"4857840142.jpg| 0| A bookstore named "" Shakespeare and Company "" has several persons sitting outside talking to each other ."
4859164621.jpg| 0| There are four people talking in the phone booths .
4859271957.jpg| 1| There is a blond female office and a male brown headed officer standing in front of a pole talking .
4859274169.jpg| 1| A policeman in a blue uniform with yellow letters and a woman are talking .
4860722428.jpg| 0| Three people , two dressed in black and one in floral Capris stand on a sidewalk talking to each other and texting on their cellphones .
4862709647.jpg| 2| A radio station is on the air talking about something .
4862738105.jpg| 4| A black-haired man talks to a woman .
4863204977.jpg| 3| Two friends walking and talking with headdresses on .
4865390214.jpg| 0| A man wearing a white shirt is talking on the phone while a little girl wearing blue jeans stands behind him .
4867368731.jpg| 1| A man in a white button up shirt and red tie talks to people in a restaurant .
4867849913.jpg| 0| A woman behind a fair booth filled with stuffed animals talks to a man with a blue shirt on the other side .
4867858371.jpg| 4| A crowd of people talking and walking around .
4867991300.jpg| 2| A group of women in a room with white walls talking and eating .
