image_name| comment_number| comment
1019604187.jpg| 0| A dog prepares to catch a thrown object in a field with nearby cars .
1020651753.jpg| 0| A white dog is trying to catch a ball in midair over a grassy field .
1030985833.jpg| 1| A brown and black lab are outside and the black lab is catching a toy in its mouth .
1043910339.jpg| 0| A baseball player in red leaps into the air to avoid a player in blue , who is shortly behind him as he catches the ball , while other blue team members look on in the background .
1049955899.jpg| 2| Hikers treks upward through the creek bed , stopping to catch their breath and enjoy the cool , green scenery .
1067180831.jpg| 0| A black and white dog is attempting to catch a yellow and purple object in a low cut yard .
1072153132.jpg| 0| A multicolor dog jumping to catch a tennis ball in a grassy field .
1077931201.jpg| 0| A man in water throwing a little boy up in the air and waiting for him to come down so he can catch him .
109823395.jpg| 4| Man on an ATV catching air !
1107246521.jpg| 3| a black dog jumping to catch a rope toy
1110208841.jpg| 0| a brown and white dog catches a Frisbee in it mouth in front of a group of people .
1176580356.jpg| 0| The brown and black dog is jumping up to catch a red ball .
122019659.jpg| 1| A small child is preparing to catch a baseball with her glove .
1229756013.jpg| 1| A brown dog jumping into the air to catch a ball .
1237985362.jpg| 3| A woman is holding a little girl who is trying to catch bubbles .
123997871.jpg| 0| The woman lacrosse player in blue is about to catch the ball .
1266359954.jpg| 1| A woman in a sweater and blue jeans leans over and catches some sleep on the subway .
128912885.jpg| 0| A white dog is jumping in the air attempting to catch a red ball .
1301337349.jpg| 0| rugby player in white number 25 uniform jumps to catch ball as opponent in green number 29 tries to stop him .
130500771.jpg| 2| The camera catches some movement as a man walks in front of the Alpha Dental Group building .
1338067602.jpg| 3| A man catches a decent sized fish and is taking it off the hook
1346529555.jpg| 1| A Yorkie jumped into the air to catch a red ball in its mouth .
135235570.jpg| 0| A man tries to catch a football on grass surrounded by American flags .
1354131040.jpg| 2| Fisherman with his daily catch on display , his product is fresh .
1355703632.jpg| 1| A teenage girl is catching a softball during a game .
1402640441.jpg| 0| The little boy in red trunks is attempting to catch a soccer ball that is coming towards him .
141126420.jpg| 2| A man in a wetsuit catches a wave on his white surfboard .
141139674.jpg| 0| The boy in the blue shirt is swinging a baseball bat towards a ball as the boy in the red helmet waits to catch him out .
1425069308.jpg| 0| Two dogs in a family room are playing , one is catching a ball in its mouth .
1425529973.jpg| 4| A man trying to catch the fish with a little net .
1433154463.jpg| 4| A man in motion wearing a catchers mitt .
1436760519.jpg| 0| A black and white dog jomps over another black and white dog to catch a cloth Frisbee .
1440024115.jpg| 0| A tri-colored dog jumps and catches a pink frisbeen that a man in shorts has thrown .
1448511770.jpg| 0| A Jack Russell Terrier is measured for distance jumping as he tries to catch a Frisbee .
1454439103.jpg| 2| A catcher and a pitcher of the same team talk on the pitcher 's mound .
1456630952.jpg| 0| A boy is catching an orange Frisbee in front of a wooden gate .
1480467399.jpg| 1| A woman catching some rays and sleeping in the grass .
149934002.jpg| 1| A bunch of cowboys are awaiting their challenge of catching a live animal .
1510078253.jpg| 4| A dog trying to catch a ball .
1581822598.jpg| 0| A dog jumps in the snow trying to catch a snowball .
1626754053.jpg| 0| A black and white dog leaps to catch an orange Frisbee .
162743064.jpg| 0| A dog is backlit buy the sun as he jumps up to catch a tennis ball .
165764051.jpg| 1| A young boy in a green and beige uniform is reaching to catch a ball in a glove .
1674612291.jpg| 0| A dog is jumping to catch a Frisbee and casts a perfect shadow .
1679557684.jpg| 1| a big black dog jumps in the air to catch the tennis ball in his mouth .
1679565118.jpg| 1| A black dog catches a tennis ball in his mouth while a white dog watches .
1800601130.jpg| 0| A dog that looks much like a coyote jumps into the air over a grassy field to catch a tennis ball .
1808007704.jpg| 1| A man jumps from one boulder to another and two men try to catch him as he barely makes it .
"1844580277.jpg| 0| A baseball player with "" Tulowitzki "" on the back of his shirt is catching a ball thrown by a man in a black jacket ."
1859941832.jpg| 0| A white dog has jumped up in the air to catch a Frisbee .
1984936420.jpg| 0| A young boy catches a fish from a stream while a young girl helps .
198534816.jpg| 0| A softball player dressed in a maroon and gold uniform , at home plate with a catcher and umpire , prepares to run after hitting the ball .
2017276266.jpg| 0| Small white dog with brown markings jumping to catch a red ring in his mouth .
2045023435.jpg| 0| A large skinny dog is trying to catch a faded green tennis ball .
2053777548.jpg| 0| A brown and white dog is catching a tennis ball while standing on its hind legs .
2054869561.jpg| 4| A dog runs to catch a Frisbee on AstroTurf .
2073756099.jpg| 0| The black dog is jumping into the pool to catch a rubber chicken in its mouth .
2100816230.jpg| 3| A skier catches air over the snow .
2110979954.jpg| 2| Looks like a man in a rodeo on a horse about to catch another animal .
2113530024.jpg| 3| A goalie tries to catch a ball during a soccer game .
2125626631.jpg| 0| A dog makes a faithful leap to catch a green and black Frisbee in his mouth .
214501174.jpg| 0| A dog jumps up to catch a tennis ball in a grassy field .
214543992.jpg| 0| The black and white dog is attempting to catch a ball in the garden .
2150590181.jpg| 2| A man trying to catch a sheep in a competition and the rodeo clown trying to help .
2186139563.jpg| 1| A white and brown dog is catching a red ball in its mouth .
2186361690.jpg| 1| A young boy in a red cap catching up with his friends .
2191788665.jpg| 4| A person is sitting and catch his hairs in his hand .
2193980605.jpg| 0| A group of six people have jumped into the air in the middle of nowhere and one is catching a ball .
2203286182.jpg| 0| A black dog is attempting to catch a thrown object that is red .
221422499.jpg| 0| A young gymnast looks back at the audience , trying to catch a glimpse of her proud parents before starting her performance .
2219805677.jpg| 1| A dog gets ready to catch a yellow ball while standing in the sand .
224702242.jpg| 0| Large white dog jumps in the air to catch a black and white soccer ball .
2268109835.jpg| 1| A man catches a bird from the partly cloudy sky with a long net .
2272750492.jpg| 0| A snowboarder in gray pants and a white jacket catches some air .
2287023569.jpg| 0| A dog in mid-flight catches an orange and blue ball in a field of dead grass .
2294598473.jpg| 1| A terrier mix catches a Frisbee in the air .
229978782.jpg| 2| Two men are running to catch a Frisbee .
2303016989.jpg| 0| A black and white dog is running through the field to catch something in its mouth .
2323096887.jpg| 2| Surfer catching a good , deep clear blue , wave .
2337825352.jpg| 2| A soccer player is catching a soccer ball while his teammates hold him up .
2341904462.jpg| 0| Two women , each embracing a little girl , catch up at a small family gathering .
2344699642.jpg| 0| A brown dog is jumping in the air whilst trying to catch a purple Frisbee .
2350400382.jpg| 3| A black dog caught in mid-jump catching a toy in his mouth .
235074044.jpg| 2| group of people waiting to catch the subway
2353119813.jpg| 2| A dog jumps to catch a ball in a large field .
2366166967.jpg| 0| This young man 's body contorts as the camera catches the motion of his soon-to-be goal .
2387661071.jpg| 2| A man fishing along the pier catches something as ships sail in the background .
241347150.jpg| 4| The receiver is tackled after making the catch .
2426724282.jpg| 0| A small , white dog with his tongue out is jumping up to catch a toy .
2429978680.jpg| 0| A brown and white dog attempts to catch a dirty tennis ball in a dirt field .
2438085746.jpg| 0| A small black and white dog jumping on the grass to catch a Frisbee
244399048.jpg| 2| A dog is jumping up in the air to catch a toy .
2446021729.jpg| 1| A young woman dressed in white with angel wings is balancing a bowling pin , while a man with a clowns nose is catching a bowling pen .
2447972568.jpg| 0| A man with a close-cropped haircut is waiting to catch a child that he has thrown into the air .
2450453051.jpg| 1| A man is throwing freesbies into the air and the border collie is catching them in the air .
2450486758.jpg| 0| A white dog in a blue leaps over a man in a blue outfit with yellow stars in order to catch a Frisbee whilst people stand by and watch .
245442617.jpg| 4| A girl in black tank top catches a fish .
245858959.jpg| 1| Around 12 people are gathered at a rodeo watching two men try to catch that has just knocked one of the men inside over .
2460823604.jpg| 3| A young boy dives to catch the ball during a baseball game .
246094557.jpg| 0| Little girl throwing food in the air for her white dog to catch .
2467354185.jpg| 0| A man in green shorts is jumping to catch a frisbee as another man and woman run towards him .
2483993772.jpg| 0| The German shepherd dog is trying to catch a blue ball .
248851880.jpg| 0| It 's a busy baseball game , with the man on base trying to catch the ball and tag out the runner coming towards him .
2504056718.jpg| 0| A black and white dog is jumping up to catch a green Frisbee .
2505360288.jpg| 1| A dog trying to catch bubbles from a bubble machine in the grass .
2507182524.jpg| 3| A dog is running towards a ball to catch it .
2508313118.jpg| 0| A brown dog is attempting to catch a Frisbee in its mouth .
2511019188.jpg| 0| A large black dog is catching a Frisbee while a large brown dog follows shortly after .
251792066.jpg| 1| There is a black dog catching a green toy in its mouth .
2521938720.jpg| 2| The cricket player just misses catching the ball .
252504549.jpg| 0| Small dog catching a ball in its mouth on a beach .
2525270674.jpg| 1| The brown and white dog is catching a Frisbee in his mouth .
2531273794.jpg| 2| Three people waiting patiently for a train to catch .
254169701.jpg| 3| Four girls on a beach are playing catch .
2541939817.jpg| 3| A group of men happily survey the day 's catch of fish .
2543589122.jpg| 1| A dog is splashing through water trying to catch ice in its mouth .
254901702.jpg| 3| A man in a yellow sweater catching a Frisbee .
2556650904.jpg| 3| A hiker in the woods takes off her backpack to catch her breath .
2557805364.jpg| 0| In a Little League baseball game , the batter watches as the ball he has just hit flies off toward right field , with the catcher looking on .
2561334141.jpg| 0| A man holds a ball in the air for a brown dog to catch on the beach .
256283122.jpg| 0| A man wearing sunglasses kneels with one knee on the ground looks up to see a dog in the air catching an orange Frisbee .
2565539201.jpg| 0| A group of people ( both men , women , and children ) are outside on a summers night trying to catch a white object .
2575846076.jpg| 0| A baseball player swings at an oncoming ball while the catcher gets ready and the umpire looks on .
2583001715.jpg| 0| A dog flies through the air , preparing to catch a ball .
2585970434.jpg| 0| A young boy wearing a catchers uniform is kneeling on one knee behind home plate on a baseball field .
260703838.jpg| 0| Cheerleaders performing a routine where three girls are thrust into the air while the others catch them during a sporting event .
2616561200.jpg| 3| A dog is running to catch a tennis ball .
2622971954.jpg| 0| A man in a blue and fuchsia sweater holds his hands as if to catch something while standing in a crowd of people .
2628331789.jpg| 3| a woman catches a young boy jumping into the pool .
2632111399.jpg| 0| A catcher with a red shirt is standing in the dirt with his glove held out .
2641288004.jpg| 2| Border collie jumps in the air and catches a tennis ball .
2644326817.jpg| 4| Dog catching a red Frisbee .
264483970.jpg| 0| Four male cheerleaders are preparing the catch the female cheerleaders they just threw in the air .
2652974155.jpg| 1| A man with a red fishing pole catching a very small fish .
2661437618.jpg| 0| The little white and brown dog has his mouth wide open while trying to catch something .
2681215810.jpg| 4| A shirtless man catches a football
2692635048.jpg| 3| The dog rests after playing catch .
2696045361.jpg| 4| A baseball player having a catch on the field .
2698487246.jpg| 1| Two men are jumping into the air to catch the football .
2698614194.jpg| 2| Three rugby players all trying to catch a ball .
2699983419.jpg| 2| A catcher tries to strike a runner out as he slides into base during a baseball game .
2708744743.jpg| 3| A dog jumps in the air to catch a Frisbee , while many people watch .
2709044515.jpg| 3| A man watches a pan catch fire while cooking in the kitchen .
2709648336.jpg| 3| A brown dog is catching a Frisbee in midair .
2720039582.jpg| 3| A football player catching the ball while going down .
2728486640.jpg| 1| A white dog catching a milkbone in his mouth
273248777.jpg| 0| The American footballer in yellow catches the ball whilst under pressure from the payer in white .
2734669176.jpg| 0| A blond-haired girl is doing a trick with her dog that is in the air trying to catch a flying Frisbee .
2735158990.jpg| 1| A white dog is jumping in the air to catch a ball in the woods .
2751602672.jpg| 0| a bald man in gray is holding out a stick whilst a black and brown dog jumps up to catch it .
275401000.jpg| 1| A dog jumps to try to catch a yellow tennis ball on a patio .
2768972186.jpg| 0| a large brown dog trying to catch a small white puppy from behind
2771662950.jpg| 0| A baseball player is standing in place , catching a flying baseball in his mitt .
2782031648.jpg| 0| In this photo there is a man in a white shirt dark blue pants standing on a small boat in what looks like a lake of some sort he has a net in one hand and a line of some type of string in the other the line is in the water the man also has a teal colored bag on his boat so he might be catching fish .
2789350645.jpg| 4| A dog jumps and catches a chew toy .
2793886035.jpg| 0| A young child in a blue shirt and green overalls laughs with their arms up in the air , the table catching their reflection .
2800934095.jpg| 2| A weiner dog catches a blue and yellow tennis ball .
2813033949.jpg| 0| There is a white and black dog jumping off the ground trying to catch a ball .
2827589184.jpg| 1| A female softball player dramatically slides into a plate as the baseman stands poised to catch the ball .
2830880811.jpg| 2| A dog is running while catching a tennis ball in its mouth .
283428775.jpg| 1| The black dog catches a toy in its mouth while running in the field .
2839038702.jpg| 3| A dog is playing catch on the grassy plain
2839789830.jpg| 0| The black and white dog jumps in the air to catch the white Frisbee on the grassy field .
2839807428.jpg| 0| A dog is jumping up to catch a Frisbee in front of white tents at a dog show .
2842439618.jpg| 0| A surfer in a black wetsuit catching a wave while another one tries to catch up with him .
2848571082.jpg| 0| A black and brown dog jumps in the air to catch a soccer ball .
2849292029.jpg| 0| Two men , both wearing collared shirts , hats , and jeans , are riding horses and trying to catch a bull .
2854959952.jpg| 1| One dog leaps to catch a softball while another looks on .
2857609295.jpg| 0| a small brown and white dog catching a Frisbee at a competition .
2866254827.jpg| 0| A man on a yellow sport bike does a wheelie as his friend on a black bike catches up .
2867026654.jpg| 0| A brown dog waits for the Frisbee to come down before catching it .
2867736861.jpg| 1| A dog has run into the water to catch a ball in his mouth .
2892992529.jpg| 0| A large black and white dog is catching a Frisbee in the park with a crowd of people behind him .
2892995070.jpg| 0| A black dog is running along the beach beside a brown dog in midair catching a stick in its mouth .
2893515010.jpg| 2| A football player catches the ball as another tries to tackle him .
2896483502.jpg| 0| A white dog with black spots catches a bright green and pink Frisbee in a field .
2899374885.jpg| 2| A baby trying to catch water from a fountain in his mouth
2899594400.jpg| 4| Two boys and a dog playing catch in the water .
2914206497.jpg| 3| A race cars muffler catches on fire .
2914737181.jpg| 0| A man parasails on the choppy sea , with a board on his feet to catch the waves .
2922807898.jpg| 1| A medium sized white dog is jumping up to catch a small cloth Frisbee .
2925160864.jpg| 2| A woman in a blue tank top and spandex shorts is running in a race and a man is catching up to her .
2927878881.jpg| 0| A man holds a stick up for a dog to catch while another dog looks on at the beach .
2930514856.jpg| 4| Two surfers catch a wave .
2939464283.jpg| 0| A football player jumps up to catch the ball while others run towards him .
2940342154.jpg| 0| Baseball player in white and black uniform is attempting to catch a baseball .
2944836001.jpg| 1| Man with dog who is jumping to catch tennis ball .
2944952557.jpg| 2| A girl is catching a baseball before an opponent touches base .
2945036454.jpg| 0| A dog is jumping in the air trying to catch a red Frisbee .
2955099064.jpg| 0| A group of men struggle to catch the ball in the air .
2970183443.jpg| 1| A small black brown and white dog catches a football in midair as a man and child look on .
2972268289.jpg| 2| a man who has fallen off his horse while trying to catch a small cattle
2973638173.jpg| 0| The young man catches some air while skateboarding .
2976946039.jpg| 4| a group of surfers catching a wave
2987195421.jpg| 1| A pitcher and catcher celebrate striking another baseball player out in a pro game .
2990563425.jpg| 1| A dirt bike rider catches some air going off a large hill
300371487.jpg| 1| Brown dog catches a pink ball in the park .
3008684665.jpg| 4| The hunter is proud of this catch of the day .
3018304737.jpg| 1| A man catches a huge wave on his surfboard .
3027282153.jpg| 0| A group of girls is waiting to catch another girl that is doing a somersault in the air .
3029463004.jpg| 2| A surfboarder prepares to catch a wave .
3030823649.jpg| 3| Shepherd dog catches tennis ball
3034585889.jpg| 2| A looker on catches a motocross bike on its side after a spill while another races by .
3046949818.jpg| 3| A soccer player pushes another player as he catches the ball .
3051998298.jpg| 1| A man catches a football in midair while jumping into a pool .
3064383768.jpg| 1| A surfer on a whiteboard catches a wave .
3069786374.jpg| 0| Two male cheerleaders are catching a girl cheerleader in the air .
3081734118.jpg| 1| a brown and white dog has is mouth open ready to catch a green ball .
3091338773.jpg| 0| A brown dog is jumping up to catch a green strap in its mouth .
3101522985.jpg| 0| A surfer with outstretched arms catches a wave as the sky turns gold behind him .
3126724531.jpg| 3| A surfer catches a large wave .
3126981064.jpg| 0| Two surfers catch the same huge wave in the ocean .
3127629248.jpg| 0| The man in the white jersey is trying to score and his opponent is trying to catch the ball .
3131990048.jpg| 1| A hawk diving to catch a small animal .
3139876823.jpg| 1| A downhill skier in black catches a tiny bit of air
3145779380.jpg| 3| A man is catching a girl who jumped into his arms
314603661.jpg| 2| The brown and white dog is running to catch something .
3153067758.jpg| 3| A person riding transit ( catching ? ) a paper bag .
3155390408.jpg| 0| A dog with its mouth open is about to catch a ball in a living room .
3155987659.jpg| 0| The black and white dog tries to catch a red Frisbee on green grass .
3163477256.jpg| 0| A goalie in a blue jersey catches a soccer ball by a player in a red jersey .
3164328039.jpg| 2| Two dogs are playing catch in a field .
3168841415.jpg| 1| A young child leaps and stretches to catch a blue Frisbee .
3170802797.jpg| 1| A snowboarder in a green jacket catches some air .
3171651115.jpg| 1| A surfer catches a big wave and catches himself in the middle of a fall .
3176998867.jpg| 2| A snowboarder catches some air and sprays up some snow .
3185695861.jpg| 0| The black and white dog catches the tennis ball in his mouth .
3186412658.jpg| 1| Team members being lifted up high to catch a flying ball .
3192311620.jpg| 0| A brown dog opens his mouth to catch a piece of food .
3204922011.jpg| 0| A surfer dressed in black catches a huge wave and starts riding on the descent .
3208227126.jpg| 1| Men at a wedding reception trying to catch the bride 's garter .
3214579977.jpg| 1| The black dog jumps out of the snow to catch an object .
3216829599.jpg| 4| A surfer catching a wave .
3223302125.jpg| 4| A skier catches air .
3226254560.jpg| 0| A white and brown spotted dog runs along the snow to catch a ball .
3235076435.jpg| 0| The surfer wearing the blue suit on the colorful surfboard is catching a wave .
3236677456.jpg| 3| A dog jumps in midair to catch a Frisbee .
3242354561.jpg| 0| A brown dog is catching a ball in its mouth whilst playing in a snow covered field .
3278189732.jpg| 0| A black and white dog leaping to catch an orange ball in an open field .
3306951622.jpg| 0| A surfer catches a wave as a man on a jet ski looks on in case of an accident .
3335773346.jpg| 3| A group of surfers in wetsuits are trying to catch a wave .
3338217927.jpg| 0| A black dog in snow is jumping off the ground to catch a stick .
3339319023.jpg| 0| The man in the dark blue jersey is holding a bat , and the catcher is holding his mitt out .
334737767.jpg| 3| A dog gets ready to catch something in the grass .
335588286.jpg| 2| a small white dog catching a stick on the shore at the beach .
3356901257.jpg| 0| A dog is jumping up for the ball while playing catch in the sand .
3359414778.jpg| 0| A young girl with long hair is standing in a dining room holding what appears to be a green plastic bib with a food-catching pouch build onto it .
3359454244.jpg| 1| A man is biting his tongue while throwing some food and attempting to catch it in a frying pan .
3361276685.jpg| 0| A baseball player in white is stretched out with his glove in position to catch a ball while a baseball player in a dark blue jersey and gold helmet is in position to run .
3361278515.jpg| 0| Baseball player in blue jersey about to catch a ball .
3362871440.jpg| 0| A black dog is jumping into the water and catches a stick in its mouth .
3367200276.jpg| 2| A baseball player is sliding into a base , while another player made the catch .
3368207495.jpg| 0| Two dogs in a field are running to catch a tennis ball .
3371567529.jpg| 2| Man in a wetsuit catching a wave on a surfboard .
3376659951.jpg| 2| A runner in a softball game slides into home while the catcher tries to tag her out .
3380643902.jpg| 4| A longboarder catches himself before hitting the ground .
3392293702.jpg| 0| A white and black dog is about to catch an object while it stands in a snowy field .
3395865970.jpg| 0| A football player in a green uniform is trying to catch the ball , while his opponent , in a blue uniform , tries to stop him .
3396817186.jpg| 3| A white fluffy dog is jumping and catching a toy .
3397803103.jpg| 1| A dog leaps in the snow to catch a ball .
3403797144.jpg| 0| A surfer catches a wave and tries to hold on as the surf collapses around him .
3412036192.jpg| 0| A brown and white dog is jumping up to catch a ball in the park .
3415165462.jpg| 4| A dog catches a ball in midair .
341665272.jpg| 3| A dog catches a red Frisbee in the snow .
3417299749.jpg| 4| A young lacrosse player is catching his breath .
3423509305.jpg| 0| A brown dog wearing an orange collar leaping to catch a bright colored ball .
3428038648.jpg| 2| A child holds a catcher with a mouse in it .
3429391520.jpg| 4| A bicyclist catches some air
3430782104.jpg| 1| a girl on a horse trying to catch a bull with a rope
3436221798.jpg| 1| A woman in a Bronco Softball jersey trying to make a catch with the ball hitting her glove .
3436313241.jpg| 0| A black dog on a yard of grass is catching a blue and red ball in its mouth .
3449846784.jpg| 0| A dog is up on its backlegs trying OT catch a ball above its head .
3460936621.jpg| 0| A young man in a blue shirt standing on the flat green lawn or what appears to be a college campus is about to catch a white frisbee .
3471571540.jpg| 4| A small dog sprints away while its owner tries to catch it .
3472315522.jpg| 1| A skateboarder catches air over a dumpster as one friend observes and the other friend jests .
3475005101.jpg| 2| A baseball player crouching to catch the ball as a runner slides to safety .
3477289176.jpg| 2| A skateboarder catches big air at the skate park .
3477676257.jpg| 0| This short-haired woman catches up on the latest People magazine .
3478176372.jpg| 2| One rugby player trying to catch the player with the ball .
3481884992.jpg| 0| Man catching a large wave on a surfboard .
3484841598.jpg| 0| A catcher in a black uniform on the ground with his glove upraised during a baseball game , while a man UN a white uniform keeps a foot on the base .
3484842724.jpg| 0| The first baseman makes hte catch just in time to get the runner out in this softball game .
