image_name| comment_number| comment
3495490064.jpg| 0| A man scowling is sitting in front of a lake trying to catch a flopping fish .
3508637029.jpg| 3| Two softball players trying to catch a ball
3513265399.jpg| 2| A player is sliding into home plate with the catcher guarding it .
3514179514.jpg| 0| An umpire in a baseball game crouches to catch a ball while an opposing team member runs to homebase .
3514184232.jpg| 2| A woman with long hair is catching a softball in a softball field .
3514297698.jpg| 0| A spotted dog stands on his hind legs to catch a ball on the beach .
3517040752.jpg| 1| A person leans forward to catch a baseball while a runner comes close to the base .
3519155763.jpg| 0| A yellow dog with a brown collar is in a field , and trying to catch a yellow and blue toy in its mouth .
3522000960.jpg| 2| A guy catches a wave on his surfboard
3524436870.jpg| 3| Dog catching bubbles on the grass .
3527659327.jpg| 0| The football player is trying to catch the football .
3538021517.jpg| 2| A goalie lays on the ground after catching a soccer ball .
3539960792.jpg| 0| There is a baseball player standing at home plate , the catcher behind him has his hand up in the air with his glove , and the umpire is standing behind him , and many people in the stands .
3542418447.jpg| 4| Two dogs run to catch a yellow soccer ball .
3544669026.jpg| 0| The big black dog is jumping up in the air to catch a ball .
3544673666.jpg| 0| A dog stands on its hind legs to catch a ball in its mouth .
3545779287.jpg| 4| A dog jumps to catch a rope toy .
3564157681.jpg| 1| A dog catches a yellow Frisbee thrown by a gray-haired man .
3565749152.jpg| 1| a white dog jumping in the air to catch a red Frisbee .
3574522127.jpg| 0| One baseball player sliding into second base and another about to catch the ball in an effort to make the out .
3575330012.jpg| 1| An outfielder for the Boston Red Sox catches a pop fly during a day baseball game .
3575330336.jpg| 0| One Baseball player racing towards the base while another tries to catch up with him and score an out .
3583293892.jpg| 0| A pitcher with a red shirt is throwing a ball and his teammate is waiting to catch near a base .
3590049329.jpg| 4| The men focus on a way to catch that snake .
3595643050.jpg| 4| A dog catching a ball .
3603116579.jpg| 2| A male dressed in a sports outfit tries to catch a baseball .
3609377404.jpg| 3| A man is catching a smiling child from midair .
3619416477.jpg| 0| A white dog catches a green ball while standing in shallow water .
3621329299.jpg| 0| A boy in a blue shirt is mountain biking on a track and catching air .
3621652774.jpg| 2| A toddler catches droplets of water as he sits in a shallow pool .
3624327440.jpg| 0| A surfer catches a nice wave in the ocean and tries to pull himself up .
3627216820.jpg| 0| a dog jumps over another dog as both animals are trying to catch the same ball .
3631344685.jpg| 0| A batsman is about to swing for a baseball whilst the catcher and referee wait behind him .
363140724.jpg| 0| A cheering squad doing their stunt by throwing one cheer dancer in the air and the rest getting ready to catch her .
3631986552.jpg| 0| The surfer catches a big wave but stays on his board .
3636796219.jpg| 1| The baseball player is catching a ball on the field .
3637966641.jpg| 1| A Little League team tries to catch a runner sliding into a base in an afternoon game .
3640329164.jpg| 3| A surfboarder catches the waves .
3643666111.jpg| 0| A Texas baseball player catches the ball as the ,  12 player from the opposite team slides into base with an umpire standing by , ready to make the call .
3647446816.jpg| 0| Two girls play softball , one slides into plate as other fails to catch ball .
3650111717.jpg| 3| A small , wet dog leaps to catch a stick .
3668900592.jpg| 3| A surfer on his white surfboard catching a wave .
3671935691.jpg| 1| A young child is trying to catch bubbles that a woman is blowing towards her
3681324243.jpg| 2| A catcher tries to beat a runner to home plate .
3689407371.jpg| 1| A little girl jumps into a pool while a man helps to catch her .
3689727848.jpg| 0| The man is leaping off of the pool deck to catch a football .
3691800116.jpg| 0| A batter playing cricket missed the ball and the person behind him is catching it .
3696698390.jpg| 3| A bike rider catches air near a ramp .
3700322513.jpg| 2| A man on a BMX bike catches massive air while someone is taking a picture
3707990914.jpg| 2| The girl catches a wave on her pink surfboard .
3711611500.jpg| 3| a black dog jumping into some water to catch a red and blue Frisbee
3716272233.jpg| 1| a white bird preparing to catch something in the water
3719712280.jpg| 0| As a crowd looks on , a player in a white uniform , wearing only one colorful sock , makes a diving catch for the frisbee .
3724581378.jpg| 1| A surfer catching a large wave in the ocean .
3726130458.jpg| 3| A baseball player runs to catch the ball .
3745354249.jpg| 1| Two men are out on a bright , sunny day attempting to catch some fish on the lake .
3821671043.jpg| 4| A rollerblader catches a cool grind .
3852276745.jpg| 3| Five workers take a break to catch their breath .
3866290511.jpg| 4| Bunches of men are helping to catch fishes .
3867308040.jpg| 4| Fishermen in Africa unload their catch as two women look on .
3876652419.jpg| 0| A guy in a black shirt is looking to catch a water-melon with two other boys present .
38803368.jpg| 0| Two young men are on a vast , level expanse of grass , and the man in the red shirt is catching the white Frisbee .
3890247909.jpg| 1| A man plays outside with two dogs , one of whom is trying to catch a ball in the air .
3897909588.jpg| 4| a surfer catches a moderately sized wave
3901882052.jpg| 0| A surfer wearing a wetsuit and using a light colored board catches some air .
391106734.jpg| 1| The brown and white dog is jumping up in an attempt to catch a ball .
398413603.jpg| 0| A white dog is leaping into the air to catch a ball in its mouth .
4021371346.jpg| 0| A football player in a yellow and white jersey is jumping up to catch a football kicked by the other team .
4027325112.jpg| 1| Fisherman at the market weighing their catch at the end of a long day .
404702274.jpg| 1| A brown and white dog jumps in the air to catch a snowball .
406901451.jpg| 0| A brown and black dog is trying to catch a red ball in its mouth .
412203580.jpg| 4| Guy on yellow surfboard catching a wave
4123816289.jpg| 2| A football player in white , black , and yellow catches a ball as a teammate and another player in red follow him .
4265806100.jpg| 2| Two pants less men sit on a train passing time while catching up on the news .
4271298554.jpg| 2| A man catches major air holding the tether while wakeboarding .
427936315.jpg| 0| The large brown dog is running through the grass to catch a red Frisbee .
429851331.jpg| 1| The wet dog catches a toy while playing on the sand .
430173345.jpg| 2| A brown dog running to catch a Frisbee in a field of grass .
4302249704.jpg| 4| A gymnast in a white leotard is about to catch a red ball .
434094589.jpg| 0| Three people in the ocean with a net catching or releasing something .
4345676156.jpg| 0| Three fishermen are on a dock area all dressed in clothes appropriate for a wet environment sorting the days catch of fish
436013859.jpg| 1| A dog is twisting in the air as it tries to catch a Frisbee .
437327595.jpg| 0| A man wearing a red shirt with the number 54 hits a baseball , while a catcher prepares to catch the ball .
443885436.jpg| 3| A white dog catches a stick in the snow .
4440438333.jpg| 1| The pitcher wearing black heaves the ball toward the catcher .
4447778955.jpg| 3| A man in the park catching frisbees .
447722389.jpg| 0| A dog is jumping and catching a small , blue ball in a park surrounded by two other dogs .
44856031.jpg| 2| A dog stands on his hind feet and catches a stream of water .
4489833894.jpg| 0| Two young women are playing baseball and one is in the midst of catching the ball while the other throws it to her .
451597318.jpg| 1| A dog is jumping in the air to catch an orange Frisbee .
4517839542.jpg| 0| Baseball player number four races to first base while his teammate slides into second , number six of the opposing team is ready to catch the ball at second base .
4517839686.jpg| 0| Absoluteily all the attention by the people attending is given to the play that the catcher is doing in this baseball game .
4520820052.jpg| 3| The woman in the gold coat hurries to catch the subway .
"4528304009.jpg| 0| A young baseball player wearing a yellow shirt and a blue helmet with "" T "" on it slides into home plate and the catcher ", while teammate watch .
4531897566.jpg| 0| A snowboarder dressed in yellow snow pants and a helmet catches some air on fresh powder .
4537959218.jpg| 0| A baseball player wearing a blue uniform and a catcher 's mitt walks across a field .
4585470754.jpg| 0| There is one football player with the ball with one of his teammates following along with a member of the other team trying to catch up .
460781612.jpg| 1| A black and white dog jumps up in the air to catch a Frisbee .
4609020271.jpg| 4| He want to catch the bus and go to his place .
4612142419.jpg| 2| A man catching a boy from falling in the water , while standing on rock stepping stones .
4625152980.jpg| 3| Precision is key as this guard throws his gun in the air ready to catch it .
462663804.jpg| 2| Two men play catch with a football in a grassy field on a sunny day .
4637796410.jpg| 1| Football player ,  40 in black and white uniform catching a football , while teammate ,  28 looks on .
4658910970.jpg| 0| The man in the black baseball cap is trying to catch a ground ball that is going foul .
4663514463.jpg| 1| Two guys are trying to catch a basketball ; one guy has a Celtics jersey on and the other guy has a red jersey and a black hat .
4694510761.jpg| 1| A mountain biker catching some after taking off a ramp on a trail .
4712604889.jpg| 4| a guy enjoying a day at the lake catching fish .
4715755037.jpg| 4| Two man riding horses trying to catch a cow .
472396131.jpg| 4| A puppy catching a bird
472860064.jpg| 0| a gray dog jumps in the air to catch a Frisbee in a grassy park
4736291991.jpg| 1| Young man in blue jeans catching sun rays in the park on his lunch hour .
477204750.jpg| 0| A dog stirs up the dirt on the ground while running to catch a ball .
477774424.jpg| 3| A fisherman takes some quiet time waiting for a catch .
4817681157.jpg| 3| People race to catch the metro at dusk .
4838047403.jpg| 4| Children are trying to catch objects with a net .
485054073.jpg| 0| A white dog with long hair jumps to catch a red and green toy .
4857094195.jpg| 2| A football team is seen making plays , blocking , catching and running .
4858940251.jpg| 4| He is walking fast to catch the train .
488549693.jpg| 0| Two children standing at the edge of a river , holding a butterfly-catcher .
491600485.jpg| 1| A black dog looks up at a ball in the air and prepares to catch it .
492802403.jpg| 1| One dog jumps up to catch a ball as another dog runs towards it .
4931370200.jpg| 1| A man in a cowboy hat on a horse swinging a rope to catch a bull .
4952701904.jpg| 0| Two cowboys ride their horses and they work together to catch the bull .
4956166435.jpg| 2| A wakeboarder catches air on a clear day at the lake .
500290283.jpg| 3| A man is at an event catching a young calf .
503717911.jpg| 1| A white dog catches a red disc in his mouth .
50655098.jpg| 0| A group of male and female cheerleaders in black and yellow uniforms have thrown a female cheerleader in the air and are waiting to catch her .
5069687927.jpg| 1| A fisherman pauses to look into the camera as he works with his catch .
5070190270.jpg| 2| Two men and a few onlookers are admiring a catch after having gone fishing from a pier .
5075833333.jpg| 0| A snowboarder catches some wicked air on the slopes as photographers capture the moment .
5119124428.jpg| 1| Two men in wetsuits surfing hoping to catch some big waves .
514073775.jpg| 1| Children play outside of a building trying to catch large bubbles .
517778590.jpg| 4| Fisherman attempt to catch a large aquatic animal .
524031846.jpg| 0| A boy splashes in a pool with his arms out to catch something .
5323049335.jpg| 0| A snowboarder is catching air on a snowy hill while wearing protective snow gear .
534200447.jpg| 3| Two girls playing catch on a lawn
5374764034.jpg| 4| A girl sitting in a wash bin in a river catching some fish .
539750844.jpg| 1| The dog , all belly , leaps in the air to catch a large ball .
5447844412.jpg| 0| Five people outside in the river working with their nets to catch fish .
5503955724.jpg| 1| A game of rugby in which 2 players are attempting to stop there opponent from catching a ball in midair .
5526668006.jpg| 1| A snowboarder catches some air going off a jump on a snow-covered mountain .
5571017359.jpg| 3| A young man is catching some air while ride a wave board .
5571949283.jpg| 3| Older man baiting his hook before tossing it out to see what he can catch
5676780431.jpg| 3| A cyclist on a yellow bike goes off-road and catches air .
574274795.jpg| 1| a dog in the foggy distance catching a Frisbee
5759882364.jpg| 4| A man in a wetsuit catching a wave .
5767811093.jpg| 0| A hitter is swinging a bat at a baseball during a game while the catcher and umpire look on .
5797756884.jpg| 0| A man playing a banjo during street fair , catching the attention of people walking past .
5812770731.jpg| 1| Two girls playing baseball interact as a red-vested catcher tags a blue-vested base-runner as she slides into home base .
5825529550.jpg| 0| A young boy attempts to catch a rugby ball at the beach while dressed in a very colorful outfit .
5831085623.jpg| 0| A young woman wearing shorts and a t-shirt with blond and blue hair watches while a dog catches a Frisbee .
"5847749710.jpg| 0| A baseball game where the red team has just gotten the white runner "" out "" by the baseman catching the ball ."
5892931627.jpg| 0| A uniformed baseball player just took a swing at the ball , as the rest of the team looks on and the catcher behind him , is ready for the play .
5893481130.jpg| 0| A baseball player attempting to catch a baseball that is about to go over the field gate .
5893485204.jpg| 0| Two baseball players try to move to the next base while a member of the opposing team tries to catch the ball .
5893495086.jpg| 0| Two baseball players in red hats are catching pitches thrown by a man , a woman , and a boy .
5903521315.jpg| 0| A baseball player wearing a blue shirt runs toward the home plate as the opposing team 's catcher tags him , the catcher 's face mask flies away of the third base foul line , and the catcher 's teammate covers the home plate .
5903545909.jpg| 1| A baseball player , wearing red , diving to catch a ball .
5914778546.jpg| 0| A baseball player sliding into home as the opposing team 's catcher awaits the baseball for the out .
5914789066.jpg| 0| Baseball player making an attempt to hit the ball while the catcher is ready to catch the ball the ref is looking to make a call on the ball .
594758693.jpg| 0| A man in a baseball uniform on a ball field is running and reaching to catch a ball that is in the air .
5972938127.jpg| 1| A baseball player wearing a gray uniform attempts to catch a fly ball against the fence .
5972945043.jpg| 3| A player throws a ball and other tries to catch it .
5973146939.jpg| 0| A cricket batsman plays at the ball while the wicketkeeper behind him gestures as if making a catch .
5973476404.jpg| 0| A man in a gray baseball uniform and a black hat is catching a ball in a baseball mit .
6042855086.jpg| 2| A windsurfer catching air with water streaming off of the board .
6137946415.jpg| 0| Prince Fielder , of the Milwaukee Brewers , ducks away from a pitch that is up and in , which is caught by catcher Carlos Ruiz of the Philadelphia Phillies
6161755456.jpg| 0| A professional baseball catcher and behind him an umpire are knelt in action position and are awaiting the pitch .
6179361394.jpg| 4| oh yea these suckers cant catch me .
6187182607.jpg| 0| A baseball batter in white pants and a black shirt attempting to hit a baseball with a catcher behind him and an umpire behind the catcher .
6199648902.jpg| 3| Football player jumping to catch the ball with an empty stand behind him .
6212107040.jpg| 0| Baseball player Melky Cabrera wearing number 53 jersey standing behind home plate looks on as his team rounds home behind the catcher .
6233103167.jpg| 3| A surfer is surfing catches a wave .
6233621366.jpg| 0| Surfer in neon green shorts and a red top , catches the wave .
624058168.jpg| 1| A black and white dog jumping to catch a ball .
6281452090.jpg| 0| A guy catches or prepares to throw a football with various teammates and staff in the background at what looks like a school .
6296741028.jpg| 4| A man catches some air with his mountain bike .
6303856162.jpg| 2| A male snowboarder catches some air and does a trick .
6309593797.jpg| 0| A pitcher is pitching a baseball to a catcher , who is standing in front of an umpire and behind a batter .
6319547436.jpg| 1| A man is on a surfboard surfing the waves and catching good air .
6341910994.jpg| 0| A rugby player is jumping up to catching a ball , with a player in blue below him .
6362439531.jpg| 0| One man has just pitched a ball at another man , who has swung his cricket bat , while a catcher watches in the background .
6397425353.jpg| 0| A person is catching a wave on a surfboard in the ocean on a clear sunny day .
643684227.jpg| 3| A woman is using a net to catch fish on the river .
6451269381.jpg| 1| A group of young men dressed in purple are preparing to catch a fellow teammate .
6451285719.jpg| 4| Amen on a baseball field catching the ball .
6454325817.jpg| 0| Young woman running as two guys in the back try to catch up to her .
6493391567.jpg| 1| A surfer standing on an orange board who is about to catch a wave .
6493393907.jpg| 2| A surfer in a wetsuit catches a nice wave to ride .
6503557611.jpg| 2| A young snowboarder catches some air on his black snowboard .
65852628.jpg| 3| A man is about to catch something , next to the pool , at a pool party .
661749711.jpg| 0| little dog is jumping up to catch a red ball in its mouth .
661755629.jpg| 1| This tiny dog is about to jump in the air to catch a red ball .
661757041.jpg| 0| A small black and brown long-haired dog prepares to catch a red ball in the grass .
6636998629.jpg| 0| Three young boys in sports uniform anticipate catching a ball at the grass sports field .
6696752075.jpg| 0| A young boy in a Texas Rangers uniform opens his glove right before he catches a baseball .
670609997.jpg| 1| a black and white dog jumping in the air to catch a Frisbee
6757018587.jpg| 1| Female baseball catcher wearing blue uniform , and red socks , prepared to catch a ball .
6788553859.jpg| 3| A hockey goalie is about to catch a puck .
6807909584.jpg| 1| A female baseball player wearing a blue shirt slides into base , while another player in a white shirt wearing a catcher 's mitt jumps .
6864521935.jpg| 1| A soccer player wearing a red and white uniform catching the ball for a score as the opponent wearing a blue and white uniform is in the background along with a crowd of people watching the game
6867047990.jpg| 1| Participant number five catches some big air on a snowboard .
6874319983.jpg| 2| Goal tender in a hockey game about to catch the puck while second player looks on
6892090337.jpg| 1| People from all walks of life rush to catch the next train in Japan .
6906686416.jpg| 3| A male surfer catches some air off of a big wave .
6907176643.jpg| 0| Two guys in baseball caps are trying to catch a frisbee , one has caught it .
6907187997.jpg| 1| Two guys ; one in white and the other in red are leaping to catch a Frisbee .
6907188365.jpg| 0| A man jumping to catch a frisbee , outside on a field , with a few people watching .
6923312748.jpg| 0| A left handed baseball player swings at a pitch while the catcher and umpire look on .
6943202340.jpg| 0| A baseball player is sliding into a base while the baseman is catching an incoming ball during a major league baseball game .
6950137939.jpg| 2| Two teams compete in a game of football and are hurrying to catch the ball midair .
6953886164.jpg| 1| A man is catching a large wave on his surfboard .
6962651246.jpg| 1| Everybody ( including the catcher and guys in the dugout ) watch where the ball goes after it is hit by the batter .
6977076039.jpg| 4| A bald man is on a surfboard presumably ready to catch some waves .
7010540685.jpg| 4| A sports player attempting to catch the ball .
7019270491.jpg| 1| A girl wearing sunglasses is throwing a lemon into the air and trying to catch it .
7024620109.jpg| 0| two opposing rugby teams running towards the ball which is in the hands of number 7 who has jumped in the air to catch it .
7035403481.jpg| 2| A soccer goalie catching the ball as it tries to go into the goal .
7052167961.jpg| 1| Baseball catcher trying to tag out a player from the opposite team that is sliding into home base .
7063636373.jpg| 0| a referee wearing black watches closely as a pitcher dives across the line underneath the catcher-with the ball in his left hand while his right hand is on the grand over the pitcher as he falls .
7081259615.jpg| 4| A soccer player catches the ball and is tackled .
7098586179.jpg| 4| Two children try to catch a large bubble .
7113951085.jpg| 2| A woman in a pink shirt is trying to catch another woman as she slides into a baseball base .
719837187.jpg| 0| A wet brown dog is jumping into the air to try and catch a basketball with his mouth .
7206608690.jpg| 0| A left-handed pitcher wearing the number 40 is throwing a ball to a catcher .
7233046630.jpg| 0| A man kayaks down a rapid river , with another kayaker in the distance tries to catch up .
724702877.jpg| 0| Small dog catches a tennis ball in its mouth indoors .
7272406870.jpg| 0| A baseball player in white uniform and red cap , stretches horizontally to catch a fly ball , in a stadium where several advertisements line the walls , including a Bingo & Casino hall in downtown Los Angeles and an ad for AAA .
7281664064.jpg| 2| Two people chasing butterflies and catching them .
7291431398.jpg| 0| A male baseball player for the baseball team The Indians prepares to catch a ball .
7309432042.jpg| 4| A soccer goalie in the air after catching the soccer ball .
732446750.jpg| 0| Two cowboys , one wearing blue and the other wearing red , are riding horses and are about to catch a cow .
7325899094.jpg| 0| On a white board with red design , male surfer catches turquoise wave while two other people wait for more waves in deep blue sea .
7347874796.jpg| 0| There is a man in a body of water with some sort of net trying to catch something , the water looks very muddy .
7352187056.jpg| 2| Two surfers are out in the ocean , and one wearing green and black catches a wave .
7380101140.jpg| 0| A baseball player in a white uniform takes a swing at a baseball while a catcher in a black and gold uniform crouches behind him .
7382482712.jpg| 4| A men 's soccer team on the sidelines catching their breath .
7411114322.jpg| 3| The soccer player wearing blue is trying to block the opposing team from catching the soccer ball .
7503567664.jpg| 1| A quad driver goes racing up a sand dune and catches air .
"7503630432.jpg| 1| A man enjoys "" catching some air "" while driving his buggy through the sand dunes ."
7512556880.jpg| 0| A man wearing a green shirt and black pants catches a baseball , while a man in a gray shirt and black shorts runs over a base and a man in a blue shirt and dark blue shorts watches .
7526600638.jpg| 0| There is a surfer in the water , wearing a red and black bodysuit , catching a wave with his hands out for balance .
753578547.jpg| 4| A small dog trying to catch a red ball outside
756521713.jpg| 1| The woman wearing the pink jacket has thrown a Frisbee for the dog to catch .
7602898434.jpg| 4| A bicyclist goes over a dirt ramp and catches some air .
7635753040.jpg| 0| Two women are playing polo with one trying to catch a ball and the other riding the horse .
7724191016.jpg| 0| Player in light gray uniform reaches head first for baseball plate while catcher in yellow top reaches arm to tag him .
7725290846.jpg| 0| A surfer just about to catch a long smooth wave on an orange surfboard .
7757250094.jpg| 0| The batter keeps his eye on the ball during his follow through with the umpire and catcher watching on with onlookers watching behind a chain link fence .
7778073672.jpg| 3| Girl gets all her fingers cutoff trying to catch a Frisbee , fail !
7778113154.jpg| 0| Man in dark shirt , yellow shorts and yellow bandanna leaps to catch a white frisbee on a soccer court .
7802432164.jpg| 0| On a clear blue day , an ocean surfer catches a wave and delicately maintains his balance on the surfboard as he rides towards the shore .
7807617146.jpg| 0| A goalie in a hockey game dives to catch a puck as the opposing team charges towards the goal .
7920471750.jpg| 0| A baseball player is sliding in to home plate while the catcher tries to tag him and the umpire and batter watch .
7981321611.jpg| 0| baseball player dressed in blue with a red helmet at home plate in front of a catcher and umpire swinging a bat
7983485994.jpg| 3| A bicyclist uses an improvised ramp to catch air .
7987822237.jpg| 1| Biker number 7065 waves during a race , while another biker rides to catch up .
7998492801.jpg| 2| The Raiders complete the pass while the Dolphin defense scrambles to catch him .
7999505950.jpg| 0| A surfer with long blond-hair runs his hand through the water while catching a wave .
