image_name| comment_number| comment
10010052.jpg| 0| A girl is on rollerskates talking on her cellphone standing in a parking lot .
1012150929.jpg| 0| A little boy plays with a Nintendo GameCube controller inside a McDonald 's .
1014785440.jpg| 2| Two men are out for a stroll with their two young children .
101958970.jpg| 3| A man with his daughter sitting on a stroller in a supermarket .
1022454428.jpg| 0| A couple and an infant , being held by the male , sitting next to a pond with a nearby stroller .
103306033.jpg| 0| A woman wearing a brown dress with a matching turban is pushing a toddler through a park in his stroller .
104835889.jpg| 3| A man in black wields a sword in front of rolling , green hills .
105335409.jpg| 1| A trolley driver is telling people to move off of the street .
1068427675.jpg| 3| A man stand there after rolling a bowling ball down a lane .
107532584.jpg| 3| A woman in a pink hat strolls along sidewalk .
1078621572.jpg| 1| People cram together in the back of a truck that is heading through green rolling hills while passing a pedestrian along the way .
1082478946.jpg| 0| There are workers laying out the tracks for a trolley .
1099434461.jpg| 1| There is a pancake pan cooking a pancake and a man is rolling it over on its opposite side with a spatula .
1130295306.jpg| 4| A boy strolls by a pond in a park .
1131889107.jpg| 1| A group of people getting ready to rollerskate
113737410.jpg| 1| People strolling in a mall with colorful decorations hanging from the ceiling .
1141643526.jpg| 1| In a crowd of young people at a bar , a man stands displaying the rock and roll sign .
116021030.jpg| 0| The man in the hooded sweatshirt is controlling the large machine .
116862076.jpg| 0| Woman with rolled up jeans throwing a frisbee on the beach .
1172514641.jpg| 3| Two men and a dog are standing among rolling green hills .
118187095.jpg| 0| Twin toddlers dressed alike being pushed in plastic car strollers in a parade
1186391461.jpg| 0| Colored woman rolling a bowling ball down an alley .
1245022983.jpg| 0| A child in all pink is posing nearby a stroller with buildings in the distance .
128395441.jpg| 2| Someone is taking a stroll on their bike .
129662899.jpg| 4| One man is rolling in an anchor for a boat .
1307094208.jpg| 4| A man wandering in the desert as the clouds roll in .
1315116409.jpg| 0| A Drayton Manor Theme Park roller coaster is shown accelerating downwards vertically on a red colored track with several visible people making either happy , excited or scared faces .
1332790049.jpg| 3| A marketplace with rolling carts selling fruits .
1336391319.jpg| 1| A person reaches for a fallen item while holding a rolling cart carrying Dole crates .
1342407554.jpg| 1| A man and a much younger boy , both wearing hats , taking a stroll through nature .
1347001782.jpg| 1| Joggers and other pedestrians enjoy an evening stroll across a bridge .
1368108583.jpg| 3| Young couple taking a stroll in a busy city .
137231942.jpg| 1| A man with blond-hair and tattoos strolls behind bleachers on the cellphone .
1374577120.jpg| 1| A man in a blue shirt holding a child while holding onto a stroller at a baseball stadium .
1377428277.jpg| 2| A one man band with a red umbrella stops in front of a woman with a child in a stroller .
1387785218.jpg| 0| A little kid in blue shoes is pushing a toy baby in a stroller .
1395107023.jpg| 1| A brunette , caucasian man stands in a long-sleeved shirt with his cuffs rolled up using a sizable music mixing machine by DX .
1396703063.jpg| 1| A man wearing a white shirt , gold cross , and a cowboy hat is standing in front of a roller coaster .
1397344877.jpg| 1| A large crowd of people walking while being controlled by officers among them .
1402641725.jpg| 0| Four kids rolling and sliding down a sand dune .
1408554531.jpg| 1| A woman wearing rolled up jeans and a black shirt is walking past a bus carrying a shopping bag .
141213544.jpg| 0| Two women with black hair wearing flower leis standing in a store with a baby in a baby stroller .
1414911626.jpg| 0| Red white and blue SUV patrolling the beach and shoreline on a cloudy day while seagulls walk in the sand .
1417031097.jpg| 2| A person is laughing on a roller coaster ride .
1423449879.jpg| 0| People of all ages stroll carelessly through aisles and aisles of kiosks , browsing the variety of random merchandise from vendors at a large flea market .
14252494.jpg| 0| A child in blue jeans with the cuffs rolled up and black socks taking a nap under a plum-colored covering decorated with large white concentric circles .
1454217779.jpg| 4| If this sculpture were real heads would roll .
1459581481.jpg| 0| A sleeping baby is being pushed in a stroller on a walkway next to a large body of water .
146906547.jpg| 1| In front of palm trees , figures ride bicycles while a couple walk and a child wears rollerskates near an older person .
1473080948.jpg| 0| A kayaker wearing a blue wetsuit and black helmet paddles his yellow kayak in murky rolling rapids .
1489529980.jpg| 2| A lady in a scarf placing rice down to roll sushi .
149167610.jpg| 0| A young man with a script tattoo on his right forearm smokes a cigarette and holds a rolling pin while standing in a dirty , compact kitchen .
151198526.jpg| 0| The 4 guys were rollerskating and blading a conga line in the outdoor staking rink with many other people on the sunny day .
156222796.jpg| 0| Many people in a public area , many pushing children in strollers .
157245265.jpg| 0| Asian children dressed in red and yellow , and wearing black knee pads , rollerskate outdoors over vast , shiny tile .
157613268.jpg| 2| Three tall women stroll down a crowded sidewalk .
168131914.jpg| 0| A young lady is being videotaped while she 's sitting in her stroller in front of a Sysco truck on the sidewalk .
170737141.jpg| 0| Woman pushes her two young boys both in red in stroller by the train .
17744613.jpg| 3| A man in a black shirt is rolling a bowling ball towards a set up of spray paint cans .
177591612.jpg| 1| Two guys against a wall , one is in black pants and is upside down , the other man is in khaki rolled up pants holding the other one up .
179620911.jpg| 3| Sun drenched strollers enjoy music on the water .
1812525037.jpg| 0| The two young children are in black and white face paint and costumes while riding in a stroller , they are being pushed by a man also in face paint and a costume
1813266419.jpg| 0| A child in rolled up jeans , a striped shirt , and a helmet frolics in sprinklers .
1893252455.jpg| 1| A man in the background about to roll a die with army men and a die in the foreground
189400451.jpg| 1| Crowds stroll past an elegant and ancient looking structure .
191375755.jpg| 1| A couple in jeans strolls down a street that is adjacent to an area being blocked off with orange netting .
195193694.jpg| 0| A man in a black vest and blue jeans is rollerskating .
19786858.jpg| 0| There is a man and a woman sitting on lawn chairs next to a skate park with a group of guys on bicycles in the background and a woman with a child in a stroller on the side of the picture .
2010898020.jpg| 0| An older gentleman is harvesting while wearing a large maroon sweater vest and rolled up navy pants .
201995559.jpg| 1| A woman is talking on a phone while a little girl is rollerskating behind her .
2029280005.jpg| 2| a man in a black shirt is rollerblading past a bench in the city .
2040964486.jpg| 0| Construction workers are talking while another is driving a steam roller .
205842.jpg| 0| A little girl wearing a pink shirt and backpack is pushing a little boy wearing a green shirt in a blue stroller .
2060031241.jpg| 0| Baby sitting on floor and holding a game controller over its head .
206475531.jpg| 1| Confused person standing in the middle of the trolley tracks trying to figure out the signs .
2095435987.jpg| 1| A white and brown dog rolls on its back in the sand .
210711305.jpg| 1| Two woman and a man are walking on a rock path with a baby who is riding in a red stroller .
2119206841.jpg| 2| Mother lifting her child onto a spin roll toy .
2119660490.jpg| 1| A brown dog is rolling on its back on a carpet with several green toys nearby .
2136455112.jpg| 4| A man helping a young child rollerskate .
213759069.jpg| 0| A little boy watches from his stroller as an older boy with a yellow balloon wanders a few steps away in a fair like setting .
214774826.jpg| 3| A woman is rolling her luggage down a brick sidewalk with brown benches .
2187720319.jpg| 4| A black dog jumps over rolled hay .
2189627515.jpg| 0| A person carrying a child piggyback style on a beach chasing a frisbee rolling toward the water .
2190899457.jpg| 0| A woman and two gentlemen are taking a stroll along the beach , as the woman talks on her cellphone one of the men takes her picture .
2204777844.jpg| 0| A child in red , wearing rollerskates is being pushed along by an adult in black .
2208652989.jpg| 1| A policeman on a white horse are patrolling the streets of the city .
2216568822.jpg| 0| A roller derby woman wearing a helmet has a tattoo of a white Indian pulling back a bow .
2218984085.jpg| 2| A group of people in silhouette play on a beach as the surf rolls in .
2226343167.jpg| 2| Two hipsters strolling down the street with ridiculous looking clothes on .
2228167286.jpg| 0| Toddler boy wearing airplane shirt , in stroller with large beads .
2228619706.jpg| 2| A small boy with blond-hair is rolling an orange bowling ball down a lane .
2234368402.jpg| 4| A child looks through a window and a woman stands outside a rolling security door .
2251992614.jpg| 0| A man walks with his shirt off and rolled up pants in a busy city street .
2256447557.jpg| 2| Young women chat after a stroll along the beach line .
2268207503.jpg| 0| A lady pushes a stroller , behind a child , riding a tricycle , while another child walks along side .
227000285.jpg| 3| A man is standing outside with his shirt rolled up and showing his stomach .
2287962706.jpg| 3| A steam roller goes by as one worker in orange raises his hand .
2289096282.jpg| 1| A person rolls down a hill riding a wagon as another watches .
2294231101.jpg| 3| A backpacker smiles widely as she strolls down the street .
229862312.jpg| 3| A dog rolling in the grass .
2305872258.jpg| 0| Two young children huddle around a woman on the street between two green and yellow trolleys .
2326666568.jpg| 2| A group of people taking a stroll on the beach at sunset .
2332975167.jpg| 4| A traffic controller is watching his camera .
2339533906.jpg| 0| A group of roller derby athletes dressed in black and skating the rink .
2344412916.jpg| 0| The man in the red cap is rollerskating on a path in front of the white building .
235834122.jpg| 1| A well-dressed group of mixed gender is rolling down a white slope inside a building .
2371173787.jpg| 0| Three boys in rollerblades sitting by a brown wall while the other boy skates on the wall .
2373370266.jpg| 0| A blond child holding a sword and dressed in a black robe is standing next to a stroller .
2373790865.jpg| 3| A woman is rolling her grocery cart across the street .
2376252671.jpg| 2| A man in black rolling a round table across a floor .
2394922193.jpg| 0| Woman wearing a red sweater , brown slacks and a white hat , rollerblading on the street in front of a yellow building .
2410153942.jpg| 4| a red car has rolled over on a dirt track .
241788774.jpg| 1| Two small babies are sitting in identical strollers .
2460188548.jpg| 0| Young woman dressed in black and white is rolling a large black ball in a patch of dirt that is close to a field of green grass that is surrounded by trees .
2480158575.jpg| 2| A boy with a blue shirt is leaning against a poll , next to his stroller .
2500864135.jpg| 2| A group of people wait at a stop for the next trolley .
2503091968.jpg| 1| A crying child in a parked car , clutches at the rolled down window .
2503678250.jpg| 3| Boy reading book with company of a rolled over dog .
2508019949.jpg| 0| A person dressed in a dress with flowers and a stuffed bee attached to it , is pushing a baby stroller down the street .
2513216023.jpg| 2| An old man standing in front of rolling security doors filled with graffiti .
251489987.jpg| 1| A lady jumping on a trampoline with rolling mountains in the background .
2536808189.jpg| 4| A man rolling up a hose at a train station .
2536858553.jpg| 2| A man on a scaffold paints a wall with a paint roller .
2537583012.jpg| 0| Two men , one wearing a green shirt , the other wearing red are rollerblading .
2537620898.jpg| 0| A large group of workers , dressed in blue with orange vests and hard hats , are standing around a large roll of wire .
2553089098.jpg| 0| a man with a rolling stones t-shirt on with beige pants sitting in a highchair adjusting a black guitar
2560981288.jpg| 2| Two little boys rolling down a hill .
2565511567.jpg| 1| Man paints red wall orange with a roller while suspended from a swing .
257456026.jpg| 2| Woman in pink goes for a stroll through a field .
2579266054.jpg| 0| The roller coaster is going through a twist , turning the people upside down .
2579268572.jpg| 0| Many people on a roller coaster ride are flipped upside down over a white track .
2580174179.jpg| 1| A larger man in a leaf-printed shirt is working with his remote controlled airplane .
258083997.jpg| 0| A young man on rollerskates , in white shorts , part of a crowd watching a black man in a red shirt .
258501174.jpg| 0| Two men with orange shirts pushing children in strollers during marathon .
2588003676.jpg| 0| A group of people raise their hands and scream as they swoop down on a roller coaster
2593392439.jpg| 1| a man with dreadlocks , strolling along a street side cafe while strumming a guitar
2594698744.jpg| 3| Two women in white dresses stroll through a park .
2601454675.jpg| 0| A man wearing a brown shirt and backpack is pushing a stroller while a small toddler is walking along aside him on a rain-covered street .
2620517927.jpg| 1| Police patrolled the downtown streets on their motorcycles .
2644302353.jpg| 0| Tourists stroll the streets between historic buildings .
2653199219.jpg| 1| Young boy is eating an egg roll with a plastic fork and looking off into the distance .
26653224.jpg| 1| Several people gathered at a train station - one on rollerblades .
2666742902.jpg| 0| A young child with dark hair and Asian features smiles out of her stroller in a shoe store .
26720379.jpg| 0| This is the image of a young child with his head slanted back , and is sleeping in a green stroller with white plastic bags hanging from the back .
2674784195.jpg| 2| Two children are rolling in muddy water .
2678685955.jpg| 1| A lady with a green top is rollerskating through a crowd .
268223986.jpg| 2| A family is sitting down in a market with a baby stroller and shopping bags .
268654674.jpg| 0| The couple pushed the strollers across the wood bridge and the dogs followed .
2687075275.jpg| 1| Two toddlers , in a stroller , are placed in front of a firetruck .
2687891662.jpg| 0| Several people are riding a roller coaster , two of whom are blond women with small children beside them .
2693539377.jpg| 1| two little kids having fun at a roller coaster
2696636252.jpg| 2| A rollerblader grinding a rail and grabbing one foot .
2696866120.jpg| 0| A dirty tan dog rolling in the dirt and looking right at the camera .
2704257993.jpg| 1| Little boy skating in roller rink , two little girls in background .
2705101597.jpg| 2| A boy in a red cap rolls his bowling ball down the alley .
2705925058.jpg| 4| Girl smiling on roller coaster .
2705925646.jpg| 0| A woman with a scared look on her face preparing for roller coaster ride .
2728583298.jpg| 2| Men and women strolling in the park on the sidewalk .
273295809.jpg| 0| Two police officers wearing rollerblades are talking to a man on the sidewalk .
2736263351.jpg| 0| A man with his sleeves rolled up is gardening next to a pole .
2746805293.jpg| 3| A crowd awaiting the arrival of a trolley .
275002371.jpg| 0| a brown dog is rolling around on the grass .
2752230113.jpg| 4| A casual family stroll by the water .
2763601657.jpg| 4| A couple strolls down a path near benches and water .
2773011586.jpg| 4| Two people raise up their arms in a roller coaster ride
2778198363.jpg| 0| A person in a shirt and rolled up jeans is running on a road through a forest .
279233409.jpg| 3| Two young black boys , One holding a scroll of their culture .
2819254573.jpg| 0| The blond boy is riding roller-coaster with his mouth wide open .
2831313661.jpg| 0| A man in a brown striped shirt is walking on the beach with a roll of string in his hand .
2831314869.jpg| 3| A fisherman sits on the roll of chain .
283611810.jpg| 1| Two men , one in a gray t-shirt and one in a black shirt with sleeves rolled up , are drinking in a bar .
2836703077.jpg| 1| Two children riding a blue roller coaster smile .
2836864045.jpg| 3| A dog strolls , holding a Frisbee in its mouth .
2847541837.jpg| 0| Five children playing on the beach as waves are rolling in , getting their feet wet .
2847615962.jpg| 0| A dog rolls on a mattress placed on a porch and scratches his back .
2851304910.jpg| 3| A woman with a camera looks out over rolling hills .
2856564292.jpg| 2| People are strolling and conversing on a sidewalk in front of a hospital .
2860400846.jpg| 0| A white dog jumps above a red Frisbee that is rolling along the surface of a low cut field .
2866016431.jpg| 0| A woman dressed in black with a green rolling suitcase walks down the sidewalk .
2866093652.jpg| 0| Four people rollerskating with spectators in the background .
2876494009.jpg| 3| A rollerblader is in midair on a ramp .
2877088081.jpg| 2| Man with helmet performing a trick while rollerblading .
288406480.jpg| 0| A baby wearing yellow is pretending to be a doctor while inside a stroller .
2891961886.jpg| 1| A man on rollerblades grinds a wall .
2894893895.jpg| 2| A man wearing headphones is controlling a machine .
289616152.jpg| 3| A man is rollerblading down a rail .
2899276965.jpg| 1| A man wearing black pants rides along a concrete ledge on rollerblades .
2905975229.jpg| 3| Airplane controller is outside white airplane .
2907244809.jpg| 1| A young skateboarder rolls down a graffiti-covered ramp .
2911107495.jpg| 3| a rollerblader grinds a rail .
2913345328.jpg| 0| A man with a race number on his shirt running with a little girl in a stroller .
2917248300.jpg| 0| A baby in a stroller , and several men sit below a structure that is casting striped shadows on them .
2918653119.jpg| 0| rollerblader in green shirt and hat , slides down a green handrail next to steps
2929006980.jpg| 3| A man on a roller scooter holding on to rope
2937611480.jpg| 0| Three people , two seated on a large rolled up piece of artifcial turf and a female standing talking to one of the seated men .
2953015871.jpg| 0| A black and tan dog rolls on his back in a field .
2961320666.jpg| 4| A woman and a boy out for an afternoon stroll .
2966930445.jpg| 0| A baby wearing a hat and sleeping in a blue stroller .
2968885599.jpg| 0| A man controlling a dog sled approaches another dog sled team in a narrow , snowy passageway between two sets of trees .
2981372647.jpg| 1| One pale dog is rolling on his back while two others stand nearby .
2987142183.jpg| 1| A secluded couple in swimwear strolls along the beach on a calm day .
2989626215.jpg| 0| An older man wearing shorts and t-shirt pushes a baby stroller as he walks in front of two women wearing hats .
2991662048.jpg| 1| A middle-aged blond woman is directing an object onto a trolley .
2992658871.jpg| 0| A man in a white helmet and green shirt grinds on his rollerblades .
300501052.jpg| 3| One girl holding a violin with another dancing on a beach with waves rolling in .
3012334157.jpg| 0| Two adults with a stroller and a child stop in front of a man in a colorful plaid outfit .
3022505829.jpg| 1| Two people standing by a small cart and a bucket on the beach , while waves roll in , and seagulls look on .
3030565991.jpg| 0| A boy in blue and white on rollerskates holds hockey stick with a black ball at the end of it .
3036894037.jpg| 2| Two armed police officers are patrolling the streets .
3041262779.jpg| 0| Two mothers stroll their children in the park , during the beginning of Autumn .
3051341320.jpg| 0| People are riding a blue roller coaster-like ride with wide seating mechanisms .
305979887.jpg| 0| A person is sitting on a yellow picnic table with a water bottle , while a baby stroller sits beside her .
3060579494.jpg| 1| Five young people are playing hockey while wearing rollerskates .
3061884351.jpg| 1| A boy in yellow pants and a blue shirt is rollerblading on the side of his black skates .
3067711936.jpg| 2| Group of young women in dresses strolling on the sidewalk .
3085017634.jpg| 0| Four boys are playing hockey in rollerskates while wearing blue and white safety gear .
30906273.jpg| 1| A man is taking a picture of himself , and a shouting child in a stroller , in a mirror .
3105743276.jpg| 0| A group of people standing on a hillside decorated with yellow flowers as fog rolls over a nearby mountainside .
3111502208.jpg| 0| A blue uniformed rollerskater is struggling for the lead against a long-haired , tattooed and red uniformed rollerskater .
3124964754.jpg| 3| The man is rollerskating on a green barrel .
3126522868.jpg| 4| A young child winds up to roll a bowling ball .
3134768532.jpg| 3| Three women enjoying a stroll through the streets .
3142787646.jpg| 2| A woman watches as her bowling ball rolls down the lane toward pins .
31490969.jpg| 0| Two young men walk through a fairgrounds , one pushing a covered stroller and the other carrying a large stuffed animal and pink pillow .
3153067758.jpg| 0| Man seated on train , holding onto a rolling coat rack that holds a shopping bag
3165123595.jpg| 1| Four ski patrollers on skis are wearing helmets and goggles .
3165826902.jpg| 0| A rollerblader grinding down a narrow platform at an indoor skate park .
3168306969.jpg| 0| A young boy with a name badge on his black jacket plays with a hammer and circular saw next to a roll of carpet padding .
3185850921.jpg| 1| A balding man in a black Enrolling Stones T-shirt reads a book .
"3186668412.jpg| 0| A man in a black shirt displaying the text "" Enrolling Stones "" plays a keyboard ."
3201128175.jpg| 0| A man with a half mask over his face is holding a toy helicopter in his left hand and a controller in is his right hand .
3201943535.jpg| 0| A man with a hat on and sleeves rolled up is working on the back tire of his bike .
3202213467.jpg| 0| Older lady wearing glasses and working on rolling out a dough like substance .
3207420792.jpg| 1| Old man taking a stroll along the beautiful rolling green hills .
322628645.jpg| 0| An Asian woman in a purple shirt preparing a bowl of food for the younger Asian boy sitting near buy , while an Asian man eats a roll and prepares to take some food up with his chopsticks .
3234890865.jpg| 0| A man is pulling tricks on his rollerblades in a indoor skate park .
3238044322.jpg| 0| A person is about to roll the bowling ball attempting to hit bowling pins .
3242263536.jpg| 2| A rollerskater does tricks on a half pipe .
3246613257.jpg| 0| A girl , dressed in winter clothing , is rolling a giant snowball along the snow-covered ground .
325015111.jpg| 0| A man prepares to roll a bowling ball between his legs while another man watches from the next lane .
3251648670.jpg| 0| Two boys walking to make a cylinder roll at a small carnival .
3253257881.jpg| 2| A little girl taking a stroll in a huge , manicured park .
325696203.jpg| 0| A woman with a stroller talking through a fence too four students with green uniform shirts .
3272541970.jpg| 2| A rollerblader skates down a ramp with his arms in the air .
3275065565.jpg| 3| The two dogs are rolling on a purple blanket .
3278132385.jpg| 0| A shirtless Asian looking man is sitting on the ground , with shorts on , slightly obscured by an evergreen shrub in the foreground while another shirtless male stands in the background of an outdoors scene with the evergreens lining either side of a green pathway on a rolling hillside .
3307978046.jpg| 0| A group of people in red clothing with scooters ride down the hill on rollerblades .
3321018071.jpg| 4| Two guys out for an afternoon stroll
333214858.jpg| 2| A worker wearing a white shirt is moving a platter of rolls in a bakery .
3334040774.jpg| 1| A woman who face is streaked with black lines and dressed in roller derby gear adjusts her strap .
3337945511.jpg| 0| A woman wearing rollerskates stops in the middle of a sidewalk or plaza to help a crying child who 's wearing a blue and yellow wizard costume .
3341919445.jpg| 0| A tired looking child is sitting in a stroller and rubbing its eyes .
3346289227.jpg| 0| A man is rollerblading down a white railing beside a red brick building .
3346919327.jpg| 0| A woman is pushing her child in a stroller while walking with her family .
3350671534.jpg| 4| guy rollerskating on skate ramp
3351586010.jpg| 1| a young boy is rollerblading across a wide open space .
"3353962769.jpg| 0| A motorcyclist "" pops a wheelie "" in a grassy field framed by rolling hills ."
3357194782.jpg| 3| People ride a bus or trolley .
3371533654.jpg| 0| A rollerblader rides high in a full pipe while others watch
3373946160.jpg| 2| A black and brown dog rolls around in the grass .
3374444564.jpg| 4| Two people strolling behind a school bus .
3384742888.jpg| 0| Black and tan dog playing with a toy and rolling on the grass .
3393394134.jpg| 0| The dog is rolling on its back on the grass with its mouth wide open .
339658315.jpg| 1| Two women with strollers standing next to a table and chair .
