image_name| comment_number| comment
2705099783.jpg| 2| A handicapped man plays a game while an elderly woman watches .
2705101739.jpg| 0| A boy in colorful pants plays guitar and laughs together with his friends .
2705102979.jpg| 2| A boy is doing a skin-the-cat on some playground equipment .
2705103851.jpg| 0| Teenagers making conversation , spending quality time , and playing with elder people .
2705298070.jpg| 2| Two sports men are playing a game before many viewers .
2705860464.jpg| 0| Three children , a blond and two brunettes , are playing doctor with a mannequin lying on a purple desk .
2705920066.jpg| 3| Two guys playing a game at a bachelor party .
2705920660.jpg| 2| A group of young people are sitting around talking and playing guitar .
2705923038.jpg| 0| A fisheye lens aerially captures a young girl with dark hair on the playground .
2705923388.jpg| 0| A young man is sitting at a table playing BINGO with an older lady .
2705925410.jpg| 2| A young man in a black shirt and blue shorts is playing air guitar .
2705947033.jpg| 0| Three children play in an outside wood structure .
2706430695.jpg| 0| An older girl and a younger girl playing barefoot in a puddle
2706469334.jpg| 1| Two young boys in swimsuits are playing on a beach by the ocean .
2706743557.jpg| 1| Two males and one female playing in a fountain of water .
2707873672.jpg| 1| Two redheaded boys with glasses stand on bench , play swordfight with sticks .
2708744743.jpg| 0| A woman is using Frisbees to play with a dog in front of a stadium crowd and a group of baseball players .
2708775214.jpg| 0| A young man in a black graphic shirt is pretending to place his hand in a torture device in a playful manner .
2709695869.jpg| 1| People are playing in sprinklers in front of a monument with a person 's face on it .
2710563762.jpg| 0| A girl basketball player wearing blue is blocking another girl player wearing yellow .
2711203701.jpg| 3| Two small children playing in a kiddie pool with water guns .
2711230445.jpg| 4| A family playing in the pool .
2713554148.jpg| 2| Little kids play a game of running around a pole .
2713897716.jpg| 0| A black and white dog playing with a white ball in a sparse brown field .
2714699748.jpg| 0| Two dogs are playing together on white carpet near a couch .
2714703706.jpg| 4| dogs playing
2714878018.jpg| 2| Young boy with glasses playing in the sprinkler .
2715262147.jpg| 1| A young girl and a young man playing a toss game at an outside party .
2716718260.jpg| 0| A young man with long , frizzy hair pulled back in a ponytail and wearing a blue button-up shirt plays the clarinet .
2716903793.jpg| 1| The two boys play in the field .
2717110088.jpg| 0| Two children play in a department store , laying under the polka-dot covers of a pre-made bed in the home furnishings department .
271770120.jpg| 1| Two large , black dogs are playing with a collapsed ball .
2718024196.jpg| 1| A young boy plays outside on a sunny day on his slip and slide .
2718027742.jpg| 2| A child in a bathing suit plays in a sprinkler .
2719343003.jpg| 4| A young boy playing in the water .
2719343357.jpg| 0| A girl wearing a pink bathing suit top and sunglasses is playing in the sand next to a boy wearing red swim trunks .
2719575713.jpg| 0| Two boy children , one wearing a helmet , play at a table in a room full of toys .
2720039582.jpg| 0| Having fallen on his upper back , a football player wearing a black jersey and white pants with an orange and black stripe , flanked by two players in white jerseys , clasps a football .
2720167660.jpg| 1| Boys are playing near water and one of them is jumping .
2720215226.jpg| 1| A dog wearing a blue ribbon sits in front of a fireplace that displays more ribbons .
2720985888.jpg| 0| A smiling little blond girl holds stands in a play structure and holds a green toy .
2723250451.jpg| 1| A male tennis player that has just swung to hit a tennis ball .
2723477522.jpg| 4| two dogs play in the grass .
2724069562.jpg| 1| A tennis player in a red shirt strikes a dynamic pose .
2724074148.jpg| 4| Here is a male tennis player about to swat a serve .
2724379828.jpg| 0| A black male in a green t-shirt and blue jeans , playing violin while seated in a green chair .
2725042940.jpg| 1| A boy playing basketball in a fenced area and hanging from the hoops .
2725441885.jpg| 0| A baseball player in a uniform with a dark top and light pants is hitting the ball with his bat .
272546805.jpg| 1| A large brown dog is playing tug-of-war with a large black dog .
2726262796.jpg| 0| A young girl wearing a blue bathing suit plays in the waves at the beach .
2726791588.jpg| 3| Two men are standing on a football field by football players .
2727051596.jpg| 1| Two little boys playing a game , one with his mouth wide open .
2727591060.jpg| 0| A woman , a card dealer , and a person in a Coldwell Banker dog mascot costume are playing a gambling game .
2728276857.jpg| 0| A group of women pose for a picture as a man plays guitar behind them .
272940778.jpg| 3| Two dogs run around in a field playing .
2729655904.jpg| 0| Two boys and two dogs are playing in the sand and water at the seashore .
2730819220.jpg| 0| a little girl is just reaching the bottom of a playground slide
273248777.jpg| 1| A football player in a full stadium jumping and recieving a football .
2734669176.jpg| 1| A baseball player , a woman with Frisbees , and a dog in front of blue bleachers .
2736169657.jpg| 1| An older man with long , shaggy gray hair , in a dark gray suit , plays a musical saw in front of a microphone .
2736200571.jpg| 0| A man with slicked back hair and black coat plays a recorder .
2736508369.jpg| 1| A baseball player is tagged out sliding into second base .
2736991184.jpg| 1| A man playing guitar in front of a crowd .
2737106219.jpg| 3| Old lady looking at lady in red jacket playing with baby .
2737233999.jpg| 0| Four people playing basketball on wooden area near the beach .
2737729252.jpg| 2| Two little girls playing in the parking lot .
2737873732.jpg| 2| A woman is standing behind a table with items on display .
2737920326.jpg| 0| A band is standing in front of a group of people playing there guitars and singing .
2738379929.jpg| 0| A young Asian girl in play clothes runs across a grassy field with bushes and fowl in the background .
2741051940.jpg| 0| A small dog is playing with a plastic bag on the sidewalk .
2741388782.jpg| 2| A man holding and playing with a blond little girl .
2741802133.jpg| 0| Three men ; one pedaling while playing drums , one playing piano and one both pedaling and steering , move a type of mobile band down a street .
2742801792.jpg| 0| A man playing volleyball on a beach on a beautiful sunny day .
2742808804.jpg| 1| A little girl is playing by jumping from one stepping stone to another .
2743046728.jpg| 4| Two young girls are playing on the beach .
2743945813.jpg| 3| Three little children playing behind bars
2744690159.jpg| 1| Three brown dogs are playing in the sea .
2744705574.jpg| 4| a dog playing in the water
2745487323.jpg| 0| A man plays the piano , while a second man plays a guitar and a third man plays the saxophone .
2745520849.jpg| 0| This is a painting of a group of people playing string instruments in a old building with many shiny glowing chandeliers .
2745656473.jpg| 0| A bald man in white linens plays a musical instrument on a red rug outside .
274604264.jpg| 0| A man wearing a red bicycle helmet is buried in fallen tree leaves with two young boys with playground equipment and trees with golden leaves in the background .
274616466.jpg| 3| two children play with food on a table .
2746839158.jpg| 0| Two young boys play in the water that has collected on the street .
2746910139.jpg| 0| A child playing with water in a children 's discovery museum .
2747637478.jpg| 0| A man , wearing a white t-shirt and jeans , sits on two stacked crates while playing a guitar for tips .
2747640247.jpg| 0| A girl is playing on a homemade swing that hangs from a tree over water .
2747714500.jpg| 1| A girl wearing a yellow dress is playing in water while others are watching .
2747895243.jpg| 0| A two man band with guitar and drums are playing to an audience in a crowded room .
274840168.jpg| 1| Children wearing school uniforms playing in a water fountain .
2748403765.jpg| 2| A guy painted in blue plays his blue guitar on the sidewalk .
2748726146.jpg| 0| A man wearing all black plays a coffee-burst bass guitar with a band .
2748929011.jpg| 3| A man is playing golf , striking his ball out of a sand bunker .
2749228652.jpg| 0| A man is holding a microphone and another man is playing a guitar and jumping on a stage .
27499590.jpg| 0| A man in a gray t-shirt is playing guitar and singing .
2750741104.jpg| 2| Little girl trying to teach her baby brother to play ball as Dad watches .
2750832671.jpg| 0| A black dog plays with a white and blue colored stuffed animal .
2750912179.jpg| 0| Two young , blond girls wearing dresses are playing and climbing on an iron fence ; in the background is a red brick wall .
275170947.jpg| 0| Actors in costumes rehearsing for a play , while a man with black hair and a white shirt sits on a stairway .
2751721665.jpg| 1| A small boy is playing with a gun on the sidewalk outside .
2752043092.jpg| 0| A young child in a blue outfit plays with a watch he is wearing .
2752265504.jpg| 1| A young boy in a dark shirt is playing a carnival fishing game with an older man standing next to him .
2752854276.jpg| 2| A little girl in a blue shirt is playing with something on a countertop .
2752919987.jpg| 1| A man and woman kiss on a dance-floor while a band plays
2753157857.jpg| 0| A woman in brown plays a wind instrument on stage with a man in white playing the harmonica and another plays a guitar .
2753682793.jpg| 1| Three preteen boys in a private swimming pool playing a water sport .
275401000.jpg| 0| A brown , tan , and white dog and a black and white dog are playing with a tennis ball on a house deck .
2754940943.jpg| 0| A heavyset young man in a blue T-shirt and heavy black-rimmed glasses is playing the guitar on the street .
2755314937.jpg| 1| Young blond girl displays a colored tongue .
2757803246.jpg| 2| A child plays outdoors , near a group of people who are mostly seated .
2760371526.jpg| 2| A boy in goggles plays in a pool .
2761599088.jpg| 4| a dog plays with his toy .
2762702644.jpg| 0| A woman wearing a red and black outfit standing in front of a building playing a violin .
2763691073.jpg| 1| A man wearing a gray and black outfit is playing tennis .
2763691333.jpg| 0| A tennis player in a gray t-shirt is jumping and trying to hit a tennis ball .
2763692131.jpg| 0| A man with a gray shirt and black shorts plays tennis in a fenced outdoor area .
2763767621.jpg| 0| Male child playing on round contained ride in the park by himself .
276589119.jpg| 0| A band that consists of four men , one of which is singing and three playing guitars .
276598014.jpg| 0| A male singer , dressed in a long purple pea coat , holding an electric guitar , singing into a microphone , while a male in sunglasses and wearing headphones , plays drums , with purple drapery hanging in the background .
276638308.jpg| 0| A man in a brown shirt plays a horn in front of a free spirit store .
2766926202.jpg| 0| Two children wearing glow necklaces play with sparklers while standing in water .
2770477799.jpg| 0| A young boy playing in a water bath in a pier at the world convention center built last year
2771662950.jpg| 0| A baseball player is standing in place , catching a flying baseball in his mitt .
2771802800.jpg| 0| A young girl wearing a striped shirt and black pants is playing with a slinky as people walk by .
2771980357.jpg| 0| A scottish band , whose members are dressed in kilts , marching in front of onlookers , playing bagpipes .
2772286941.jpg| 0| A soccer player in a blue shirt uses his back to play the ball as the player in the white shirt attempts to gain control of it .
2772292098.jpg| 2| A child playing with water noodles in a pool .
2772793352.jpg| 4| Two children playing video games in a red chair .
2773136618.jpg| 3| A young soccer player kicking a soccer ball .
2773139170.jpg| 1| A soccer player in a red shirt in diving into the air .
2774010992.jpg| 0| A man in a plaid shirt and a hat looks on as a young child plays in a yard that contains rubble , a mattress , and a bucket .
2774012125.jpg| 0| Children playing on a sandy playground , and one of them has a bike .
2774020195.jpg| 0| One shirtless boy and two boys wearing striped shirts wrestle with each other playfully .
2774025309.jpg| 2| Two young boys play marbles at the bottom of a stairwell .
2774041957.jpg| 0| A boy in an orange shirt plays on a large drainpipe with several other children in a sandy area .
2774430374.jpg| 1| A little boy playing baseball outside wearing flip-flops .
2774554310.jpg| 0| A woman in pink pants and a black tank top displays the tattoo on her back .
2774875318.jpg| 1| A young male is playing with a rope tied to a tree .
2774880158.jpg| 0| Young South Asian Children play in the water near a small dam in a guided river .
2776029171.jpg| 0| A little boy is running on the round playing with a little girl .
2778696039.jpg| 4| A young boy playing in the street .
277928620.jpg| 0| There is a woman sitting down in front of an organ , at a church , practicing or beginning to play .
277930631.jpg| 0| A man in a red hat playing a guitar and singing into a microphone .
2781296531.jpg| 1| A boy is splashed in the face by a playground toy at a water park .
2781699063.jpg| 3| Two people enjoying a water fountain display .
2781920563.jpg| 3| A hooded man working in a kiosk displays his wares .
278608022.jpg| 2| A male watches a young female playing soccer .
2786242106.jpg| 1| A boy plays within the path of a large outdoor meditation labyrinth .
2791234044.jpg| 3| A man is hugging a lady in front of a Heineke display .
2792254349.jpg| 4| A young man in a wife beater t-shirt is playing the drums .
279233409.jpg| 0| Two children display a stone with dialect on it while people in the background are reading .
2793105660.jpg| 0| A young man with glasses wearing a black t-shirt is playing the guitar in a green walled room .
2793597468.jpg| 1| A black man is watching another black man playing in the waterfall .
2795679393.jpg| 0| A man is crouched down on a play mat with two children and is letting one of the children sip from his glass .
2796095711.jpg| 0| Woman in gypsy outfit plays the saw as a musical instrument .
2796525620.jpg| 0| Two young siblings standing next to each other in playpen .
2796921601.jpg| 4| A boy stands ready to play in a soccer game
279728508.jpg| 4| Two boys playing in a lake .
2797640772.jpg| 0| A saxophone player dressed in a blue sweatshirt and an accordion player entertain people on the street , including a pirate .
2797774642.jpg| 2| Young boys in yellow and red uniforms are playing soccer .
2797785048.jpg| 0| A boy in an orange and black soccer uniform playing soccer on an artificial turf field , with the ball out in front of him .
2798651021.jpg| 0| A man sits by a driveway in front of a white building playing an accordion .
279901198.jpg| 3| A few brown dogs play in some dirt near woods .
2800004913.jpg| 1| This boy is spreading his arms while playing in the water .
2800842386.jpg| 0| An attractive young woman with blond-hair is playing a guitar in the street .
2801851082.jpg| 3| A boy plays with a water tube .
2802158972.jpg| 0| A group of guys are standing on a stage playing several different instruments .
2803058589.jpg| 0| A boy wearing red swim trunks is playing in the water at the beach .
28041138.jpg| 0| Man wearing a cotton gray tank top , straw hat and rope necklace singing into a microphone and playing a bass .
2804851816.jpg| 3| A brown dog has a ball in his mouth while playing in the fence .
2804904604.jpg| 0| A small blond boy plays with a rubber paint-spattered mallet .
2805101709.jpg| 2| A blond girl climbing on a play set .
280511194.jpg| 0| A group of adults holding musical instruments , they do not appear to be playing the instruments .
2805822564.jpg| 4| A young girl plays in the sand on a beach .
2806006698.jpg| 0| Beach volleyball player Dalhausser just blocked a spike from a Brazilian beach volleyball player .
280608840.jpg| 1| 4 string instrument playing men sit on a black stage playing their instruments from their music stands .
2806447.jpg| 0| Indonesian sitar player and drummer playing their instruments on padding in front of a river .
2807177340.jpg| 0| A child in jeans and a t-shirt hangs from monkey-bars at a playground .
280840823.jpg| 0| Three young men are seated at a table playing a game of Monopoly while drinking sodas and one man is shoving the other away from him .
2808838598.jpg| 1| This person is in a boat with a display of food laid out on a platform across the boat .
2809406383.jpg| 0| The little boy with the yellow and blue striped shirt is playing a board game with an adult .
2809793070.jpg| 0| Three large black dogs are playing on the shore near the ocean .
281076795.jpg| 0| A man and woman play roulette with a blackjack table in the background .
2812086571.jpg| 0| A young boy dressed in white jumps , while another in blue plays on a small frog statue .
2812568040.jpg| 2| Two young girls with fishing poles and a man displaying a fish they caught .
2813033949.jpg| 2| A white and black dog is playing with a tennis ball near flowers .
2813784259.jpg| 1| A player kicks the soccer ball from the corner of the field .
2814028429.jpg| 2| Little kids play in the water while their friend poses on top of their raft .
2815745115.jpg| 3| Woman with stuffed animal display .
2815755985.jpg| 1| A blond-haired girl plays on a blown-up bouncy toy .
2816361063.jpg| 0| A young man in black glasses and a striped shirt jumping up while playing a guitar .
2817230861.jpg| 0| Two female beach volleyball players face off at the net with the Beijing Olympics logo visible in the background .
2817847072.jpg| 3| A soccer player is running on the field
2818419321.jpg| 3| A young boy wearing an orange shirt is playing on big rocks .
2820063211.jpg| 0| A fit beach volleyball player is preparing for a bump .
2823075967.jpg| 2| A black and white dog is playing with a tan dog .
282308302.jpg| 2| A small boy plays on a blue toy structure .
2824004868.jpg| 1| Child playing with a hula hoop on a cement driveway in housing alotment .
2825897091.jpg| 3| A group of people enjoy playing video games at a cybercafe .
2825932918.jpg| 1| A male child in a blue summer hat shoveling at the beach looks on at a family that plays in the ocean .
282660659.jpg| 0| A man wearing glasses and a green shirt practices playing a stringed instrument indoors .
2826701936.jpg| 0| Children are playing in a puddle of water that has resulted from a spray gushing from the pavement .
2827589184.jpg| 0| The blue-uniformed softball player is blocking the bag and trying to prevent the opposing player from touching the base .
2830309113.jpg| 0| A closeup of a small boy smiling while holding onto some playground equipment .
2830559877.jpg| 0| An elderly woman is watching a lady in a green shirt and her son , in a red shirt , play on the floor .
2830561413.jpg| 0| A woman sits at a primary colored children 's table , playing with building blocks , as two girls in pink dresses , and a boy in a red shirt surround her .
283056265.jpg| 0| A female singer sings passionately while the back-up guitarist plays in the background .
2830579786.jpg| 1| Group of people including a man and a woman playing instruments on a double-decker red Planet Hollywood sightseeing bus .
2830869109.jpg| 0| A young girl and young boy are playing with pails of water with the ocean in the background .
2830880811.jpg| 1| A small dog with a tennis ball in its mouth playing in a driveway .
2831394884.jpg| 2| A father plays with his two girls .
28318358.jpg| 1| Several kids playing in an outdoor water fountain .
2832453252.jpg| 0| Young girls in bathing suits playing in the knee deep water beyond the blue railing .
2833172038.jpg| 3| The man in the white shirt holds up a playing card .
2833502675.jpg| 0| A man with brown hair and a green shirt is playing a trumpet .
283428775.jpg| 2| Black retriever plays with a multicolored toy in dry grass .
2836325261.jpg| 0| A woman in a red medieval type dress playing a bagpipe or some similar instrument .
2837127816.jpg| 1| A man chases a dog trying to pass the barrier to enter a play area .
2837254541.jpg| 0| A woman with a red shirt and a large tattoo on her arm is playing a saxaphone .
283757164.jpg| 0| A woman with a red shirt and black vest , standing in front of coolers , is talking to two women who are also in red about something she is selling or displaying on a brick walkway .
2837695157.jpg| 0| A little boy in a blue shirt is playing with a yellow dump truck on a rose colored carpet in front of a flowered sofa .
2837695383.jpg| 0| Three white children playing with LEGO and toy trucks on the carpet .
2837734285.jpg| 1| A woman watches her child play with a pair of sunglasses against a picture window .
2837799692.jpg| 0| A football player , his helmet half off , looking at the ground .
2837804631.jpg| 2| A little boy playing and getting wet from a park fountain .
2837808847.jpg| 1| Two dogs , one brown and the other black , play in the surf in the shallow ocean water .
2838085973.jpg| 0| The football player is preparing to make a play with onlookers nearby .
2838133448.jpg| 0| Two male guitarists and a male trombonist play music on a stage while someone in the foreground takes a picture of them .
2838535875.jpg| 1| A little Asian girl is playing with microscopes at a museum .
2838590130.jpg| 1| Large amounts of people walk around near a large , silver , reflective display .
2839038702.jpg| 3| A dog is playing catch on the grassy plain
2839532455.jpg| 0| The white dog , with dark patches , is playing in the sand with a tennis ball in its mouth .
2842032768.jpg| 0| Black poodle carrying red chew toy while playing with a brown poodle .
284279868.jpg| 0| The black and brown dogs play in the snowy field .
2842849030.jpg| 1| A child with orange and white water wings is playing in a pool .
2843198818.jpg| 1| A tennis player wearing an orange shirt and brown shorts appears to be hitting the ball back to his opponent .
2843524276.jpg| 0| Four young children are sitting on a blanket in the grass while someone is kneeling , playing a musical instrument .
2843629756.jpg| 0| A man wearing shorts and a blue t-shirt is applying signage to the display window of an ice cream shop .
2844018783.jpg| 1| Three little boys are playing on the floor of an unfinished house .
2844641033.jpg| 0| A black boy in orange and white trucks on playing in the sand .
2844747252.jpg| 1| Three dogs are playing with a yellow ball in a grassy field .
2844963839.jpg| 0| A group of football players wearing orange and blue uniforms gather together on the field .
2845845721.jpg| 0| A man in jeans is playing with a ball while a woman in jeans stands nearby looking away .
2845913086.jpg| 3| People are playing volleyball at the beach .
2845914142.jpg| 1| A female Chinese volleyball player looking into the crowd at the 2008 olympics .
2846037553.jpg| 2| A child in a red shirt climbs on play equipment .
2846853277.jpg| 2| a nice building with a gate and a child playing outside on his bike .
2847541837.jpg| 0| Five children playing on the beach as waves are rolling in , getting their feet wet .
2847859796.jpg| 1| A child in colorful goggles plays in a pool .
2848895544.jpg| 1| A young boy playing goalie stops the soccer ball with his hands .
2850719435.jpg| 2| Two children are playing on a teal trampoline near greenery .
2852982055.jpg| 0| a woman is looking away from two small children playing in a fountain .
2853205396.jpg| 4| A dog runs and plays in the water .
2853811730.jpg| 2| A man is standing under a tent playing a guitar .
2854291706.jpg| 2| Interracial couple stand together looking at a display on street
2854959952.jpg| 3| Two dogs play catch with a ball in a field .
2855417531.jpg| 4| A boy plays on a swing .
2855727603.jpg| 3| A large brown dog plays in the water .
2855910826.jpg| 0| A football player in a blue and yellow uniform is tackling another player in a white and gold uniform .
2856053254.jpg| 1| A young child holds hands with an adult while playing .
2856080862.jpg| 1| Nine men are playing a game in the park , shirts versus skins .
2856456013.jpg| 1| A soccer player in a white shirt moves to run past a player from the opposite team .
2858835419.jpg| 0| Two men play guitars amidst musical equipment .
2858843359.jpg| 0| A overweight male is playing electric guitar while wearing a white hat .
2858903676.jpg| 2| The girls playfully pose for photos for each other in the park .
2860040276.jpg| 3| The blond-haired child played on the swing .
2860344033.jpg| 1| The grownups are smiling as a child plays with some rocks on the ground .
2860872588.jpg| 0| A black and a blond dog are either playing or fighting with each other .
2861413434.jpg| 0| The boy in the blue jacket and gray cap is playing with a ball .
2863349041.jpg| 1| Two little kids playing with toilet paper in the bathroom .
2863848437.jpg| 4| A boy plays goalie at a soccer game .
2865409854.jpg| 2| Children and a few adults are playing in a water fountain on the ground .
2866686547.jpg| 2| Two girls are playing soccer with orange and white uniforms .
2867026654.jpg| 1| Dog standing in grass playing with green flying disc
2867459095.jpg| 0| A bald man in front of a microphone plays electric guitar under a spotlight .
