image_name| comment_number| comment
3355084320.jpg| 1| A mother talks on her cellphone while her daughter waits .
3359636318.jpg| 0| Two people are talking outside of the video game shop next door to the mobile phone store .
336403796.jpg| 0| A woman with dark , curly hair and a strapless dress is playing a guitar and singing into a microphone .
3365049500.jpg| 0| This is the image of an Asian woman in bikinis with her legs folded and looking at an I-Pod phone on top of a swimming pool deck .
3369909499.jpg| 2| Two men are sitting at a table , while a third fits one for a microphone .
3376227695.jpg| 0| Here is a picture of a blond middle-aged woman talking on her cellphone at a local fair .
3388563134.jpg| 0| A female singer dressed in a tan dress pulls a microphone toward her as three musicians playing stringed instruments provide the music .
3388569156.jpg| 0| A man sits in a brown shirt , playing a wooden looking guitar with microphone stands on his sides .
3405279045.jpg| 1| A young girl plays at a large sand box , while a woman sits and chats on a cellphone .
3409582456.jpg| 0| The woman sings into the microphone while the two men accompany her on a keyboard and guitar .
3412249548.jpg| 3| A smiling man with a headphones and a gray mustache
3415228562.jpg| 0| A woman walks and talks on her cellphone while nearby men watch .
3421477759.jpg| 0| A person is standing on a telephone pole while a large group of people watch .
3427301653.jpg| 3| A man sits on the sidewalk listening to headphones .
3433526767.jpg| 0| Asian men sit with neutral expressions as though waiting for something , one man is talking on his cellphone .
3435319805.jpg| 0| A blond man in a white coat standing in front of a microphone with a guitar .
3440724965.jpg| 0| A man in a suit touches his head while another speaks at a microphone .
3457210101.jpg| 0| A woman holding a microphone speaks to a man wearing a white shirt .
3460038273.jpg| 1| A woman with headphones is walking across the street .
3469711377.jpg| 0| A boy in a red shirt wearing headphones is standing in front of a roped off kitchen
3471986083.jpg| 0| An woman wearing headphones is sitting on a subway wearing a blue face mask while three men also wearing the masks to prevent germs look back in her direction .
347397012.jpg| 1| A woman wearing a dress is standing on a lighted stage singing into a microphone in front of a large crowd .
3486768631.jpg| 0| A woman in a long-sleeved shirt checks her phone as a man in a leather jacket passes behind her .
3497260786.jpg| 0| In the foreground of a busy street scene filled with people wearing aqua colored shirts , an asian man wearing a black ball cap plays guitar in front of a microphone while an asian woman wearing a gray floppy hat stands next to him and in front of her own microphone while holding a guitar .
3502459991.jpg| 2| A person wearing yellow headphones shoots a gun at a target .
3517414605.jpg| 0| A man in a striped shirt is standing in front of an advertisement while talking on his cellphone .
3518822380.jpg| 0| A white man in a brown trench coat , a black man in a black shirt and an asian woman in a black coat walking a street in front of a blue wall passing phone booths and green milk crates .
3526580643.jpg| 0| A man in a blue shirt with a name tag around his neck is standing next to a bar , while a man stands next to him in a tan shirt is on his cellphone .
3528884854.jpg| 2| A designer takes a picture on her cellphone of her work table .
3529333786.jpg| 0| Male wearing brown shorts and black t-shirt in his bedroom with his feet on the desk talking on the phone .
3533452777.jpg| 1| Street Performer dressed in shiny clothing uses a cellphone on the bus .
3533484468.jpg| 0| Couple talking and looking in same direction , man is using a cellphone and wearing a gray sweatshirt woman is wearing a black coat .
3534668485.jpg| 0| two girls , one in black and one in white are talking on cellphones in front a wall covered in music posters .
3546891929.jpg| 0| A man wearing a red bicycle helmet talking on a cellphone with other people in the background .
3554391279.jpg| 2| Two women ascend a telephone pole with special boots and straps on their waists .
3556702089.jpg| 0| Three gentlemen wearing jackets and holding microphones standing around a table , waiting to either begin or continue sportscasting .
3560504626.jpg| 0| Three men are working in a bike shop , surrounded by bicycle frames , one of the men is sitting down , possibly reading something , another man is checking his phone , and the third man is smiling , looking around at the shop .
3560965055.jpg| 0| A band on stage playing a cello and guitars while singing into microphones .
3568673111.jpg| 1| Street view of a city featuring a old asian woman walking by a pay phone .
3574930742.jpg| 1| A man falls asleep with his head on a table while listening to headphones .
3576387257.jpg| 0| Woman wearing tennis shoes is stopped and looking at her cellphone .
3579148506.jpg| 0| Male in green plaid shirt and name tag , holding a microphone with right thumb in his blue jean 's pocket .
3587666993.jpg| 1| A balding white-haired man talks on his cellphone outside while looking at a red notebook .
358771859.jpg| 0| Village people are watching a woman who seems to be checking her messages possibly on her cellphone .
3589367895.jpg| 0| The man dressed liked an indian wearing feathers is standing in front of the microphone .
3599392711.jpg| 0| Three young sumo wrestler students stand at attention at an award ceremony in front of a man at the microphone .
3601533527.jpg| 1| The man is standing outside next to a wooden phone pole .
3604383863.jpg| 0| A man with headphones has his mouth wide open while a woman stands next to him .
36139994.jpg| 0| A woman with short hair is singing passionately into a microphone on stage .
3627290893.jpg| 1| Three woman and a man sing their hearts out in the microphone .
3628059004.jpg| 0| Two smiling women in costumes standing in front of a microphone .
3628103548.jpg| 2| A blond woman stands behind a microphone .
3631029759.jpg| 1| A woman holds her cellphone up to a cardboard box of kittens while another woman watches them .
3631530817.jpg| 1| A man is playing an instrument beside a microphone .
3642570796.jpg| 0| A woman in a multicolored top is walking down the street and holding a black purse while talking on her phone .
3643684044.jpg| 0| Four people are sitting at a table , with microphones and bottles of water in front of them .
3643684616.jpg| 0| Women wearing a black top and glasses speaking into a blue tipped microphone with another woman beside her writing .
3646120271.jpg| 0| A blond woman lays in the grass on her pink cellphone lying next to a man in black on his cellphone .
3655745504.jpg| 0| An African-American man wearing a purple shirt , white shoes and blue jeans is playing a saxophone while standing inside of a building which has many archways and a red and gray tiled floor .
3664860861.jpg| 0| A street performer out on a street is singing with a microphone in his hand .
3664988259.jpg| 0| A guy sitting on a chair , dressed in black , with earphones and a mic possibly getting ready to sing .
3666056567.jpg| 0| Four people are walking along a city sidewalk , while the one in the green hat talks on a cellphone .
3670184928.jpg| 1| A girl taking a picture with her cellphone of a large group of people .
3675878796.jpg| 2| woman with not a whole lot of clothes on playing on phone
367673290.jpg| 0| The woman wearing a black and white jacket and red boots is also wearing headphones .
3677613006.jpg| 1| The girl is wearing headphones and holding a Michael Jackson album .
3678885320.jpg| 3| A man sings into a microphone while holding a guitar .
36880708.jpg| 0| A group of men play xylophones in a concert space filled with percussion instruments .
3688343105.jpg| 2| Patriotic parade with a woman playing a saxophone and wearing an Egyptian hat .
3699318394.jpg| 0| The man in the blue shirt wearing headphones around his neck is sitting next to the man who is working at a computer .
36995794.jpg| 0| Man with guitar holding a microphone in one hand and extending his other arm .
3704642429.jpg| 0| A woman in a black t-shirt and light tan long skirt sing at the microphone while her band members play in the background .
3704709223.jpg| 0| A man in a tuxedo smiles while standing in front of a microphone and next to a man in a black hat on the electric guitar .
3705470430.jpg| 0| A girl wearing a short-sleeve floral print dress with a watch on has a microphone and appears to be speaking or singing to a man with a sports coat , orange shirt and hat on who is playing a guitar .
3705560226.jpg| 0| A man with clown makeup on is holding a guitar and a harmonica while standing in front of a microphone .
3705585216.jpg| 1| A woman , a man , and a clown laughing on stage in front of a microphone .
3708441539.jpg| 0| A city street with a telephone booth , passing cars , a parked bicycle , and a blond woman with a purse and young girl with a backpack walking away .
3717886615.jpg| 1| A female sings and plays into a microphone and a male in green striped shorts plays a hand drum
371897.jpg| 0| A young man in a red and gray shirt and blue jeans is walking outside with a cellphone in his hand .
3720930835.jpg| 0| A group a youths sitting outdoors watching two people with a microphone that are doing something by a table with a basin and some soap .
3721584359.jpg| 1| Two men wearing black t-shirt and headphones are next to a silver race car .
3721604285.jpg| 0| Two men , each wearing a white tee-shirt and headphones make adjustments to a machine while shaded by a dark umbrella-like contraption .
3721977689.jpg| 1| A man with red earphones is working on a red and white painted hot rod from Team ACE Racing .
373004394.jpg| 0| A man on the sidewalk talks a cellphone and looks past a man on the cellphone in a car .
3731335528.jpg| 0| The lead singer of Green Day is singing into a microphone and wearing his guitar and there is a young boy behind him .
3731739486.jpg| 0| Four people , One male in a blue shirt and slacks with three females , one in pink , one in blue , and the other with a white shirt and blue blouse , in line to enter a yellow school bus , while a female in pink hold paper is on the phone .
3731865465.jpg| 0| A woman with blond-hair is wearing sunglasses and headphones while holding a cigarette .
3746359593.jpg| 0| The young child is yelling into the microphone , while other children watch .
3747031933.jpg| 0| A woman is standing on stage with a clown either singing or talking to him with a microphone .
374707236.jpg| 0| A man with headphones in his ear is playing music with his DJ equipment .
3747821314.jpg| 0| A man wearing a black hat , a tan and black plaid suit and an orange shirt performs behind a man who is wearing an opened black shirt holds a piece of paper and sings into a microphone .
3759504106.jpg| 0| 2 men , one playing a violin , one playing a xylophone , both older and wearing darker glasses .
3760799822.jpg| 0| Two women , standing at a fence , are each talking on their cellphones , while two men sitting on the opposite side of the fence are having a conversation .
3766335291.jpg| 4| Three men and one is checking his cellphone .
3776965455.jpg| 0| A man and woman , each wearing a white shirt , are walking down the sidewalk while talking on their phones .
3784577325.jpg| 0| One construction worker talks on his cellphone while the other works on the ground by a black pipe .
379111807.jpg| 0| A man in a brownish green shirting playing guitar singing into a microphone
3791132794.jpg| 3| A man with a spike hairdo wearing a quilt while talking on a cellphone surrounded by people .
3798486812.jpg| 3| Two electrical workers are working on a phone pole .
3798592106.jpg| 0| a man with a tall glass of water sitting at a table looking at his phone at a eating place .
3799562471.jpg| 0| An elderly man dressed in a red vest , bowtie & straw hat is holding a saw and speaking into a microphone .
3799563009.jpg| 1| A gentleman is playing the saw while surrounded by microphones .
3799980514.jpg| 0| One man is holding a guitar in front of a microphone while there are people standing behind tables at an event .
3799984714.jpg| 1| A man with a banjo is speaking into a microphone .
3799987586.jpg| 0| A man is seen singing into a microphone and playing banjo with a guitar nearby while sitting on a stool at a festival where there are booths featuring items for sale .
3803956452.jpg| 0| It is really dark and there are at least two performers in Oriental outfits speaking into red covered microphones .
38130732.jpg| 0| A man on the phone dressed in hard has standing next to a white van .
381505599.jpg| 0| A big man in a black t-shirt is holding onto a beer with one hand and a microphone with the other .
381750411.jpg| 0| Man dressed in business casual attire playing the saxophone with the rest of a band .
381754795.jpg| 0| A group of students who play the saxophone are preparing for a concert .
381760243.jpg| 0| A girl in a white shirt and blue tie plays her solo into the microphone .
381763336.jpg| 0| Two girls play trombone and a boy plays the saxophone .
381767781.jpg| 0| A blond saxophone player and a black-haired saxophone player are talking at a concert .
3821050211.jpg| 0| A blond woman on the street on a cellphone carrying a bag and drink .
3822476498.jpg| 3| Man in hat and headphones on red camp chair reading .
3826499281.jpg| 2| A child stoops to the sidewalk to pick up his toy phone .
3844096151.jpg| 0| A woman in a blue sparkly dress with a slit up the leg holding a microphone .
38478677.jpg| 0| A man is standing in front of a meat market while talking on the phone .
3855157718.jpg| 3| A man riding a bicycle up a telephone pole .
385835044.jpg| 0| A girl wearing a brown jacket and blue jeans has on some white headphones and is walking .
3872838863.jpg| 0| A young man in a yellow floral shirt ponders purchases in an outdoor market while an older man in a gray t-shirt texts on his phone in the background .
3877444622.jpg| 0| This dark-skinned man checks his phone while riding in what looks like a bus .
3880471209.jpg| 0| A blond man in a striped shirt and jeans sitting at a table with a computer and talking on a cellphone .
388790511.jpg| 0| A chinese child in a yellow old navy sweatshirt and brown camouflage pants is shown sitting on a red couch and playing with a phone .
3903603264.jpg| 0| A man singing with his eyes closed and holding a microphone , with a woman behind him playing an electric bass guitar .
390892763.jpg| 0| A bearded man with a brown wool cap and gray shirt is singing into a microphone he is holding with both hands while a brunette female sits behind a keyboard to his left .
3909552008.jpg| 0| Three men in blue hard hats are on the tops of telephone poles working on the wires of one with a tall wedge topped skyscraper in the background .
3921094853.jpg| 0| A woman in a blue dress is walking and talking on her cellphone .
3939508858.jpg| 0| A brown-haired man wearing jeans , glasses , a pink shirt , and jacket is playing guitar and singing into a microphone .
3959371388.jpg| 0| A middle-aged man is standing outside of a building while looking at his phone .
3963684908.jpg| 0| Five men stand on construction scaffolding with paints splattered on them as they appear fascinated by something to the left , one even records the unseen event on a phone .
3965161439.jpg| 3| Two women standing idly by as a man talks on his cellphone .
3970504937.jpg| 1| Man in blue suit with megaphone walking in front to people dressed in blue robes
3970619871.jpg| 0| Two men in dress shirts and holding microphones sing together .
3971423752.jpg| 1| A four piece male band which includes two saxophone players , a trumpet player and a trombone player are playing on a stage while two other males are dancing in front of the band .
3971425242.jpg| 1| A group of seven men perform on a stage with microphones and guitars as several young men and women dance and look on .
3971426050.jpg| 1| A man in a small-brimmed black hat manipulates a soundboard in front of a microphone .
397601572.jpg| 1| Two guys are sharing headphones and are listening to music on a subway .
3977104006.jpg| 3| Four men dressed in white play saxophones in front of an audience .
3978531966.jpg| 1| A woman singing into a microphone and playing guitar at an event .
3999242523.jpg| 4| A man playing a Saxophone .
400106578.jpg| 1| A worker is at the top of a telephone pole , working on the wires .
400242803.jpg| 0| A person is directing traffic while repairs are being made at a telephone pole .
4003129619.jpg| 0| Two older people in marching uniforms both playing saxophones .
4004004911.jpg| 1| A solitary guitar player with dreadlocks sings into a microphone on stage .
4006075273.jpg| 0| A man plays guitar and sings into a microphone while a woman sings into a microphone next to him .
4014210988.jpg| 2| Man lighting a cigarette on the right and man looking at the phone on the left .
4015868140.jpg| 0| A man in an orange uniform jacket holds a phone to the ear of a woman wearing a white shirt .
402978771.jpg| 0| A woman wearing a vertical striped top , sitting on a bench beside a telephone booth in a train station .
4032977916.jpg| 0| A woman in a white and beige-striped sweater answers telephones in an office .
403308982.jpg| 0| A man in a red shirt and a black and blue striped shirt are singing into microphones .
4033789272.jpg| 0| Two older men speak into microphones on a stage , while a projector screen displays a vintage photo of a young man behind them .
4033800420.jpg| 0| Two men in suits sitting on stage with microphones near their mouths and a powerpoint picture in the background .
4036388209.jpg| 0| A woman in a black shirt getting emotional while talking into a microphone .
4037148542.jpg| 0| A group of people holding papers and microphones stand in front of a man with his face painted like a mime .
4037153114.jpg| 1| Two men and a woman play violins in stage in front of a microphone .
4046952585.jpg| 0| A man is wearing yellow protective headphones while using a circular saw to carve pieces away from a tan stone sculpture .
4050304997.jpg| 0| While other people walk by , a woman sitting on a bench next to an escalator uses her phone .
405240865.jpg| 3| Woman on cellphone running in the snow .
4054618575.jpg| 0| A construction worker in blue jeans talks on the phone with someone while standing near a construction site .
4077089649.jpg| 0| An Asian man with Headphones sneers as he works a turntable in a dark room .
4077122969.jpg| 0| A DJ with one hand on his headphones and one hand on his turntable .
4078134904.jpg| 0| A man wearing a black and white hat as well as a black and white shirt is singing into a microphone in front of band mates .
40793390.jpg| 1| Two male band members are playing guitars in front of a microphone .
4099476662.jpg| 0| A man standing in front of a brick wall while playing the saxophone .
410184063.jpg| 0| A man with dark hair and a mustache is wearing a light blue shirt while talking on a cellphone .
4107219685.jpg| 0| A blond man singing into a microphone with a guitarist behind him .
4107979730.jpg| 0| A singer sings into a microphone while other musicians play in the background .
4107989090.jpg| 0| A man in bright white clothing and tattoos performs on a stage with a red background while holding a microphone in his left hand .
4111420077.jpg| 0| A young man carries a big basket while an older man behind him talks on a cellphone .
4111709447.jpg| 1| A woman wearing red speaks through a megaphone while walking in front of a banner .
4116163419.jpg| 0| A man wearing a suit with a name tag stands reading in front of a microphone as a screen behind him displays a presentation .
4116166193.jpg| 0| A man wearing a tag that says Jake is standing in front of microphone wearing a brown jacket and a red patterned tie with a large screen displaying text in the background .
413426348.jpg| 2| A man is playing the flute into the microphone .
4145780777.jpg| 0| A boy cutting his friends hair while other boys look and one boy using his cellphone .
4146540950.jpg| 0| Four individuals are outside on a patio , one man has raised his shirt over his head and another is holding a cellular phone .
4151523027.jpg| 3| Three ladies with cloth looking at a phone .
4154882742.jpg| 0| A man and a woman are standing in front of a store that sells phone cards .
415603021.jpg| 2| A woman looking up and a man speaking through a microphone .
4159174548.jpg| 1| A band on stage playing instruments like trumpets , trombones , french horns and violins while one of the men sings into a microphone .
4160672903.jpg| 0| A man is holding a microphone in his right hand and has his left hand stretched out to the side .
4161126086.jpg| 0| A little boy is wearing headphones while watching a pair of hands on a TV screen with a microphone stand in front of the hands .
4172764408.jpg| 0| One man playing a trumpet and one man playing a saxophone are playing music in front of evergreen trees .
4173843036.jpg| 2| A man on a megaphone protesting with three kids in the back .
4181633615.jpg| 0| A man in a pink shirt and white pants checks out his cellphone on a completely deserted street corner .
41868213.jpg| 0| A middle-aged male with brunette hair , sitting in a green chair , writing in a notebook , sitting by a phone booth .
419147172.jpg| 1| Two men , one holding a microphone , are talking while standing on a wood floor designed for an athletic event .
4196155263.jpg| 0| A person holding a cellphone in order to take a picture of another person in the crowd .
419638730.jpg| 1| A man is singing into a microphone while his band plays .
4196898728.jpg| 0| A performer holds a microphone out to a member of a crowd .
4202061400.jpg| 0| A man in a brown shirt and glasses plays a guitar and sings into a microphone .
4202073868.jpg| 1| A man with a tattoo behind his ear plays the guitar and sings into a microphone .
4203065094.jpg| 0| A woman with a microphone leaning towards a crowd while people raise their hands in the air .
421322723.jpg| 1| A teenager standing in a crowd of people texting on his phone .
42160866.jpg| 0| A young man on an indoor stage stands before a microphone while holding a guitar .
4225248313.jpg| 0| Two teenage helping their mother to carry their small brother after their mother received a phone call .
4260156359.jpg| 0| Monkey walking on a telephone wire in front of a sign that says friends cycle .
426065353.jpg| 1| Three young men are taking a picture of two girls at a bar with a camera-phone .
4273711559.jpg| 0| A man in a green shirt is talking on the phone and resting his leg on a piece of machinery .
4287766241.jpg| 0| A man and woman , both in black , dance outside of a restaurant while an older man is on a microphone .
428927040.jpg| 0| A man in blue holds a microphone and stands next to another man in blue with an orange wristband in front of a large speaker .
428973409.jpg| 1| The person standing at the microphone is wearing a red , plaid tie and holding a trumpet .
428979011.jpg| 0| An asian long-haired man wearing a yellow hat & long-sleeved shirt talking on a microphone
429500919.jpg| 1| Women standing at podium talking into a microphone giving a speech .
4295295528.jpg| 0| A man is sitting in the street eating fast food and using a cellphone .
43194646.jpg| 0| A man with a brown suit jacket playing the piano and singing into a microphone .
432326912.jpg| 3| A man in a button up shirt is playing the xylophone .
432329497.jpg| 0| A man with glasses and a scarf on his head looking at different color phones hanging from a tree while another gentleman walks away .
43244430.jpg| 0| A lady with a white tank top holds a blue yard style cocktail cup with her black tank topped phone holding a phone .
432639190.jpg| 0| An old Indian woman who looks to be sitting on the floor in her home , enjoying a phone call .
4334945607.jpg| 0| Two girls in white and gold seductive costumes are standing with microphones next to an older man , playing the guitar .
4344231645.jpg| 0| A woman with long brown hair plays an instrument and sings into a microphone .
4351584075.jpg| 2| Two men in clown makeup , one with a ukulele , stand in front of a microphone .
4351738795.jpg| 0| A band is on stage and the man behind the microphone has his hands in the air .
4352857810.jpg| 0| A woman in a black tank top and shorts listens to headphones and walks on a sidewalk next to water .
4357771796.jpg| 0| Man in black shirt singing into microphone and playing a guitar .
4368366048.jpg| 1| A woman holding a microphone is talking during a Powerpoint presentation .
4373143112.jpg| 0| While singing into the microphone the man in the black shirt plays an acoustic guitar .
437404867.jpg| 0| A woman rests on the curb of a city street while talking on her cellphone .
4376939715.jpg| 0| A business event is taking place with an attractive blond woman smiling at the camera with her phone in her hand .
4378823.jpg| 0| A woman wearing a red poncho is talking on her cellphone while holding her daughter who is wearing a pink dress .
4381932580.jpg| 0| A woman is sitting on a beach with her shoes off and on a cellphone talking , scratching her shoulder , while a group of 5 other people are walking in the background .
4389769939.jpg| 0| Several people are on a stage by a microphone ; one is lying on the floor while others are standing around with their hands out to their sides .
4389771753.jpg| 2| Boy Scouts standing on a stage by a microphone .
