image_name| comment_number| comment
107969134.jpg| 4| A woman gives a small child a piggyback ride .
1145145003.jpg| 2| The woman tries to hide from work under a black sweatshirt , but her red corduroy pants give her away .
1159425410.jpg| 2| Two people give a dog a bath outdoors in a blue container .
"1231348815.jpg| 1| A man pulling a fancy rickshaw along a waterway smiles and gives the "" thumbs up "" sign ."
124390903.jpg| 1| Woman in red shirt and sunglasses gives candy to her daughter who is wearing a crown .
1298866571.jpg| 4| a asian man gives an evil eye to the camera .
1304961697.jpg| 2| Two kids on wakeboards attempt to give one another a high-five .
1401998185.jpg| 0| A white man in South Africa with a megaphone standing near a street sign that gives directions to the AFL Premiership cup , Johannesburg and several other places .
1415147666.jpg| 1| A crowd is watching a lady give a demonstration of KitchenAid products with the help of an overhead mirror .
1427670417.jpg| 2| Two men sit at table at a conference given answers as the questions are called out .
15688495.jpg| 3| The woman in pink pants and white top is being given a baby shower .
157910841.jpg| 1| A man gives the thumbs up as he grills chicken .
1629337128.jpg| 3| Man gives an interview in a nearly empty theater .
1690926854.jpg| 0| Two teammates from the USA team are jumping in the air to give high-fives while two teammates watch .
1775223211.jpg| 2| A woman gives the 'thumbs up ' before her legs are amputated .
1786425974.jpg| 2| The lady ask the dog to give her the ball on their beach walk .
1797554350.jpg| 3| On a rainy day , a woman holds an umbrella above a runner and gives her water .
185057637.jpg| 2| Five people , wearing dark blue shirts , give a presentation outdoors .
1873155511.jpg| 4| A man gives a boy high-fives outside a barber shop .
199413572.jpg| 0| One woman gives another woman a pedicure in a small apartment , as yet another woman watches .
2054308369.jpg| 2| A small girl gives a kiss to a tan dog .
2061354254.jpg| 1| A boy hangs from a t-bar while a man gives him a push .
2074430847.jpg| 1| A man in a dark suit and blue shirt gives a presentation to many people sitting in chairs .
2090327868.jpg| 0| A woman gives a baby to a small child to hold as they stand in front of a cow statue .
218442982.jpg| 3| A man in formal wear and glasses gives a speech he has written down .
2192411521.jpg| 3| A man with long hair riding a bicycle gives the peace sign .
2210068481.jpg| 2| A man in a hat gives instruction to a group of children .
2230813326.jpg| 0| A man carries a picket sign that resembles a restaurant menu , while a woman in a pink , printed sweatshirt gives an exaggerated pout .
2273871383.jpg| 2| An older gentleman in brown gives a look of astonishment to the camera .
2277294556.jpg| 0| A gentleman wearing board shorts is enjoying himself at the beach as jagged cliffs give texture to the picture .
230105501.jpg| 2| The girl in a black shirt is reading a greeting card that was given to her by a friend of hers .
2308322210.jpg| 1| A guy shakes hands with a plastic dummy and gives the dummy a thumbs up with the other hand .
2360371074.jpg| 2| The women gives the man a hug and kiss while his dog is on the leash .
2366306683.jpg| 4| A man gives a presentation .
2367317953.jpg| 2| A female soccer player gives a teammate a piggyback ride .
2376694294.jpg| 0| A boy in a swimming pool , wearing goggles ," gives the "" two thumbs up "" sign ."
2390551509.jpg| 3| A local man sitting on a stool gives directions to a tourist .
2393911878.jpg| 1| Little boy sitting on snow gives the camera two thumbs up .
2410906422.jpg| 1| One man stops to give a sweet kiss to a cow near a train on an overpass .
241346215.jpg| 0| A horse mascot gives high-fives to some football fans .
2434440010.jpg| 1| An older man in a suit gives a presentation to other businessmen .
2434440948.jpg| 1| An elderly gentleman in a suit gives an address to a group of seated listeners .
2448210587.jpg| 0| A white bulldog sitting on a tree stump gives paw to an older woman wearing a black jacket .
246094557.jpg| 4| Girl gives treat to jumping dog .
2502115872.jpg| 3| Children climb a tree , while caregivers watch .
2512450458.jpg| 1| A man wearing a snorkel and goggles gives a thumbs up as he and another person speed through the water .
2525552286.jpg| 0| A bridesmaid gives a toast with a microphone while two other bridesmaids and a gentleman look on .
2534655741.jpg| 1| A girl in a white dress holding roses gives some to a man in a gray tank top .
2551344688.jpg| 0| An old man with a white-haired beard and a blue cap gives a thumbs-up sign with his right hand .
2557998845.jpg| 0| A man in an orange shirt and a man in a white shirt are at a vegetable stand , and the man in the orange shirt gives a woman wearing red some vegetables .
2602827193.jpg| 1| A darkly clad musician gives a focused look as he views his instrument .
2612150730.jpg| 1| We pledge allegiance to whatever you want if you only give us a little food .
2620756624.jpg| 0| An older man gives verbal instruction about handling owls to a young boy in a clearing in a park or wooded area .
2657097653.jpg| 0| A man gives the camera the finger as a band plays a house party .
2701635619.jpg| 0| A kid with a blue hat and braces holding onto a skateboard and appearing to give the impression that he is yelling .
2727062058.jpg| 4| A coach gives instructions on the field .
2792212974.jpg| 2| Woman 's long wet hair gives off spray in water
280435773.jpg| 2| A man in a white checkered shirt gives a business presentation with a slide show behind him .
2810289270.jpg| 2| A child is given a medical check up by a doctor .
2832610852.jpg| 3| A man is about to give another a haircut in a barber .
2834761411.jpg| 2| A man in a top-hat and sunglasses is waiting to give people a horse and buggy ride .
2871691966.jpg| 2| A congregation is watching the Pope give a speech .
2874728371.jpg| 2| A small black dog is shocked when a larger brown dog gives him a sniff .
2884092603.jpg| 2| The young girl is given rabbit ears by the young boy behind her .
292354399.jpg| 2| A woman with a yellow shoulder bag gives a man a massage .
2924489177.jpg| 3| Asian woman standing near machinery give peace sign .
2925163942.jpg| 1| A male runner with a number pinned to his shorts gives the thumbs-up .
2929086689.jpg| 1| Two men trying to give directions and failing completely , confusing their victim in the process .
2936969650.jpg| 0| A young teenage boy in a blue and white striped coat gives a weak smile while walking with four other girls .
2940719987.jpg| 0| A woman stands in front of a board as her team gives a presentation to a class .
2941650098.jpg| 3| A businessman in a yellow tie gives a frustrated look .
2956822125.jpg| 1| An asian man dressed in a white shirt and blue jeans gives a powerpoint presentation .
299309703.jpg| 4| A child is given a bath by the sink .
3004287781.jpg| 0| A woman wearing a hood gives two peace signs while the man next to her claps and the woman behind her raises up her arms .
3019199755.jpg| 1| A race car driver smiles and gives the thumbs up before a race .
3031792444.jpg| 4| A man gives a speech at an ornate costume party .
3040051410.jpg| 2| An older man gives a woman an amused look .
304450431.jpg| 4| A woman gives the thumbs up over the slope .
3046126634.jpg| 0| A lady with a striped shirt is about to give a bath to a baby she is holding across her lap , in front of a little blue bathtub .
306395036.jpg| 0| A little boy in a pool gives a thumbs up to the camera as another swims away .
3084752813.jpg| 0| Three women taking food items given to them from a man in a blue jacket from the back of a truck .
3113105156.jpg| 4| A professional soccer player gives the ball a high kick .
3163273640.jpg| 2| Four men wearing turbans wait to give elephant rides to people .
3163281186.jpg| 2| A woman pats an elephant that is saddled to give rides .
318706557.jpg| 4| A large choir gives a holiday performance .
3202362346.jpg| 3| A man gives out literature on the street corner .
3243866702.jpg| 0| A boy in a wet red shirt gives water to a turtle while a boy dressed like Spider man and others look on .
3280672302.jpg| 1| A teenage boy gives another teenage boy a piggyback ride in a forest .
"33143954.jpg| 1| A man wearing a t-shirt that has "" gnu "" printed on it gives a technology presentation ."
3335049445.jpg| 2| A man uses a projector to give a presentation .
3398276602.jpg| 1| The man in the tan shirt gives to the man in the wheelchair and hat .
3438858409.jpg| 4| a man gives another man a piggyback ride .
3497485793.jpg| 1| A pair of young women with an easel give a lecture to a young audience .
3504913634.jpg| 0| An older woman wearing a brown shirt gives a presentation .
3504922522.jpg| 1| A woman in a black shirt gives a presentation while projecting slides onto a screen .
3533470072.jpg| 2| Twp young ladies give the piece sign with their fingers to the camera .
3548354827.jpg| 2| A man , woman , and young girl give a demonstration for several kids .
3549614763.jpg| 3| Two girls sit at a table outdoors and give their order to the waiter .
3584812840.jpg| 1| Two little kids are trying out their new cameras which probably were given by the women in black .
358718746.jpg| 0| A man wearing a black t-shirt gives a food order in a restaurant .
"3595956590.jpg| 1| A blond-haired girl lying on grass behind a fence gives "" thumbs up "" sign as a tortoise walks in front of her ."
3601419342.jpg| 1| A young woman in a green t-shirt gives the thumbs up on a mountain .
3656030945.jpg| 2| Small puppies in bathtub being given a shower with handheld showerhead
3657503733.jpg| 1| A person is doing a bicycle trick over the rocks while a bystander gives a thumbs up .
3664781437.jpg| 3| The girl is stretching to give the boy the racket .
3672940355.jpg| 1| A little girl gives a good kick to a blue ball .
3711352975.jpg| 1| A young infant is being given a bubble bath by its mother who is wearing a blue and white striped shirt .
371910695.jpg| 1| A group of several people wait to give their order in a restaurant .
375489940.jpg| 1| A group of women are listening to a presentation given by a woman in a lab coat .
3793774643.jpg| 3| Man gives a speech before a conference audience .
3794595430.jpg| 2| A young woman gives a presentation concerning Wikipedia .
3821187649.jpg| 2| A baby gives a woman an opportunity to engage in its world .
3824451716.jpg| 1| One teenager gives a performance , while another , holding a bike , looks on .
388604469.jpg| 4| A band gives a performance .
3890244554.jpg| 0| A dance instructor gives instruction to a group of people in a sea of foam .
3953055731.jpg| 1| A woman in a military uniform gives an inflated rubber glove to some children .
3981715035.jpg| 1| A man gives another man a tattoo on his shoulder .
3996888830.jpg| 0| This child is visiting the pet zoo for the first time and did not expect the deer to give him a kiss .
4033049067.jpg| 1| Two older men , dressed in suits , give a presentation .
4039941514.jpg| 3| A man gives a speech and uses to Apple computers .
"410396747.jpg| 1| A young girl is standing beside a group of marathoners and has her hand out to give them a "" high-five "" ."
4116163419.jpg| 4| A man gives a presentation .
4201333762.jpg| 3| Two women and 1 man give a man bunny ears as they pose for photo .
425775901.jpg| 1| The man in the suit with pink shirt and striped tie gives a speech while others laugh .
4301236235.jpg| 2| People look upon a monument where a speed is being given .
4379576888.jpg| 0| A group of men and women workers give an applause .
4389770745.jpg| 0| Three boy scouts give presentations on a stage with two tents , a bench , and an American flag behind them .
439584948.jpg| 1| A woman in a white dress is trying to give a man in a suit bunny ears .
4444092165.jpg| 4| A politician gives a speech as people watch .
4444863968.jpg| 1| An award is being given to a woman in a green dress in front of the white house .
4459039661.jpg| 0| Two businessmen give a presentation in a room filled with audience members sitting at tables .
4506868550.jpg| 2| He prepares to give meals to the less fortunate .
4511879942.jpg| 3| A young woman gives directions to an older woman outside a subway station .
4514569490.jpg| 3| A man gives a little girls a kiss .
4517839686.jpg| 0| Absoluteily all the attention by the people attending is given to the play that the catcher is doing in this baseball game .
4525785614.jpg| 3| A man give a presentation using an overhead projector .
4565259835.jpg| 1| An old woman looking excited with a present given to her by her friends .
4571034074.jpg| 3| Brunette girl gives puzzled look while carrying a purse .
4578161441.jpg| 3| A boy gives a shy smile through gaps in a fence .
4613883258.jpg| 3| A drummer gives a performance to a group of children .
4671749902.jpg| 2| A black man with a white cap and sunglasses gives a speech .
468760987.jpg| 0| A man in a lawn chair gives a small boy a hug and kiss , while another small boy in a yellow shirt plays in the sand with his toys .
4698463256.jpg| 3| A young man gives another young man advise on sex and dating .
4705341010.jpg| 0| A group watches a man as he gives a presentation .
471694463.jpg| 4| A woman about to give a speech .
4727561977.jpg| 0| The drummer of the band in the talent show gives it his all .
4728578735.jpg| 2| Man with hat and sunglasses gives the camera a thumbs up .
4736257831.jpg| 3| A woman in blue makeup and a costume gives a mysterious look to the camera .
4741991547.jpg| 1| An old , bald barber give a haircut to a twenty something man .
4747299805.jpg| 1| The sunlight shining in from outside gives an ordinary Indian woman a moment of clarity .
4751207389.jpg| 0| A woman in a bright yellow top and short plaid shorts gives a look of disgust .
4774482282.jpg| 1| Teacher in a classroom , gives on girl in a pink shirt a High-Five while all other students also reach for her .
4815052270.jpg| 0| Three young people sit at a table together with food , and one of them gives peace signs on each hand .
4820394128.jpg| 1| A man with glasses and a young girl smiling for the camera , the girl gives a peace sign .
4824979525.jpg| 1| An Asian cute girl in an ash color outfit with a bag color bag give a beautiful smile .
4852829439.jpg| 2| An elderly Asian man waits for someone to give him service at a food counter .
4857560023.jpg| 1| A small baby is given a bath in a plastic tub by an adult wearing rubber gloves .
4859002730.jpg| 0| A conductor getting ready to give a child a ride on the train .
4871416563.jpg| 2| a woman with a bloody umbrella gives a mean look despite her blindfold .
4898740268.jpg| 0| A young boy gives a thumbs up as he is pulled up on a wakeboard in a river .
4900674063.jpg| 1| A young woman gives a pink-draped man a haircut .
4906343557.jpg| 1| The sun gives the waves a green hue as this surfer displays his skills .
4915228657.jpg| 2| The chemists give the lost man directions to the bathroom .
4924958553.jpg| 0| Woman being given a palm reading by a female psychic while two other women wait inside of a small shop .
4933367985.jpg| 0| A man gives his son company as his son enjoys the Wiggle 's Big red car .
4941400100.jpg| 0| A woman is sitting down on the sidewalk is receiving a wristband given to her by another woman .
4959432218.jpg| 1| A shirtless man , wearing a brown kilt and backpack , gives a thumbs up on a city sidewalk .
4965081213.jpg| 0| A rodeo clown in a black cowboy hat gives out American flags to children .
4965595911.jpg| 4| Woman gives a fake crown to a statue of liberty look alike .
4975066304.jpg| 1| Two boys play on a city street ; the one with glasses gives a V-sign to the camera .
4977357613.jpg| 2| Two young black men in uniforms are smiling and give the thumbs up .
5090110064.jpg| 3| Child gives a yawning kitten a hug .
5103801187.jpg| 2| A man gives a speech at a Pop ! Tech event .
523985664.jpg| 1| A girl wearing a swimsuit top wears a sign to give free hugs .
5380411758.jpg| 1| A man suited in vest , tie , and glasses gives a speech in an art gallery .
5405213054.jpg| 2| A boxer in red with an intricate tattoo gives his opponent a right hook to the head .
5423102604.jpg| 0| There is a line of veterans sitting in this photo one of which is being given a folded American flag by a female officer at what looks to be some sort of ceremony .
5434071249.jpg| 0| A young man gives a peace sign as he jumps into a pool surrounded by foliage .
5526424589.jpg| 3| A man in a suit is about to give a speech at the podium .
5543458745.jpg| 0| A guitarist in front of a microphone gives a child a hug and a kiss on the head while holding his guitar in his lap .
5570254.jpg| 1| A newscaster in a blue coat gives his report in the rain .
561906323.jpg| 0| A woman gives the finger to a man about to deliver a shipment of plants and a passerby looks on .
562242613.jpg| 4| A farmer gives a tour of his farm to local families
566384456.jpg| 4| a man gives a fish to a boy .
5687833791.jpg| 3| A large group gathers as a man in period clothing gives a tour .
5738179350.jpg| 0| A man in a black shirt and gray hat gives the thumbs up to a crowd with one hand , while holding a microphone in the other .
5766437977.jpg| 4| A young woman gives a doll to an older woman .
5930769790.jpg| 0| A dog groomer gives a dog a haircut using electric hair clippers .
6049472523.jpg| 3| A man on a quad gives a thumbs up at a sporting event .
6231398559.jpg| 2| a man enjoying the day by the water , waiting to give out balloons .
6417423499.jpg| 2| Man observes a wavelength given off by an electronic device .
6662693149.jpg| 0| In front of a decorated Christmas tree , four adults and two children sit or stand amongst gifts , and one of the adults gives a child a drink of water .
6738018405.jpg| 2| Two young boys give their big black dog a bath .
685698139.jpg| 1| A man in a red shirt gives a peace sign while cooking chicken on a barbecue .
6888161449.jpg| 2| A rugby team gives chase as the man in possession punts the ball .
6890393836.jpg| 2| A woman smiles as she gives a presentation on a microphone .
6917567087.jpg| 1| A man in a collared shirt points to a projector as he gives a presentation to a room full of people .
6945520856.jpg| 3| Funny kid plays with his milk straw gives a smile for the camera .
6980999098.jpg| 1| Two young boys are given some help digging their hole in the beach by an adult .
6999353542.jpg| 3| Some people stare into the distance as a barber gives an Asian man a haircut .
7072093225.jpg| 4| A man gives a speech in front of a tv .
7125476937.jpg| 2| A cyclist takes his hands off the handlebar to give a victory sign .
7139378209.jpg| 0| A man in a black t-shirt is holding a pool cue next to a pool table with the cue ball on it while another man in a gray hat gives him directions .
7184998020.jpg| 3| A young woman gives a lady a hug after graduation .
72008434.jpg| 3| a guy give a kiss to a guy also
72010195.jpg| 0| A man holding a dotted bag gives another man a piggyback ride in front of a Subway sandwich shop .
745966757.jpg| 1| A young girl has on rollerblades and looks ready to give it a try .
7556970798.jpg| 0| A person with a ponytail , black shirt , and camouflaged cap gives blond woman in an ice cream cone outside .
7870403558.jpg| 2| Two running competitors give it their all as they see the finish line .
98817947.jpg| 0| A smiling warehouse worker with a tattoo on his forearm gives the peace sign while surrounded by cardboard boxes .
