image_name| comment_number| comment
8006241096.jpg| 3| A baseball player at bat and a catcher get ready for the pitch .
8019420543.jpg| 4| Two football teams try to catch the pass .
8038092309.jpg| 2| Two baseball players are trying to catch this ball and not dance with each other .
8041006083.jpg| 0| Stop motion photography clearly catches the image of a woman in full cycling gear competing in a bicycling day event .
8081646730.jpg| 0| A baseball player in a white uniform with dark stripes is partially on the ground , poised to catch a ball in his left hand as the ball quickly approaches .
8081695451.jpg| 1| A baseball player sliding into a base while a player from the other team tries to catch the ball .
8112734986.jpg| 1| A men 's tennis match on blue court , shows player perfectly catching and returning the ball .
8113418940.jpg| 1| A boy catches air while racing down a local dirt trail .
8136850076.jpg| 0| A man catching a wave on a surfboard being observed or photographed by others from the shore .
8170798749.jpg| 0| A person wearing a blue shirt attempts to catch a wave while surfing .
821071719.jpg| 0| A man dressed in orange t-shirt is trying to hit a baseball , with a few people looking at them and a keeper behind trying to catch the ball .
8247042603.jpg| 3| A surfer in a black wetsuit catches a small wave .
825918657.jpg| 2| Dog jumps over a man and catches a Frisbee in his mouth .
82679822.jpg| 4| Two friends catch up over a couple of drinks .
837893113.jpg| 0| A young boy tries to catch an orange and yellow Frisbee in a green , grassy field .
848180689.jpg| 2| Two girls in a pool , one catching a ball the other has thrown .
859620561.jpg| 0| A dog leaps high in the air to catch a toy over the green grass .
87938334.jpg| 0| A little boy in a taupe sweatshirt tries to catch a green balloon above him .
888517718.jpg| 0| A brown and black dog is standing on its hind legs trying to catch something .
901027462.jpg| 0| There are three kids in a field with flowers in the background and the kid with a red shirt and the kid with the blue hat are holding what appears to be bug catching nets .
940973925.jpg| 1| Two children play on a stone railing while a third catches a green ball .
95795877.jpg| 0| A man catching some much needed rest while riding some public transportation .
