image_name| comment_number| comment
3825049160.jpg| 0| Two men in orange vests and hard hats are standing at the base of an unfinished building and are working on lifting something .
3826405905.jpg| 0| Two young people are selling items on a sidewalk and working on their creations .
3827183336.jpg| 3| A woman is working on a craft .
3830027232.jpg| 1| Two workers help customers at the Sonoma Artisan Sourdough Baker stand .
3833511502.jpg| 4| Teller working at a bank .
3834502656.jpg| 3| A man working on metal with sparks flying .
383657310.jpg| 2| A construction worker walks near a backhoe tearing up a street .
3843254402.jpg| 2| After a sandstorm , a maintenance worker cleaned debris from the historic ruins .
38437776.jpg| 1| Two men work on top of a tall building on a cloudy day .
3846432179.jpg| 0| Five people are working in a field full of tall dry brush .
3847186406.jpg| 0| There is one man in the foreground with a hammer , another is in the background , possibly doing the same work as the man in the foreground .
384806138.jpg| 0| An African woman in long , flowing garb , with a baby on her back , is working in a dry field with trees far off in the distance .
3848578709.jpg| 1| An old man wearing a blue shirt and vest is working on a piece of clothing .
3852276745.jpg| 3| Five workers take a break to catch their breath .
3852752203.jpg| 3| Three men work under a hot sun .
3853580806.jpg| 0| A carpenter with a pencil on his ear seriously doing his carpentry work .
3855173636.jpg| 2| A man does mechanic work on a dune buggy .
3855279759.jpg| 3| A man with a gun watches as another man works on a car .
3856130327.jpg| 1| A group of healthcare workers posing for a picture in their uniforms at work .
3856149623.jpg| 0| Two female medical professionals , one african american & one white , looking over paperwork in a hospital .
3856153247.jpg| 3| A woman who is working try out the new yellow jacket
3856178809.jpg| 0| One nurse in purple Mr. Potato Head scrubs showing a pink bottle to another nurse in blue scrubs at a hospital with a third nurse in floral shirt and khaki pants in the background looks through paperwork .
3856182861.jpg| 1| Three female workers in a medical facility looking at printed material .
"3856921828.jpg| 1| Medical workers standing behind a "" Magnet is You "" cart ."
3856990752.jpg| 2| Two medical workers are posing with a law enforcement worker .
3859203305.jpg| 2| A man is working under a white vehicle while a child watches him .
3863631198.jpg| 2| Two U.S. soldiers work on assembling a miniature motorcycle while other soldiers look on .
3864694123.jpg| 0| Two mosaic workers in white jackets work on an elaborately designed tile floor .
3866270897.jpg| 1| bare chested man with ball cap sits in an outdoor work shop
3866290511.jpg| 2| Men working together , to pull in a fishing net .
3867054856.jpg| 2| Male working on a tea pot sitting on the floor of his garage .
3870931650.jpg| 2| A man in a gray collared shirt working on a machine .
3873728049.jpg| 1| Two men stand in a basement workshop , looking at each other .
3880471209.jpg| 1| A man sitting at a small outdoor table is conversing on his cellphone while working on his laptop .
3880775790.jpg| 1| Beachgoers relax on a beach as camels and their handlers work nearby .
3881645432.jpg| 3| A woman wearing a blue top and white pants working in a store
3883192246.jpg| 0| A man in a blue uniform works beside a train on train tracks .
3884010975.jpg| 2| A woman in a white shirt works behind the counter at a cafe .
3887428186.jpg| 0| A worker in a safety vest and hat is unloading equipment from the back of a truck .
3888267140.jpg| 0| An older woman is working behind a counter at a restaurant .
3888575744.jpg| 3| Artist on street corner selling his artwork .
388913235.jpg| 1| A fashion designer is working on his one of his designs at his studio .
3889711490.jpg| 0| Five women wearing scarves , sitting in a row , on the ground in front of an old stone wall working with their hands .
3890223491.jpg| 0| A man with a white t-shirt and red hat is working outside a house .
39024981.jpg| 4| Two female co-workers talk on break .
3902517480.jpg| 0| A man and a woman with a blue banana on her head using tools to work on part of a vehicle .
3903142951.jpg| 1| A man is suspended in the air on cables while doing some work on a building .
3904368912.jpg| 3| People working and selling goods in a market in Southeast Asia .
390675437.jpg| 4| A man working an office printer .
3907881388.jpg| 2| A balding painter working on a piece on the street in the daytime .
3909544831.jpg| 1| The guests of the office table had left all of their paperwork and belongings .
3909552008.jpg| 0| Three men in blue hard hats are on the tops of telephone poles working on the wires of one with a tall wedge topped skyscraper in the background .
391020801.jpg| 3| a walmart worker wearing a white coat .
3911874189.jpg| 3| A man in a blue shirt and a woman in a white apron are working at a produce stand .
392167806.jpg| 1| A group of children , with adult helpers , work together .
3927396708.jpg| 3| A woman working with a stock of animals .
3929821625.jpg| 0| five migrant farm workers in a field of pineapples picking and taking off the outer covering of the freshly picked pineapples and then putting them on a conveyor belt .
3932157451.jpg| 3| A shirtless worker is on a scaffold , working on a building .
3936422227.jpg| 0| A man in a hard hat and brightly colored vest is doing work on cement steps .
3936738389.jpg| 0| A man dressed in a light shirt and coveralls attempting to work on a train locomotive .
3937269663.jpg| 2| Men work on and around equipment on a construction site at night .
3938776000.jpg| 3| One guy using an animal to work in a flooded field .
394335828.jpg| 0| A man in a pink striped shirt and jeans and a head light working on electrical components in a large gray box .
3944497603.jpg| 4| Bus worker sleeping on building ledge .
3947686324.jpg| 0| A man in a workout clothing sits in a yoga pose and meditates .
39494353.jpg| 4| A man prepares a fire outside to do some metalwork .
3951142610.jpg| 2| A young female technician in a white coat works in a modern laboratory .
3951498887.jpg| 0| A man in a blue shirt and who has scratches below his right elbow is working on a blue bicycle .
3952305716.jpg| 2| A balloon artist is showing his work to two young children .
3952819160.jpg| 0| A worker is pointing at something while suspended above ground , standing on a platform .
3952821132.jpg| 1| A group of people work on the side of a large metal structure that is very blue on a cloudy day .
3953382308.jpg| 4| Two airport employees work clearing out laundry from a plane .
396084707.jpg| 3| A little Middle Eastern girl doing her homework .
3963683506.jpg| 0| Six males , four with shirts and two without , have taken a break from their construction work on a building .
3963684908.jpg| 1| male construction workers observing something from a construction site .
3965588075.jpg| 1| A blond street worker wearing a white hard hat , orange shirt , jeans and a reflective jacket in front of a white truck and orange pylons .
3965771582.jpg| 0| Four men , two in work cloths , are relaxing and taking a rest break .
3966071063.jpg| 3| Police officer whistles while he works
3971893411.jpg| 1| A group of villagers working beside a dirt road .
3972666986.jpg| 3| Two women work together while another woman watches .
3972668464.jpg| 3| A group of women fill out some paperwork .
3972670198.jpg| 4| Man and Woman are working .
3974475911.jpg| 1| Revelers participate in the Chinese New Year parade with fireworks .
3975881094.jpg| 0| A mother peacefully works on making a beautiful and colorful mat while her son admires her skills .
3976211522.jpg| 0| A group of workers in blue uniforms are marching in line down a path .
3976795263.jpg| 0| Man in white t-shirt and black safety glasses is working with a glass bottle in a shop with a rock wall .
3978631696.jpg| 0| A chain through whole where a man can be seen at a work site .
3980506413.jpg| 1| A man is working in a mine or cavern of some sort .
3983874347.jpg| 1| three male safety workers in neon yellow vests are taking their break .
3990927873.jpg| 0| A young woman in striped turtleneck blouse is sitting in an office and working on an Apple computer .
399226846.jpg| 0| A construction worker trying to help the traffic in one of the construction sites in the city .
3992847618.jpg| 3| A man in a smart business suit walks past a wall with artwork .
3994030417.jpg| 0| A city worker sweeps up the ground at the top of a set of concrete stairs .
40001784.jpg| 1| A man with several tattoos is working a restaurant stand .
4001021645.jpg| 1| A man in a blue dress is working under a bus , another man is rotating a tyre .
400106578.jpg| 1| A worker is at the top of a telephone pole , working on the wires .
4001914227.jpg| 3| A young boy trying to impress his dad by doing yard work .
400242803.jpg| 1| A worker directs traffic around a crew working on utility wires .
400946967.jpg| 1| Hard at work , this teenage boy is handling a fish on the beach .
400949109.jpg| 0| Two young black men sit on a beach and work on fish netting while boats and other men are visible in the background .
401059368.jpg| 1| This dude is Asian , and works on computers all the time , not stereotyping .
4011394505.jpg| 0| A worker in a bright orange uniform is cleaning up the mess on the street while a small boy in red pants walks by .
4013752334.jpg| 1| Two men in helmets and gloves are working on decoration for the outside of a building .
4015350856.jpg| 4| Volunteers working at a surfing booth at beach .
4015868140.jpg| 4| An medical worker examines a young girl .
4017747090.jpg| 0| Student in a classroom concentrate on their work , guided by a PowerPoint presentation on a large screen .
402229993.jpg| 0| Ethnic woman in traditional clothing sitting on the ground by artwork designs in chalk .
402264555.jpg| 2| A chef working on an outside stove burning coal and logs to cook the top layer of food
4027325112.jpg| 2| People working together with fish set on the tables .
402839598.jpg| 1| A girl in a pink with white polka dot shirt setting up a box with a face drawn on it on a work counter .
4029929673.jpg| 4| Children being show how things work .
4030623833.jpg| 4| A construction worker peering over a ledge .
4031278022.jpg| 2| Bald man wearing a tool belt working on a water fountain .
4035527590.jpg| 0| A construction worker with a hard hat and green gloves standing shoulder deep in still water facing away from camera .
4037128007.jpg| 0| A worker is power washing the sidewalk outside of an estate surrounded by an iron fence .
4038121720.jpg| 2| A train conductor looking out the window of a black train while the worker looks at the gauges .
4043883681.jpg| 4| A woman is working on an ice sculpture .
4044612196.jpg| 0| Construction workers are walking down a hallway of a building they are constructing .
4045361947.jpg| 2| A man in a black shirt working on a guitar .
4045372755.jpg| 2| A man and a woman work together on a computer in a recording studio .
4045411879.jpg| 0| A man wearing a yellow safety vest watches other workers on machinery .
4046952585.jpg| 2| Man working on beige carving while wearing yellow ear protectors .
4049278176.jpg| 0| A black man in a tan sarong and head wrap , works outside shoveling a sand from a yellow truck on to a road , he is surrounded by green grass , shrubs , and plums of dust .
4049532274.jpg| 3| A balding man is standing and working with a blowtorch .
4050246422.jpg| 3| A man with glasses uses a torch to work on a glass project .
405117798.jpg| 3| A boy is doing work in his bed on a boat .
4054618575.jpg| 0| A construction worker in blue jeans talks on the phone with someone while standing near a construction site .
4056514744.jpg| 0| Two workers with leaf blowers blow orange leaves off patches of grass next to a wet sidewalk .
405961988.jpg| 0| The construction worker is drilling into the street near a street with active traffic .
40670061.jpg| 3| The Two kitchen workers are standing near the dishwasher .
4069561894.jpg| 4| A worker in a yellow coat pushes a cart .
407569668.jpg| 3| Three people work on their laptops inside a store .
4077089649.jpg| 0| An Asian man with Headphones sneers as he works a turntable in a dark room .
4077122969.jpg| 1| A disc jockey busy at work as lights shine upon him .
4077359929.jpg| 4| Two people working near a laptop computer .
4077598908.jpg| 1| Five black men wearing white coat and their heads shaved are working in a laboratory , looking under the microscope .
407815946.jpg| 1| A man wearing a harley-davidson hat working in a cornfield .
4082185154.jpg| 4| A priest working at an Italian booth .
408695996.jpg| 4| Two guys in the snow work on a snowmobile .
4089361660.jpg| 3| A worker in a hard hat is being interviewed .
4089545692.jpg| 0| A man wearing black pants and a white shirt busily working in a restaurant kitchen with food and 3 wine bottles on the counter to his right , and dishes in the dishwasher to his left .
4091722734.jpg| 2| Two women are on break at work , laughing , talking , and enjoying a soda .
4093561036.jpg| 3| A guy is operating a bulldozer , and they are working on the sewer lines .
4093563644.jpg| 4| Tractor doing construction work .
4093746088.jpg| 1| A worker in a hard hat standing on a roof looks off into the distance .
4093748512.jpg| 4| A guy appears to be doing some work outside .
409468643.jpg| 3| A man in a plaid jacket works with flowers .
4102545355.jpg| 0| Two construction workers taking a break ; one is napping in a chair and the other is lying on boards from the work site .
4105635976.jpg| 0| A man works at a desk overflowing with paperwork and business-related electronic devices .
4105944919.jpg| 3| Workers are working and chatting in the middle of a street .
4105945751.jpg| 4| Some people working in a yard .
4111392491.jpg| 1| A man in a white shirt and baseball cap is working on a sculpture of a person .
4111392499.jpg| 0| Two men dressed in work attire are looking at a pipe that is sticking off the wall .
4115261994.jpg| 3| a crowd of people at a city festival with smoke and fireworks
4115571898.jpg| 1| Two workers dressed in hard hats and yellow jumpsuits work around a construction scene .
4115814951.jpg| 0| Many children are working together in someone 's yard cleaning leaves .
411678041.jpg| 3| A man in a parade rides a brown horse and works a lariat rope .
4119134806.jpg| 2| Three workers in reflective gear are waiting against a wall .
4119940755.jpg| 3| man in a pinstriped jacket is working with an object .
4127226771.jpg| 0| Migrant workers working for the government on its big plantation .
4127569424.jpg| 4| A restaurant worker is cleaning a seat .
4135917871.jpg| 0| A man with a beard works intently on a project that needs a lot of heat .
4138236406.jpg| 1| People dressed in red pants wearing yellow gloves hold bright fireworks suspended on long poles .
4143332417.jpg| 0| A woman in a black and yellow shirts works the clean the floor under the red chairs .
4148921661.jpg| 1| The elderly gentleman relaxes reading his novel after a long day of work .
4152320485.jpg| 4| Some people are working out in a field .
4153140979.jpg| 0| Two men in white hard hats are working on a large object inside a chain-linked fence .
4153903524.jpg| 0| Two men in hard hats attempt to help as a third man works on a big white machine .
415832172.jpg| 1| A man and woman work together to inflate a hot air balloon .
4165414625.jpg| 0| A pizza worker helps a customer while other workers deal with food .
4166168198.jpg| 2| A young woman picks up bread at a bakery in which she works .
416960865.jpg| 0| A woman wearing a red work man 's hat and red jacket is hiking in the snow topped mountains .
4169721618.jpg| 1| A man in a black shirt is removing his work gloves by a red gate at a construction site .
417024751.jpg| 0| A man rests a silver-colored metal disk on a rock surface as he works on the back side of it .
4175080701.jpg| 1| Six with helmets workers are walking on a balcony through the snow .
4180952377.jpg| 0| A man works on his car as he tries to keep warm with his hat and sweatshirt .
4181865001.jpg| 3| A person 's hands work on some sort of project .
4182499394.jpg| 3| A man on scaffolding working on the masonry of a wall .
4182684430.jpg| 0| Two workmen are standing on a roof while they repair a chimney .
4183630653.jpg| 2| There is a woman working in a corn field .
4186516481.jpg| 2| Two boys and a girl doing schoolwork in a classroom with a green wall in the background .
4190354455.jpg| 3| Two men of hispanic descent are working at the wood boards .
4190354833.jpg| 2| A man working hard to sort through wooden crates on a hot day .
4194358849.jpg| 0| Overhead shot of a gray-haired man working on a piece of art .
4195751574.jpg| 2| A woman in a flower shirt is working on a piece of pottery .
4198839235.jpg| 1| A little girl having to stop her holiday artwork in a hospital room in order to breathe-in oxygen through a tube .
4199756372.jpg| 0| City workers in bright yellow and green safety suits haul a stack of traffic cones through the snow and past the tree trunk .
4200109001.jpg| 0| Two males on a cherry picker type of elevator , one wearing a khaki colored shirt and the other a yellow one , working on a cracked side of a building , with red flowers in the window next to them .
4200405484.jpg| 3| Women workers in a produce market in a foreign land .
4201060050.jpg| 2| Three men at a construction sight working with a dumpster .
4201682728.jpg| 2| Two employees wearing white caps are working at two computer screens in a dimly lit room .
4203512618.jpg| 0| Two boys one wearing a yellow shirt and the other wearing a white sleeveless shirt working at a workbench .
4206319600.jpg| 0| Two men are working in the dark and only have the headlights of their truck to see by .
4212865709.jpg| 0| Two people in bright orange coats are working on some piece of equipment that is dealing with a train .
4213647132.jpg| 0| A red train on the track is being worked on outside by three workers wearing orange .
4218701454.jpg| 1| Five young , well-dressed people work in a kitchen .
4224693415.jpg| 2| A man and a woman work in a butcher shop .
42256309.jpg| 0| Two workers in reflective vests walk in front of a wall painted with the image of a mannequin in a reflective vest with rubber boots and a trowel .
422736619.jpg| 3| Three construction workers digging a hole .
422737954.jpg| 0| Three construction workers working on digging on a hole , while the supervisor looks at them .
422787743.jpg| 4| Two men work to move a slab of stone .
423066487.jpg| 3| The chef is working at a restaurant .
4236452679.jpg| 2| A woman in an orange red shirt working at a cash register .
424268604.jpg| 3| Man working a machine that looks old .
4243568636.jpg| 0| Five construction workers in orange vests and orange hard-hats standing outside in the rain .
4249149516.jpg| 0| A man stands in front of a stack of paperwork and you can see it the reflection form the window
4254863635.jpg| 0| A construction worker takes a moment to wipe his face while working in the hot sun outdoors .
4255627436.jpg| 0| A construction worker in a hard hat , red shirt and yellow and orange vest operates a piece of machinery in front of palm trees .
425623983.jpg| 0| Two workers making dough in a room with a large fireplace and a crate full of dough .
425725042.jpg| 1| A man wearing an apron and a gray shirt is working in a white tiled area with some equipment .
4257593776.jpg| 0| Three construction workers in orange vests speak to one another in front of railroad tracks .
4258465084.jpg| 3| An electrician working on lights , possibly air conditioning ducts in an office building .
4260403844.jpg| 1| A man in the snow on a ramp working on an ice sculpture .
4268242266.jpg| 2| Men are in a work zone , working across the street from a DSW store .
4268485193.jpg| 1| Five people are working on bicycles with a large graffiti mural behind them .
4270148661.jpg| 2| A food worker giving a customer a spoon .
4272747342.jpg| 2| A construction worker wearing a black shirt and jeans , sets up his ladder .
4273698621.jpg| 1| A man dressed in all green with his face covered by a bandanna is working outdoors with heavy machinery .
4273711559.jpg| 2| Male construction worker on his cellphone with one foot on his yellow tractor .
427703425.jpg| 1| A man in a blue , plaid shirt in a garage wearing a protective mask and using a torch on his workbench .
4278658978.jpg| 2| A yellow construction crane does work demolishing a vacant building .
4284601289.jpg| 2| A group of people in purple and red shirts are working on a performance routine .
4287001609.jpg| 1| A worker wearing gloves is bending over and working .
4287004211.jpg| 1| Three men work in an alley , while a woman watches from a balcony .
4287405602.jpg| 0| There is a woman standing in some sort of restaurant with her hands up smiling while two men are working to make food .
4291704682.jpg| 2| Two workers sweep the sidewalk outside of their small shop .
4294773353.jpg| 0| An older man with blond-hair and a black fleece is working on a sculpture .
429497076.jpg| 2| Two men in an reception area watch as three woman work on something on a table .
4295355954.jpg| 1| An older women in glasses and a white and black shirt working with paints .
4297110982.jpg| 2| People at a park or beach surrounded by colorful artwork .
4300375062.jpg| 1| A group of people sitting at a table working on paperwork .
4302493227.jpg| 0| The craftsman sits outside working his treadle machine to braid rope .
4302494415.jpg| 2| A man and a woman are sitting on the floor , working with craft items .
4303243256.jpg| 2| An old man wearing a hat is working on a project .
4304306426.jpg| 4| A young student doing her math homework .
4305146644.jpg| 0| A group of construction workers are attempting to pull a cover onto a framework .
431059632.jpg| 1| Man in a tank-top working on textiles .
431168725.jpg| 3| A man in a white shirt does work at a table .
4312737358.jpg| 2| A worker is looking at her laptop sitting at her desk .
4320863128.jpg| 1| A group of people , mostly teenagers , are working on a city sidewalk , digging and cleaning up vines .
4322208721.jpg| 4| An artist working on an ice sculpture
4326538699.jpg| 1| Two rodeo workers in cowboy hats trying to get a brown and white bull to move out of the way .
4328442305.jpg| 4| A young boy lying on the floor with his artwork .
4328445479.jpg| 0| Several kids in what seems to be a classroom , working on a problem together or potentially giving a presentation .
4329198220.jpg| 1| A group of youths ," one wearing a t-shirt labeled "" L.A. City Lounge South "" ", are working on a craft project that involves the use of flour .
4329267374.jpg| 2| Four young adults sit on the floor and work on a project .
432945206.jpg| 0| A young girl wearing white stockings is working her way down a play set .
433471134.jpg| 2| An elderly woman working with a man and two children
4340031884.jpg| 2| Two men standing in a work place , one man taking pictures .
43426408.jpg| 3| Many people work on repairing a wooden house .
434467651.jpg| 1| A girl in a pink sweatshirt is working at a loom .
434469662.jpg| 2| A man in a red shirt is being serviced by a working old woman in a store .
4345676156.jpg| 2| Three men are working up fish on a stainless steel table outdoors right next to the water .
4346213739.jpg| 0| A group of construction workers refer to a chart in the middle of roadwork .
4351577560.jpg| 3| A group of people in a rush to get to work .
4354222843.jpg| 1| A baker dressed in white with a hairnet works with dough using a long pole .
4355306057.jpg| 3| a man working in a outside meat deli .
4357061908.jpg| 2| An Asian male focuses on building something at a workbench .
435966316.jpg| 1| Three workers , with life vests and hard hats , on a boat hanging from cables over water .
4360892902.jpg| 2| A construction worker checking out the building site .
4361061763.jpg| 3| A man on a ladder doing work on a business storefront .
4361879526.jpg| 0| Two men wearing work clothing climb a scaffold at a construction site .
437057062.jpg| 3| A man and a woman work with a tool on a log .
4371764049.jpg| 4| A person working in a field .
437827172.jpg| 0| A boy in a blue coat hangs his artwork on the wall .
4378806339.jpg| 4| Office workers having fun .
4379576888.jpg| 0| A group of men and women workers give an applause .
"4379845375.jpg| 2| A crowd of people in workout clothes at a "" Run For Haiti "" event ."
4382642104.jpg| 0| On a street in England , people watch a construction vehicle work on the road .
4385122946.jpg| 4| A shirtless man is working on a bicycle .
4391092093.jpg| 2| Two men are working on a fishing boat unloading many blue crates .
439171995.jpg| 4| A man working on his computer .
439348091.jpg| 2| Group of working man dressed in black and white laugh and talk on a cellphone .
43980543.jpg| 0| A construction crew of 10 people is working on a new building structure .
4405699723.jpg| 0| A man is sitting at a table , working with a machine of some sort .
4409805003.jpg| 2| A man in a striped shirt with a rolled up sleeve is working on his laptop
4412978133.jpg| 1| A man in an apron appears to be working on a project .
4413714.jpg| 1| A room of Asian students are working in groups at desks in a classroom .
