image_name| comment_number| comment
4107474314.jpg| 0| Three boys on a basketball court , wearing team uniforms , are attempting to reach a basketball which is not photographed but appears to be descending just out of their reach .
4107795952.jpg| 3| A snowboarder dressed in red is attempting to jump over a red board lying on top of snow .
4123816289.jpg| 4| A football player attempting to catch the ball .
4130537606.jpg| 1| Two firemen at the end of a cherry picker attempting to get above a fire in a small trailer at night .
4153903524.jpg| 0| Two men in hard hats attempt to help as a third man works on a big white machine .
415832172.jpg| 0| A man using a contraption that breaths out fire while a woman holding the balloon as they attempt to fill it with hot air .
423485388.jpg| 0| Two skydivers wearing blue and purple jumpsuits attempt to smile for the camera as they fall with the cloud and blue sky above them .
4248543428.jpg| 2| Two girls attempt to cross the street in a crowded Asian city .
42649475.jpg| 0| eight people are attempting to pull a tractor with a rope
4267417965.jpg| 3| A skateboarder attempts his newest trick .
4303790425.jpg| 0| Two horses greet a man in red pants and a black shirt , while a dog on a leash attempts to jump the fence .
4305146644.jpg| 0| A group of construction workers are attempting to pull a cover onto a framework .
432329497.jpg| 4| A couple attempting to establish telephone communications .
4329187340.jpg| 0| A group of women on a green bus , one has noticed the camera and attempts to imitate it by making a rectangle with her index finger and her thumb .
433855742.jpg| 1| The dog owner attempts to retrieve the Frisbee from her pet .
440166415.jpg| 1| a man with a cowboy hat on is holding on tight to his black horse as the horse attempts to buck the man off .
440984831.jpg| 1| A man is attempting to fix a sink while his friends looks on .
4448862529.jpg| 1| A rugby player in red and black attempts to score as he is descended upon by members of both teams .
445348023.jpg| 1| A man laying on the roof attempting to rebuild it .
4470892676.jpg| 0| An older man in a rust colored t-shirt attempts to play a black umbrella like a violin .
4488188880.jpg| 0| A young lady attempts to play darts in a darkened room .
4517839686.jpg| 1| A baseball player is catching or attempting to catch the baseball during a baseball game .
4521860330.jpg| 0| A man that is working efficiently is wearing a denim jacket and attempting to fix something .
4529690052.jpg| 0| A male soccer player attempting to head the ball past the goalkeeper to score a goal .
4530802564.jpg| 1| City workers attempting to remove the ice and snow that had recently fallen .
453807108.jpg| 0| A man wearing chuck taylor shoes and a tan shirt attempts to break free from a straitjacket in front of a crowd
455709958.jpg| 0| A young woman is wearing a pink hood shirt while attempting to drink water from an outside shower .
4562771403.jpg| 0| A Woman wearing gray pants and a black jacket is balancing on one foot on a public street attempting to put socks on .
4574570790.jpg| 2| Two boxers are fighting and the one in the blue short is attempting to block a punch .
4585470754.jpg| 2| A football player in a mostly white uniform flees as a red-uniformed member of the opposite team attempts to catch and tackle him .
461139067.jpg| 3| This man is attempting to touch a hot light .
4644979500.jpg| 0| A group of firefighters and other workers attempts to push a red car that has been flipped back onto its wheels .
4650172049.jpg| 4| A woman is attempting to lie on a tree branch .
4655825812.jpg| 1| A baseball player is attempting to tag out a runner .
4683661511.jpg| 1| Male volleyball players in red attempt to score on the other team , lighter red .
4690242705.jpg| 0| The woman in the black shirt attempts to find her bike in the midst of the crowded street .
4700236014.jpg| 0| A woman wearing a blue and white floral patterned tank dress makes a funny face as she attempts to eat some type of foil-wrapped food .
4713156011.jpg| 3| Dark-skinned individual having a failed high jump attempt .
4721682484.jpg| 1| Two men on the beach attempting to throw pillows into targeted holes .
4728340384.jpg| 4| A fruit vendor attempting to sell his fruit .
4741608436.jpg| 0| Three grown adults in shorts attempting to practice yoga , two adults are wearing tank tops , while the other is shirtless .
4742299638.jpg| 4| A man is attempting to cross the street .
4758483073.jpg| 0| A man attempts to start a flying model of a bi-plane with British air force rondel markings .
4764493697.jpg| 1| Three firefighters attempting to extinguish a car fire in the middle of the road .
478592803.jpg| 4| Two women attempting to cross a busy street in China .
4793039083.jpg| 3| Man attempts skateboard trick in tree-lined skate park .
4797878234.jpg| 0| A nighttime scene where firefighters anxiously attempt to put out a building fire , shooting water from all directions .
4805120667.jpg| 4| A man attempts to blow bubbles .
4841988538.jpg| 1| One man standing in a clearing attempting to pull an object by a rope .
485054073.jpg| 1| a white dog is attempting to catch a green and pink object .
486975428.jpg| 1| A man in a white hat , blue sweater , and khaki pants gets ready to attempt a putt .
4881309019.jpg| 0| A long jumper takes flight in an attempt to jump the longest distance possible in a track competition .
4902026887.jpg| 2| A young man with glasses and his companion are attempting to do laundry in a public place .
4912972404.jpg| 0| Two adults , one a man and one a woman , in orange shirts , attempt to make a swimmer feel better by hugging her and talking to her .
4915022692.jpg| 0| Two ladies dressed are dressed in blue and one of them attempts to hand out a pamphlet to a tall man in a blue t-shirt who is drinking coffee .
4922803624.jpg| 4| A man attempts to skateboard over a chasm .
4931227978.jpg| 1| A man on horseback chases , and attempts to lasso , a young calf .
4931229672.jpg| 1| A man riding a horse attempts to lasso livestock in a pen .
4931239366.jpg| 2| On horseback a man attempts to rope a young bull .
4931289200.jpg| 0| A female on a horse is attempting to move cattle to another area of a pen .
4931319718.jpg| 2| A cowboy is attempting to lasso a calf while riding a horse .
4931356888.jpg| 2| A man and a boy on horses attempting to rope a cow .
4931368578.jpg| 0| A person on a brown horse wearing jeans , a plaid shirt , and a cowboy hat attempts to lasso a running calf .
493654365.jpg| 0| Five children spin around on a playground roundabout ; three lay on their backs , while one attempts to pull himself up with both arms , and another holds onto the side while sitting up .
4938550261.jpg| 4| Snowboarder attempting to perform a trick in midair .
49402821.jpg| 0| A little girl in a salmon skirt attempting to hit a soccer ball but missing .
4950125546.jpg| 0| A surfer is about to attempt a large wave , he is also wearing a life jacket for protection .
4979481707.jpg| 2| An soccer player attempts a cross while a defender throws his body in the way in order to block the pass .
4982419929.jpg| 1| A group of women observe as two men attempt to fix their bikes .
500113182.jpg| 1| Young child in black overalls attempting to climb over a fence
5009013963.jpg| 1| A football player in blue and gold is attempting to tackle the player in white .
5016198622.jpg| 2| A man is in the ocean holding onto a surfboard as a child attempts to stand up .
5031372579.jpg| 0| A young female child attempts to break a Scooby Doo pinata using a stick at a gathering of her and her friends .
5114288800.jpg| 2| A child in green pants attempts a handstand in a field on a clear blue day .
5135670352.jpg| 0| A very fair-skinned girl wearing a red and black plaid shirt , blue jeans and boots attempts leans backwards so far that her long blond-hair touches the ground .
517778590.jpg| 4| Fisherman attempt to catch a large aquatic animal .
5180313655.jpg| 0| An Asian man attempting to repair a green bicycle outdoors while two other Asian men stand by .
5187127204.jpg| 0| Four military servicemen in a boat are attempting to attach a stairway to a larger vessel next to them .
5192912743.jpg| 0| A barefoot child wearing a blue shirt and a child wearing sandals with a red shirt both attempting to grab a soccer ball falling from the air .
5197289352.jpg| 4| Two football teams are attempting to complete a play .
520341293.jpg| 1| A man in a white t-shirt and blue jeans is attempting to sweep a dirty street .
5210430501.jpg| 2| A young man attempts a tricky maneuver on his skateboard along a graffiti-covered wall in a park .
5241034101.jpg| 4| Two workers attempt to stop a flooding street .
527288854.jpg| 3| A person wearing a yellow helmet attempts to climb a rock .
5287405.jpg| 0| A man in a white shirt is attempting to feed a baby in a highchair .
5316221658.jpg| 1| A person attempting a stunt using a snowboard and some wooden pallets while it is dark outside with snow on the ground .
5316470320.jpg| 0| A teenage boy is attempting to rollerskate down the handrail on a set of yellow stairs while a woman and two children look on with shocked or anticipatory faces .
5365075444.jpg| 1| Two children attempt to use a bicycle to large for them .
5381657104.jpg| 2| Two men attempt to rope a calf while an audience watches .
5405152538.jpg| 0| A young man riding a skateboard through a park that appears to be attempting a trick .
5450688421.jpg| 2| Three military males are watching a female wearing a red sports shirt attempt to do a push up .
5460845581.jpg| 1| A basketball player in a white uniform is attempting to block a shot from a basketball player in a dark blue uniform .
5468293105.jpg| 2| One boxer attempts to punch his defensive opponent with a fierce expression on his face .
5479743540.jpg| 3| A skateboarder at a skate park attempting a rail slide trick .
5503955724.jpg| 1| A game of rugby in which 2 players are attempting to stop there opponent from catching a ball in midair .
5518762083.jpg| 0| Two children are in the snow and one of them in a blue coat is attempting to pick up a huge snowball .
5572351880.jpg| 0| A shirtless man holding up a large barbell in a gym , while a man next to him attempts the same .
5572655622.jpg| 1| A female officer is attempting to direct traffic on a street corner .
5602731697.jpg| 0| A group of 6 men are attempting to pick up or move a heavy missile looking object that is supported by a chicken foot .
5611391594.jpg| 3| A man attempts to get a ball through a hoop as a bystander watches at a park .
5637361857.jpg| 2| A man observes a painting while another person attempts to recreate the same painting .
5639106614.jpg| 1| There is a man in a red sweatshirt attempting to do a trick on a skateboard .
5687832945.jpg| 0| A woman in a blue shirt attempting to take a picture of a man in a wheelchair , two men dressed in military uniform , a woman in a white shirt , a man in a suit and a man in a blue shirt .
57078880.jpg| 1| Four men attempt to fix a hot air balloon with another hot air balloon seen in the background .
570996053.jpg| 2| A construction worker is attempting to climb a tree .
5769961721.jpg| 4| A young girl attempting to break open a pinata .
5822381051.jpg| 2| A boy is driving a toy tractor while another boy attempts to jump into the trailer .
5823151095.jpg| 0| A toddler girl in a pink sweater is attempting to wipe a chalkboard writing off with her hand .
5825529550.jpg| 0| A young boy attempts to catch a rugby ball at the beach while dressed in a very colorful outfit .
5890401192.jpg| 1| A young man wearing a green shirt and a hat attempts a trick on a skateboard while riding it in a skate park next to a beach .
5892895879.jpg| 3| Man in blue shirt attempts to make it on base .
5893468050.jpg| 0| A baseball player wearing a blue uniform with the letter 16 on it , is attempting to hit the base without the opposite team tagging him out .
5893481130.jpg| 0| A baseball player attempting to catch a baseball that is about to go over the field gate .
5899799040.jpg| 0| Three people are attempting feel the rush of free falling before they pull their parachutes .
5903545909.jpg| 4| A baseball player attempting a diving catch .
5914789066.jpg| 0| Baseball player making an attempt to hit the ball while the catcher is ready to catch the ball the ref is looking to make a call on the ball .
5972938127.jpg| 1| A baseball player wearing a gray uniform attempts to catch a fly ball against the fence .
5988551357.jpg| 4| A person in pink attempts to mount a horse .
6006191679.jpg| 1| The woman is attempting to surf in front of two photographers taking pictures .
6012829906.jpg| 3| A man attempts to surf in a public , outdoor space while people watch .
6050027136.jpg| 2| The man is attempting wheelie on hi moped in front of his fascinated family .
6083027696.jpg| 1| Two men in jumpsuits attempt to work on the side of a ship from a small vessel .
6086876085.jpg| 1| A mature woman and senior man are dancing on a dance floor with a few other couples , the lights are all red and you can see an attempt to block the day light with red curtains in the background .
6090766940.jpg| 0| Two men , one standing and one seated on the ground are attempting to wrangle a bull as dust from the action is being kicked up .
610590753.jpg| 3| An animal is attempting to cross the river .
6141300695.jpg| 0| A soccer goalie in red and green attempts to move the ball out of range of a player in red as the goalie has possession of it in his hands .
6146405403.jpg| 0| Two ice fishers watch on as a third attempts to cut out a portion of ice with a chainsaw .
6155571589.jpg| 0| The runner clearly is determined as he crawls to the finish-line while onlookers attempt to help him .
6156416718.jpg| 4| Two men playing soccer collide while attempting to gain possession of the ball .
6180807938.jpg| 0| In the middle of a soccer game , the team wearing stripes has the ball as the turquoise-wearing team is attempting to steal it away .
6181931777.jpg| 4| Professional Dirt biker attempts large jump .
6187182607.jpg| 0| A baseball batter in white pants and a black shirt attempting to hit a baseball with a catcher behind him and an umpire behind the catcher .
6188266707.jpg| 1| Female volleyball player attempts to set the ball over the net .
6190299977.jpg| 1| A white-clad soccer player is attempting to intercept a soccer ball that is quickly approaching the goal box .
6200565917.jpg| 2| A hockey player is attempting to take a shot on the opposing team 's goal .
6206340700.jpg| 0| A running back maneuvers himself into an opening between two lineman as he attempts to run the ball down the football field .
6212337902.jpg| 2| An equestrian sits upon a brown horse which is attempting to leap over an obstacle .
6221126100.jpg| 3| Muddy men attempting to climb a tall wooden pole .
6221946312.jpg| 2| A defensive football player attempts tackling an offensive football player holding a football .
6246430633.jpg| 2| A man attempts to ski on the one last patch of snow left on the hill .
628282183.jpg| 0| An elderly gentleman attempting repairs on an inverted bicycle next too a silver vehicle .
"6286405785.jpg| 0| A football player in a blue "" Rams "" jersey runs with a football on a field ", as another player in a white jersey falls in an attempt to tackle him .
6296537344.jpg| 2| A roller-hockey player is attempting to make a shot that the goalie is blocking .
6333818443.jpg| 2| A woman in a kitchen , leaps in the air while attempting to balance a glass cup in one hand .
6337155749.jpg| 2| Mr. Soccer player of the green team attempts a shot .
6338542128.jpg| 4| ,  8 for Iowa State stiff arms a Texas AM player attempting to tackle him .
6348201976.jpg| 2| Two soccer players fall down attempting to get to the ball .
6371364473.jpg| 0| The bare-chested young man , attempted to gain a firm grip on the rock , as he attempted to scale the mountain .
6376516937.jpg| 3| A basketball player hanging in the hoop is attempting to high-five the referee .
6378330987.jpg| 1| Construction workers stand in a street attempting to move bricks .
640053014.jpg| 0| A motorcyclist is attempting a jump with another motorcyclist nearby as well as onlookers .
6413464907.jpg| 1| A skateboarder moving extremely quickly , attempting to turn while going down a hill .
6422968349.jpg| 1| The young Anderson player is attempting to shoot while his opponent and teammate look on .
6493407251.jpg| 0| A man dressed in layers is attempting a trick on his snowboard .
6526560433.jpg| 0| Two football players on the field one from different teams , the blue and black player is attempting to tackle the blue and white player who is holding the football .
65757777.jpg| 1| A large man attempts to climb a tree while a cat & dog sit near him .
6592762429.jpg| 0| A soccer player who has just attempted a goal kick is burying his face in the field in frustration as the ball sits by the goal post and the goal keeper looks out towards the crowd and the rest of the field .
6617044713.jpg| 2| A child is attempting a jump trick on his skateboard while another films it from a low angle .
661757041.jpg| 2| A little dog is attempting to catch a red ball .
6638041153.jpg| 1| Competing girls volleyball players attempt to control the ball in midair .
6659698.jpg| 1| five children lie on a gymnasium floor holding hands while a sixth attempts to pull them all along in a chain .
6669144827.jpg| 1| A male diver attempts a back somersault while ambivalent onlookers chat amongst each other .
6677599803.jpg| 1| Woman fell to her death while attempting rock climbing while drunk .
6699112713.jpg| 1| A young woman is smiling towards the camera as she attempts to pull herself up a hill while skiing .
6763339241.jpg| 0| A snowboarder is flying in the air attempting to land on a snow mound .
6770707007.jpg| 1| A BMX motorcyclist dressed in protective gear and helmet , attempting a jump on a sandy dune .
6782145166.jpg| 0| A man is attempting to make a basket in a basketball game and a member from the opposing team is trying to stop him .
6797626960.jpg| 1| Basketball player in the orange uniform attempts to block the shot of the player in the white uniform .
6805643630.jpg| 0| A hockey player attempts to score a goal close to the net while a goalie strives to protect the net .
6810081173.jpg| 1| Little boy attempting to help mom do dishes & play in the bubbles .
6822696890.jpg| 0| Three wheelchair basketball players wearing team uniforms are attempting to reach the descending basketball with other players in the background .
6828084858.jpg| 2| A seagull appears at the left corners as a surfer attempts a minor wave .
6828313172.jpg| 1| A basketball team is taking a shot while three men attempt to get the rebound .
6847695941.jpg| 2| A young boy attempting a stunt flying off stairs on a scooter .
6871582253.jpg| 3| A man attempts to place basketball in hoop while surrounded by opposing teammates .
6874319983.jpg| 1| A goalie for a hockey team is attempting to block the puck from entering the net .
6881296905.jpg| 2| Two tall basketball players are attempting to block a smaller player from throwing the ball .
6889203488.jpg| 2| Young athletes compete in a soccer game in an attempt to block a goal .
6891631263.jpg| 4| Young boy in green shirt attempts juggling .
6896996092.jpg| 1| A man in a red vest stands up during a game and calls out in an attempt to sell things .
6898973401.jpg| 1| A basketball player dribbles with authority and skill up the court as a defender gets ready to stop his attempt at scoring .
6907187997.jpg| 0| Two men from opposing teams jump and reach high in the air in an attempt to grab a Frisbee .
6912268860.jpg| 3| Opposing soccer players attempt to head ball simultaneously .
6915111992.jpg| 2| A child in yellow attempts a goal at a soccer game while the goalie in red tries to block the shot .
6926577156.jpg| 2| Basketball player attempts to dunk the basketball while being surrounded by three members of the opposing team .
6928261287.jpg| 2| A basketball player is attempting a layup while another basketball player is attempting to block the shot .
6929649160.jpg| 1| A bull is attempting to throw off a male human with colorful pants on his back .
6940278172.jpg| 1| A young man attempts to pole vault over a bar , barely inches away from it mid flight .
6943740971.jpg| 2| A basketball player is attempting to make a basket when an opposing player attempts to block his shot .
6957006310.jpg| 3| The teenager is attempting a skateboard trick at his local skate park surrounded by palm trees .
6964979447.jpg| 1| Tennis player midair attempting to swing his tennis racket .
6970752746.jpg| 1| A player for the white and yellow basketball team is attempting to score points for his team in the game .
6971364322.jpg| 1| One man attempts to pin his opponent who is waring a blue singlet during a wrestling match .
6974857128.jpg| 3| A goalie attempts to block a shot in a hockey match .
6977076039.jpg| 1| A surfer attempts to stand on his board as water splashes up from the sides .
6988222785.jpg| 3| This is a small child attempting to look through a telescope .
698947790.jpg| 2| A man and two women attempting to construct a grill .
7010540685.jpg| 2| A rugby player is attempting to outplay his opponents .
7018032339.jpg| 1| A soccer game is played as two men attempt to reach the ball before their respected opponent .
7024548103.jpg| 0| A person with black sleeves is holding a lock with the left hand and attempting to pick it using a small metal bar held by the right hand .
7035417199.jpg| 1| A soccer game where the team in yellow is attempting to advance past the team in white towards the goalie wearing a black top and blue shorts .
7036939605.jpg| 0| Two hockey players are in the middle of a match and the man on the left is in the process of swinging his stick in the attempt of scoring .
7081259615.jpg| 2| Three men are playing rugby , one man is attempting to tackle the man on the opposite team who is holding the ball .
7081260077.jpg| 1| A man in red and white runs with a rugby ball as another man in blue attempts to tackle him while two other men look on .
7099368287.jpg| 4| Two football players , jumping in attempt to win a header .
7100593697.jpg| 1| A group of 5 young girls pose for a photograph by attempting to jump in the air just as the picture is taken , one of them stays on the ground and is holding an infant male .
7113951085.jpg| 1| A first basemen in a women 's softball game attempts to tag the runner out at the end of a pickoff play .
7148403727.jpg| 0| Several young men at a track competition attempt to jump over a hurdle while avoiding the water and the competitor who has fallen on the ground .
719231347.jpg| 0| A boy wearing a hooded sweatshirt is looking down attempting to fix a brightly colored umbrella .
7252718418.jpg| 1| A young bespectacled girl attempts to hit a softball from a free-standing batting tee .
7272406870.jpg| 1| A baseball player is caught midair attempting to catch the baseball with his mitt , while another player looks on .
7277131866.jpg| 3| A mustached man wearing glasses and a maroon polo is attempting to use a food processor .
7284554016.jpg| 0| The man attempting an extreme stunt on his bicycle is wearing a black helmet and black elbow pads .
732437240.jpg| 1| In this picture it appears that a man is falling off a bull while attempting to ride the animal .
732446750.jpg| 3| Man on horse wearing white hat attempting to lasso small animal .
733411277.jpg| 3| Woman attempting to complete a spare in bowling using a red ball .
7438344154.jpg| 1| A girl wearing a green jersey chases down a soccer ball in an attempt to kick it in to the net .
7503435144.jpg| 0| A stunt driver is attempting to drive with only one side his four-wheeler touching the ground .
7512556880.jpg| 1| The ,  5 baseball player from the Green Team attempts to make the catch as the ,  7 Gray Team player crosses the base , with the umpire looking on to make the call .
7570232540.jpg| 4| A woman attempts to swim across ocean .
7596563022.jpg| 0| A brown horse with a red rider leaps over an obstacle while a white horse with a black rider attempts to close the distance .
7600282242.jpg| 0| A man in a white and black uniform is attempting to hit the baseball .
7652712058.jpg| 0| A soccer game with the blue striped shirt team attempting to score a goal against the red shirt team as the red shirt team defends .
7663275698.jpg| 0| Two guys playing basketball both midair one blocking while the other is attempting a jump shot .
7670346004.jpg| 1| A judo player in white attempts to submit a judo player in blue while on a yellow and red mat .
7671952322.jpg| 1| A basketball player with a USA jersey is attempting a slam dunk .
7673105012.jpg| 1| The oakland athletics player trying to turn a double play as the Orioles base runner attempts to break it up .
7700078440.jpg| 0| A member of one volleyball team has just sent the volleyball over the net while the other team is attempting to block it .
7712229454.jpg| 0| An athletic woman wearing blue and red shorts stands between the white lines on the rust-colored court and attempts to throw the javelin , while cameramen stand by .
7713053118.jpg| 0| A soccer player has just shot a penalty kick which the goalkeeper attempts to save it from going in .
7719481340.jpg| 2| LeBron James , playing for Team USA , is attempting a layup from underneath the basket .
7723452818.jpg| 0| A male bull rider maintains his balance while his bull kicks his rear legs off in attempt to throw the rider off .
