image_name| comment_number| comment
36147990.jpg| 3| A man with a cigarette hanging out his mouth playing pool .
361565925.jpg| 0| A Toddler wearing a dark blue jacket and knit cap is standing on gravel and pointing upward , with stone columns and a wooden display board in the background .
3620197503.jpg| 3| Two man are talking inside the baseball playing area
3620343911.jpg| 2| Two small children play after a swim .
3621717946.jpg| 1| Two swimmers are playing a water sport with a yellow ball and a net .
3621972977.jpg| 2| A small group of people sitting in green chairs while watching a man in a helmet play the accordion .
3622752371.jpg| 3| Two young boys playing on the rocks .
3623047508.jpg| 0| A scene with an old auditorium in the background an orchestra in front playing music and people wearing hard hats in the forefront .
3626642428.jpg| 4| Dogs play in creek .
3626964430.jpg| 0| People playing cricket in the park , pine trees in the back .
3626998066.jpg| 2| Two brown dogs are playing with a green toy on grass .
3627216820.jpg| 1| Two dogs playing , one dog is jumping in the air above the second dog .
3627290893.jpg| 0| There is a group of three women and one man singing while one of the woman plays a guitar .
3627929314.jpg| 3| A child plays with a costumed adult at a parade .
3628017876.jpg| 3| A little boy playing with two rubber chickens .
3628059004.jpg| 4| A woman is laughing while playing guitar .
3628103548.jpg| 0| A woman playing guitar and singing in the foreground and three others performing behind her .
36286937.jpg| 0| A man wearing black shirt and shorts playing guitar on a sidewalk while another man is sitting on the ground looking in the opposite direction .
3629615546.jpg| 2| Two women in matching black and green outfits leap in synchronization during a play .
3630641436.jpg| 1| Three large dogs are playing in the water at the beach .
3631023049.jpg| 1| Three smiling children swing in a tire swing at a playground .
3631344685.jpg| 1| A baseball player swings the bat as a catcher and umpire watch .
3631530817.jpg| 0| A long-haired , male musician is playing on a piano .
3631671718.jpg| 4| A girl plays T-ball .
3632047678.jpg| 2| A group of anime cosplayers sitting in a hall .
3632572264.jpg| 0| Two teams line up either side of a pylon , on a barren playing field
3634200287.jpg| 0| A bald musician wearing a black shirt plays his guitar on stage .
363560757.jpg| 3| a boy in red shirt playing ball .
3635915412.jpg| 0| A tent is to the left and two boys are playing Frisbee in a field .
3635991166.jpg| 0| There are four smiling boys with smiles on a playground with their ball .
3636055584.jpg| 0| Two male athletes wearing the same uniforms are playing against another male athlete on the opposing team .
3636796219.jpg| 0| There is a baseball player in a yellow shirt running midfield .
363755314.jpg| 1| A man is trying out a display piece of exercise bike equipment .
3637965586.jpg| 1| A boy does gymnastics in the grass by the blue play tunnel , as two boys stand on the patio of a ranch-style house .
3637966641.jpg| 0| A young baseball player sliding into a base while a dust cloud rises and the other team moves around him .
3638318149.jpg| 0| A young boy playing on his skateboard on a patio of an interesting building , while two people are sitting in chairs in the background .
3638783120.jpg| 3| Two people are on a golf course playing golf .
3639691167.jpg| 0| A young football team is on the field chasing a player from the other team who has the ball while the referee looks on .
3639845565.jpg| 0| A man in a cowboy hat sits on bleachers near the water and plays guitar .
3640020134.jpg| 3| The dog is playing in the water .
3640109324.jpg| 0| Men carry a small structure on their shoulders while others play instruments behind .
3640417354.jpg| 4| Girl is playing at park on a swing .
3640661245.jpg| 0| A girl in a red polka dot dress and red headband playing with a pink handheld game
3641999223.jpg| 0| A man playing a sport in a green uniform holding a paddle over his head .
3642604708.jpg| 0| A boy toddler play outside on a clothes rack full of tied dye shirts .
3643021980.jpg| 0| A young girl in a baby pink outfit poses for the camera while holding onto a jungle gym in a playground .
3643074723.jpg| 3| A young boy plays on a swing .
3643087589.jpg| 2| A small white dog and large brown dog play on the grass .
3643666111.jpg| 0| A Texas baseball player catches the ball as the ,  12 player from the opposite team slides into base with an umpire standing by , ready to make the call .
3643974707.jpg| 4| A child is playing underneath a larch arch .
3644142276.jpg| 3| Two children play while being suspended in harnesses .
3645134768.jpg| 0| A band with four members , one female , plays for a small audience .
3645809088.jpg| 0| A band of five men singing and playing instruments on stage before an audience .
3646190566.jpg| 1| A man in a pirate costume playing an instrument in a band .
3647446816.jpg| 0| Two girls play softball , one slides into plate as other fails to catch ball .
3647693147.jpg| 0| A small , young boy wearing a white shirt is playing with fallen leaves outside .
3647826834.jpg| 0| A woman is playing with two children on a seesaw in a playground .
364880092.jpg| 4| A kid playing soccer in an alley .
3649224118.jpg| 0| They are playing with a soccer ball on the beach .
3649307685.jpg| 0| Two males are playing field hockey , one with a blue stick , one with a gold stick .
3650111717.jpg| 2| A white and brown dog is playing in the dirt with a toy .
3650986674.jpg| 3| Two dogs play in shallow water .
3651690772.jpg| 3| A woman playing mini-golf , putting a blue ball out of the water .
3652207174.jpg| 3| A blond-haired woman wearing sunglasses is playing mini-golf
365274901.jpg| 2| The two dogs are playing fetch in the snow .
3653385929.jpg| 0| Two members of a military brass band play their horns while others look on .
3653386313.jpg| 0| A group of officers in navy blue uniforms play brass instruments for a group of children .
3653462288.jpg| 1| A child in a helmet plays on a skateboard by a playground .
3654869593.jpg| 0| The children are playing a game , with a volleyball net and a football , on the beach .
3655155990.jpg| 0| Two dogs playing in the water , one is bounding at the other .
3655326478.jpg| 2| A woman plays with her dog on an obstacle course .
3655745504.jpg| 0| An African-American man wearing a purple shirt , white shoes and blue jeans is playing a saxophone while standing inside of a building which has many archways and a red and gray tiled floor .
3656206975.jpg| 0| A black dog is playing in water with a green toy .
3656225270.jpg| 0| A girl in red rides on her stomach in a playground swing above a sandy surface .
3656906086.jpg| 2| Two dogs play with each other outside .
3656957567.jpg| 4| Children playing on a merry-go-round on a chilly day .
3657387086.jpg| 0| A woman wearing a coin hat and pink scarf is playing a drum-like instrument by a small tree while several others are standing in the background .
3658279485.jpg| 0| Elderly male accordion player plays in the street in front of a boutique wearing a blue vest , sunglasses , and a white hat with a red scarf on .
365849741.jpg| 0| A man is riding a unicycle and playing the bagpipes in a crowd of people .
3658733605.jpg| 0| A man in black is on a blue trimmed bicycle in front of a playground .
3659090958.jpg| 1| There is a little child sitting in a little chair playing with a toy .
3660516586.jpg| 0| Four people are playing football by a body of water in partly cloudy weather .
3661239105.jpg| 0| A small blond boy dressed in shorts and a blue shirt playing on a jungle gym .
3661789938.jpg| 0| A female wearing glasses is seen from a three-quarter rear view , as she plays a horn in a musical group .
3662865.jpg| 0| Two kids , one in a blue coat and one in a green coat , play in the snow with shovels .
3663793993.jpg| 2| A child in shorts and blue shirt is playing in the sprinkler .
3664781437.jpg| 0| Four children are playing on their front porch while their father looks on .
3665549027.jpg| 0| Two brown dogs are playing with each other on the grass , with one dog laying on its side .
3665569615.jpg| 3| A profession baseball player pitches a ball in a baseball game .
3666020875.jpg| 3| Kid playing on sidewalk in puddle .
3666169738.jpg| 3| A baby playing in the water at a beach
3666179842.jpg| 2| A young man is holding the hand of a toddler girl as she plays in a creek .
3666188047.jpg| 0| A child in a yellow shirt is playing a red arcade ride .
3666188658.jpg| 0| A man wearing a long brown robe is playing the guitar while another person is sitting at the drums and yet another is wearing a long gray robe and singing .
3666537170.jpg| 2| A boy in orange shorts is playing in the shallow part of the ocean .
3666574371.jpg| 0| A rugby player wearing a colored top has scored a try as the players in black are running towards him .
3667822570.jpg| 0| Soccer players get in a scuffle as one puts the other in a head lock .
3668118382.jpg| 1| Male tennis player getting ready to serve tennis ball .
3668244651.jpg| 3| Two children are playing with baby dolls while adults watch them .
3668520111.jpg| 1| A boy in a green and yellow t-shirt is playing a guitar in a large crowd .
3669527584.jpg| 0| A Indian women displaying her cultural heritage with painted red fingers and an extravagant head piece .
3669564923.jpg| 3| Two girls play with their food for the camera .
3669635757.jpg| 0| A black woman supervising a young white child in a play pit filled with plastic balls .
3671694723.jpg| 0| Three girls in gold ' Native American ' costumes dance on a football field while several young men in dark blue uniforms play drums behind them .
3671851846.jpg| 2| A lady holding one dog while another dog is playing in the yard .
3671935691.jpg| 0| A woman is blowing bubbles and a little girl in a pink outfit is playing in front of her .
3672105509.jpg| 3| Two dogs play with each other on the sidewalk .
367248403.jpg| 1| Three people are playing in a snowy landscape , one is holding a large snowball ready to drop it on the others .
367400736.jpg| 3| A street vendor is displaying artwork and other goods .
3675685612.jpg| 0| a child is playing with a green , white and red spinning toy that turning on the ground .
3675878796.jpg| 2| woman with not a whole lot of clothes on playing on phone
367602066.jpg| 1| A little girl with brown hair wearing a sweater is playing with a pink yo-yo .
3676289259.jpg| 2| A dirty boy at a playground holds up his hands with disgust .
3677318686.jpg| 0| Little boy juggling orange balls in the park with a playground behind him .
367740415.jpg| 3| Little kid jumping around house playing .
3677693858.jpg| 0| A child is playing near a swing set , with a hedge in the background .
3677860841.jpg| 2| A boy and a girl playing in the pool on a sunny day .
3677992640.jpg| 0| A girl in a white tank top and bikini bottoms is playing volleyball on a sandy beach .
3678098428.jpg| 0| A man wearing a black tank top and red plaid hat is smiling as a man behind him is playing with a colorful object .
3678885320.jpg| 0| A husky middle-aged man ," with a black shirt that says "" got music "" ", and a cowboy hat , plays a guitar .
367890260.jpg| 4| Young children play with a telescope .
367964525.jpg| 3| A German shepherd playing in the snow near the woods .
3680031186.jpg| 0| A Boston Red Sox baseball player holds the bat waiting for the incoming pitch .
3680378579.jpg| 0| A woman in colorful clothing plays her guitar in the street , next to her guitar case .
3681324243.jpg| 0| Two baseball players on a field , with four spectators , and a crowd .
3681414069.jpg| 0| One black and white dog sleeps while the other two black and white dogs play with a plastic bag .
3681637675.jpg| 0| A young black woman wearing a white tennis dress , white visor and white tennis shoes is swinging a racquet while playing a game of tennis .
3683974620.jpg| 0| Two dirt bikers - one in black and red , sporting number 64 ," the other in blue and white displaying a red "" 21 "" - round the corner of a tree-lined track ."
3684280516.jpg| 4| Woman in blue shirt listening to guitar player .
368650516.jpg| 2| A man in a blue jumpsuit displays his sculptures .
3687222696.jpg| 1| A little boy in a red t-shirt jumps off of a blue slide at a playground .
3687537196.jpg| 1| Nightclub scene with disc jockey playing music to dance by .
36880708.jpg| 0| A group of men play xylophones in a concert space filled with percussion instruments .
3688343105.jpg| 0| A concert band displays patriotism and talent , through dress , as well as their music .
3688364166.jpg| 0| A man in a white hat is playing a red and white electric guitar while sitting at a synthesizer with multiple keyboards supported by white PVC pipes , with a blue railing in the background .
3689407371.jpg| 4| A man playing with a small child in a pool .
3690358925.jpg| 1| A young child playing on the floor with letters made out of quilted fabric .
3690358949.jpg| 0| A small child is laughing and playing while lying on her back on a gray rug .
3691800116.jpg| 0| A batter playing cricket missed the ball and the person behind him is catching it .
3692154582.jpg| 0| A young woman with elaborately designed hair is playing a game on a Game Boy .
369244499.jpg| 0| A man with a ponytail is playing a decorated piano in the street next to a table with a red cloth .
3693255006.jpg| 1| A group of young men are playing around a natural waterfall .
3694219419.jpg| 1| A group of adults and children play with a parachute outdoors .
3694528441.jpg| 0| A group of girls playing touch tag , one team dressed in blue and another in dark green , are running to help two injured players .
3694555931.jpg| 2| Two girls playing in mud in a small pool .
3694991841.jpg| 0| A musician plays a drum while his hair covers his face , and tattoos dot his arms .
3695517194.jpg| 0| A black soccer male soccer player in a purple uniform with a soccer ball on his head , and a white male soccer player in a white uniform behind him .
3696190497.jpg| 4| A child in a yellow shirt playing with their hat .
3696246123.jpg| 2| Two dog play with ball while one makes a big jump
3697153626.jpg| 1| A boy in a plaid shirt plays with string .
3697379772.jpg| 0| A tattooed man in black playing a white guitar and singing .
36979.jpg| 0| A group of friends playing cards and trying to bluff each other into making a terrible mistake .
3698507219.jpg| 3| A father and his son and daughter play by the waters edge .
3699318394.jpg| 4| Two men playing on a computer
3701699584.jpg| 1| A tennis player wearing a white shirt and black pants prepares to hit the ball .
3702038926.jpg| 4| The girl is playing while four boys look on .
3704642429.jpg| 0| A woman in a black t-shirt and light tan long skirt sing at the microphone while her band members play in the background .
3704709223.jpg| 2| Two gentlemen in tuxes play the keyboard and guitar .
3704725503.jpg| 2| A baby and 2 year old laying on the ground under a play mobile .
3705470430.jpg| 0| A girl wearing a short-sleeve floral print dress with a watch on has a microphone and appears to be speaking or singing to a man with a sports coat , orange shirt and hat on who is playing a guitar .
3705560226.jpg| 2| A man in suit with face paint is playing a guitar on stage .
3706064643.jpg| 1| A young man is concentrating on playing with a notebook .
3707585013.jpg| 0| A woman sings and plays guitar while young adults mill around in the background .
3707738261.jpg| 4| A girl in a pink coat plays in the leaves .
3708748633.jpg| 0| A man wearing a coat and a plaid green skirt is playing a bagpipe .
3708839890.jpg| 4| A dog playing in water .
3709030554.jpg| 1| A young boy with a dinosaur shirt on runs at a playground .
3709301369.jpg| 0| A man is in an ornate , wood paneled room , standing and playing an unusual semi-circular instrument while being accompanied by a wind ensemble composed of young people who are sitting behind him .
3710176138.jpg| 2| Little boy getting soaked playing an outdoor water game .
3710353645.jpg| 0| A young girl wearing a pink dress jumps through the air over playground equipment .
3710468717.jpg| 0| Two children and a dog play in the snow with a woods behind them .
3710971182.jpg| 0| Men play some type of sport on the field with what looks like hockey sticks .
371269133.jpg| 0| An older man in sunglasses , a hat and a leather jacket plays the trumpet on a fall day .
3712720433.jpg| 2| The girl with the blue jean shorts on is playing with the two boys .
3713030758.jpg| 1| A football player is kneeling on the football field with the football on the ground in front of him .
3713632593.jpg| 0| Young boy sits on a computer chair while playing a game on his computer screen while his hands are on the keyboard .
3714755769.jpg| 1| A kid with blond-hair playing with a rock outside .
3715635007.jpg| 2| Two children climb a very large metal play structure .
3716139039.jpg| 2| The child playing on the deck has a red bucket on their head .
3716462559.jpg| 0| A male billiards player with a grin on his face and his pool stick in hand overlooking a billiards table with some balls on it .
3717809376.jpg| 0| Two young children ride on the swings at a playground .
3717845800.jpg| 1| The rugby players in red are wrestling the player in yellow to the ground .
3717886615.jpg| 0| A boy in a tee-shirt and shorts playing an instrument next to a girl singing while playing the guitar .
3718076407.jpg| 1| A brown and white dog is playing with a toy in a field of green grass and clover .
3719712280.jpg| 0| As a crowd looks on , a player in a white uniform , wearing only one colorful sock , makes a diving catch for the frisbee .
372160542.jpg| 1| A man in a blue shirt playing with a young boy in a red shirt on the ground in a bedroom .
3722809335.jpg| 0| A musician settles down in a subtle area to play his tunes for the people walking by .
3723541814.jpg| 0| A man in all black is playing the violin outdoors and has the attention of a young woman who is sitting in front him , enjoying the performance .
3723690961.jpg| 1| A man in a white suit and a pink shirt plays guitar .
3724150944.jpg| 0| A group of young boys on opposing teams are playing soccer .
3724623861.jpg| 0| A woman wearing a plaid dress plays an instrument while standing near a tree .
3724718895.jpg| 0| A small brown and white dog is playing with the sprinkler in the grass .
3724759125.jpg| 0| A small boy rides on a playground toy while pointing to a slide .
3725353555.jpg| 4| A dog playing with a sprinkler
3726130458.jpg| 0| A baseball player in a white uniform is walking to base while a crowd of people watch from the bleachers .
3726168984.jpg| 2| A brown dog and a yellow dog play fight over a plastic bottle .
3726170067.jpg| 1| A balding man with glasses stands in front of a colorful display .
3726629271.jpg| 3| Four dogs are playing and jumping in the air outside .
3726980861.jpg| 0| A man in a black graphic t-shirt playing an acoustic guitar .
3728015645.jpg| 0| Man standing on one arm with feet in the air on playground equipment with a body of water in the background .
3728438187.jpg| 4| Two teenagers playing in a big hallway .
3730944337.jpg| 3| A baseball player is standing on the pitcher 's mound .
3730944557.jpg| 4| A man is playing baseball .
3732563003.jpg| 0| A man with a hat , boots , and brown pants , is playing the violin outside in front of a black structure .
3732728142.jpg| 2| a litttle baby plays with her teddy bear .
373341109.jpg| 0| Two children play in a bedroom , fully furnished with bookshelves , a ' Dora the Explorer ' poster , and a bunk-bed shaped like a fantasy castle .
3735197045.jpg| 0| Three male children play flag football on a grassy area by a body of water .
3735202441.jpg| 4| A little boy plays ball in the water , while at camp .
3736786640.jpg| 0| Two teenage boys in black swim trunks play on a trampoline .
3737492755.jpg| 0| There is a man in a black and yellow outfit playing the drums .
3737539561.jpg| 1| There are two kids in swimmies playing outside next to some trees .
3738685861.jpg| 0| A small child is sitting playing with an adornment in a small garden .
3738789925.jpg| 0| A young boy with blue eyes plays on a red and yellow playground set .
3741827382.jpg| 2| A young boy plays in front of a blue object .
3742963998.jpg| 0| A little boy in a Superman t-shirt is playing with a push toy , while the adults are standing and talking .
3744832122.jpg| 0| A young baseball player winds up to throw the ball .
3745699897.jpg| 0| The hockey players , in blue , are waiting for their best chance to get the puck from the opposing hockey team .
3746623148.jpg| 1| Children playing in water looking at a giant picture of a person 's face .
374707236.jpg| 0| A man with headphones in his ear is playing music with his DJ equipment .
3747543364.jpg| 3| Three young girls playing on the beach .
3747821314.jpg| 1| A man in a black and red jacket sings into a microphone while another man in a bowler hat and plaid suit plays an instrument behind him .
3748065273.jpg| 0| A small boy is playing in the waves at the shore of the ocean during a sunset .
3749195206.jpg| 3| A little boy is playing with bubbles in his bathtub .
3749668646.jpg| 4| A group of people are performing a play .
375118300.jpg| 0| Two women are sitting in front of a table where they have many items on display such as parts of fish .
3751594676.jpg| 0| A child in blue and yellow clothing is clinging to playground equipment with an adult nearby .
3753435962.jpg| 0| A woman dressed brightly in florescent wig , tights , leotard , tank top , and high tops plays in public with a pink hula hoop .
3754150327.jpg| 0| There is a lot of people watching a group of people playing the violin on stage .
3754588617.jpg| 0| Two young girls are playing on swings ," and one is holding the other girls swing "" still . """
3756112747.jpg| 1| A bunch of kids play with toys that are inside a blue bucket with white writing .
3756254732.jpg| 1| Four women dressed in white midriff displaying outfits flap a white sheet in the air .
3758175529.jpg| 2| There is a small child playing in a green kiddy pool .
3758747095.jpg| 2| little boy in a playground sitting on swing set
3759492488.jpg| 1| A little kid swings on a pole at a playground .
3759504106.jpg| 0| 2 men , one playing a violin , one playing a xylophone , both older and wearing darker glasses .
3759953984.jpg| 1| Piles of fruits and vegetables are displayed with their prices on hand made signs .
3760001378.jpg| 0| A young girl in a blue shirt is bending over playing with a pile of sand on what seems to be a beach .
3763257911.jpg| 0| Three older men are standing on the sidewalk leaning on a half brick wall , one of them is playing chess with a younger boy while the other two seem to be relaxing .
3766991914.jpg| 0| Instrumental band members are wearing matching uniforms that consists of the colors white , red , and yellow while playing their instruments .
3767841911.jpg| 3| On wet grass , little blond girl in orange dress plays in sprinkler .
3773323977.jpg| 0| Children play with a remote-control boat in a pond with a boat house .
377406355.jpg| 1| A vendor sits in the middle of a display of glasses at a street market in an Asian country .
3775443800.jpg| 1| Two men playing a board game at a city park with two spectators .
377872472.jpg| 2| Three dogs are playing around in the snow .
377872672.jpg| 0| Three dogs playing in the snow , with a city in the background .
37791887.jpg| 0| A group of children divided into a maroon team and a blue team playing a soccer game .
3780234150.jpg| 0| A woman in a red tank tee , black shorts , white and black socks , with white sneakers is playing tennis , but she is kneeing on the ground .
3781571333.jpg| 0| A young girl dressed for cool weather in a cap and long-sleeved sweater , about to climb a log ladder to a playground platform .
3782318456.jpg| 4| There are about five people getting suited up to play some sort of sport .
378998340.jpg| 0| Trumpet player with eyes closed , playing in the band dressed in a red uniform with black cuffs and white braid trim .
379111807.jpg| 0| A man in a brownish green shirting playing guitar singing into a microphone
3792602083.jpg| 0| Girl standing in front of a musical band , playing for a party .
379505240.jpg| 0| Two men in pink jerseys , two men in white jerseys , and one man in a black jersey and black helmet , are playing field hockey .
3798411098.jpg| 0| Three woman , one wearing blue , one wearing red , and one wearing white look at a display of a potato wearing a wig .
3798412244.jpg| 0| A multicolored display of Mama Lucchetti products .
3799563009.jpg| 0| A old man wearing red , white and bluish gray playing music on a stage using a cross-cut saw .
3799847884.jpg| 0| An older woman looks at the camera while young children play with many kinds of toys around the room in the background .
3799980514.jpg| 2| A man in a gray shirt is playing the guitar in front of a microphone .
3799984714.jpg| 0| A man playing a banjo near a tree at an outdoor event .
3799987586.jpg| 0| A man is seen singing into a microphone and playing banjo with a guitar nearby while sitting on a stool at a festival where there are booths featuring items for sale .
3800647959.jpg| 1| Young boy wearing jeans and a blue shirt playing with a dog .
3801083035.jpg| 4| A person playing on a rope swing .
3801309708.jpg| 1| Here is a picture of a young boy playing in a golf resort village .
