image_name| comment_number| comment
5261090459.jpg| 2| An older man working in a farm house , unrolling some string .
5261346652.jpg| 0| A worker uses a jackhammer on boulders from a rockside , a dump truck is parked nearby .
5262731925.jpg| 1| A construction worker is digging a hole in the street while another man watches .
5263339188.jpg| 1| A construction crew is busy working , while a man is talking to the workers .
5264507624.jpg| 0| Two men wearing bright orange safety vests are working to repair electrical lines .
526671837.jpg| 4| Two workers cooking at a food stand .
5266810229.jpg| 0| A man with black hair and a red shirt is sitting at a work desk with an extend screen and there is another person working on his extend screen in the background .
527041167.jpg| 0| A man in a blue shirt and tan shorts has his feet in the steps of an exercise bicycle and is working on the control panel of the machine .
527076501.jpg| 1| An artist dressed in a gray sweatshirt is working on a brightly colored painting of a town .
527288854.jpg| 0| A woman works hard to maintain a fingerhold as she climbs a rock face .
5280521648.jpg| 3| Two young students going over work materials and studying together .
5284421435.jpg| 4| People conduct landscaping work beside a neighborhood
5290994547.jpg| 0| A young man with glasses who 's working on a electronic panel takes a peek on person who photographs him .
5291335711.jpg| 3| A young boy wearing goggles working on a simple science project .
529328292.jpg| 0| Co-workers in restaurant take a short break to smile at the camera amidst folding napkins at a table .
529821195.jpg| 0| A construction worker in safety gear stand on an elevated walkway of a construction site looking down .
5301071699.jpg| 2| A group of dark-haired men and women sit at an outdoor cafe , working and conversing .
530507000.jpg| 2| A person wearing glasses is prepped for some kind of dental work .
5311177343.jpg| 0| Two men are working out together , one is lifting on a machine , and the other appears to be spotting him .
5316250295.jpg| 4| A man shaves early in the morning before going to work
5321569042.jpg| 2| A woman with tattoos on both arms , working out .
5331177956.jpg| 1| Man using magnifying glasses while working on a wood crafting project .
5332049234.jpg| 0| A street artist sits cross-legged surrounded by many drawings , one of which he is currently working on .
5347416087.jpg| 4| One man in a fishing boat , working on his net .
5349069500.jpg| 0| Two men , one in a blue shirt and one in a green shirt analyze a piece of paper in the middle of a workshop area .
5349090392.jpg| 0| A small group of people wearing coolie hats and standing at the edge of a body of water working .
5359437945.jpg| 0| A Man and woman stand in conversation next to a red telephone booth in front of construction workers and passersby .
53614287.jpg| 3| Two children work together on a project at a table .
536156200.jpg| 0| A construction worker in a blue hard hat does work while standing on metal piping .
5365075444.jpg| 0| Two young children working together to operate a bicycle .
5371586024.jpg| 1| Two women talk while working with dough in a commercial kitchen .
5381104643.jpg| 4| Woman in a purple shirt doing craft work .
5384744603.jpg| 3| A postal worker is holding a handful of items to be delivered .
5387261695.jpg| 0| A young Indian lady working diligently on a crochet project .
5390483760.jpg| 4| A car is turned upside down in a ditch with emergency workers nearby .
539871204.jpg| 2| A man lays on the deck after a hard day of work .
5402085.jpg| 0| The worker , in the blue suit , is digging in the dirt , while his coworker , in the gray-green suit , is attending the machine .
541046380.jpg| 2| Two little girls in front of the Build a Bear workshop .
5410472318.jpg| 1| Hardworking farmer and oxen plowing his fields on a hot summer day .
5415070045.jpg| 1| A woman in orange work clothes next to a large blue trashcan is helping a man sweep some dirt and water into a dustpan .
5415181095.jpg| 2| A man with a child of Asian descent strapped to his back while he does a little bit of yard work .
54185885.jpg| 1| A man in a brown coat covers his eyes while working with a flame .
5436250638.jpg| 3| Two surgeons hard at work examining a patient .
544039045.jpg| 2| A man without a shirt working on a rooftop .
544039061.jpg| 1| There is a man working on the roof of a house that is either being newly built or remodeled .
544149309.jpg| 0| A middle-aged white male with blue jeans , black gloves , no shirt and a hat is working on a roof .
5447844412.jpg| 0| Five people outside in the river working with their nets to catch fish .
5476674072.jpg| 4| two men working in a bakery
5482951453.jpg| 0| Several people are working in the warm manufacturing facility .
5485593000.jpg| 0| Construction workers in a Spanish town are working on a business outside .
5488532211.jpg| 3| Children are working on an assignment at school .
5491874786.jpg| 0| Three men of varying ages are working preparing something with pots and bowls .
5498941021.jpg| 2| Under sunny skies , a worker helps in the framing of new building .
549945760.jpg| 0| A view of fireman at work on a residential street , standing around their yellow-colored fire engines , while some civilians stand by and watch .
549998716.jpg| 3| A priest on the phone near some female military workers taking a break .
5500695312.jpg| 1| A group of people doing some type of artwork outside , with snow in the background .
5504368601.jpg| 0| A dead fish that is reddish color on a butcher shop with a worker standing over it .
5504963988.jpg| 0| Numerous workers with blue shirts and white aprons are preparing fish for sale .
5505219003.jpg| 3| Dr. Nava working on some mathematical equations on a blackboard .
5506407501.jpg| 1| There is an older man , ironing a shirt for his work .
5508346028.jpg| 4| Two guys in a chemistry lab doing homework .
5510073103.jpg| 0| A little boy wearing a chef 's hat is working in a kitchen , chopping up some long hotdogs .
5521996.jpg| 0| Four workers in their green uniforms on horseback all in stationary positions next to a white van .
5522482326.jpg| 1| A man with long hair works on putting tile on the ground .
5526034.jpg| 2| Airline workers standing under a plane .
5532294954.jpg| 2| A rescue worker searches with a flashlight under a slab in a ruined building .
5535626115.jpg| 2| Man in green vest working with tools on a large piece of wood shaped like a stump
5536018727.jpg| 0| A constructions worker scratches his backside and stands with his backside towards the viewer observing a construction site .
5536018957.jpg| 0| Two men in belt harnesses are working on a construction project , though only one wears his hard hat .
5536107008.jpg| 0| A young man in a blue shirt is working at his computer , drinking coffee .
55389857.jpg| 0| Old man in a light blue shirt and jeans works on wood carving in a workshop surrounded by other projects .
55406417.jpg| 4| A man is using woodworking tools .
554215758.jpg| 2| Hard hatted construction workers wait to board a lift .
5551993461.jpg| 0| An older gentleman working with tools in a machine tool shop while wearing headphones to protect his ears from the noise .
5562975921.jpg| 0| A young man sits at a workbench amidst a number of work tools including wire cutters working on what appears to be a large ornate necklace .
5563345549.jpg| 0| A woman is sitting down doing some sort of craft work while another person operates a large wooden loom device in the background .
5565536413.jpg| 0| A man is squatting down while painting his artwork on a large metal garage door .
5566972.jpg| 3| A yellow bulldozer working to move dirt .
5570219.jpg| 2| A man in a yellow jacket works with a film camera .
5583005407.jpg| 0| A group of people playing cricket outside among ornate stonework pavilions .
5583280537.jpg| 3| Three men are working with their bikes in the shoulder of a road .
5583327265.jpg| 1| Customers and workers at the checkout of a store with red counters and shopping carts .
5586889028.jpg| 1| A man working in the fields as he moves his hands around the tall grass .
5589693661.jpg| 2| Girl working at a candy store stocks the merchandise .
5595611219.jpg| 2| A person working with yarn in the back of a shop .
5602737557.jpg| 1| 3 people are working in a park doing various tasks using wheelbarrows and a rake .
5605133486.jpg| 3| A chef working in a kitchen using a knife .
5612808611.jpg| 1| Lab technicians are working on a project and teaching the new tech the procedures of the project .
5613922717.jpg| 0| A worker in a hard hat is sitting on a beam in what appears to be an unfinished building .
5615077255.jpg| 0| A small group , two in yellow staff shirts , five in plain clothes , are working on an art project with colored paper .
561906323.jpg| 2| Three workers unloading flowers from a large truck .
562242613.jpg| 2| A crowd of onlookers on a tractor ride watch a farmer hard at work in the field .
5624522.jpg| 2| Man with a blue jacket and white pants , standing on a platform , working .
5633231430.jpg| 3| This worker is pushing his cart through the busy traffic alone .
5637361857.jpg| 0| A woman in an art gallery works on her own version of the middle of three portraits that are shown , while an old man in a tan trench coat studies the art .
5637994240.jpg| 3| A small child plays with toys at a wooden workbench .
5639026536.jpg| 0| Seems to me looks like people in a work room or office working they all using laptop computers from apple it seems there Dr Pepper soda and water bottle on the desk
5640452539.jpg| 1| Disney workers dressed as the Seven Dwarves wave to visitors , while Goofy joins them in the background .
5645857612.jpg| 2| An old woman is bent over a table , working with dough .
5648957534.jpg| 4| A person is working in the garden .
565088263.jpg| 3| Two men that are latched and secured working .
5658123607.jpg| 0| A group of boys wearing orange jerseys playing soccer , with a blond boy guarding a dark-haired boy working the soccer ball down the field , while the other boys are running in the background .
5661996549.jpg| 0| A young man wearing protective eye wear , works on a tire .
5671379503.jpg| 0| Two men in construction clothing and helmet works on the side of a building with metal structures .
5675148300.jpg| 0| Two workers , one male and one female , wearing green pants and neon yellow work shirts are planting flowers in the median of a street .
567526452.jpg| 1| Several government workers working on a railroad crossing .
567903453.jpg| 0| A young , male adult wearing blue jeans , a green reflective vest , work gloves and a hard hat stood between the rails of a railroad track to the rear of a white truck that is specially built to roll on the tracks .
567909573.jpg| 0| Men with yellow jacket and blue jeans behind white truck and working on train tracks
5679390502.jpg| 1| An excited boy in striped sweater seated doing an artwork on a wooden table with his tongue out .
5681130869.jpg| 0| A mother and son work together to clean up their garden so they can begin planting their new spring seeds .
5686865855.jpg| 1| Two men without shirts on working on a roof of a building that has been damaged .
5687925512.jpg| 2| A car wash worker cleaning the interior of the wheel .
5690228281.jpg| 2| A man wearing lime green pants and shirt working on a sign .
570996053.jpg| 2| A construction worker is attempting to climb a tree .
570999731.jpg| 1| Three workers in bright yellow fluorescent shirts are working outside .
571002259.jpg| 0| A worker is cutting down the limbs of a tree by using a special tool .
5710348031.jpg| 0| Two crew workers in orange and yellow safety gear are holding a long , thick road that runs over the edge of a structure .
5712096379.jpg| 1| Maintenance worker cleaning the side of a red and white train .
5714006990.jpg| 1| A seamstress who had a surprise visitor at work .
5714048502.jpg| 0| A woman wearing a purple sweatshirt and jeans with red feathers attached to her head is working on a laptop which sits on a small wooden desk .
571602538.jpg| 0| The worker is assessing the job site after a tree has been damaged and broken .
571612606.jpg| 0| City workers , both wearing gray pants and green shirts , are trimming tree branches and picking up the debris .
571621280.jpg| 1| Three people in bright clothing working on branches of a tree .
572135297.jpg| 1| A construction worker in a bright green shirt is walking past a tree grinder truck .
572149383.jpg| 1| A construction worker by the side of the road stands next to a pile of tree branches .
5721530415.jpg| 1| Kitchen workers are preparing food in a busy , smokey kitchen .
572163357.jpg| 0| A man , wearing a yellow shirt and yellow hard hat , is working with a tree mulcher .
5726810305.jpg| 0| An older man with glasses working on a craft with a lot of thin wire .
5730226613.jpg| 0| Two men appear to be working construction with their hard hats on .
5737982354.jpg| 2| Three men are working together to pump gas from a barrel .
5738778049.jpg| 2| A butcher is hard at work flaying a large fish .
5745120660.jpg| 0| Four in bright clothes men are performing on a stage , while other men in brown at the base of the stage work on equipment .
5745422329.jpg| 0| A workman wearing a striped shirt and gloves clutching his hard hat with one hand and his crotch with the other .
5755891783.jpg| 2| Food donations for the community food bank fill a truck as a worker donning a black hat reaches the loading dock .
5756366794.jpg| 0| Two postal workers smiling as they show off the donations of canned goods they have received .
5761090545.jpg| 3| Construction workers cut beams for their house building project .
5769937988.jpg| 0| An Asian chef is in the foreground , working over a steaming grill while a younger man is behind him .
5770115416.jpg| 2| An older man wearing a tan sweater is working on a painting .
5777129645.jpg| 0| Two men are here and working together at the John Deere 7200 type of machine or vehicle outside in the open air .
5788177425.jpg| 3| A group of people are observing artwork on a wall .
5788687372.jpg| 3| Large group of people sitting and looking at artwork in a museum .
5788742746.jpg| 1| Asian man wearing a black backpack takes pictures of framed artwork .
578910261.jpg| 0| Indoors , a woman wearing a surgical mask , gown and gloves works on a reclining person .
5789294140.jpg| 4| A group of guys working as a group in a classroom .
5790434381.jpg| 0| Four construction workers in safety equipment are working on the wall of a building with the help of a red crane attached to a large truck .
5790840713.jpg| 0| Several people in colorful clothing are working in a garment facility with a quantity of red fabric on tables .
5791568.jpg| 0| City workers work on a busy street , one operates a large Caterpillar bulldozer and another works in the foreground .
5806219410.jpg| 1| Two female Army personnel are handling a lot of paperwork at one desk .
5811788459.jpg| 1| Team of migrant workers pull together to gather the days fishing haul .
581630745.jpg| 1| A woman wearing a white shirt works out on an elliptical machine .
5823026973.jpg| 0| A construction worker with tattoos on his arms is bending while working , and he is wearing shorts and a blue hard hat .
5823285867.jpg| 2| There are 2 painters working on the side of a high building .
5823326999.jpg| 0| Two men working on the roof of an apartment building with a nice looking skyline behind them .
5826844495.jpg| 1| This worker is high above the buildings changing the advertising on a bulletin board .
5832821999.jpg| 1| Two construction workers are maneuvering a log onto or off of a flatbed on a heavily tree-lined road .
5848679932.jpg| 4| A cameraman is working at a sporting event .
5866079837.jpg| 1| A woman in yellow works at an outdoor fruit stand while a customer in sunglasses stands near the stand .
5867606.jpg| 3| A craftsman thoughtfully considers his designs in the workshop .
5879279230.jpg| 1| Men and women are working a kick-boxing routine at a gym .
5888746167.jpg| 3| Two men are working in a field by a den as their dog is about to walk up on them .
5891694046.jpg| 0| A group of workers are staring at a map and two men are pointing at the map .
5897279071.jpg| 1| Children in aprons , and some in chef hats , are working at tables with rolling pins .
5914327.jpg| 0| Two guys in blue shirts are standing on top of a construction surface doing construction work .
5918675.jpg| 0| Several men in white chef 's jackets work in a kitchen .
5925544338.jpg| 1| An older white man with glasses works on a metalworking task on an anvil .
5925544722.jpg| 1| Three construction workers completing the foundation for a driveway .
5926326440.jpg| 0| Its a man driving in a car listening to music in traffic its also can be a person late for work
5929073261.jpg| 0| On stage , the innards of a piano are shown next to a man at a desk who is working on electronics ," while a long-haired man is looking at a screen which shows "" 53 :11 "" ."
5931039781.jpg| 0| A lone worker dressed in hard had , red shirt , mask and reflective vest , stands on dusty concrete , holding a broom and looking over his left shoulder .
5932900326.jpg| 1| Two young women wearing safety goggles while working in a laboratory .
5932908042.jpg| 1| Man wearing an purple shirt working in a biology lab .
593326301.jpg| 4| Rescue workers using a cherry picker .
594582753.jpg| 2| A man cleans up the remains of a house with a rake while others work in the background .
5962276180.jpg| 1| Two men work on girls bike in front of garage .
5962278982.jpg| 3| older man in orange top and pants working on bike .
5964699090.jpg| 2| Two kids work on a science experiment with leaves at a park bench .
5971671598.jpg| 0| some physical event that requires more work after swimming in a pool
5984974054.jpg| 0| A small white car is stuck on the track , while the train car that hit it at a slow speed , sits still , as a rescue worker helps the driver .
5995751546.jpg| 2| Two men work on a net with a large , decorative sailboat in the background .
602612183.jpg| 2| Multiple females sitting indian-style doing what appears to be textile work .
602723055.jpg| 4| a group of people are talking in a workplace .
6028997083.jpg| 1| Two guys are working on their laptops in a room with a red light .
6033533190.jpg| 3| A worker searches for the correct tool in their briefcase .
6034056358.jpg| 0| Amid a group of blue-uniformed workers wearing hard hats and life jackets , a person is being pulled out of the water onto a ship , apparently having rescued another person .
6038122264.jpg| 1| A man on a scaffold uses spray paint to work on a mural .
6054169.jpg| 0| A man wearing a construction vest is working on laying pipe on site .
605691297.jpg| 0| A man in a orange shirt is on a ladder working on a power line , as several men below him are loading their truck with equipment while a dog is watching .
60617980.jpg| 2| A cement worker is working on a new sidewalk outside of a clothing store .
6073765731.jpg| 1| A woman is standing behind and supervising another woman in blue gloves working with specimens under a clean hood in a laboratory .
6074238868.jpg| 0| Two girls , one asian and one white , are in white lab coats working on something from a yellow box .
6075404518.jpg| 0| A woman wearing a blue shirt and black apron is working at the counter of a fast food restaurant .
6077671447.jpg| 0| A woman with brown hair is wearing a brown shirt and navy colored pants and is working on pottery at a table full of unpainted pottery with a chalkboard in the background .
6078212486.jpg| 0| Two girls one with black shirt and one with white sweater are sitting at a table working with clay sculptures .
6079294995.jpg| 4| A man is working in a restaurant while a man washes dishes behind him .
6083027696.jpg| 1| Two men in jumpsuits attempt to work on the side of a ship from a small vessel .
6086510173.jpg| 4| a doctor at work looking through a telescope
60908622.jpg| 0| Two men working with wood , cutting a board with a large saw that 's sitting on a table .
6104320982.jpg| 0| A man talking on a call phone is getting his shoes shined while he sits upon a blue work cart .
6121112512.jpg| 1| A woman works with cotton on a loom in an exotic setting .
6140511870.jpg| 2| Indian man wearing a mask , dirty and hard at work .
6141144133.jpg| 2| A male and female wearing lab glasses are working with vials in a lab .
6141698120.jpg| 0| A girl with a brown jacket , white shirt with a black wolf on it , goggles , and blue gloves on working with test tubes .
6142334811.jpg| 0| Two workers are wearing orange shirts and orange hard hats one of them feeds a tree into a wood-chipper machine while the other fumbles with his headgear .
6146405403.jpg| 4| A worker using a saw to carve into ice .
6147066205.jpg| 1| A man in yellow clothes and a white turban is sitting and working on a carving .
6151897522.jpg| 0| A woman sitting behind a counter at work is wearing a white lab coat , glasses , and gold jewelry as she reads leaflets that she is holding .
616237861.jpg| 2| Two men working together to carve ice sculpture .
6171705161.jpg| 2| The men are working on bikes in a workshop .
6174401215.jpg| 1| The worker concentrates on his task as a gardener as he trims the hedges with care .
6175408029.jpg| 2| A male is working in a bakery shop is taking out the pastries .
6179612438.jpg| 3| A man creating woodwork outside on a city bench .
6186146093.jpg| 0| An innertube is being worked on a bicycle by a male and female .
6189950649.jpg| 3| A street worker wearing bright orange safety gear picks up trash along the street .
6190349317.jpg| 0| A man in a baseball cap and denim shorts stands in an old blacksmith shop , using tools to work metal on an anvil .
6196180784.jpg| 4| Artist works with human subject .
6209779666.jpg| 1| A man , on a ladder works on the roof of a building .
6214239936.jpg| 0| A woman working alone in a blue t-shirt has thrown clay to form a wide-mouth vessel on a potter 's wheel in a classroom .
6217699262.jpg| 0| A man in an orange work outfit is sitting in a crane , waiting to be lifted .
6218244928.jpg| 0| Several workers brace a large yellow object aboard a boat with the Golden Gate bridge in the background .
6221186953.jpg| 0| A man and a woman are busy working together at the front desk of a building .
6226359268.jpg| 2| Three men are working on a bicycle , which has been positioned upside down .
6228224680.jpg| 0| A man with a beard and mustache working on a mechanical components under a hood .
6229823951.jpg| 0| Three men are working on some kind of equipment , but I 'm not sure whether it 's a ship or an oil rig .
6229825733.jpg| 1| Three construction workers are joking around on a boat , leaving the bridge that they are working on .
6231017294.jpg| 3| Two Asian martial artists work on their skills .
6232601127.jpg| 2| An aproned clay-worker throws a pot and forms it on a potter 's wheel .
6235083172.jpg| 1| Two workers in protective suits cut into a metal barrel while onlookers observe their performance .
62525206.jpg| 1| Two men in black shirts are sitting on a white sofa and working on laptops .
6258860982.jpg| 1| A man in an orange shirt and headphones working with equipment in front of a brick building .
6268271168.jpg| 1| An elderly woman in a blue print dress works with twine on an old wooden machine .
6273115722.jpg| 0| A woman is working the spotlights to a play while other spectators watch the play in the background .
6284697322.jpg| 2| A female student concentrates on her schoolwork .
6303184938.jpg| 2| A male lab worker with glasses is examining something using a microscope .
6307273092.jpg| 2| A lady is on a mechanical racing device in a workout gym .
6312121806.jpg| 3| A worker using a broom to clean the ground .
6316125258.jpg| 0| A man dressed in blue is performing some yard work with what appears to be a broom or rake on the steps leading up to a house next to a street on a sunny day .
631949256.jpg| 0| An African-American female sits outside of a village side in a foreign country as she works on sewing on some unknown material as she sets on another material on top of the dirt .
6330156332.jpg| 4| The cook enjoys some downtime with a coworker .
6340723441.jpg| 0| A muscled , shirtless man sitting on a bench working out on an arm-exercising machine .
6341526291.jpg| 2| A female factory worker placing a product on a conveyor belt .
6353804827.jpg| 0| Lady doing chemistry work while the man in long-sleeve shirt observes her .
6353805299.jpg| 3| Two women and a man smile as they work together with some chemical equipment .
6353806575.jpg| 2| A man with a receded hairline is in a chemistry lab working with several beakers .
6372114839.jpg| 2| A man in a blue shirt and a man in a red shirt work with a high powered telescope .
6378330987.jpg| 0| Construction workers are unloading bricks from a truck parked directly across from the work area where another worker waits .
639120223.jpg| 0| Two workers at a grocery store observing something out of camera range .
6398924.jpg| 0| A construction worker dressed in a white shirt and blue jeans is standing on a latter outside of an apartment building .
6398988.jpg| 4| Quiznos worker wearing sign .
6417423499.jpg| 1| A man works on engineering a circuit as he monitors the progress on a tablet device .
6426218107.jpg| 1| A workman in an orange jumpsuit , vest and hard hat steadying a large piece of concrete .
6439261679.jpg| 3| Two sweepers work frantically as their curling teammates look on .
