image_name| comment_number| comment
10002456.jpg| 2| Two men working on a machine wearing hard hats .
100652400.jpg| 3| A construction worker is standing in the street and holding a red flag .
1010087179.jpg| 1| Older man working in a factory not looking too excited about the photograph .
1010087623.jpg| 0| A caucasian man wearing a short-sleeved black shirt and a dark-skinned woman wearing a sleeveless dress are working at a conveyor .
1015118661.jpg| 1| A little boy is standing on the street while a man in overalls is working on a stone wall .
101669240.jpg| 4| Man on skis looking at artwork for sale in the snow
102860573.jpg| 0| A construction site on a street with three men working .
10287332.jpg| 2| Three men , one on a ladder , work on a roof .
103625356.jpg| 1| A man in a baseball cap works to spread cement behind a line of yellow caution tape .
1044798682.jpg| 3| Man works on top of scaffolding .
104700891.jpg| 0| A man wearing a gray jacket and blue work pants is standing in a hole in the ground
1047921035.jpg| 4| Steam rises from a large outdoor vat as two workers look on .
1055753357.jpg| 0| Two construction workers are sitting up on the side of a building .
106300392.jpg| 1| There are two workers , one on a ladder , against a blue wall with a yellow-and-black stripe .
106356264.jpg| 0| A newsstand so packed with magazines , candy and coke-a-cola products that the smiling woman working behind the counter is easy to miss .
10637120.jpg| 1| A worker wearing a hard hat watching a large machine dig a trench in the dry dirt .
1071201387.jpg| 4| A construction worker holds a sign about bicycling .
107936523.jpg| 1| A man in workman 's gear is welding an I beam above a chain link fence .
108149945.jpg| 3| Men at work shoveling snow from a rail track .
1081595465.jpg| 0| A group of construction workers dressed in orange safety vest sit on the ground assembling a railroad track .
1082110795.jpg| 0| Two gentlemen in baseball caps and shirts , work on the engine of an old , rusted VW beetle .
1082223338.jpg| 1| woman with blue gloves working on the sidewalk with some cleaner
1082478946.jpg| 0| There are workers laying out the tracks for a trolley .
1082608010.jpg| 0| A construction worker in a neon vest is working with electrical equipment while sparks fly .
10863862.jpg| 0| An older , male construction worker wearing a yellow vest climbing down from the roof of a building onto scaffolding .
1089059626.jpg| 1| A man working diligently while sitting at a table .
1089354362.jpg| 1| A woman in a green shirt and jeans kneels on a stoop with coffee in hand , her purse beside her and a large door behind her , as she fills out paperwork .
108957912.jpg| 0| People walk across a street as utility workers fix a light .
10919429.jpg| 1| A male in a black shirt , and black pants , working on the engine of an old , green antique automobile , with a yellow gas canister sitting on the grass .
1094606832.jpg| 1| A woman wearing a brown headscarf works at a sewing machine .
1095109931.jpg| 2| A girl working at a farm market selling peppers .
109741554.jpg| 3| Two people working on removing snow from a roof .
1101207553.jpg| 1| Two dock workers and small boat guiding a cruise ship to place to tie up on dock .
110647073.jpg| 1| A group of workers in the desert , two with wheel barrels and two just standing around .
111069375.jpg| 2| A male and female fire performer , work their craft in front of an audience .
111285749.jpg| 3| There are four Eastern guys working on and hanging pictures of humans .
1121053156.jpg| 4| A father and son working on a boat .
11214205.jpg| 0| Men with reflective safety jackets on are working on a street intersection with many orange reflective cones .
11214370.jpg| 0| A man in jeans and a yellow safety jacket is working on bricks in the ground .
11214470.jpg| 0| Two men in construction vests are working on the side of a street with machines .
11220707.jpg| 0| A construction worker standing on the roof of a house wearing an orange vest with a yellow hard hat .
112411540.jpg| 3| A pleasant young man working at a jewelry store .
112550433.jpg| 3| A female works out near the ocean side .
112604461.jpg| 0| Two men work together to attach pieces of wood in a room set up for carpentry .
1131883759.jpg| 1| A small whole is being drilled into a white piece of plastic while being held down securely on a workbench .
11382381.jpg| 0| A woman wearing a green tank top is working on a horse 's shoe .
1145145003.jpg| 2| The woman tries to hide from work under a black sweatshirt , but her red corduroy pants give her away .
1145755142.jpg| 1| 4 men are working on ladders cutting off tree branches .
1145810912.jpg| 0| A boy works on a log that he is using for a project .
1148889628.jpg| 0| A construction worker in jeans is standing on a scaffold holding on to a metal frame with a city backdrop .
115275671.jpg| 4| A Caucasian male is performing yard work outside a building .
115275691.jpg| 0| An elderly man holding a pitchfork and doing some yard work .
1153857697.jpg| 4| Employees of a park discussing work .
115767961.jpg| 2| A pilot in his uniform carrying luggage on his way to work .
1158505981.jpg| 3| People are engaged in worked involving laptops .
116021030.jpg| 2| A worker operates machinery on a cold day .
116450583.jpg| 1| A man in a safety vest is kneeling down and working on a train .
116457850.jpg| 0| Four men working putting a tree into the ground , two are looking away , while the other two are shoveling the tree into the ground .
116569042.jpg| 0| Construction workers standing on top of a piece of machinery .
116569046.jpg| 2| Construction workers standing outside looking at wires above them .
116976749.jpg| 0| Metal worker in protective gear and welding face mask works on weld .
117956563.jpg| 0| Restaurant workers smile as they take a break , gathered around a huge copper bowl in the kitchen .
118707970.jpg| 0| A man in a blue workers outfit with a yellow construction hat examines the side of a brick building from the top of a ladder .
118708295.jpg| 0| Construction workers wearing bright orange suits are working on a road in the rain .
118802644.jpg| 0| Two men in black clothes at a meat market showing a red meat while workers in blue look on .
118865844.jpg| 2| A lady with blond-hair and glasses works hard to clean up her table .
118939861.jpg| 0| Two bald men in a bedroom with one man working on a desktop computer and the observing while seated on the bed next to him .
1190951807.jpg| 2| Two workers toil in a smelting factory .
1191939974.jpg| 0| A man wearing a construction hat and gloves works with machinery .
1196432301.jpg| 0| A half dozen construction workers stand beside a large piece of equipment .
1211184847.jpg| 0| Several men are working on tiles together while sitting on the floor .
122188825.jpg| 0| A construction worker in a yellow vest digs in the street while a second worker looks on .
122189647.jpg| 0| Three men with yellow vests doing work on the side of a street with three blue and white trucks nearby .
122190424.jpg| 1| A construction crew working at several spots on the road .
122202217.jpg| 2| A man with red-hair working on his bicycle .
1223671563.jpg| 0| Construction workers working on a highway at night as people look to see what they are doing .
122868800.jpg| 0| Two people are working the one guy is measuring and the other guy is watching
123244147.jpg| 3| This machine is working in the dirt .
123628218.jpg| 0| Three people , one with a black shirt , one with a navy blue jacket , and one with a red t-shirt , working in an office with a large messy bookshelf .
12393802.jpg| 1| Two men work in a butcher shop ; one cuts the meat from a butchered cow , while the other hoses the floor .
1246863003.jpg| 1| Three men work quickly preparing food in the kitchen of an upper-class Chinese restaurant .
1251583490.jpg| 1| A shirtless man wearing a black hat and a scarf works on an anvil .
1254659.jpg| 3| Two workers in a mongolian bbq restaurant .
1259627071.jpg| 0| There are about a dozen of men in work clothes that are getting directions for a task .
126227418.jpg| 4| A man working on a circuit board
1269021329.jpg| 0| A woman works on a piece of computer equipment , while surrounded by a variety of mechanical and computer equipment , in what appears to be some type of laboratory workroom .
1269022629.jpg| 1| A man wearing white gloves is working in a lab .
1269844288.jpg| 4| people in the ground maybe working
127146749.jpg| 1| This is a railroad engineer working on a green and red tourism train in a theme park .
127332812.jpg| 0| An native-looking older man is sitting and working on making an item that looks to be similar to his hat or bag which is beside him .
12736326.jpg| 3| Waitress working in a restaurant cutting watermelon .
1292033319.jpg| 4| A man and a woman work in their garden .
129269068.jpg| 0| A man in a dirty hat and sweater works on a remodeling project .
129474628.jpg| 3| workers at Roppolo 's pizzeria busy at work .
1296395998.jpg| 3| Numerous Asian people working behind a counter .
129978192.jpg| 1| A young woman wearing a gray shawl is sitting outside working on creating textile .
13042995.jpg| 0| A dozen workers wearing uniforms & sanitation hats are working on an assembly line in a factory .
1306080718.jpg| 0| A worker is sweeping off a sidewalk 302 miles from Liverpool .
13061918.jpg| 3| Two male worker talking outside their building .
131254736.jpg| 2| A railroad worker is checking the tracks .
132056499.jpg| 3| A maintenance worker walking past a statue .
1323858296.jpg| 0| Someone wearing a large hat is sitting on colorful blankets working a loom with a pair of men 's dress shoes in front of him .
1324673652.jpg| 2| A man wearing a jacket working hard in a field .
1325756278.jpg| 1| A bike rider wearing a red shirt and black shorts is attended to by city workers .
1325846369.jpg| 2| A worker stands on a scaffolding to repair a brick building .
132717787.jpg| 1| People working in front and behind a really nice counter with black tile .
132935994.jpg| 1| An older fireman with an orange work suit holding a brown water hose .
133280430.jpg| 2| Three men in work-related uniforms standing next to a building .
1336600636.jpg| 4| One lady working at a convenience store .
1338243125.jpg| 1| A man in blue pants is working in a factory .
135426024.jpg| 0| Three workers in fluorescent orange clothing cleaning the subway tracks .
135515207.jpg| 0| A man in a camouflage shirt mows a small yard while another man and woman who are also performing yard work look on .
1355224458.jpg| 4| A worker burning some material as he squats .
135992929.jpg| 4| 3pm and struggling to stay awake at work .
1362206741.jpg| 0| A woman works at her computer inside a large office housing several rows of desks .
1363343745.jpg| 0| Two men in life jackets working on a jet ski while a small boy in a life jacket and a woman look on .
1364148267.jpg| 1| A man in an orange raincoat is discussing something with another man wearing work clothes near a sewer manhole .
13651137.jpg| 1| A man working at the side of the road with a grill .
13652901.jpg| 0| Two men in hard hats and work coveralls look at the docked ship one of them points at .
136693281.jpg| 1| A father-figure and two children outside their home doing yard work such as using a hoe on the grass and planting a tree .
1369162.jpg| 1| Two men are lying on a roof doing work , while two other men are assisting using a lift .
137453678.jpg| 2| A girl working with paint while an adult guides her on what to do .
137453681.jpg| 1| A group of children are working on a project in a large room .
1385492203.jpg| 0| A group of four young men and one young woman holding spray paint cans and smiling next to their artwork .
1393947190.jpg| 4| Wrinkled hands work on a hand loom .
1395107023.jpg| 2| A man in striped shirt standing in front of , and working on , audio equipment .
139719522.jpg| 0| A young boy with black hair and tie-dyed shirt and jeans and an older man balding with a long-sleeved dark shirt and jeans working on lawn equipment .
1398957709.jpg| 0| A man wears a black cape in the parking lot of a building that has artwork displayed on the exterior .
1403857072.jpg| 2| Two men sit at work computers and work at night .
140557878.jpg| 0| Five workers sitting on the side of a road eating lunch .
140770875.jpg| 0| An older gentleman working with a machine and shaving down a wooden object
140774394.jpg| 0| A man wearing a green shirt and an orange safety hat works on mechanical equipment inside a fenced area , while a group of people walk on a lawn behind him .
1409041007.jpg| 2| A man in glasses works behind a KitchenAid selling counter .
141066782.jpg| 0| A man works on a very large , intricate sand sculpture on a beach .
1411855204.jpg| 1| A young man with blond-hair works with multicolored wires while sitting on a stoop .
141203926.jpg| 3| A woman in a apron is working in a cafe .
1413647425.jpg| 2| Young children in a classroom working on an arts and crafts project .
1414454789.jpg| 3| A cooking staff working and preparing a meal .
1415960251.jpg| 0| Two men work on a metal roof in the sunlight , one man is wearing a white shirt and the other man is wearing a black shirt and holding a drill .
1418632004.jpg| 2| A nun is being searched at an airport by a female Department of Homeland worker .
14220927.jpg| 0| A worker begins to make renovations to the outside of a building .
142258955.jpg| 0| A man is working on the wheel area of a black mercedes while another man is standing and taking a picture of something that is in front of the car .
1424170200.jpg| 1| Hard hat workers are descending into cement walls .
1425529973.jpg| 1| A worker wearing work boots stands on some aquariums as he puts fish on a weighing scale .
14264287.jpg| 2| A young child working in the kitchen has powder all over his face .
1428349199.jpg| 1| Barefoot worker on chair laying out roofing for small garden enclosure .
143149186.jpg| 1| A worker in a white hard hat and yellow vest operates a yellow bulldozer .
143793054.jpg| 1| Two construction workers assist in the loading of a dump truck at an urban construction site .
1438769690.jpg| 3| A worker is in the cage at the top of the truck on a busy street .
1441148458.jpg| 0| Construction worker in the middle of doing his job working on a house .
1441477578.jpg| 1| A man is setting up a ladder to complete some ceiling work .
1442562321.jpg| 1| Small Children work their way together to unwrap their presents .
1447077067.jpg| 0| The man in the blue plaid shirt is working on a project .
1449163823.jpg| 0| A woman with black hair , wearing a blue shirt and orange vest working with some blue clay like material .
145097595.jpg| 0| Two workers are on a cherry-picker , one leaning out with a safety harness and the other smiling at the camera .
1452555387.jpg| 0| A hard working technician digs for a solution in a huge television console .
1453251773.jpg| 0| A woman wearing a sunhat and gloves sorts oranges , surrounded by flat containers of oranges resting on a lattice work structure suspended at waist level .
145645390.jpg| 2| Artwork on stairs and covering the wall .
1457898867.jpg| 1| Local African boy doing his daily work guiding the animals that are pulling a cart .
146479460.jpg| 1| A black man sits at a sewing machine on the sidewalk in front of a home , working on a project of some sort .
1472433625.jpg| 4| A worker walking down the street .
1478414349.jpg| 4| Five workers on ladders working on windows .
1478576516.jpg| 0| A group of workers begin to put up the metal frame of a future building .
1483574454.jpg| 0| Two asian children working on bicycles at a shop in front of their mother .
148441028.jpg| 0| Children are reading and working on schoolwork in a library setting .
1484711469.jpg| 0| A large work site with yellow railings and girders surrounds a worker in a blue shirt standing in the middle near a large pile of soil .
14868339.jpg| 0| Two workers at a train station are cleaning an elevator .
148774287.jpg| 0| A bald dark-skinned man in a purple tank top and jeans works with another man next to a blue bucket .
14887980.jpg| 1| Two women are at work along a balcony on the edge of a bamboo forest .
14919212.jpg| 4| A guy is working in construction in what looks like a swamp .
149806768.jpg| 0| Two women in white shirts and dark pants are working with cloth .
151021636.jpg| 0| Three chefs in uniform are working in an assembly line to prepare pastries .
151853042.jpg| 2| A worker making sure his machine is working correctly .
151853044.jpg| 4| A man working with a welding tool .
151853983.jpg| 1| A man in a checkered welder 's helmet is working in a workshop .
1519172943.jpg| 0| A man in a leather apron who appears to be a blacksmith holds up a glowing hot piece of iron which he is working on with the hammer in his right hand , the forge fire conspicuous in the background .
152027605.jpg| 0| Four people are working on blue legal sized forms at a brown conference table .
1521979323.jpg| 0| Four men working together trying to get a banner of Luciano on top of a building .
1522291943.jpg| 0| Three men are working on scaffolding on the side of a building .
15305247.jpg| 1| An artist hard at work to draw a comical portrait .
153299765.jpg| 0| A worker in a checkered shirt weighs out produce behind a stand that offers exotic foods .
1533470077.jpg| 0| A man in a blue work uniform is working on a blue bus on a lift .
153374075.jpg| 0| A construction worker working on a building .
153374889.jpg| 0| A group of construction workers working on a ramp that is closed .
1538278785.jpg| 1| A worker on scaffolding passing a tool to another worker in front of a brick structure .
154257460.jpg| 0| A man in a black shirt and jeans appears to be working on some piping system .
1542970798.jpg| 1| A man with work gloves and tool belt climbs the scaffolding next to an old yellow and white building .
154789578.jpg| 4| A man is working in a blood lab evaluating some specimens .
155490259.jpg| 3| a man working on a window of the old building .
15558523.jpg| 3| A worker in a blue shirt is standing in front of a business .
1561246336.jpg| 3| Two people working on a sculpture in an art studio .
156453471.jpg| 1| Two black men smiling and working on a piece of wood with a hammer .
1570065565.jpg| 0| Two chefs in white are working in the kitchen , while a woman sits at a nearby counter .
157492155.jpg| 0| A person in a hard hat is doing some work on a train track .
1595227547.jpg| 1| A boy and a man work on an upturned bicycle 's front wheel .
161456716.jpg| 0| A road worker is holding a stop sign , while his coworker is working on the road .
1614698671.jpg| 0| A picture of different kinds of donuts on display with a man wearing a bandanna and a red shirt working in the background .
16158623.jpg| 4| Two men are working together on a ladder .
162060045.jpg| 1| A worker wearing a bright vest and black clothes is picking up trash on the ground while people cross the street behind him .
1629337128.jpg| 1| Two men work together to interview a seated man in a large theater .
165173293.jpg| 1| Two women bent down working in the field with trees in the background .
167063396.jpg| 2| Men on a work site are looking at something to their right .
1674493314.jpg| 2| A woman getting her hands dirty while working with homemade pottery .
1681253990.jpg| 2| A woman working on a painting of a young woman on a wall with tan skin .
168482401.jpg| 3| Two men working on cutting back foliage in yard .
1687886596.jpg| 0| A guy sitting on a stool in a light tan shirt and darker tan shorts with glasses around his neck working on a project .
1693120546.jpg| 1| A woman works a project with thread in hand .
169450570.jpg| 2| A small group of team members work together in the office to complete their task .
170258785.jpg| 0| Two men working outside cleaning the street in their orange uniforms .
170273913.jpg| 4| A policeman is shown working a block party .
170473787.jpg| 0| A man in military camouflage is working a shepherd type dog in a grassy area while being observed by others in a parking lot in uniform .
170547828.jpg| 3| A fisherman works on his net while on shore .
170876266.jpg| 3| Three young women sit outside Jane after a workout .
17095593.jpg| 0| Two maintenance workers paint a bench outdoors .
171133671.jpg| 3| An older man with a dirty shirt is working in construction .
171486070.jpg| 4| A man working with a electric drill .
1716219111.jpg| 0| A woman working on a large machine which she appears to be using to make a blanket of some sort .
1717077532.jpg| 1| In a public area , a young girl in a pink dress sits next to an older woman who works a primitive device to make brown thread .
1720302155.jpg| 1| A man on a steep incline wearing a white shirt is working on a roof , with lots of debris all around .
1720431026.jpg| 0| There are construction workers on the corner of Hemlock and one is walking away .
1720835468.jpg| 4| A man pushing a work down the street .
17266976.jpg| 3| Shipyard workers are standing around .
173227546.jpg| 1| A man wearing a hard hat is working on a construction site atop a wall .
1732567333.jpg| 1| The FedEx driver listens to the workman in the green hard hat while the equipment to ship is being loaded .
1737441377.jpg| 3| Man and boy work their fruit cart .
173831485.jpg| 0| A man at working on carpentry in the old town of Shanghai , China .
1749201369.jpg| 0| Several men wearing helmets are working on a railway line .
1749235955.jpg| 0| A man in yellow construction safety gear is working on a large piece of metal .
1749702972.jpg| 3| A man is working a hotdog stand .
1750167036.jpg| 0| A group of six men work on a railroad track dressed in construction green jumpsuits .
175826463.jpg| 4| A group of people are working on a sand sculpture .
175973485.jpg| 2| The boys are having a night out from homework ; some are at the table while two are sleeping .
1763754548.jpg| 0| A man in jeans with white paint stains on them is standing on a short ladder working on the front of a store .
17641927.jpg| 1| A man at work is doing a small welding job with a soldering tool .
1775007639.jpg| 4| A lady siting on her porch working .
1775223211.jpg| 0| One woman is sitting under a loom , another woman is stooping beside it , and is working on the unfinished item .
1791491934.jpg| 0| An Asian man wearing a blue long-sleeve shirt and patterned pants is working with an old looking machine .
179214616.jpg| 0| A man , standing with his back to the camera , films another man , facing him , with white ash trees in the background , working in a notebook .
180150786.jpg| 4| A yellow construction vehicle working in the street .
180362495.jpg| 4| A hair designer working during renovations .
1804144683.jpg| 0| An artist is working on his very contemporary looking piece of art , and is focusing very intensely on the work at hand .
1807463181.jpg| 0| Two workers in orange vests are cleaning the windows outside while other look on .
182503906.jpg| 4| A person working in a market selling various items .
1827287777.jpg| 3| A man is working on his laptop at a desk and two men are talking behind him .
183437158.jpg| 0| A man with a black backpack is working through a wooded area .
183502317.jpg| 1| A man in an office serving cake , with his co-workers around .
183647966.jpg| 2| A male worker with his tool box is kneeling next to two women .
183975129.jpg| 4| A child having dental work done .
184477778.jpg| 0| The back-view of a group of people looking at fireworks .
1855985590.jpg| 4| An older man works his station by the boat dock .
1858123511.jpg| 0| Asian workers , attempting to clean up piles of rubble .
18638572.jpg| 1| One little boy working hard in his martial arts class .
1869615544.jpg| 2| A group of volunteers working with children to do a toy drive outside of a toys r us for children in need .
1872000955.jpg| 4| Africans working in a mine digging .
1873655403.jpg| 0| 3 safety jacket clad Construction workers appear to be poking something interesting with their shovels .
1873666741.jpg| 0| A man who is smoking , wearing a yellow safety vest , is doing landscape work .
1873704867.jpg| 1| Three men in safety vests work along a roadside .
1874497944.jpg| 0| Two workers in work attire ( windbreakers and vests ) walking along the edge of a road .
1874530310.jpg| 0| Three construction workers are digging a whole next to a wall in a field .
1877018139.jpg| 1| Two construction workers wait for materials to be raised up to them .
1877161207.jpg| 3| Workers working in the mud and sand .
187780595.jpg| 4| Two men doing a construction works
1879693922.jpg| 3| Two men are filling out paperwork for a man in a red shirt who is behind the counter .
189038731.jpg| 1| Two workers in their hard hats and safety vests stand near a yellow block of concrete .
1897067588.jpg| 3| A woman is welding metal at a work table .
19023618.jpg| 1| A worker is driving a piece of green colored machinery on a city sidewalk .
1916798494.jpg| 2| Many youth are gathered in a computer lab working at computers while wearing headphones .
1925086298.jpg| 4| Two Women working on the computer in the library .
1925838315.jpg| 0| A guy with a red shirt and black apron on working standing with his hand in a shopping cart .
1932532591.jpg| 0| Two men in chartreuse jackets and dungarees are working on the roof of a house .
193596215.jpg| 2| A man is walking down the sidewalk near construction work .
194166920.jpg| 1| A man in a green shirt is sitting next to a man in a white shirt working on a computer .
