image_name| comment_number| comment
3402502423.jpg| 1| A man in a red shirt is rolling up the sleeve of a jacket that is lying on his cars front seat .
340425915.jpg| 1| A black and brown dog wearing a red coat rolls in the snow .
3413669228.jpg| 4| The girl takes a break from rollerblading .
3414734842.jpg| 4| Three friends on a stroll in the forest .
3415589320.jpg| 0| Two dogs are playing and rolling around with each other in the grass .
3424861178.jpg| 3| Policemen riding horses while patrolling the streets .
3426724811.jpg| 0| several men in biohazard suits carrying a human looking doll on a rolling bed
3432495898.jpg| 0| A tan dog is rolling on his back on some asphalt with a bike and a scooter in the background .
3446122073.jpg| 0| A group of people , including a man and woman with strollers , are standing next to Charging Bull , sometimes called the Wall Street Bull , a large bronze sculpture located in Bowling Green Park near Wall Street in Manhattan , New York City .
345412253.jpg| 3| A young man in a brown jacket pushes a rolling food cart .
3454728570.jpg| 0| A crowded carousel surrounded by parents with baby strollers sitting on a bench .
3455964125.jpg| 3| A woman is waving to the crowd as she rides a roller coaster .
3460551728.jpg| 1| A dog walks across the sand next to a river in front of rolling hills .
3465396606.jpg| 0| A blond woman wearing a white top and black bottoms pushes a black stroller while a brunette male wearing a gray t-shirt and white shorts walks a brown dog .
3465703153.jpg| 0| A woman with glasses wearing a green knitted hat pushes a red baby stroller down an unpaved pathway .
3468023754.jpg| 1| Four children look through rolled magazines like telescopes .
3471841031.jpg| 0| A woman leaning over to help a child in a stroller with a man laying down on a park bench and another sitting on a bench .
3475751336.jpg| 1| a girl stands on the grass holding a rolling box wearing a white lawn hat and sunglasses .
3477369101.jpg| 0| The black and brown dog is rolling in the grass .
348380010.jpg| 0| A brown dog with a tennis ball its mouth rolling on its back on a grassy surface .
3487015378.jpg| 0| A woman dressed in green is rollerskating outside at an event .
3495224860.jpg| 0| A young lady wearing a dark blue shirt and shorts that have a scroll-like black and white pattern shares her excitement with several friends while a crowd of people are gathered in the background .
3497805015.jpg| 0| An older woman with a stroller and a red jacket wrapped around her waist looking at an amusement park ride .
3500136982.jpg| 0| A group of rollerbladers is lined up on the street .
3500505549.jpg| 2| A person is rollerblading on a railing by a sidewalk with people .
350529848.jpg| 1| Two dogs playing on a beach with a red ball while waves roll in .
3506454111.jpg| 3| A woman , wearing jeans , rolls a bowling ball down the lane .
3508522093.jpg| 2| Young boy in green shirt rolling on a cart into a pile of leaves .
3520241606.jpg| 0| A person in a blue shirt and tan shorts getting ready to roll a bowling ball down the alley .
3532412342.jpg| 2| A child rolls around in a large tire .
3533452777.jpg| 4| Man in a silver suit sits on a trolley .
3539552261.jpg| 1| Spectators are standing near a road in rolling vineyards .
3540241710.jpg| 0| A man , low to the ground , rolls down a ramp on a skateboard .
3548358879.jpg| 0| Asian boy with his sleeves rolled up is standing in front of what appears to be a game board with circular pieces .
3551003620.jpg| 0| A person is performing a rollerblading trick as other people skate and run nearby .
3555376013.jpg| 0| Woman with a red helmet and red and black stockings playing roller derby .
3556181622.jpg| 0| A female rollerblader in a black , red and white uniform and red helmet with a star on it , and MC squared tattoo on her upper right arm , competes with her team .
3559327762.jpg| 0| Large group of people in a building looking at a large mostly white color ball being rolled .
3560891822.jpg| 4| A skateboard rolling down a ramp .
3567358622.jpg| 2| Two players collide during a recent roller derby match .
3572548523.jpg| 2| A couple strolls arm and arm and hand in hand down a city sidewalk .
3578477508.jpg| 1| A man is roller-skating down the wall next to some white steps .
3582914739.jpg| 2| A woman wearing a helmet is in a rollerskating competition .
3585487286.jpg| 0| Two white and brown dogs barking on the shoreline while waves roll in behind them .
3586239953.jpg| 1| Two young boys roll down a grassy hill .
3593206558.jpg| 0| The young man strolls on the rooftop as a kite flies in the cloudy distance .
3606355203.jpg| 0| A man pushing a baby stroller at the beach , a woman with a little boy ahead .
3607752136.jpg| 1| A group of people , many with backpacks , walk down a corridor carrying rolling luggage .
3609061538.jpg| 1| A group of passengers relax and enjoy a trolley ride through town
3609448700.jpg| 0| The number eight rollerskater is taking the lead and pulling away from her black and red dressed opponents .
3611124440.jpg| 0| A number of people are on a moving roller coaster and their reflections are seen in a body of water below them .
3613175012.jpg| 4| A group of bohemians stroll down the street , one with a shopping cart .
3625049113.jpg| 1| A rollerblader is performing a trick on a ramp .
3625537155.jpg| 0| A lady in a white shirt with a baby in one hand , and a stroller in the other hand , walks through an outdoor kiosk .
3638459638.jpg| 3| Someone with a wave rolling over them .
3642088668.jpg| 3| An airline stewardess is carefully rolling her drink cart down the aisle .
3653462288.jpg| 4| A boy rollerskating in the street .
365584746.jpg| 4| An elderly woman pushing a stroller
3665549027.jpg| 1| A brown dog is rolling over in the grass while a white and brown dog stands next to it .
3676561090.jpg| 0| The yellow dog wears a blue dog tag and rolls on a green field .
367925122.jpg| 4| A cute toddler girl waits in her stroller .
3679407035.jpg| 4| A man is wearing a blue shirt that is rolled up above his abdomen .
3681127787.jpg| 4| The old man is taking a stroll .
3690159129.jpg| 3| A rollerblader pauses at the top of a skate ramp .
3692836015.jpg| 1| Several people dressed in like jerseys roll an old cannon during a competition .
3697003897.jpg| 3| A rollerblader is sliding down a railing .
3715669736.jpg| 1| Two girls ( one dressed in blue , and one dressed in pink ) are racing one another on rollerskates .
3732728142.jpg| 1| A baby in a red hat sitting in a stroller is holding a doll .
3754150327.jpg| 4| Two men in rolling down a winter bank .
3761138998.jpg| 0| A blue-shirted skateboarder grinds on a rail and another flips his board in the air while other people roll in the background of the park .
3776839227.jpg| 0| A middle-age couple are in a beautiful open field with rolling hills on a sunny day preparing to Hang Glide .
3821671043.jpg| 0| A guy with a light blue shirt , blue jeans , and rollerblades is grinding on a curved surface .
3821678223.jpg| 0| Four children at a skate park , one in rollerblades and three riding scooters .
3822469102.jpg| 0| A rollerblader in a red hat is grinding on an elevated metal pole .
3830027232.jpg| 0| Two people standing behind a Sonoma display and a woman with a stroller on the other side .
383027310.jpg| 2| A smiling man in a dark shirt is playing on a ' Guitar Hero ' controller .
384104693.jpg| 4| Woman in a scarf strolls along a sidewalk .
3858228351.jpg| 1| A para-glider coming down to dry fields on gently rolling hills , near a lake .
3859858842.jpg| 1| A slender man wearing rolled pants and a striped white and blue shirt walks on sand .
3864134621.jpg| 0| Boy , of age approximately 7 years old , down on one knee wearing rollerblades and a protective helmet .
3887721909.jpg| 0| Two ladies in matching dresses and shoes , both wearing straw hats pulled down over their faces , are napping on a bench next to a rolling suitcase .
3902721920.jpg| 0| A man and a woman , both pushing strollers with children in them , are stopped and looking at each other .
3908271774.jpg| 1| A man and women kissing on a yellow trolley car .
3927396708.jpg| 0| A woman in a green apron and rolled-up sleeves is handling the underside of one in a row of furry animals .
394335828.jpg| 4| A man wearing a flashlight on his head has his hand in a rolling case with wires .
3955648022.jpg| 4| A boy with a shovel riding a bike and a woman rolling a basket with a dolly .
3957074517.jpg| 4| People strolling or standing on a street .
396129701.jpg| 4| A cowboy strolling in the street .
3965762928.jpg| 0| An African American Male with a black top with the sleeves rolled up holding a white cup with his right hand .
397725001.jpg| 0| The people on the balcony are controlling the man in the white shorts like a puppet .
3981584370.jpg| 0| A woman in a black uniform and black helmet on skates is competing in a roller derby .
3984282687.jpg| 0| Two ladies with a stroller and a group of men are walking in front of a wall with graffiti .
399226846.jpg| 1| The guy in the yellow jacket is patrolling the road with fast moving cars at night .
3998011916.jpg| 0| A woman in a red jacket is leaning on a baby stroller while talking with another woman at a train station .
39999879.jpg| 4| Police officers patrolling a beach .
4005120966.jpg| 0| A balding man wearing a dark , blue uniform is rolling a yellow stretcher containing a large , blue duffel bag .
4005459199.jpg| 1| An elderly man sits in silver vehicle with window rolled down .
4019373509.jpg| 1| A little girl is watching a little boy roll a ball on the pavement .
403844559.jpg| 1| Three children rolling down a green hillside towards a parking lot where a woman is getting into a white car .
4041300706.jpg| 1| A shirtless man painting the ceiling with a long paint roller .
40425624.jpg| 0| A man in a short-sleeved white shirt is standing beside a man in a long-sleeved white shirt with the sleeves rolled up .
4043081763.jpg| 0| Male conductor of a train or trolley looking out the window of the train or trolley .
4052526123.jpg| 0| Two air traffic controllers are sitting in the control tower overlooking the runway .
4074903180.jpg| 0| A man in a jacket and jeans and a woman in a green coat are reading books on a bench with a baby stroller parked next to it .
4097554482.jpg| 1| An older businessman takes a lonely stroll down a city street .
4106207160.jpg| 0| A mom happily pushes her two children in a stroller down a brick lined path in the park .
4106379547.jpg| 0| A young boy wearing a yellow shirt and green pants pushing a baby stroller in front of houses with red and white roofs , red doors , white railing and red floor planks .
4120624922.jpg| 0| A man wearing only blue jeans and a cap is using a paint roller on a light blue floor .
4125992235.jpg| 1| A person strolling through an orange tinted woods with a dog .
4151679198.jpg| 0| A group of women wearing rolling skates and knee pads stand around in a huddle .
4152801453.jpg| 1| Pedestrians strolling about a plaza in front of a large building .
4174409888.jpg| 0| A woman in heels carrying a bag and a man with a black hat rolling a bag on a wet tarmac .
4174532000.jpg| 2| A rollerblader performs a toe grab off a curved wall .
4179982279.jpg| 3| People rollerskating on an ice rink .
4202255358.jpg| 1| A woman wearing a turquoise sweatshirt is standing in front of a trolley .
423066487.jpg| 0| A man in a butchers uniform standing next to two large rolls of beef .
4234670797.jpg| 1| A small child trying to roll a ball to hit another ball in a bowling alley .
4237212038.jpg| 0| Woman in black coat , jeans and gray hat , with baby stroller , shopping for party decorations at a store .
4255627436.jpg| 1| A red hatted man is controlling a red machine to clear out the road , with blue skies and green tress behind him .
425977726.jpg| 1| Someone dressed in a gray top looks on as the bowl rolls down the lane on lane eight at the colorful bowling alley .
4274035185.jpg| 1| A man wearing a train conductor 's uniform standing inside an old train or trolley car .
4274782458.jpg| 1| Bearded old man has discussion on trolley .
429283612.jpg| 0| Two people are standing on a hill overlooking rolling green grass .
4299131799.jpg| 4| Old couple , out taking a stroll , One uses a cain .
4311708229.jpg| 1| A trolley car is passing through a city .
4320494335.jpg| 0| A man and woman stroll down a sidewalk pushing a baby carriage in a residential area .
433720959.jpg| 2| A man with shirtsleeves rolled up gestures while speaking .
4351142771.jpg| 2| Two kids are rolling around a pool in big plastic balls
4354222843.jpg| 0| A male baker dressed from head to toe in white cotton clothing rolls out a giant sheet of dough .
4374241200.jpg| 1| A tall man in navy track pants strolls down a sidewalk past a large , orange ' Reduce Speed ' sign .
4384686805.jpg| 1| A man with rolled-up blue jeans stares off into the distance watching the sun rise .
4397975773.jpg| 1| A young girl dressed in nice springtime clothes is strolling on a lawn by a man-made creek and pond .
440190907.jpg| 1| People strolling through an indoor market .
4408414886.jpg| 0| Here is a picture of a woman and her husband and child taking a stroll by the parking lot .
4409805003.jpg| 2| A man in a striped shirt with a rolled up sleeve is working on his laptop
4412560590.jpg| 0| Two rock and roll performers on stage playing their guitars performing in front of a crowd .
4433206636.jpg| 0| A man with long hair is vacuuming a carpet that is laid over a wood floor and is partially rolled up .
4433557295.jpg| 0| A referee on rollerskates and wearing knee pads and a helmet is sweeping the floor of a wooden basketball court in front of a crowd .
4436916291.jpg| 4| A man strolls along a palm treed walkway .
4442488355.jpg| 0| A woman wearing black pants and a black shirt pushing a stroller down the street .
4447269544.jpg| 0| A woman with dreadlocks and an olive green bag sits on red brick while checking the baby stroller .
4448064784.jpg| 0| A tall black man in yellow pants shows his rollerskating skills , while pedestrians watch .
4448469248.jpg| 1| A redheaded female and brown-haired male wearing glasses stroll together .
4450184997.jpg| 3| A blond woman in heels strolls past the cemetery .
4450422489.jpg| 1| A man in a gray jacket and black knit hat walking in front of a gray roll-up garage door .
4450537155.jpg| 2| A woman in a purple top and jeans talking to a woman in a roller derby .
4451329664.jpg| 0| A woman is dressed for roller derby in pads , shorts and fishnet tights .
4451567464.jpg| 1| A man and a woman standing by a building next to some trolley tracks .
4469878736.jpg| 4| A young woman walking by a rolling door .
4477151562.jpg| 3| Pedestrians strolling along a brick walkway tween high buildings .
4478989677.jpg| 0| Girl in pink tank top and blue jeans rolling white paint outside
4481546417.jpg| 4| Group of people strolling down the street .
4483752409.jpg| 1| Three ladies enjoying a stroll on a cold , foggy day .
4485484248.jpg| 3| A woman with a laundry basket in a portable cart takes a stroll .
4486440297.jpg| 3| A woman in a skirt strolls past a man wearing a business suit .
44953144.jpg| 4| A man controlling a horse drawn carriage
449669516.jpg| 0| A child in green jacket , red mittens , blue jeans , yellow boots and black hat sits in a blue stroller .
4502378197.jpg| 4| A man trying to cart some items in a rolling container .
4504942754.jpg| 1| A very tall woman in a very short orange dress strolls down an empty sidewalk .
451081733.jpg| 0| The man is wearing rolled up blue jeans and holding a video camera on a stone beach .
4514082925.jpg| 3| Yellow Trolley as it 's making its rounds .
4525286529.jpg| 0| Various sophisticated-looking urban types stroll down the avenue of a vintage-looking area , complete with street lamps .
4527840050.jpg| 0| Three ladies loaded down with bags and a stroller make their way down a crowded sidewalk .
4534889800.jpg| 0| A man in an apron sits at a table in front of a restaurant , while another man crosses the street with a purple gift bag and rolling luggage .
454333157.jpg| 2| A diner enjoying a roll at a restaurant .
4558696075.jpg| 2| The trolley carrying people is pictured in front of a building .
4558719211.jpg| 1| Two people stroll in front of a Vietnamese restaurant that has graffiti painted on it .
4575380951.jpg| 0| A lady in a convent rolling dough in the kitchen .
45756278.jpg| 0| In front of a building , a man with rolled-up sleeves stands between two others wearing striped vests .
4578856261.jpg| 3| A man strolls down a sidewalk , holding an orange bag .
4580064094.jpg| 0| A man reaches through a window at a restaurant to pick up a half of a submarine sandwich roll .
458183774.jpg| 0| A large tan dog is rolling around on its back in a yard of grass .
4588444998.jpg| 2| A black woman rolls out a sheet of dough in a messy kitchen .
4589066890.jpg| 0| A man pushes a baby stroller , with a woman dressed in yellow follows behind , while two children , once wearing sunglasses , the other with a mohawk , walk down the road .
4592281294.jpg| 2| The lady in blue is pushing the gray and red baby stroller .
4606714393.jpg| 1| People out for a stroll on a picturesque European city street with a green rotunda in the background  .
4608463080.jpg| 1| A woman is pushing a baby stroller on a clean , well kept street .
4609351402.jpg| 0| A woman with short , wavy hair and a black coat is standing outside a fancy door with scrolling next to an elevator .
4611964104.jpg| 0| Pedestrian stroll along the paved walkway between bright yellow and red shops in the marketplace of city streets .
4622908706.jpg| 0| A person with long hair pushes a young girl with pigtails in a stroller .
4622915732.jpg| 1| Two attractive women stroll down a crowded brick street at night .
4631421666.jpg| 1| A man on rollerblades , dressed as a bear with clothes on , holds the bear head , while waiting behind a group of people .
4640634694.jpg| 2| A adult female with dark hair and sunglasses holding something , she has a scrolling tattoo on her arm .
4644628615.jpg| 1| A man is sitting on a bench talking on a mobile phone while other people stroll across a walkway above him .
4648521440.jpg| 0| A man and a woman are seated , holding reading materials , while he looks into the camera and she looks down into her partly rolled-up magazine .
4649865586.jpg| 1| Cute little girl , with a pink hair bow her orange stroller .
4649891200.jpg| 0| A man with a camera and another with a stroller stop and lean against the rails of an elevated walkway .
4652396489.jpg| 0| Two boys are smiling while a woman is behind them in a stroller .
"4654498293.jpg| 0| A gray patrol SUV with orange lights and the word "" Brigada "" contains a man or woman sitting in it and is parked outside an iron fence with a large gold lock and chain ", with a dark-skinned woman inside the fence , holding a rolled up red flag , with an emblem on it .
4656147510.jpg| 1| A person wearing rollerblades is skating along side a railing .
4656148446.jpg| 1| A man is sitting on a triangular shaped bench wearing rollerskates .
4665446842.jpg| 0| A group of girls are standing with rollerblades on while a man is lifting his leg next to them .
4666848560.jpg| 0| Blue , red , yellow , and white are the dominant colors of a picture of two police vehicles outside of what looks like a smoke roll playing vehicle , a motorcycle in between the two cars with 6 people in the picture .
4681325639.jpg| 3| Asian man walking on a beach with pant legs rolled up .
4681354399.jpg| 0| Trolleys , buses and cars are stopped on the street while pedestrians while along the sidewalk .
4682437142.jpg| 1| The older lady and dark-haired girl are making crafts out of paper plates and toilet paper rolls .
4684253615.jpg| 0| A european city street scene with trolley tracks on the roadway and a cathedral clock tower in the background .
4687713681.jpg| 2| A young woman in athletic gear is taking her bike on a stroll near a lake .
4691217656.jpg| 3| A smiling young couple are strolling arm in arm down a Paris street .
4694601786.jpg| 1| Two men taking a stroll along a building , during a beautiful sunny day .
4696526667.jpg| 0| Women are playing at a roller derby and one in yellow has fallen .
4696548185.jpg| 1| Two teams of women in orange and yellow compete on rollerskates while a crowd watches .
4697137626.jpg| 0| Two ladies in orange roller derby uniforms block another in a yellow uniform .
4697182982.jpg| 0| A group of women , all of whom are wearing orange or yellow shirts , are skating on rollerskates .
4700435315.jpg| 0| Someone wearing a skimpy costume rollerskates around a ring .
4700437495.jpg| 0| a lady is wearing all black with a whistle in the middle of rollerskaters .
4701188650.jpg| 3| Man with rolling suitcase sitting on bench looking to his right .
4701941908.jpg| 0| A young blond girl is eating her frozen snack while sitting on a bench next to a red stroller .
4709819574.jpg| 1| Harnessed Asian child lying on ground in front of stroller .
4710230329.jpg| 1| An blue electric trolley turns a corner on a busy Asian street .
4710990069.jpg| 3| Lady in black jacket and red shoes taking a stroll
4716333601.jpg| 4| A man and a woman out for a stroll .
4718154276.jpg| 0| A woman with a baby stroller selects a small beach ball from a rack outside of a store .
4725695244.jpg| 0| Two ladies are standing in the store and talking , and one is holding the stroller with a baby .
4726714032.jpg| 1| Nicely dressed woman pose for pictures or stand and talk , while passersby stroll by a fountain .
4739130060.jpg| 3| Passengers getting on , and off a trolley .
"4750415524.jpg| 0| Three men stroll down the street beneath a large red awning that says "" Arrivo "" ."
4751250311.jpg| 0| A man strolling down the sidewalk wearing a red shirt and jeans .
4754077178.jpg| 0| A woman with gray hair is sitting next to a little boy who is holding onto the handles of a stroller and a little girl who is sitting in a different stroller .
4755693778.jpg| 0| A baby in an orange t-shirt holds onto his stroller like a steering wheel .
475594565.jpg| 0| This young lady with her white polka dot blouse is about to take a stroll on her bike in a foreign country .
4758449727.jpg| 1| A classic propeller-driven airplane flies in the distance as two men play with a remote-controlled toy airplane in a field in the foreground .
4758483073.jpg| 3| A man holding a remote controlled airplane .
4758561233.jpg| 1| A man in a blue windbreaker is playing with his yellow remote controlled airplane .
4758626595.jpg| 3| Several men are tinkering with radio controlled items .
4760594001.jpg| 1| Two females ( in blue and bright orange shirt respectively ) taking a stroll .
4764082600.jpg| 3| A man operating a trolley car .
4769384377.jpg| 2| Women taking a stroll while using their cellular phones on the streets .
4772317885.jpg| 0| A man in a black tank top and rolled up jeans wearing brown shoes is sitting on a bench resting his feet on a skateboard .
4778036926.jpg| 0| A blond girl about 11 with a purple shirt and checkered green and white and black knee high shorts playing a game that requires her to roll an object up and down on a string .
4781019036.jpg| 4| Six people riding a roller coaster .
4781282778.jpg| 4| People strolling outside near a brick building .
4781897636.jpg| 0| A woman in bright red lipstick and a black and white polka-dot bare-shouldered top strolls with other pedestrians past the booths in an open-air market .
478200744.jpg| 0| An aged woman cradles her hand-rolled cigarette as she smokes .
4782112001.jpg| 2| A young attractive lady taking a stroll down the city street .
4782269293.jpg| 2| Police officer patrolling on a bicycle .
4782588680.jpg| 4| People stroll down a sidewalk of a city street .
47951611.jpg| 2| There are two coast guard men patrolling the water in their craft .
4798886213.jpg| 3| A woman wearing a hooded jacket over a striped sweater is rollerskating with other people .
4799239390.jpg| 0| A man in a blue shirt with a duffel bag and a woman in a yellow jacket pushing a baby stroller crossing a city street .
4803925182.jpg| 3| An older man sitting on the ground rolling a cigarette .
4811949930.jpg| 2| A man in cargo shorts pulling two rolling cases .
4813023306.jpg| 1| A view of people on a sidewalk , with a woman in a leopard dress and another woman pushing a stroller with a child in the foreground .
4818210621.jpg| 4| A woman rolling pastry in her fish shop .
4818306972.jpg| 2| Men strolling a brick-paved , brightly lit , business district .
4818774874.jpg| 0| a boy wearing jean shorts , and a black and blue shirt , reading a book , sits on a rolling device up against a wall that says book fair , while other people stand around .
4819160095.jpg| 0| A quartet of young people , possibly Spanish or Portuguese , wearing red bandannas , while one conspicuously does not , stroll down a boulevard .
482047956.jpg| 1| Three young girls posing while riding a roller coaster .
4821901289.jpg| 1| Two women wearing tiger print jumpsuits and sandals stroll down the street .
4821904419.jpg| 0| A lady in a black shirt is standing in a crowd with a rolled up piece of paper in her hands .
4822105350.jpg| 2| A woman with a rolling luggage waits on a sidewalk .
4822443231.jpg| 1| A man wearing orange overalls uses a roller to cover graffiti .
4822527778.jpg| 1| Middle-aged women in short skirts and heels stroll down a sidewalk .
4823222029.jpg| 2| a couple taking a stroll in the park .
