image_name| comment_number| comment
1065831604.jpg| 4| Several bike riders compete in a competition .
1080230428.jpg| 3| Volleyball players compete on a sunny day at the beach .
123101580.jpg| 4| Two female soccer players compete for the ball .
12904242.jpg| 1| There are three swimmers from the same team getting ready to compete .
162759228.jpg| 1| Two teen girls compete against one another in a soccer match .
1797436026.jpg| 1| Two hockey players stand and compete for the puck while a goalie crouches in front of the net .
18638574.jpg| 1| Two young boys dressed in white karate uniforms compete with each other while a man looks on from the background .
1865794063.jpg| 3| Young children compete in a co-ed soccer game .
19469520.jpg| 0| Competitors getting ready to compete in a grand opening event hosted by the chief executive
2185734339.jpg| 2| A young female gymnast wearing purple competes on the balance beam .
2240975290.jpg| 1| Small children wearing matching uniforms compete in a soccer match .
229574079.jpg| 4| Men compete in an eating contest .
241347271.jpg| 4| Two football teams compete .
2474480672.jpg| 0| Two men wearing colorful sweaters about to wrestle each other in a game that compete with strength and the ability to be quick and stronger than the other person .
2522995166.jpg| 4| Two women compete in a martial arts contest .
2644277889.jpg| 4| Two women compete in a kick-boxing match .
2664027527.jpg| 1| A man , trying to hold on , as he competes in a rodeo on horse back .
2701892321.jpg| 0| Two martial art athletes compete in front of an audience , carefully monitored by the judge .
2864634088.jpg| 3| A line of men on bicycles compete in a race
289262516.jpg| 1| Two boxers compete while spectators watch tensely from the background .
2924305507.jpg| 4| A runner in a black and blue uniform competes in a race .
2924307251.jpg| 4| A runner competes in a marathon .
2925677810.jpg| 4| Male gymnast practice and compete outside .
2939371251.jpg| 3| Two teams compete in football .
2947172114.jpg| 4| Two boys ' football teams compete on the field .
2959737718.jpg| 4| Two soccer teams compete .
2976537455.jpg| 4| Two hockey players compete on the ice .
2986620935.jpg| 0| Two off-road bikers compete on a dirt course on a sunny day .
2993388841.jpg| 4| Two teams compete in a basketball game .
3211581957.jpg| 1| A horse jumps a fence in a show jumping competeition .
3249125548.jpg| 1| Cyclists compete in a race that takes them on a dirt mountain road .
3262386960.jpg| 0| Two fencers in white suits and black masks compete in a gymnasium setting .
3281078518.jpg| 4| Five white puppies and several chickens compete for food
3286045254.jpg| 4| Two basketball teams compete .
3324957208.jpg| 2| Some dancers in kilts compete in front of a judge wearing black .
3354489242.jpg| 3| Two hockey teams compete .
3389995545.jpg| 1| Two men 's soccer teams compete for a ball under the lights at a night game .
3556181622.jpg| 0| A female rollerblader in a black , red and white uniform and red helmet with a star on it , and MC squared tattoo on her upper right arm , competes with her team .
3584907869.jpg| 3| Two volleyball players compete in a sand tournament
3606084228.jpg| 4| A dirt biker competes while onlookers watch .
3607405494.jpg| 1| Three dogs leaping up in the air as they compete in a race .
3681056426.jpg| 2| Three horses and their jockeys compete in a race .
3725814794.jpg| 4| Two men compete in a karate tournament .
3727740053.jpg| 4| Two martial artists compete in a match .
3735158583.jpg| 2| A woman competes in an equestrian competition atop a white horse .
3955811518.jpg| 3| Two martial artists compete before a referee and onlookers .
4075695875.jpg| 3| Swimmers compete in the butterfly .
4383269886.jpg| 3| Runners compete on a cold day in the city .
4404273714.jpg| 4| Two women compete in a hurdle event .
4435179084.jpg| 4| A tattooed runner competes in a road race .
4451329664.jpg| 2| A woman in safety gear gets ready to compete athletically .
4688805626.jpg| 1| A yellow t-shirt soccer team competes against a gray t-shirt team in a match played on a stone tile city area .
4696008531.jpg| 1| A man in a kilt competes in an sporting contest at a Highland Games event .
4696548185.jpg| 1| Two teams of women in orange and yellow compete on rollerskates while a crowd watches .
4700437495.jpg| 3| Women compete in a game of roller derby .
4773988789.jpg| 3| Runners compete in a marathon .
4913689385.jpg| 1| Several runners compete in a road race .
4930690081.jpg| 1| Two men on horses compete to see who can rope the calf first .
4966417717.jpg| 0| Young boy and old balding man in orange shirt compete in a race .
5423080316.jpg| 3| A man who bears the number 53 , competes in a race in the snow .
55442802.jpg| 3| Young children compete in outdoor sports .
5669382831.jpg| 2| A young Asian woman competes in an ice skating competition .
5840232264.jpg| 1| An amputee competes for the gold medal in volleyball in the special olympics .
5949201274.jpg| 2| A young acrobat in flame design costume waits for her turn to compete .
5949695639.jpg| 3| Four young girls compete in team gymnastics .
5968404576.jpg| 1| 2 females , 1 from germany and 1 from China , compete in a wrestling match on a mat .
6157574915.jpg| 3| Two girls compete over the ball while playing lacrosse .
6179361394.jpg| 3| Bikers compete in a long winded endurance test .
6201295346.jpg| 0| Two professional soccer players , one dressed in red top and black shorts , the other in blue top and white shorts , compete for control of ball .
6234467033.jpg| 3| Two men , one in blue and one in red , compete in a boxing match .
6235436806.jpg| 3| 2 women compete in a karate tournament .
6275000713.jpg| 3| Kids compete to gain possession of the soccer ball .
6282161290.jpg| 2| A man in a blue uniform on rollerskates and a man in camouflage on skates compete in a ring .
6293812868.jpg| 0| Young women compete in a relay event at a swimming pool while teammates cheer or anxiously await their turns .
6302275277.jpg| 4| Two fencers compete in match .
6302283809.jpg| 4| Fencers compete for a point .
6310645834.jpg| 2| A silver and red race car competes in a race while a crowd of people look on .
6320815199.jpg| 3| A Kenyan woman competes in a race .
6387209003.jpg| 4| Young people compete in amateur wrestling .
6454325817.jpg| 2| A female runner in a white jersey competes in a race .
6502487823.jpg| 4| Two kickboxers compete in front of a live audience .
654130822.jpg| 3| A young girl in her swimsuit is getting ready to compete .
6700129137.jpg| 3| A crowd watches two traditionally dressed Asian woman compete in an archery contest .
6796767853.jpg| 2| A man in blue competes against a man in white during a taekwondo match .
6800484706.jpg| 1| Eight go kart racers speed around the curves at fast paced speeds as they all race of the same goal of finishing first on their mind as the compete in a race .
6858312644.jpg| 2| A young person competes for the snowboarding title in their town .
6859510611.jpg| 0| Two young children in black clothing and padding perform a martial arts match where they compete against the other .
6889203488.jpg| 2| Young athletes compete in a soccer game in an attempt to block a goal .
6899247616.jpg| 0| A woman , wearing sunglasses , a red athletic top , and running shorts competes in a marathon .
6929271699.jpg| 3| Two young , male soccer players compete for the ball on a wet field .
6950137939.jpg| 2| Two teams compete in a game of football and are hurrying to catch the ball midair .
7006590104.jpg| 0| Two professional soccer players compete in a stadium on AstroTurf during a soccer match , and one player is controlling the ball while the other is running after him trying to defend it .
7096517911.jpg| 4| Two young men compete in an informal basketball game .
7099368287.jpg| 1| Two football players compete for the ball while another teammate looks on .
7100199765.jpg| 3| Two young soccer players compete for the ball .
7102120965.jpg| 2| Two people compete in a wheelchair race on a city street .
7148403727.jpg| 4| Several young men compete in the 1 meter puddle hurdle .
7150684289.jpg| 0| Two soccer players wait to compete on an outdoor field in front of a crowd of people watching in the stands in the background .
7236831126.jpg| 3| A woman in a red shirt competes in an endurance sport .
7239362178.jpg| 1| Two women compete in a marathon , while a little boy competes close behind them .
7422429952.jpg| 0| Two people wearing protective clothing compete at a fencing competition .
7433123648.jpg| 2| Two cyclists in blue uniforms compete against each other down the bicycle course .
7670346550.jpg| 4| Two competitors compete at a martial arts tournament .
7700080224.jpg| 1| Women compete in a volleyball match in the London 2012 Olympics .
7711590378.jpg| 2| Two women , one of them being from team Great Britain compete at the 2012 London Olympic games .
7725132206.jpg| 3| Women beach volleyball teams compete during London Olympics .
7745225040.jpg| 0| Two archers compete , one wearing an orange shirt and another wearing a red shirt .
7808252542.jpg| 1| Teenage girls from different high schools compete in a race on a well-maintained field .
7820686892.jpg| 3| Two soccer player are head to head trying to compete for the ball .
7847188372.jpg| 4| Three athletes compete on 3 wheeled conveyances .
7958174552.jpg| 4| Two members of a wheelchair basketball team compete in the tip off .
8036608675.jpg| 3| Three runners compete in a race .
8038855203.jpg| 4| Two young people compete in a game of ping-pong .
8111204604.jpg| 0| Young women in sports uniforms , short-sleeved shirts and shorts , compete on a green field .
8154670501.jpg| 0| Two men , one in red and one in black , compete in a marathon followed by a motorcyclists and a third competitor .
8159685070.jpg| 1| A group of more than a dozen bike riders competes in a close race .
8189395281.jpg| 3| A woman in fishnet stockings competes in a roller derby .
8239100625.jpg| 4| three men compete in a skateboard race .
8243477528.jpg| 2| A group of long-distance runners compete in a competition .
