image_name| comment_number| comment
10010052.jpg| 0| A girl is on rollerskates talking on her cellphone standing in a parking lot .
1001896054.jpg| 3| A man in a tractor wearing headphones driving down a paved street .
1027149103.jpg| 2| A man wearing a yellow t-shirt is shouting into a microphone while an audience is listening .
1029737941.jpg| 0| Boy in brown shirt with headphones on sits on woman 's shoulders in a crowd .
1030041880.jpg| 1| A red-haired woman in a white top and green and white skirt is singing into a microphone .
1045124251.jpg| 0| a blond-haired man with glasses and a blank tank top is sitting next to another man with glasses and headphones while sitting on a train .
1051290485.jpg| 1| Two women squatting on the sidewalk looking at plants , one in black shirt , shorts and pink sandals , the other in a white shirt , black shorts talking on a cellphone .
105335409.jpg| 0| Man talking on a microphone and a crowd of people in front of him .
1073444492.jpg| 0| A guy sitting at a desk talking on a phone with books laying everywhere .
10751489.jpg| 0| Two men are squatting with one man lighting a stick from a candle flame and the other man has his hands folded looking at the ground while a person wearing a bracelet has a phone to their ear .
109770830.jpg| 0| Two buildings beyond a concrete wall facing a walkway with a woman talking on a cellphone .
1101291373.jpg| 0| A man in sandals and white cardigan sits on a green bench while talking on his cellphone .
1101923011.jpg| 0| A man wearing a white tank top sings into a microphones on a stage with a crowd watching .
1126450961.jpg| 0| A man in a business suit talking on the phone and carrying a briefcase walking by a mirrored building .
1144288288.jpg| 1| A woman in a white shirt and blue shorts is wearing headphones .
1144885633.jpg| 0| Three young men read the plaque on a wooden cross in a rocky landscape , one young man is talking on his cellphone .
122634567.jpg| 0| A man wearing glasses holds a flip phone in his hand while a woman wearing earrings stands behind him .
123416768.jpg| 0| Three women at a shopping mall , one has a dog , one is on her cellphone , one is playing with her necklace .
124145159.jpg| 0| Two men , one looking at a screen with a drum next to him , while the other is a man dressed in a white shirt is talking into a microphone .
1262720546.jpg| 1| A man is playing a small guitar-like instrument and singing into a microphone .
12637806.jpg| 0| A man in jeans and a blue long-sleeved shirt is on his phone while leaning on the edge of a building .
128128618.jpg| 1| A man playing a xylophone is seated next to a man playing the guitar .
1287166023.jpg| 0| A lone musician in black is on stage , playing an acoustic guitar and singing into a microphone .
1294578091.jpg| 0| Standing man on phone with seated woman writing , near artist 's outdoor display .
129528391.jpg| 1| An accordion player wearing a heavy jacket , scarf and beanie standing by a yellow telephone pole .
1298866571.jpg| 0| Man in suit is using his cellphone while sitting on a train .
13051044.jpg| 0| Puppeteer wearing a purple sleeveless shirt showing off a puppet that looks like a black man with shades playing a saxophone .
1311388430.jpg| 0| A person hanging from a telephone pole near the mountains .
1346051107.jpg| 1| The man is standing next to a fire hydrant and playing a saxophone .
1348278340.jpg| 0| A man is singing into a microphone while standing on a stage with instruments and musical equipment on the floor around him .
134829866.jpg| 1| A man wearing a white cap , sunglasses , and red vest is playing a gold sousaphone .
1362276354.jpg| 4| Young woman with headphones makes a large bubble .
136399365.jpg| 0| A man in a blue shirt is walking and talking on the phone .
137231942.jpg| 0| A man wearing shorts , sandals , and a black shirt is talking on his cellphone .
137444523.jpg| 3| A man in a lime green shirt waits for the subway while a woman films using her phone .
1376871596.jpg| 1| A woman in a pink shirt and jean skirt walking down the street talking on her cellphone .
1379026456.jpg| 0| A man with headphones on is looking at a computer screen while sitting at a table .
1388373425.jpg| 0| A woman speaks on her cellphone with her purse and a yellow bag on the ledge next to her .
1394796089.jpg| 0| A band with saxophones and trombones are preparing to play music .
139818748.jpg| 0| A man wearing headphones and a checkered shirt with tan jacket reaches inside his jacket while crossing a busy street .
1401998185.jpg| 0| A white man in South Africa with a megaphone standing near a street sign that gives directions to the AFL Premiership cup , Johannesburg and several other places .
1404471863.jpg| 0| A young gentlemen with a blue tie talking into a microphone .
1410039760.jpg| 3| Gentleman with glasses who is wearing a microphone .
1412022357.jpg| 1| Asian woman in black skirt and jacket leaning against a light pole near a phone booth .
1417068537.jpg| 0| A man on the left speaks into a microphone , while a man on the right plays an unidentified instrument with a drum set in the background .
1417295167.jpg| 0| A man wearing glasses is reading his cellphone and holding a drink in the other hand .
1419062069.jpg| 0| A man in a suit , sitting behind a desk covered with radio paraphernalia , speaks into a microphone .
1427670417.jpg| 0| A dark-haired man is speaking into a microphone while another man is sitting beside him .
145053276.jpg| 0| A woman out to dinner and drinks laughs hysterically while her friend uses her cellphone .
1451143609.jpg| 0| People pass each other on a busy city street while talking on their cellphones .
1461667284.jpg| 0| A guitarist sits playing before microphones , while a man and a boy dance and a woman stands by .
1462460316.jpg| 0| A woman wearing a blue dress and gold belt sings with a microphone .
1471163137.jpg| 0| A man in a suit with a briefcase checks his phone while the gray building in the background is reflected in the pool of water on the street .
1477503966.jpg| 0| Four young men and a young woman on her cellphone are in a kitchen together .
1482654385.jpg| 0| Two boys climbing telephone poles to stay out of flood waters .
149588792.jpg| 3| A man , on the side of the road , playing a xylophone .
1509437339.jpg| 1| A woman holding a microphone and another woman playing the piano .
1516097777.jpg| 0| Three men have a conversation while sitting around an ornate table with microphones .
1569562856.jpg| 0| A young man is wearing a black jacket and has white earphones in his ears .
1578894657.jpg| 0| A young woman wearing a blue button shirt over a white shirt holds a microphone in her right hand .
1579198375.jpg| 0| Woman singing with a microphone next to a person playing guitar .
1579291454.jpg| 1| One man in a white robe with a microphone is reading off a sheet of paper to a crowd of people .
1579798212.jpg| 0| a child is laying in a bubble bath holding a yellow scrubbing brush up to his mouth as if singing into a microphone .
159712188.jpg| 1| A woman talking on a cellphone walking in front of water .
1604496657.jpg| 0| A brunette with curly hair is standing by a mural between a bike and a motorcycle and talking on a cellphone .
1605883315.jpg| 0| Three young Afro-American ladies on a subway train , one of them is on the phone .
16151663.jpg| 0| A girl is playing the violin in the street while her band mate on the guitar is talking on her cellphone with a confused look .
1618094569.jpg| 0| Guy with long black hair and t-shirt playing the bass as a man holding a microphone sings
1619001772.jpg| 0| A female vocalist singing on stage with microphone in hand as her drummer watches .
1629595358.jpg| 0| A man and a woman speaking into a microphone are on a stage .
1629709872.jpg| 0| A man wearing a brown shirt , green hat , and black headphones handles audio equipment in a white room with two black boxes in the foreground .
16988097.jpg| 0| Man in dark business suit , sitting by a marble water fountain , wearing eyeglasses and talking on his cellphone with newspaper on his lap .
170525064.jpg| 0| Two men dressed in blue uniforms wearing headphones are standing with their arms behind their back while a man dressed in a brown camouflage uniform with a leashed dog looks over his right shoulder at several parked vehicles .
1733671069.jpg| 0| A young man with long brown hair and a white shirt sings into a microphone
1734643212.jpg| 1| A man in a red button up shirt play a guitar and standing next to a microphone .
174217492.jpg| 0| A man with a blue and yellow bowler hat on is speaking into a headset microphone , while holding a rope .
174557398.jpg| 0| Musician in cowboy hat playing an electric guitar and singing into a microphone .
177351658.jpg| 1| A man with a microphone reads from a piece of paper as he stands in front of two men holding tubas .
1784309115.jpg| 0| A woman in a small pink bikini chats on a cellphone while a man looks on outside a city shop .
1800739200.jpg| 0| People are listening to their headphones as they hold on for a ride on public transit .
181970350.jpg| 0| A man wearing a shirt with an animal pattern on it and a purple tie is singing in a microphone .
181989658.jpg| 0| A woman carrying a mannequin is walking down the sidewalk and talking on a mobile phone .
1837976956.jpg| 0| A woman with black hair wearing a black and white polka-dot dress is singing into a microphone .
184256548.jpg| 0| A young man with a close haircut and wearing a sport coat , is talking on the phone .
189100641.jpg| 3| A woman with brown hair , singing into a microphone .
191227760.jpg| 0| A man with muscular arms shouts into a microphone at another man , who also appears to be shouting .
1916798494.jpg| 0| A number of people are sitting in blue chairs in a room , looking at computer screens while wearing earphones .
1918894054.jpg| 0| A female speaker wearing a gray jacket , a dark scoop necked top with a dark knee length skirt is presenting to a group using a computer to present as well as a microphone at the podium .
1925066432.jpg| 1| A woman in black flips through pages of a book in a library as a girl in white wearing headphones smiles .
1930975781.jpg| 0| A man with a guitar is at a microphone while the drummer seems to be resting and the other guitarist has his back to him .
1935532481.jpg| 0| A man in a black shirt and salt and pepper hair is speaking into a microphone .
193596775.jpg| 0| A woman in a sky blue coat is talking on a corded phone while petting a black dog .
1945930488.jpg| 0| Green shirted man singing at a microphone wearing a white and silver shiny hat .
1945939774.jpg| 0| A man wearing a green sleeveless t-shirt , red and white and black underpants and blue tights is singing or talking into a microphone .
195038634.jpg| 0| A man in a t-shirt plays an electric guitar and sings into a microphone .
1955172907.jpg| 0| African American people in dark clothing are raising their hands up in a room with green curtains , and a man at the front right is standing behind a microphone .
1957701886.jpg| 4| A woman is walking her dog and using her cellphone .
19663663.jpg| 0| Four young adults sit outside on a wooden deck near a building around a small round table , while another person stands on the edge of the deck , leaning on the wooden railing , with the sun shining on one of them and the rest of them are in the shade , two of them crossing their legs , one holding a cellphone out in front of himself and another holding a green and red soda can .
200278000.jpg| 1| A young child in a blue shirt holds a phone and eats something while standing in front of bicycles .
201995559.jpg| 0| A brunette female , wearing polka dot pants , talking on her cellphone , while a blond female child in pink shirt and red pants , dances .
2044546977.jpg| 0| A woman wearing a blue dress is holding a microphone and smiling while her friend looks on .
2056930414.jpg| 0| A child plays a red toy guitar and sings into multicolored plastic microphone .
206051614.jpg| 0| A man with brown hair , eyeglasses , and a gray long-sleeved shirt is holding a telephone in his left hand .
2072154465.jpg| 1| Upstairs , in a cafe , one man is eating and , at a separate table , another speaks on a cellphone , while downstairs a man sits among cardboard boxes .
2077433632.jpg| 0| A woman in front of white bars puts her hand to her forehead and talks on the phone .
2085726719.jpg| 0| Two women dressed for cold weather in jackets and gloves look at something on a cellphone screen .
211341511.jpg| 0| A young girl in a yellow shirt with a falconer 's glove and hawk perched on it is being assisted by a man with a ball cap and microphone in one hand .
2114005241.jpg| 0| Two men sitting in front of a christmas tree , one man is talking on the phone , the other man is drawing a picture .
21164875.jpg| 0| Two people are performing on a stage , one in front of a microphone , another playing the guitar .
21167868.jpg| 0| Two men are playing guitars and one man is singing into a microphone on a stage with the spotlight on them .
2123838998.jpg| 2| An ensemble of musicians playing an accordion , a saxophone , and a trumpet are in front of a store , dressed as santas .
2131716223.jpg| 0| A pharmacist in a white coat and glasses is talking on the phone .
2132881811.jpg| 0| A female soprano saxophone player and a male trumpet player are performing on the street as a man looks on from behind .
213412641.jpg| 1| A man with a guitar and a cowboy hat performs in front of a microphone .
213412642.jpg| 2| Two men playing guitars next to a microphone .
2136514643.jpg| 1| A girl on the phone standing in front of beautiful plants is passed by another smiling girl .
2151149988.jpg| 0| A man in a choir robe is standing at a microphone while the choir sits behind him .
2162746678.jpg| 1| An Asian man wearing thick white gloves , talking on a cellphone , and working on something .
2190899457.jpg| 0| A woman and two gentlemen are taking a stroll along the beach , as the woman talks on her cellphone one of the men takes her picture .
2191896524.jpg| 0| A man is talking into a microphone , there is a boy in the background , a man is playing a keyboard and is wearing a camouflaged jacket .
219357394.jpg| 1| Two people are sitting on a bench while one of them is holding a phone to his ear .
21954377.jpg| 0| A man in a green shirt playing a guitar is singing through a microphone .
2203224077.jpg| 0| With a cellphone off to the side , a young white girl is eating cereal from a white bowl on a white table in the kitchen .
2213762298.jpg| 0| A black man plays the alto saxophone in front of a brick storefront .
2219522227.jpg| 1| A young man is leaning against a tree listening to headphones with his eyes closed .
2220274048.jpg| 0| Blue scooter with white helmet and two women sitting on bench looking at phone next to small shop .
22215229.jpg| 0| African American man with shopping bag standing in a blue phone booth .
2226280160.jpg| 0| A firefighter on his ladder up against a telephone pole investigating a problem , with smoky clouds in the background .
2226449279.jpg| 1| A man in a blue jacket and a New York Yankees hat with a cellphone in his hand .
2230396241.jpg| 0| Two girls sing into a microphone while reading of a piece of paper together .
2231089996.jpg| 0| A man in white wearing a Yarmulke is in front of a microphone with several other men in the background .
2232255534.jpg| 1| A man wearing a tracksuit is standing against a pole while other people sit , listening to something through earphones .
2232718966.jpg| 1| A person on the phone in purple leggings , leaning on a building on a street walkway .
2241768909.jpg| 1| A woman with a panda hat and headphones is in front of a man outside in the snow .
2245914678.jpg| 0| a red-haired girl with a black and white striped shirt talking on a cellphone
2246717855.jpg| 0| Three people in an Asian transportation station are all focused on their cellphones .
2248487950.jpg| 0| A woman in a coat and a man in a tracksuit talking on a phone cross the street .
2249034258.jpg| 0| A woman talking on a cellphone and a man with a mustache emerge up the stairs from an underground subway .
2255753004.jpg| 0| Two girls stand in front of two men selling what appears to be concert merchandise while a woman holding a microphone interviews the men behind the merchandise counter .
2260099785.jpg| 0| Two men are on stage playing guitars while a third man wearing a baseball hat sings into a microphone .
226065257.jpg| 0| Four people sit on a subway two read books , one looks at a cellphone and is wearing knee high boots .
2260891072.jpg| 0| A man plays an acoustic guitar while sitting in front of a microphone .
2263132077.jpg| 0| A blond man with a beard operates a camera while a young boy in a green shirt stands beside him holding a microphone in his hand .
2271099293.jpg| 0| Brunette man play saxophone in a busy outdoor shopping center as people look on , he wears a camouflage jacket and saxophone is gold .
2273650537.jpg| 0| An older man with graying hair talks on his cellular phone as he walks out of a Jewelry store while a woman in a black coat with furry fringes stands outside .
2273871383.jpg| 3| An older man standing by a younger man with earphones
22764427.jpg| 4| People are talking to a camera crew with video and microphone .
227701311.jpg| 3| A man in a bowler hat sitting next to a speaker and a figure playing a saxophone .
22779038.jpg| 0| Two men wearing red jackets are looking out over some water and one man has yellow earphones on his ears .
2289754578.jpg| 1| A red-haired woman and a black man stand sharing a microphone while playing violins as part of an ensemble .
2295489839.jpg| 0| A man playing a keyboard and singing into a microphone .
23022402.jpg| 0| A graveyard worker is digging , or filling a grave , another person is on his cellphone , leaning on a tombstone .
2305869802.jpg| 3| A gray-haired man is sitting outside talking on the phone .
2312984882.jpg| 0| A small band of guys are playing their saxophones and one man is playing the drums with buckets .
2313609814.jpg| 2| A woman wearing gray speaks into a microphone at an event while two men listen .
2315973850.jpg| 0| A man in a white polo shirt speaks into a microphone with a sign behind him that reads ," "" Truth ! """
2317077597.jpg| 0| A woman on the phone is standing at the end of the subway entrance while a man with a black hat stares straight at the camera .
"2324804923.jpg| 0| A man with a sign in front of him that reads "" Deleon "" sits at a microphone ."
2324842075.jpg| 0| A man wearing a Facebook lanyard is holding a microphone .
2324842927.jpg| 1| Man with glasses on speaking in a microphone surrounded by a group of people .
2335931883.jpg| 1| A man plays a blue electric guitar in front of a microphone .
234249498.jpg| 0| Male and female performers stand on stage holding microphones up to their lips and raising their hands in the sky .
2343145630.jpg| 1| Two people are together and one of them is using a microphone .
234374617.jpg| 0| A man in a yellow reflective vest squats on a lawn while using on a cellphone .
2344898759.jpg| 0| A woman talks on a cellphone while sitting in front of blue railings that are in front of the ocean .
2347763226.jpg| 3| a man sitting on steps with headphones and sandals
2347772881.jpg| 4| Two men standing by a microphone .
2353999195.jpg| 1| A man playing a guitar while standing in front of a microphone singing .
2354007039.jpg| 0| A woman in a brown shirt is singing into two microphones .
2354827014.jpg| 0| A woman in a solid colored black shirt sings into a microphone while a man in the background plays a tambourine .
2354834216.jpg| 0| A man sings into a microphone as another man plays electric bass behind him .
2359862217.jpg| 0| A man and two women are sitting on the beach , the man is wearing a watch and talking on his phone , while the women are building sand castles .
2364728258.jpg| 2| A well dressed man speaks into a microphone at a Tech Summit .
2364942064.jpg| 0| A woman dressed in black blouse standing and speaking into a long microphone .
2366292699.jpg| 0| A man in a brown suit is speaking into a microphone while sitting down with his right foot up .
2366296895.jpg| 0| A man sits talking into a microphone in front of a sign ," part of which says the word "" policy "" ."
2366306683.jpg| 0| A man with white hair wearing a gray suit speaks into a microphone with a metal jug sitting in front of him .
2366958894.jpg| 2| Two men and a woman are sitting at a table in front of microphones .
2367387854.jpg| 0| A woman with short brown hair in glasses wearing a gray shirt sits in a chair and speaks into a microphone .
2369809845.jpg| 0| A man wearing a brown suit and glasses is taking into a microphone .
2372541545.jpg| 0| A man in suspenders sits at a table at a booth , talking on a cellphone , while a few people peruse the items on the tables .
2376413845.jpg| 0| A woman in a pink shirt is sitting on a rail talking on a cellphone while a couple in business wear is enjoying a lunch .
2386924148.jpg| 0| A group of young band members wearing black perform on instruments including the saxophone and the trombone .
2391152358.jpg| 1| A girl sings into a microphone while a man watches her .
2391442557.jpg| 3| A woman is sitting on a bench looking at her phone .
2401794446.jpg| 0| Three people sit against a wall and use their phones to capture what 's taking place .
2409771090.jpg| 0| A guy singing on stage with a cool black shirt , while turning his microphone to the audience so they can sing along .
2410562803.jpg| 0| A girl using a laptop , another girl , and a boy looking at his cellphone .
241345446.jpg| 1| A man in a white shirt with a white hat holding a pair of headphones at a field based game .
241345533.jpg| 0| A man wearing a white shirt is wearing an at&t headphone at a game .
241347700.jpg| 0| A man in red holds up a cellphone on the sidelines of football game .
24183660.jpg| 1| Four women in dresses and three men in black suits standing in front of a microphone singing .
2419569803.jpg| 0| A blond woman wearing a pink tank top is singing into a microphone with musicians in the background at a venue with a brick wall .
2421340833.jpg| 0| A man with a bright reflective vest and headphones is standing next to a man with a suit and scarf .
2427393337.jpg| 0| A man wearing glasses is sitting at the table and checking his i-phone .
2429175207.jpg| 0| A woman in a black shirt with long brown hair standing in front of a microphone .
2429366041.jpg| 0| A woman with brown hair , white blouse , and a red purse is wearing headphones while a black-haired woman in a black and white blouse smiles next to her .
2429405579.jpg| 0| A man in a bight blue shirt and two women dancing and listening to something on their headphones .
243015377.jpg| 0| A man wearing glasses is singing into a microphone .
2433178831.jpg| 3| A long-haired man wearing a jumpsuit with headphones over his green cap .
2434440010.jpg| 0| A man is standing in front of a microphone in a room with individuals sitting on chairs in rows around the edges of the room .
24355644.jpg| 0| Three females stand in front of microphones with mouths open in apparent act of singing .
2438950574.jpg| 0| A black man in a suit is speaking into a microphone attached to a stand , his arms raised .
2441817905.jpg| 0| They are doing the carpentry work and their ears are closed by the headphone .
244344740.jpg| 1| A young woman is plotting on a drafting table while talking on the phone .
2446928775.jpg| 0| A man in formal wear , holding a microphone in one hand and a pen in the other , appears to be giving a speech .
2446932233.jpg| 0| Four men and a woman sit at a conference table covered in a white sheet , with beverages in front of them and one has a microphone .
245133696.jpg| 0| A man in a black shirt and jeans stands at a microphone holding a guitar .
2454189540.jpg| 0| A woman in a gray t-shirt is looking at a cellphone in her hand and another woman in a black top is looking down at a little boy with a blue hat and a striped white and blue shirt .
2469620360.jpg| 0| A woman is standing in a field of tulips holding onto a coat and cellphone .
247617754.jpg| 0| A woman with a backpack looks at her cellphone while sitting on a short concrete wall .
247874544.jpg| 0| Lady wearing greenish pants , a purple and white striped jacket and knit cap singing at a microphone .
249147570.jpg| 0| An individual in a red plaid shirt is standing in a telephone booth outside .
2503169353.jpg| 0| Man wearing a suit and tie is in front of a podium with a microphone in front of him .
2511798599.jpg| 0| At an outdoor event , one man is speaking into a megaphone while another man is holding the megaphone .
2515822745.jpg| 0| An Asian man reading a piece of paper into a microphone with an Asian lady in a light blue jacket standing next to him looking at a folder .
2516649032.jpg| 0| Two girls look up at something while standing in front of a microphone .
2519585357.jpg| 1| A man with a guitar and a microphone stands on stage .
2523934341.jpg| 0| A person wearing a striped shirt , headphones , and a headscarf watches a street with a large truck driving through .
2525552286.jpg| 0| A bridesmaid gives a toast with a microphone while two other bridesmaids and a gentleman look on .
2528076469.jpg| 0| A man in a floral shirt unbuttoned over a white t-shirt stands in the street in front of a building and a telephone pole .
2534904279.jpg| 1| Four men and one women are discussing something together on a stage with microphones .
