image_name| comment_number| comment
4911436510.jpg| 0| The volleyball player reaches up with his fist to knock back the approaching ball .
4912108775.jpg| 0| A man in a black shirt with a white ring in his right hand reaching for something on the edge of a window .
4921249499.jpg| 1| With a roll of toilet paper in reach a male is asleep at his desk .
4921374490.jpg| 2| An outdoor market vendor reaches up with a pole to knock rainwater off of the tarp covering her stall .
4932279873.jpg| 0| A man with black pants and a white shirt is reaching into a large white plastic bag in front of a store with large windows .
4939698838.jpg| 0| A woman wearing orange is putting a bowl into a dishwasher next to another woman that is reaching for dish soap .
4960617393.jpg| 1| A man is walking down the sidewalk to his destination as he reaches inside his pocket .
4965595911.jpg| 0| A woman holding a purse reaches up to grab the hands of a performer dressed as the statue of liberty wearing sunglasses .
4966861386.jpg| 0| A firefighter wearing a hard hat , carrying a tank on his back stands behind another man who is reaching in behind a fire hose in a metal cabinet .
4981040278.jpg| 3| An older gentleman reaching to the floor .
514073775.jpg| 4| group of kids outside a building reaching for a bubble
5171029614.jpg| 1| A man is in front of a dryer in a laundromat with both hands reaching into a bin or basket .
5192912743.jpg| 2| Two African boys reach out for a soccer ball while playing outside .
524031846.jpg| 3| Boy reaches up while in pool .
5270958162.jpg| 3| A small group is waiting for the trolley to reach the bottom of the hill .
5303938013.jpg| 0| A man and woman are in a dance class , and the man , wearing a white tank top , is grabbing the woman 's hand by reaching between her legs as she is in the air .
539744890.jpg| 2| A man lifts a child up to reach the bars at a playground .
5468029953.jpg| 0| A little boy wearing a dark blue jacket reaches out to a woman dressed up in a pink and purple costume with white wings , who is standing on street .
5503955724.jpg| 0| Stretching high in the air , the player in the black shirt reaches for the football as the other stretches toward him to steal it away .
5513727638.jpg| 2| A biker reaches the apex of his ramp while onlookers watch his feat .
5518762299.jpg| 2| A small boy reaches into a dog 's food bowl as the brown dog watches .
5585791618.jpg| 0| A young lady in gym attire is trying to reach the top of a wall that is covered in graffiti .
5604852363.jpg| 3| A musician on stage reaches out to a fan in the audience .
5615084425.jpg| 0| Three men in a science lab watch one of them hold a burning object , one man on the side is reaching for the ground .
562928217.jpg| 2| Two dogs reach for a yellow Frisbee as it flies through the air .
565605894.jpg| 0| A young girl reaches for playground rings with determination in her eyes .
567909573.jpg| 1| A person reaches into the backseat of a truck while workers work behind .
5684881640.jpg| 0| An elderly man with a mustache and a black baseball cap reaches over to select a bottle of Ar and Hammer laundry detergent .
5755891783.jpg| 2| Food donations for the community food bank fill a truck as a worker donning a black hat reaches the loading dock .
5757492662.jpg| 3| A female gymnast wearing a blue leotard is reaching backwards .
5885058292.jpg| 1| Somebody is reaching out their arm to a little girl that is about to walk by .
5888746167.jpg| 2| Two men , one reaching to the ground and the other watching , on country property .
5941812271.jpg| 1| A baseball player trying to reach first base by beating out the shortstops throw .
594758693.jpg| 0| A man in a baseball uniform on a ball field is running and reaching to catch a ball that is in the air .
5973476404.jpg| 1| Baseball player reaches down to retrieve a baseball having rolled near the infield .
5989324335.jpg| 2| During a baseball game , one player is diving on the ground to reach the base in time .
6011731872.jpg| 2| A gathering of people in bright attire while two women reach into large , yellow bags .
6042049207.jpg| 1| A man dressed in gray laying on the floor in front of another person while reaching out his hand .
607339469.jpg| 2| A girl wearing purple lean over the edge to reach for the ducks .
6142033763.jpg| 0| Four young men are playing indoor basketball while one jumps to reach the ball .
61454211.jpg| 1| A man in jeans and a black t-shirt standing precariously at the top of a ladder and reaching up to paint the walls .
6188266707.jpg| 0| A female volleyball player reaches high as her fingers touch the ball .
6188880632.jpg| 1| Two young girls jumping up to reach a volleyball during an indoor volleyball game .
6189950649.jpg| 0| A man in orange clothing is kneeling , holding a trash bag , and reaching for a broom in the road near the sidewalk .
6194740899.jpg| 4| A young boy reaching for something in a black plastic bin .
6209169496.jpg| 3| This is a young guy reaching for a falcon on a perch .
6283123175.jpg| 1| A volleyball player jumps to reach the ball in an all-women 's game .
6295775965.jpg| 1| An entertainers reaches out to his audience during a performance .
6337228599.jpg| 1| A meaning is sitting on a stool and leaning toward a body of water while reaching into it with a pole or net .
6338542128.jpg| 0| On a sunny , dry day , wearing full football gear , a Texas A&M football player tries to reach an Iowa State football player , for the football during the game .
6398952.jpg| 0| A man in blue jeans and a white t-shirt is standing on scaffolding reaching out to the ladder .
6492500461.jpg| 4| A pair of female volleyball players reach for a volleyball .
6497851023.jpg| 2| A snowboarder at the top of a slope reaches down to grab his board while in midair .
6761248991.jpg| 0| The golfer in the blue shirt and visor is chipping out of the bunker to try to reach the green from roughly 150 yards .
6822696890.jpg| 0| Three wheelchair basketball players wearing team uniforms are attempting to reach the descending basketball with other players in the background .
6828313172.jpg| 0| Basketball players are reaching for the basketball as it flies through the air .
6874319983.jpg| 4| Hockey goalie is reaching towards the puck .
6907187997.jpg| 0| Two men from opposing teams jump and reach high in the air in an attempt to grab a Frisbee .
6915121934.jpg| 1| Goalie reaching to block a soccer ball from going in the net .
6926577156.jpg| 0| Intense basketball game while Los Angeles player dressed in red reaches for the hoop while the other team , wearing a white uniform , and fans look intently on .
6942745583.jpg| 0| a woman in a black shirt and purple pants is bending over reaching into a dishwasher .
6950137939.jpg| 1| A team of men are playing a game in which several of them are jumping to reach the ball .
6988222785.jpg| 2| A little toddler trying to look through a scope but ca n't reach it .
7018032339.jpg| 1| A soccer game is played as two men attempt to reach the ball before their respected opponent .
7026715373.jpg| 2| The employee wearing a red apron is reaching into the deli cooler .
7032696983.jpg| 1| During a volleyball match , one girl in white recoils and closes her eyes as the ball approaches , while the girl in black and blue seems ready to reach for the ball .
7035403481.jpg| 0| The goalie wearing white reaches to stop a soccer ball that is coming towards the goal he is protecting .
7165193566.jpg| 0| A blond woman in a short denim skirt , black top and beige jacket , is reaching towards part of a painting that is propped up on a windowsill .
7173234758.jpg| 3| A man trying to reach the tennis ball in a tennis game .
7184992060.jpg| 0| A new graduate is reaching over to shake hands with a man behind the roped off section separating them .
7199683822.jpg| 1| The man , with no shirt , reaches into a bucket to extract the substance inside .
7371279360.jpg| 3| A black male looking and reaching his arms upward .
7411114322.jpg| 0| Number 13 reaches out as he turns directions in an effort to deflect the anticipated path of the football during the game .
7512556880.jpg| 4| During a game of baseball , a man takes a base while his opponent reaches for a ball and another man looks on .
7520731.jpg| 0| Two men in construction hats are looking at a large piece of suspended machinery , while another man in a construction hat reaches for it .
7553133572.jpg| 0| A large huddle of young people in swimwear reaching their hands toward the center of their huddle .
7558179624.jpg| 3| A child is reaching up to the counter using a step stool .
76485985.jpg| 2| A girl in a long pink jacket reaching into a pool of water filled with change .
7687786248.jpg| 4| A tennis player is jumping and reaching high to hit the ball .
7694340978.jpg| 0| A woman dressed in a red bikini is jumping up in the sand to reach the volleyball hitting it with the palm of her hand while people in the arena watch .
7718342644.jpg| 3| A man reaches across another while playing a sport outside .
7724191016.jpg| 0| Player in light gray uniform reaches head first for baseball plate while catcher in yellow top reaches arm to tag him .
7784949770.jpg| 2| A male badminton player reaching to backhand the shuttlecock at an Olympic event .
7812870472.jpg| 1| Two professional soccer players attempt to reach the ball first , with the fans in the stands looking on from the background .
7958174552.jpg| 0| Two men in uniforms and wheelchairs are reaching up for a white ball on a basketball court .
7966143612.jpg| 0| An Asian man in an ivory suit jacket is reaching out hands to an eager crowd in front of him .
8006608256.jpg| 2| A young man reaches for green apples to put in a box .
8018246519.jpg| 4| A singer is performing with fans ' hands reaching toward her .
8022825509.jpg| 4| An intense roller derby event reaching its peak .
8089660385.jpg| 1| A man wearing a black and white checkered jacket and white paint around his eyes reaches toward the camera .
8170352192.jpg| 0| A man in a park is leaning on a bar looking , towards the camera while a boy in the background is leaning over a bar , and a lady with a bag is reaching towards a girl .
8211471228.jpg| 0| A basketball player approaches the net in the air in an attempt to perform a slam dunk over the reach of his opponent .
837893113.jpg| 2| A young boy wearing a large hat reaches to catch a Frisbee .
86112634.jpg| 0| A large man smiles as he reaches past a display counter with jewelry in it , pointing at something , while his younger , dark-haired friend looks on smiling .
87938334.jpg| 1| A young boy in a beige jacket laughs as he reaches for a teal balloon .
889751330.jpg| 2| A man in a blue shirt reaches for a large wooden block .
953036866.jpg| 0| A small child reaches out to touch some sort of gadget , in front of a colorful wall .
97131520.jpg| 3| People sitting inside a bus waiting to reach their destination .
