image_name| comment_number| comment
1243798805.jpg| 0| A street performer strumming on his guitar , waiting for people to toss him tips .
13301546.jpg| 4| A bowler winding up for the toss .
1355833561.jpg| 0| A man in an orange jacket playfully tosses a small girl into the air on an empty stretch of beach on an overcast day .
139245992.jpg| 0| An older gentleman , dressed in jeans and a long-sleeved shirt , tosses a small red ball on the beach .
172719061.jpg| 0| A woman with short red-hair sitting on a rocky beach tossing a rock into the water .
178249309.jpg| 4| A man tossing trash to the side .
184326428.jpg| 0| A man in a yellow shirt and light colored pants sits next to a woman wearing a light colored hat in front of a camper while a young boy in a yellow shirt and jeans tosses rocks .
19796500.jpg| 0| A man in a navy blue shirt is tossing a boy with a large smile on his face high into the air .
1994416869.jpg| 0| A little girl in only socks and a necklace is being tossed in the air and caught .
2120512339.jpg| 0| Two young men one in a yellow sweatshirt and the other has no top on they are tossing a piece of green material .
2121140070.jpg| 2| A group of people in a large yard toss a disc .
2242347403.jpg| 2| A young man with a happy expression is tossing bits of colored paper into the air .
2245019332.jpg| 0| Little girl cooking pancakes and tossing it out of the pan .
225692535.jpg| 0| A young boy in pajamas tosses a red ball in the air .
2301379282.jpg| 2| The baby enjoys being tossed up in the air .
2306799249.jpg| 4| Young boy wearing red shorts , tossing a bowling ball .
2335511314.jpg| 1| A man in a canoe paddles while another man tosses a net out into a large body of water .
2341757202.jpg| 2| A girl footballer stands near a fence about to toss the ball back into play .
2343879696.jpg| 1| The child enjoys being tossed in the air by his mother .
2386635533.jpg| 4| A woman tosses a bag of trash into a dumpster .
239175477.jpg| 0| Several young Asian guests at a seaside wedding , including two bridesmaids in pink dresses , wait in anticipation as the bride tosses her bouquet .
2398466720.jpg| 0| A girl in a colorful dress is tossing sand from her hands while walking a sandy beach with a grass covered dune behind her .
2447972568.jpg| 2| A man tosses a child in camouflage into the air .
2450453051.jpg| 0| Man in white shirt tossing Frisbee for black and white dog who has a white Frisbee in its mouth .
2462702522.jpg| 2| A little boy starts to toss a mini basketball .
2526752524.jpg| 1| A man wearing a white shirt tosses a frisbee in the park .
2550756380.jpg| 0| A woman in a white wedding dress tosses a bouquet behind her to a group ow women while people at tables look on .
2582211817.jpg| 0| A man tosses a soccer ball in the air on the beach at sunset while boats go by in the distance .
2631000531.jpg| 0| Lady wearing a straw hat and flip-flops watches the tossed object fly through the air .
2705099765.jpg| 1| A man in a blue shirt and sandals tossing an object toward a target while a group of older adults look on .
2711230445.jpg| 3| A woman is tossing a bucket of water .
2715262147.jpg| 1| A young girl and a young man playing a toss game at an outside party .
2873522522.jpg| 1| Rugby player in red gets ready to toss the ball .
289638863.jpg| 1| A soccer player in a yellow shirt tossing the ball back .
2899594400.jpg| 1| Two men toss a ball while standing in the water and a dog is with them .
2972864304.jpg| 0| A laughing little girl sits in a pile of leaves and tosses the leaves in the air .
2987328689.jpg| 1| A boy tosses a rock across a river .
3004359992.jpg| 0| A group of girls in cheerleader clothing tosses another girl into the air with an athletic field in the background .
3049649128.jpg| 0| A young boy with his eyes closed tossing leaves while sitting in a leaf pile .
3054989420.jpg| 3| Children tossing dead leaves on lawn .
3116769029.jpg| 4| Young boy tosses autumn leaves
312691128.jpg| 1| A man in hat and apron flipping over his pancake by tossing it in the air back to the pan .
3162940296.jpg| 1| An Asian couple have rose petals tossed at them by a woman .
3178357056.jpg| 2| A man in a blue shirt is tossing a football .
3186412658.jpg| 0| A women 's sports squad performs some tricks , including lifting members high and tossing a ball .
3255732353.jpg| 3| A girl in pink tosses a snowball a girl wearing blue .
3293642024.jpg| 2| The man is tossed from his boogie board by a large wave .
3359454244.jpg| 2| A man wearing glasses is holding a pan and tossing it 's contents into the air .
3362592729.jpg| 4| Two girls in black toss their guns in the air .
3421928157.jpg| 2| People are tossed around in a blue raft in a foamy river .
3426789838.jpg| 1| The man tossed a child into the swimming pool near the ocean .
3468275336.jpg| 4| A bride tossing her bouquet to a group of women .
3547524138.jpg| 4| The early stages of a water balloons toss .
3564157681.jpg| 2| A man tossing a Frisbee to his dog that leaps to catch it .
3580277210.jpg| 0| An older man and a young girl tossing a ball back and forth with their sports equipment .
3582465732.jpg| 1| A girl sitting on a trampoline tosses an empty water bottle in the air .
3590654365.jpg| 0| A bull is tossing a rider off him while several other cowboys try to restrain it .
3591462960.jpg| 0| A rodeo rider gets tossed up into the air by a black bull as fellow cowboys look on .
3603879637.jpg| 0| Six young children are standing in an area shaded by trees viewing paper being tossed into the air .
363140724.jpg| 1| A cheerleader dressed in an orange and white outfit is tossed in the air by four other cheerleaders on the ground .
3677318686.jpg| 2| A boy in a purple shirt tosses orange balls on a lawn .
3726700898.jpg| 1| A man is tossing a knife in the air while another man stands nearby .
3741827382.jpg| 4| a small boy getting tossed into the air
3876652419.jpg| 4| Three young boys tossing a watermelon .
3924998281.jpg| 3| A cute little toddler grips a volleyball ready to toss it .
392950732.jpg| 0| Two employees look on as another employee is tossing dough in a commercial kitchen .
3953382308.jpg| 3| An older man tosses plastic bags down a staircase , attacked to a plane .
396768260.jpg| 2| People toss candy as they celebrate on top of a float .
4019373509.jpg| 0| A young girl dressed in brown dress and sandals scowls at a young boy dressed in black hat , tank top , and blue cargo shorts as he tosses a silver ball towards a identical ball .
40267450.jpg| 1| A street performer tosses up a ball in front of a small crowd .
4121365461.jpg| 0| A young brunette male in a striped blue shirt and denim jeans , tossing a basketball on a basketball court .
4326555575.jpg| 3| A bull rider is tossed from the bull near men with hats .
4380486458.jpg| 1| A man is tossing an onion in the air as he prepares to slice it .
4489833894.jpg| 3| One girl tosses a softball to her team member on base .
4582536661.jpg| 3| A skilled worker tossing dough to make the perfect tomato pies .
459778335.jpg| 4| A man tosses a boy into the air at the beach .
460188299.jpg| 2| A male with glasses is tossing a dart .
4625152980.jpg| 1| A military man is going through a gun exercise , tossing it in the air , with military men in the background .
4637796410.jpg| 2| Two people in football uniforms toss around a football in a subtle field .
4655653584.jpg| 0| Three girls in the picture are playing a frisbee game with one girl tossing the frisbee , another girl in front trying to intercept the frisbee , another girl standing behind her teammate , and some ladies observing in the background with an umbrella .
4669065532.jpg| 0| Three children are tossing a toy in the air in the middle of a field .
4696008519.jpg| 1| A man wearing a Nike shirt and kilt prepares to toss an object .
4706432787.jpg| 1| A man is being tossed in the air by a large group holding the edges of a flag .
4706435859.jpg| 0| A large crowd is tossing someone dressed in black and red up in the air using a large cloth .
4755628405.jpg| 4| The lady is tossing the balls and looking up .
50655098.jpg| 2| Cheerleaders at a sporting event toss a girl high up into the air .
514448571.jpg| 4| A man in a black outfit are tossing up toy balls .
515684832.jpg| 1| A lady standing on an exhibition table for a ring tossing game .
539750844.jpg| 2| A dog tries to play with a ball that is tossed to it .
5571949283.jpg| 3| Older man baiting his hook before tossing it out to see what he can catch
5617549557.jpg| 2| A man in a yellow shirt is tossing a neon yellow Frisbee under his leg .
5715657613.jpg| 1| The young lady wearing outdoor clothing is tossing a blue football , with a couple of other people in the photo who look like students , on a sunny day .
5716219952.jpg| 0| Young girl in pink T-shirt and black leggings tosses blue football in grassy open area .
5794205434.jpg| 3| A girl tossing a hula hoop into the air in her yard .
5923096321.jpg| 0| Someone tosses a bowling ball down a lane while 2 others watch .
6167481552.jpg| 3| A football team getting ready for the coin toss in a half empty stadium .
6168223686.jpg| 1| A man holds a beer in one hand as he tosses a frisbee in a park .
6281452090.jpg| 2| A football player prepares to toss the football as the rest of his team watches .
6314475788.jpg| 0| A man in a kilt tossing a log outside in front of some trees and bales of hay while many people look on , 7 of which are in front of a safety line , one obscured by the tosser and 3 with kilts .
6451269381.jpg| 2| There are cheerleaders tossing a member in the air .
6843047255.jpg| 0| This is a male juggler tossing three flaming batons at night near a yellow car and in front a picket fence .
6886050898.jpg| 2| A swimming pool with men tossing a ball around .
7380263314.jpg| 1| A girl , kneeling on the sand with a pink Minny Mouse bucket near her , is tossing a scoop of sand with a shovel .
75698102.jpg| 1| A young girl in the pool playing with the floating ring , and balls to toss into the ring .
7778073672.jpg| 2| a female throws a frisbee while another attempts to block her toss .
81707157.jpg| 3| A woman in a bathing suit is being tossed up on a seesaw .
950411653.jpg| 2| Woman in blue is tossing a young child into a pool .
973827791.jpg| 0| A child slides into a wading pool full of water while an adult tosses a bucket of water on them .
987442144.jpg| 3| A man and a woman are tossing salads .
