image_name| comment_number| comment
106027978.jpg| 1| A woman in a pink shirt wrapped up in a blue blanket asleep in a car .
1266116986.jpg| 0| A little girl wrapped in a dark blanket smiles broadly and stirs a spoon in a pan while she stands beside a crowded kitchen counter .
1304428316.jpg| 0| A man wearing a blue shirt and a plaid cloth wrapped around his waist is trying to obtain something from a tree by using a long pole .
132887917.jpg| 0| A little boy with a cream colored shirt holding a small piece of candy in a wrapper .
13615892.jpg| 1| A baby carefully wrapped in a blanket sleeping in an infirmity crib .
1367685772.jpg| 0| A baby in a blue outfit , wrapped in a blanket , is sucking on her pacifier while laying down .
137431020.jpg| 0| A boy and two girls are sitting in the street while wrapped in blankets .
139165197.jpg| 0| A man wearing a white head wrap is pealing the green outer layer off some sort of tropical fruit .
1418019748.jpg| 0| A man dressed in a white shirt , blue baseball cap while wearing gloves , holding a red and white checkered food wrapping .
1419385780.jpg| 1| A man with a brown Mohawk and white shirt is wrapping his arm .
1442562321.jpg| 1| Small Children work their way together to unwrap their presents .
1578427672.jpg| 0| A small girl is unwrapping a green present with toys strewn around .
158484558.jpg| 0| A man in a dark coat and jeans and a blond woman in a tan coat with a scarf wrapped around her neck are holding hands stopping to look at something .
1678345419.jpg| 0| A young man in a white shirt is sitting on a wall with his legs wrapped around a young girl , with their motorcycle helmets on the wall behind him .
182074740.jpg| 0| A woman in yellow shorts and a red bandanna wrapped around her head is walking in the street in front of a blue house .
1944940887.jpg| 0| Two men sitting down and wrapping baked goods in plastic wrap .
197924859.jpg| 3| A tarp wrapped around a tree and a watering can .
2045127186.jpg| 1| Girl in a red coat , blue head wrap and jeans is making a snow angel .
2061927950.jpg| 0| a couple with a young child wrapped in a blanket sitting on a concrete step
2068556363.jpg| 3| A lady and a guy are sitting down wrapping gifts .
2119283186.jpg| 0| Two men are standing in the middle of the room ; three more are sitting , each holding a wrapped up box .
2119381199.jpg| 0| A woman in a red shirt and eyeglasses is seated on a beige couch smiling up at the camera showing a just unwrapped gift .
2137071442.jpg| 0| Young boy holding a light saber in front of a Christmas tree with wrapping paper littering the floor .
2138735584.jpg| 2| A young woman in a cupcake shirt unwraps a gift .
2142631327.jpg| 4| Older woman and young child unwrap a child 's painting easel .
2144670301.jpg| 0| A woman wearing a blue dress has fur wrapped around her wrists and her head and she is wearing a wooden beaded necklace .
215806759.jpg| 3| Two women with head wrappings are walking in front of a decrepit building .
218428071.jpg| 4| A man wrapped in a flag walks down the street .
2204545235.jpg| 1| A child wearing goggles and wrapped in a towel is crying in front of a pool .
2228381169.jpg| 0| A man in all black holds on to a railing while a white dog wraps itself about his legs .
2252722473.jpg| 1| Man in a coat , walking with plastic wrapped around shoulders , shielding himself from the cold .
2314377503.jpg| 1| A man who is wrapped in a gray wrap is stooping on the ground .
2314528789.jpg| 0| A woman is putting a wrapped package into a red velvet stocking .
2315320158.jpg| 1| A blond-haired woman wearing a blue shirt unwraps a hat .
2315335328.jpg| 0| A blond woman in a green dress , with a tattoo on her left arm , holds a yellow pot of flowers - someone else sticks their twine-wrapped finger into the frame of the photograph before her .
2327240505.jpg| 0| A young girl with a flower on her shirt rides a skateboard while a young boy wraps something around her .
2334933071.jpg| 1| A woman dressed in a traditional wrap can be seen through a small hole archway .
2403610816.jpg| 0| Two man finish wrapping a billboard sign on a building that advertises Lombardi sports .
2414035800.jpg| 0| A woman in a gray sweatshirt is sitting on the floor with her small dog that is wrapped in a blanket .
2417617305.jpg| 2| A sweet baby wrapped in their blanket sleeping .
2429243285.jpg| 0| A woman in a green and red wrap dress stands with her hand on her heart next to another lady and a man .
2451988767.jpg| 1| One boy has his leg wrapped in blue material and the other boy is wearing a red cape .
2471184383.jpg| 1| A smiling elderly woman with a head wrap prepares boiled water .
2533010184.jpg| 0| A woman in a head wrap is standing behind a tree and some beautiful white flowers .
2535619827.jpg| 2| Two people wrapped in blankets in an alley .
254555172.jpg| 0| A little girl unwrapping her birthday gift , in a white dress at home .
2579490116.jpg| 0| A white truck filled with a sofa , table , wrapped blue blankets , and a steel gurney standing under a thin tree .
260217340.jpg| 0| A black woman with a red turban is wrapped in a towel and wears a pink shirt near a bucket .
2611335633.jpg| 0| An older man wearing a black baseball cap and black shirt holding a baby wrapped in a blue and white striped towel .
2614027432.jpg| 2| A Hawaiian man without a shirt on and wearing a pink flower in his hair and a green wrap playing an instrument .
2631300484.jpg| 0| A blond boy stands among people in a shady setting with a large snake wrapped around his chest .
26439066.jpg| 0| An elderly woman sits near a small Christmas tree holding an unwrapped present , and wearing a lampshade on her head .
2657301826.jpg| 1| A toddler with a blue scarf wrapped on his head plays with a wooden toy .
2686849571.jpg| 3| A man in blue with a white wrap around his forehead reading a book .
2688902319.jpg| 0| A older man in a orange wrap looks into the camera on the sidewalk of a city .
2689829779.jpg| 0| A young , white boy is lying on a couch with an injured leg wrapped in a knee brace .
2712331670.jpg| 1| A woman wraps her arms around a man as he leans in to kiss her .
2718188904.jpg| 2| shirtless man with red towel wrapped around his head .
274646416.jpg| 1| Blond-haired woman and brown-haired man wrap an arm around each other .
2762301555.jpg| 1| a toddler is with wet hair stands by swimming pool wrapped in a towel .
281792349.jpg| 0| A woman with multicolored hair working in daycare has several children gathered while one of the children open a box wrapped in the comic section of the newspaper .
2827629249.jpg| 4| A young girl and a toddler are tearing wrapping paper off a present .
2844963839.jpg| 2| The men in the Gators helmets have their arms wrapped around each other .
2847553486.jpg| 1| A group of people carrying something wrapped in an american flag .
2858408189.jpg| 0| A woman with a white blanket over her head is holding a baby wrapped in a blue , pink , and yellow blanket .
2873065944.jpg| 1| A football player has his arms wrapped around the person holding the ball .
289560545.jpg| 4| Baby wrapped in soft , pink onesie lying in leaves .
2897990634.jpg| 1| A man wrapped in a cloth with shorts and sandals is walking up a stairwell .
2915718100.jpg| 4| Several men wrapped in orange cloth looking towards boats .
2920005017.jpg| 0| A man with a towel wrapped around his waist sits in a sauna with the light on .
29320312.jpg| 0| An adult is feeding a little girl a foil wrapped burrito .
2932395753.jpg| 1| A man in a blue long sleeves shirt and cloth wrapped around his head , getting ready to smoke .
2937312269.jpg| 0| A band of asian students with different instruments wearing a white uniform with a yellow tie around the waist and a red tie across the chest with either a white head wrap or a red hat with a long white tassel .
2967116678.jpg| 4| A young girl unwraps a box .
2997483933.jpg| 1| A little boy sleeping on a striped couch while wrapped in a white blanket .
3018895758.jpg| 4| A nurse preparing to wrap a newborn baby up .
3031071921.jpg| 4| men are wrapping and packaging some cloth .
3086848252.jpg| 2| A man in a collared shirt holds an unwrapped Christmas gift .
3103248445.jpg| 2| A balding man kisses a very small baby wrapped in a blanket .
3103292929.jpg| 0| An unshaven man looks down at a blanket wrapped baby in his arms .
3106257008.jpg| 1| An older man holds a crying baby boy and a wrapped Christmas present .
3123651135.jpg| 0| A man sitting at a table looking at a woman , who has a hat on , which has a handkerchief connected so it may wrap under her chin , and the woman is working a food stand made of wood .
3153835274.jpg| 0| An older woman in a blue shirt and colorful scarf admires a half-wrapped claw hammer .
3168360695.jpg| 0| A young boy in green Christmas print pajamas unwraps a gift while a man with a gold wedding band and green sweatshirt assists him .
3169174852.jpg| 1| A young child in a striped shirt unwrapping a gift .
3169199340.jpg| 0| A young boy in Christmas-themed pajamas unwraps a gift and plays with other gifts while family watches him .
3179294878.jpg| 2| A small child in red pajamas stands on top of a wrapped present .
3183195653.jpg| 1| Woman with red headwrap at a market with a woman with a brown headwrap .
3184031654.jpg| 4| Two women in head wraps .
3206326389.jpg| 1| Women in headwraps are gathered together , speaking emotionally .
3236892217.jpg| 0| A woman with brown hair is standing behind a counter holding plastic wrap .
3247693965.jpg| 0| A dog wrapped with straps is walking away from a red tray holding a bag .
3288203502.jpg| 1| A female with red-hair wraps her hair in plastic .
329832952.jpg| 0| Two young girls wrapped in holiday garland pose for the camera .
332124056.jpg| 1| A man and woman and two small children are sitting in the floor with wrapped Christmas presents .
3321516504.jpg| 1| Man sits on sofa holding a sleeping baby wrapped in a blanket
3344948183.jpg| 0| A woman with a black sweatband is wrapped in a blue , red and yellow blanket and is smoking .
3364247489.jpg| 4| Two women wrapped in robes lay on a couch .
3367758711.jpg| 4| Two women in headwraps are hurrying past buses .
3372351555.jpg| 1| A man wearing a hat and a woman in a navy shirt are putting items wrapped in fabric on a pulley system .
3381392182.jpg| 3| A person wrapped in wrapping paper and tinsel .
3383037991.jpg| 2| The large brown dog sat on the bed surronded by wrapping paper .
3393274529.jpg| 1| Man in dark colored clothing holds bouquet of paper wrapped flowers .
3397433780.jpg| 1| A man , with a blue wrapping around his foot , is about to kick another man , with a red cloth hanging from his belt , in the head .
3410519828.jpg| 3| A pigeon lurks near a man sleeping with a red bandanna wrapped around his face .
341235582.jpg| 0| A small girl with blond-hair wrapped up in a pink care bear blanket surrounded by torn Christmas wrapping paper .
345326388.jpg| 0| One man clothed in robes and white head wrap rows a blue and red boat while another robed man stands on bow of the boat retrieving a fishing net .
347186933.jpg| 3| A woman hanging from a tree , her leg wrapped in cloth .
3497805015.jpg| 0| An older woman with a stroller and a red jacket wrapped around her waist looking at an amusement park ride .
3509611207.jpg| 2| Three girls with head wraps carrying objects while standing on unpaved surface .
3512033659.jpg| 4| A crowd of Hindu women in headwraps .
3565840872.jpg| 3| Two women with their heads wrapped in cloth are checking out at the store .
3597687059.jpg| 0| A woman wearing a scarf is holding a gift wrapped in blue character themed wrapping paper .
3686889377.jpg| 2| A woman with a red tank top and colorful head wrap washing dishes .
3691085094.jpg| 0| Two persons , wearing martial arts black belts at their waists over their white clothes fly through the air horizontally towards the floor with their arms wrapped around each other .
370256193.jpg| 0| Wearing a brown jacket , multicolored scarf and purse , an adult female walks along a sidewalk while looking downward next to a green pole with plastic wrapped around it .
3706019259.jpg| 0| A couple , who appear to be Indian or Pakistani , walk on a path beside a body of water , the mother carrying a child in a diaper ," the father wrapped in a blanket with the logo of the humanitarian organization "" Save the Children . """
374437961.jpg| 1| A woman is smiling and has her arms wrapped around a man wearing a gray sweater .
3782318456.jpg| 0| Five men in asian inspired garb wrap clothes around their heads while people converse in the background .
38541144.jpg| 0| Young male in a white karate outfit with a blue belt wrapped around his waist performs karate moves in front of the judges of the competition .
3873835329.jpg| 2| A firefighter is wrapping caution tape around a light post .
3908650006.jpg| 0| Closeup of a man holding a baby , wrapped in a blue blanket , to his shoulder .
3912412153.jpg| 0| A large man sits in a chair with a box wrapped in paper sits on his lap and a child nearby plays with paper .
3914087743.jpg| 4| A cowboy wrapping up his arm with a bandage .
3915181249.jpg| 0| A man with cloth wrapped around his head is sitting on a miniature wooden wagon .
3961790757.jpg| 0| A man with white hair and a full beard is eating food wrapped in aluminum foil .
3972665750.jpg| 2| 5 woman stand outside wearing saris and hair wraps while one writes on her clipboard .
3972668464.jpg| 0| A cultured woman with a head wrap is checking a paper while standing in the dirt .
4049278176.jpg| 0| A black man in a tan sarong and head wrap , works outside shoveling a sand from a yellow truck on to a road , he is surrounded by green grass , shrubs , and plums of dust .
4105382797.jpg| 0| a woman in a orange and brown wrap over her green shirt shovels a brown material into lines on a cement pad .
4122674603.jpg| 1| A Native American person with missing teeth , a red hat and a red wrap or blanket , is smiling .
4146540950.jpg| 2| A man wrapping a gray collared shirt over his head while a friend holds up a mobile device .
418310966.jpg| 0| A new baby still in the hospital , wrapped in blanket , sleeping .
4183630653.jpg| 0| A woman wearing a striped wrap is bent over in a cornfield while looking at the camera .
4195953639.jpg| 2| A child is wrapped and bundled for cold weather in a child carrier sitting on the ground .
4208402957.jpg| 1| A man and woman in military garb at the back of an open van ; the man is carrying wrapped christmas packages .
4225248313.jpg| 1| Two children in sweaters are holding a baby wrapped in a blanket that is crying .
425518464.jpg| 2| Woman wrapped in blanket sits on bench and reads in park .
4265333893.jpg| 1| A lady sitting wearing a red jacket blue handkerchief wrapped around her head selling bags of goods on the street .
4329269128.jpg| 1| Two girls laugh smile as they wrap brightly colored cords into each other 's hair .
4361644383.jpg| 0| A group of people are walking down the sidewalk in the snow all wrapped up because of the cold weather .
4362931553.jpg| 2| A girl with a towel wrapped around her head looking into the camera .
4376216802.jpg| 0| There is a woman with a purple wrap on who is making quits the old fashion way with a loom .
4390269250.jpg| 0| There is a little asian girl with black hair and a white sweater eating a strawberry her eyes are cocked to the right and her fingers are wrapped around the long green vine that 's coming from the fruit .
4410657516.jpg| 3| A person wrapped up in winter clothing jumps up with colorful balloons
4436084437.jpg| 0| A brunette in a shirt plaid shirt and knee-high socks , with green beads wrapped around her wrists .
4447650454.jpg| 2| A tree whose truck in wrapped in red coverings in front of a tall white building .
4451427540.jpg| 2| Young woman wrapped in blue and red towel after swimming .
4463772983.jpg| 0| An old woman sits on a red seat , crafting small wrapped items from fabrics in a blue tray .
4473275393.jpg| 1| A man in an orange wrap clothing is being driven by a man on a motorbike .
4546261932.jpg| 0| A man wearing a black T-shirt and a tan jacket wrapped around his waist pulls a wheeled gray and black bag as he walks next to a building that has large glass windows .
455500368.jpg| 1| A young woman is reclining in a sauna wrapped in a white terry cloth towel .
4603716254.jpg| 2| A man with a white towel wrapped around the lower part of his face and neck .
4612142419.jpg| 0| A short-haired man wearing blue jeans with a jacket wrapped around his waist is helping a small boy with a cap to cross a body of water on small stepping stones .
4616529073.jpg| 0| A man is standing on the sidewalk publicly advertising a religious message via a sign wrapped around his neck .
4631033411.jpg| 2| A girl in a red top and wearing a brown head wrap is sitting next to a wall , facing away from the camera .
4683273591.jpg| 0| A woman in white with a pink wrap around her head painting the face of a young girl .
4700236014.jpg| 0| A woman wearing a blue and white floral patterned tank dress makes a funny face as she attempts to eat some type of foil-wrapped food .
4707440120.jpg| 0| A blond woman with a fur wrap around her shoulder and a glass of wine in front of her is getting something painted on her arm by a man .
4717261252.jpg| 0| A woman wearing a lot of makeup has just finished eating something and had a white and red wrapper in her hand .
4717515747.jpg| 1| A man with a white scarf wrapped around his head cooks at a street fair .
4728200662.jpg| 0| The lead singer of a band is wearing white glasses while standing in front of a microphone stand with a white boa wrapped around it .
4733508705.jpg| 1| A woman wearing a tan hat with a red sweatshirt wrapped around her shoulders stands in the middle of a small crowd .
4753637884.jpg| 4| A man walking , wrapped in a Canadian flag .
4788709442.jpg| 4| A bike wrapped up in a tree .
479472539.jpg| 0| Two Muslim men wearing head wraps walking in a city .
4795096132.jpg| 2| An older woman walking along a parking lot wearing a wrap around her head .
4802552043.jpg| 2| A man in a black head wrap is standing against a blue wall .
4811312839.jpg| 2| A man in an orange shirt and jacket is standing next to a mannequin wrapped in plastic .
4837972719.jpg| 0| A girl with a red scarf wrapped around her neck is walking down the road carrying a white bag .
4846306430.jpg| 0| A woman lies naked , wrapped in a net on top of a rock by the ocean .
4851225205.jpg| 0| An African-American young man is sitting on a fence railing with his legs wrapped a young woman , as another young man looks on .
4858173106.jpg| 1| A blond woman wearing pink holds an infant wrapped in a blanket .
4858175898.jpg| 0| An older many in a navy blue polo shirt holds an infant wrapped in a blanket .
4858186528.jpg| 0| A person touches a baby , wrapped up in a blanket , with several pieces of medical equipment attached to its head
4860408066.jpg| 3| Several women are wrapping themselves up in pink , blue and white ribbon .
4862282021.jpg| 0| The man in the red coat holds a Subway wrapper close to his face .
4865409871.jpg| 3| A baby wrapped in blankets is tucked into a metal wagon .
4869523413.jpg| 0| Two girls sit on blue folding camp chairs , with the girl on the right smiling and the one on the left flashing a peace sign ; in the foreground , food wrapped in foil cooks on a barbecue grill .
4906688039.jpg| 0| A man wrapped up in a white mask , glasses , and a hat is working with a tool on a metal plate .
4914943385.jpg| 3| A woman in a redhead wrap is sitting on a bridge .
492104206.jpg| 0| A person sits on a bus stop bench wrapped in a blanket and wearing a hat with some packages next to them .
4931775347.jpg| 0| A woman on a pay phone wearing a red skirt , white shirt , and a blue sweater wrapped around her shoulders .
495014499.jpg| 0| Man standing on a street with a green red and yellow flag wrapped around him and a cap on his head .
4953270033.jpg| 0| A man in a blue shirt walks a bull with rope wrapped around its horns .
4961047341.jpg| 1| A group of five girls in pink wrap dresses , tribal headbands and face paint rest behind a cargo truck .
501320769.jpg| 0| A young black child is wrapped in a white robe and standing in a bathroom doorway .
501960549.jpg| 0| A woman wrapped in a large piece of cloth peeking her head out of 2 large wooden doors .
5024063793.jpg| 0| A cook in a restaurant wearing a colorful hat , standing in front of a lamb rotisserie , squeezes a sauce onto food wrapped in foil while another man watches with his back turned .
5060753.jpg| 1| A girl wearing a paper hat opens a present wrapped in pink wrapping paper while others look on .
5231178541.jpg| 1| There is a man wrapped in a blanket of some sort sliding down a hill that is covered in snow .
523485792.jpg| 0| A woman sits with wrapping to cover her whole body is having her head shaved by a woman in a yellow flowing top while a group of woman in the back watch .
5266194002.jpg| 1| Two women stuff filing in wrappers while a man wearing a blue t-shirt looks on .
5278211707.jpg| 2| A ballerina posing or dancing with a string of lit Christmas lights wrapped her .
536495604.jpg| 0| A woman in black is standing on an urban sidewalk carrying a baby in an orange baby wrap .
5435865134.jpg| 1| A skinny woman , wrapped only in a towel , sitting in a sauna .
5496383618.jpg| 0| A muscular man arches backwards while supported by a black chord which wraps around his body .
5508398736.jpg| 0| A bunch of people are watching a man with his left arm wrapped around the legs of his downed , struggling wrestling opponent on a blue mat .
5593628279.jpg| 0| A youth with musical tattoos and a black shirt stands open mouthed holding a microphone wrapped with bright green tape next to outstretched hands .
6296342997.jpg| 0| An elderly couple in a prayer mood squatting on a wrapper laid on the ground with a bushy background .
6483566713.jpg| 4| Two girls wrapped in a blanket .
6503917545.jpg| 0| A male child with blond-hair , green eyes , and a sticky looking mouth wearing a multicolored t-shirt has his hand wrapped around a popsicle stick and is chewing and has it inserted into his mouth where you can see 4 bright white teeth on the bottom row .
6758527995.jpg| 1| A young man and a young woman with a wrapped knee injury dance together on a dance floor surrounded by onlookers .
6877046697.jpg| 1| A person sitting on the corner , wrapped in a blanket in front of a metal door .
696663662.jpg| 0| Child in blue shirt with eye closed and left arm wrapped with ace bandage and propped on a white pillow .
7009203493.jpg| 3| A man wearing a kilt leans against a poll holding a large wrapped item .
7300199078.jpg| 0| A young boy holds a small , dirty girl on his lap while wrapping her in his jacket .
7573421864.jpg| 0| A young , brown-haired girl in a Hello Kitty shirt holding a bouquet of flowers wrapped in leopard print paper
7610186624.jpg| 0| A woman in a gray and blue shirt smiles as she unwraps and cuts into a calzone .
7646106950.jpg| 0| A white woman in a blue uniform is wrapping a bandage around an arm of a black woman who is wearing a blue hooded sweatshirt .
7648640466.jpg| 0| A performer wrapped in tight fabric hangs by her ankle from a scaffolding underneath a blue sky .
7676512794.jpg| 0| Two men in pink short-sleeved shirts and white head wraps are in a commercial kitchen , one working and the other smiling as he looks on .
77417252.jpg| 0| A small Asian girl is holding a large pink pale of individually wrapped red roses .
77740577.jpg| 2| A man and woman rest on a sofa , with holiday wrapping paper beside their feet .
787907341.jpg| 1| A black man in a blue shirt hold his baby in a blue wrap .
8086165175.jpg| 3| A young woman in a blue wrap around scarf sitting in a museum .
8162775105.jpg| 0| A woman on stage lit from behind standing in front of a microphone wearing a gray top and black pants with a red , white , and blue flag wrapped part way around the lower half of her body
