image_name| comment_number| comment
4825995199.jpg| 0| A man wearing a striped shirt carried a white scroll as he walked down the street .
4826547083.jpg| 0| A woman wearing sunglasses , white shorts and gray t-shirt is walking her dog and talking to another woman pushing a stroller .
4829869876.jpg| 1| A young boy in a cowboy hat and a blue jean jacket sitting in a stroller .
4830504677.jpg| 0| A young couple walking by a mural of an ice cream parlor that is painted on a roll up door in a graffiti covered building .
4832372673.jpg| 1| A tourist with a backpack takes a stroll on a narrow cobblestone street .
4834896209.jpg| 2| Several people stroll through a park with many trees .
4835236623.jpg| 4| People are strolling across some stores .
4837825680.jpg| 0| A man wearing a black shirt and red trousers is rollerblading toward a crowd of people also on rollerblades .
4850355890.jpg| 0| A young man wearing a black shirt and a young lady also wearing a black shirt are rollerblading outside .
4850651669.jpg| 0| A young girl with a fake mustache and face paint is riding on rollerskates while talking on her cellphone
4851908792.jpg| 0| Two police officers on rollerblades , standing near a man in baggy clothing outside .
4855964619.jpg| 1| Two men and a woman standing behind brown one man band rolling appliances
4857180539.jpg| 0| The little boy with his tan pants leg rolled up seems to be occupied by looking down at his shoes as his mom sports a beautiful black purse and pink top with matching head cover .
4859795801.jpg| 0| A crowd gathers in the street to watch a performer roll a chrome ball over his body .
4859978011.jpg| 0| A woman in a purple blouse and big black hat strolls down the street while listening to music on her mp3 player .
4868582683.jpg| 0| A man in an orange shirt and bathing suit rolls in a plastic ball through water .
4870785283.jpg| 4| Strolling down path to nowhere .
4873072568.jpg| 0| A caucasian woman wearing glasses is holding a darker-skinned little boy outside of a school and both are rolling their tounges .
487652642.jpg| 1| A cute child strolls trough the park in a Radio Flyer wagon .
4882763253.jpg| 0| A city street with market vendors and children being pushed in strollers with a large cathedral in the background .
4886280540.jpg| 2| A woman is being controlled like a marionette by a guy standing on stilts .
4892691213.jpg| 0| A blond-haired woman and her friend are buying some items from the man in the white t-shirt while the other blond woman stands near the baby stroller .
4893518190.jpg| 1| A man in a business suit strolls beneath a covered walkway .
4894954666.jpg| 0| A couple takes pictures in the park as others stroll by and enjoy the area .
4897479032.jpg| 0| A shirtless man is painting over a graffiti filled wall with a paint roller .
4901197698.jpg| 0| A large group of people riding a green roller coaster on its downhill slide while on a yellow rail while over a green algae ridden pond or body of water .
490411016.jpg| 0| Three guys standing together with roll around luggage on a brick road in front of very old church type brick building with wood door .
4905777485.jpg| 1| White women with blond-hair with rolling stone shirt laughs with dark-haired woman wearing a red skirt .
4910374312.jpg| 0| A toddler , whilst sitting in a stroller , is perplexed by a Korean child 's book .
4910375558.jpg| 1| Women and children with strollers in a library .
4910842410.jpg| 3| Pedestrians stroll down gardened walkway .
4910904772.jpg| 1| A woman in a blue skirt pushing a stroller along a tree lined street .
4914433221.jpg| 0| A child wearing a red shirt is rolling a bowling ball down a lane .
4915118332.jpg| 0| A woman is pushing a child in a stroller of some sort while many people ride bikes behind her .
4921249499.jpg| 0| A man sitting with his head down on his arm and a roll of toilet paper and a cellphone sitting beside him .
4923964340.jpg| 3| People riding an old looking trolley .
4931927819.jpg| 3| Two old people strolling the street .
4932212272.jpg| 0| Some people on motorcycles are riding down the road in the same direction as a trolley car .
4935686055.jpg| 2| In a group of people on a street , three preteen boys pose with their shirts rolled up .
4935761859.jpg| 1| Two men and a woman stroll down the city street past storefronts .
4936286470.jpg| 0| Two boys with their shirts rolled-up are standing outside and there are some other people behind them and in the background .
4936351064.jpg| 4| People strolling a city street at night .
4938457809.jpg| 2| The man ponders his situation during a stroll through the yard .
4940539020.jpg| 0| A couple strolls up the sidewalk and the newspaper machine sits on the side of a building .
4940658327.jpg| 1| A man pushing a stroller is walking past two erotically dressed mannequins that are in a store window .
4945148977.jpg| 0| young people troll or sit and talk in a clear evening in a city with high rise buildings .
4947861901.jpg| 0| A woman pushing a baby stroller is holding the hand of a young child with a white backpack .
4948910881.jpg| 2| Woman walking on a sidewalk and pushing a stroller .
4951841137.jpg| 0| There are a few people strolling along a large oceanside walkway .
4955130534.jpg| 0| A young woman , wearing a red shirt , caresses a baby in a stroller on a sidewalk
4956587131.jpg| 0| An elderly lady strolls with her walking , passing graffiti along the way .
4957461228.jpg| 4| A bride and groom crossing over some trolley tracks .
4964920809.jpg| 0| A crowd of people ," many wearing blue "" LABOR DAY 2010 "" shirts walk down a street ", the 3 people in the foreground include a woman with a stroller , and a man with a young boy on his shoulders .
4967971683.jpg| 0| A woman with a black hat and sunglasses strolls through the street carrying a brown purse .
4968291657.jpg| 0| A woman in a blue hat is talking to a baby in a stroller , while a small boy in is walking away .
4972166251.jpg| 0| A man using a parachute controlled device going into a sunset background on a beautiful partly cloudy day .
4975221752.jpg| 1| A man in a blue shirt and black pants strolls by an irish pub .
4981438692.jpg| 0| A middle-aged couple is dancing , the man is wearing a white dress shirt with the sleeves rolled up and the woman is wearing a black dress .
502529086.jpg| 3| A man sits in a chair watching people stroll by .
50735095.jpg| 1| Children playing with a remote controlled car in a road .
508261758.jpg| 0| Three teenage girls rolling all over each other on the ground , laughing
5130882483.jpg| 0| A teenage male in jeans and gray shirt is mid-jump while rollerblading with red skates .
515664903.jpg| 0| A man is pulling his rolling suitcase while holding a brown jacket and walking past a window of red flowers .
521297970.jpg| 3| An older lady is making yarn and it rolling it into balls .
522652105.jpg| 0| a young girl with a white shirt and pink shorts rolling around in some plastic multicolored balls
5246531712.jpg| 1| Several people are playing hockey on rollerblades in a fenced in area .
5246912916.jpg| 0| A man wearing a black backpack and holding a rolling suitcase is approaching an escalator .
524787268.jpg| 0| Two men sit on a park bench , watching the river roll by , as a dog stands off to the side .
5250530592.jpg| 0| Yellow dough is rolled out with a rolling pin .
5261090459.jpg| 2| An older man working in a farm house , unrolling some string .
526328385.jpg| 0| A red and yellow roller coaster car on a white track is about to go down a hill with many passengers raising their hands .
5264507624.jpg| 4| Two trolley repair men are fixing a line .
526847964.jpg| 1| Two men , one being John McCain , and one woman sitting in red rolling chairs next to a white sign with a blue letter D and a number 5 on it .
5270958162.jpg| 3| A small group is waiting for the trolley to reach the bottom of the hill .
5270960438.jpg| 0| a green and white trolley car with an advertisement of coffee on the side and front of it in a city .
5279140646.jpg| 0| A woman is smiling at the bowling alley while a woman in the background is preparing to roll the ball .
529114761.jpg| 0| Two lone men in dark clothes stroll separately across an otherwise deserted brick plaza .
530465741.jpg| 3| Two hikers stroll up a hill to take photographs .
5316470320.jpg| 0| A teenage boy is attempting to rollerskate down the handrail on a set of yellow stairs while a woman and two children look on with shocked or anticipatory faces .
534056823.jpg| 3| A woman poses for pictures with a statue of a troll .
534153791.jpg| 0| A yellow , suspended roller coaster on a yellow track is midway through a loop .
5341921763.jpg| 0| A bunch of young children are riding on the back of a trolley while being carried by a black and white horse
5392145976.jpg| 0| A woman rollerblader with knee and elbow pads and a helmet jumping into the air .
540746143.jpg| 0| A toddler sucks his finger while he sits in a stroller ; the stroller is indoors and the safety harness is not fastened .
5421108099.jpg| 0| Two boys watch are watching their own bowling balls roll down their respective lanes , towards the pins at the end of the alley .
543797471.jpg| 0| A young man waits on the steps of a stationary trolley in Berlin .
5453323381.jpg| 2| Three men and a boy ride an orange roller coaster .
5459493511.jpg| 2| A skateboarder in a white t-shirt and blue cap rolls down the street .
5476674072.jpg| 0| Two men in a bakery , one in a black cap and one in a white cap , are rolling dough out on a wooden table .
5483599902.jpg| 1| A man selling different types of rolls and bread at an open market .
5491402223.jpg| 0| In this photo there is are two men one in a blue shirt blue pants white hat and sunglasses the other has on pants that are rolled up just under his knees and a black shirt on they are both on a boat at sea it looks like the man with the black shirt is looking for something while the man in the hat is handling a white rope in his hands .
5510989691.jpg| 0| This is a well-dressed dark-haired gentleman wearing a gray suit jacket , gray trousers , black sweater and lavender tie with a mustache and goatee holding a frying pan , standing on the sidewalk in front of a roll-open garage-type door .
5518762083.jpg| 1| Two children play in the snow ; one is watching the other roll a gigantic snowball .
5519354264.jpg| 0| Two children are asleep in a two-child stroller on the sidewalk .
5615068475.jpg| 0| A red-haired woman in a tank top and rolled up jeans sits atop a large rock in a wooded park , smiling at the camera .
5645857612.jpg| 0| A woman with a gray sweater is rolling out dough on a table .
567459261.jpg| 2| Two adolescent boys are at a roller rink and one is performing a skateboarding trick .
567903453.jpg| 0| A young , male adult wearing blue jeans , a green reflective vest , work gloves and a hard hat stood between the rails of a railroad track to the rear of a white truck that is specially built to roll on the tracks .
5683406436.jpg| 0| A mountain bike rider rolls over raised logs while wearing a green helmet , white jersey and black protective pads .
5683548982.jpg| 0| A man with a guitar , he has a hat and is playing along a brick lined walkway , two children in strollers are looking on .
5691273582.jpg| 4| Man cleans roller coaster .
5694314894.jpg| 2| Two women with a shopping trolley on a moving walkway .
5708913531.jpg| 1| A guy dressed in a black shirt and white jeans rollerblading on a steel beam .
5708913719.jpg| 0| A young man wearing a hat and black t-shirt roller-blades down a rail in a park as other young men look on .
5723818088.jpg| 0| A guy in a white robe with a black cape is standing next to some rollerblades and leaning on a fence by a crowd of people .
5821273614.jpg| 0| It 's a snow day so the mother takes her little boy who is in yellow out to make a snowman , and the dog loves to roll in the snow .
5843921596.jpg| 0| Several men and women in rollerskates , with a man in the center and a woman on either side of him in the foreground .
5849278148.jpg| 2| A woman in a turquoise top talking to the conductor of a trolley near a foreign cafe .
5852667073.jpg| 0| A man in a pair of jeans and blue shirt is conversing with a woman in a blue shirt pushing a plaid stroller .
5897279071.jpg| 0| A small group of adults and children are in a room with large glass windows and using rolling pins .
5925545440.jpg| 2| A girl is painting a room red with a roller brush .
5931115247.jpg| 0| A child wearing rollerblades , knee pads , a helmet , and elbow pads is skating down a paved path .
5973476404.jpg| 1| Baseball player reaches down to retrieve a baseball having rolled near the infield .
6000340511.jpg| 0| A woman is rollerskating wearing black capri pants , a white tank top and a purple helmet while a crowd watches .
6021205363.jpg| 0| A group of women , dressed in safety gear , are on rollerskates and skating in front of a large group of people .
6082535291.jpg| 1| A group of rollerskaters skate on a patch of cement with palm trees in the background .
609358708.jpg| 1| A man in an orange jumpsuit with the legs rolled up is standing in the road with some people and outdoor awnings in the background .
6110024306.jpg| 0| Woman wearing jeans and white shirt watches as her bowling ball rolls down the lane to the pins .
6121757226.jpg| 0| Three boys in a skate park , two sitting and watching the third boy with a white t-shirt , brown pants and red rollerblades sliding down a rail .
6157355105.jpg| 2| A young women rollerskating in an empty swimming pool .
619169586.jpg| 0| A woman stands on a mountain overlooking a rolling field of trees underneath a blue sky .
6208520381.jpg| 0| A young boy in a white shirt surrounded by several other children who are rollerskating .
6213858694.jpg| 1| A roller-skating woman in red and black socks and a black shirt is elbowing another skater out of her way .
6273590324.jpg| 2| One lady focusing on her rollerskating .
6274389805.jpg| 0| A man with a red helmet is rollerblading on a boardwalk with two dogs on red leashes , a busy beach is in the background .
6282161290.jpg| 0| Two men on rollerskates are facing one another as others are passing them or coming upon them as an audience watches their interaction .
6282165546.jpg| 0| There are people on rollerskates with one player charging and another player blocking .
6291644661.jpg| 0| Two teams of men ( one wearing green uniforms and one wearing black and white uniforms ) are playing a sport on ice wearing rollerskates .
6296537344.jpg| 0| Two young men play roller hockey on an indoor rink while a referee looks on near the goal net .
635444010.jpg| 1| A large woman with a pink feather boa strolls down the sidewalk .
6400126225.jpg| 0| A man in red pants and a white shirt rollerskating with a woman in a purple and white dress in front of an audience .
640290739.jpg| 2| People in orange shirts roll carts while people watch them .
64327797.jpg| 1| A young boy on rollerskates jumps over a blue barrel .
6463107815.jpg| 0| Wearing a helmet with a reindeer on it , as well as protective knee and elbow pads , a woman in the roller derby crouches and waits .
6651304481.jpg| 2| Birds flying above the rolling waves of the ocean .
6773823152.jpg| 0| These two roller derby teams are competing for the most points , the blue team is in the lead currently .
6788100307.jpg| 1| A man wearing an extremely short necktie , suspenders , and brightly colored striped socks stands on a stage , doing something with a contraption involving objects which roll back and forth on strings .
6845273916.jpg| 0| A young boy around the age of 10 , is bowling and has just rolled the bowl down a lane .
6847163438.jpg| 0| There are seven women competing in a roller derby contest with a referee in the background .
6869199530.jpg| 0| A woman wearing a cute hat with ears rolls a bowling ball down the lane .
6888444346.jpg| 0| Three roller hockey players chase after a ball as an excited crowd watches on .
6888808971.jpg| 0| A mailman with a rolling mailbag smiling at the camera in front of a wall topped with an iron decorative fence .
6907873186.jpg| 2| Two police officers are patrolling on their horses .
6927003662.jpg| 0| A man wearing a thick-striped orange shirt , bandanna and dreadlocks at a bowling alley is in a pose as if he just rolled a bowling bowl .
6927291004.jpg| 1| A rock and roll band performing in front of enthusiastic fans .
6934906804.jpg| 0| Two women competing in a roller derby , one wearing and orange shirt , the other black , but both pushing each other as they turn the bend .
6955501424.jpg| 2| A man on a mountain bike is rolling down a mild hill .
6960234433.jpg| 0| A woman wearing a blue jacket and a man in a black shirt are unrolling brown paper on hay .
6962167854.jpg| 0| Six women in what appears to be a roller derby match , with bleachers and onlookers in the background .
6966309732.jpg| 0| Three men , two of them on one soccer team wearing blue , and one man , from the other soccer team wearing red , with the ball in play , controlled by a man in blue .
6986780079.jpg| 0| A female skater dressed in shorts and a sleeveless t-shirt and wearing a safety helmet skates around a roller derby track as teammates observe the action in the background .
7006590104.jpg| 0| Two professional soccer players compete in a stadium on AstroTurf during a soccer match , and one player is controlling the ball while the other is running after him trying to defend it .
7007309854.jpg| 0| A child rolls a ball at a bowling pin while a woman helps another child arrange some sort of symbols on the concrete ground next to the first child .
7032796325.jpg| 1| White male playing guitar on live on stage in a rock and roll band .
7043828775.jpg| 1| An older gentleman enjoys a scenic stroll through the countryside .
7062794595.jpg| 0| An older man , who seems to be a community leader hands a young buddhist a scroll while others wait in line for their turn .
70758995.jpg| 0| A young child leaning forward asleep in a stroller with a butterfly on their head .
7108301125.jpg| 0| Several women are playing some sort of sport , they are wearing rollerblades , and there is a referee onlooking them .
7125381623.jpg| 0| Three males are playing a competitive game on rollerblades , while being watched by players on the sidelines .
7127451781.jpg| 2| The boy is licking the spoon to taste the sweetness of the rolls ' toppings .
7162017948.jpg| 1| A woman and man cut rolled up dough into small pieces .
7184912719.jpg| 1| A remote controlled children 's toy motorboat flies a kite under a bridge in the water .
72090503.jpg| 3| Three people and a stroller are beside a road .
7271256962.jpg| 0| A woman running in a purple shirt pushes a stroller with her child in it on a sidewalk with neatly cut grass on either side .
7306334328.jpg| 0| A man wearing a red garment is hunched over another man who has fallen and is rolling on the grass while other people are in visible in the background .
733411277.jpg| 1| A girl with black hair and jeans is rolling a ball to knock down three pins in a bowling alley .
7423137882.jpg| 1| A man in rollerblades with knee pads and a helmet on does a trick in the air .
74244744.jpg| 0| A male bartender dressed in all black with his sleeves rolled up to elbow height making a drink in a martini glass .
745966757.jpg| 0| A young girl with rollerblades and green foliage in the background .
74736854.jpg| 0| A couple bows their head as a man in a decorative robe reads from a scroll in Asia with a black late model station wagon in the background .
7525845590.jpg| 3| Man wearing jeans rolls a bowling ball down the lane .
7576330234.jpg| 4| guy does rollerblading and loves it
7602525254.jpg| 1| A father in a black hoodie with his son and a baby stroller at a corner are lying on top of a blue blanket .
7632093958.jpg| 0| There is an oriental woman leaning out of an open red trolley car waving at the person taking her picture while a little girl is standing and watching at the side .
7633434714.jpg| 0| Orange steamroller crushing sub-pavement while doing street repair on a closed and torn up city street .
7638876050.jpg| 1| A rock and roll concert ensues as a guitarist steals the spotlight .
7649202360.jpg| 0| A boy with a white shirt , jeans and rollerskates skating down a highway .
7729758628.jpg| 0| A number of young people are having fun in a pool trying out their log-rolling skills .
776421378.jpg| 1| Several people ride on camels as they take a leisurely stroll on a dirt road .
7854434658.jpg| 0| A boy and his younger brother taking a stroll through a grassy and forested field .
7879838102.jpg| 2| A crowd of people closely watching a rollerskater ;at the summit of his run .
8008888211.jpg| 1| Crowd cheerleaders dressed in red , white , and blue smile as they pass out rolled up t-shirts to a full stadium of people .
8022825509.jpg| 1| Two women roller derby players , competing in front of a referee who is dressed in a black striped shirt .
8052328504.jpg| 0| A football player holding a football rolling on the field with three other football players watching him .
808877347.jpg| 3| People are strolling around a market .
8109932996.jpg| 3| A band is performing at a rock and roll concert .
8119830947.jpg| 3| A cat sits in a trolley cart while people pass on the street .
8144714172.jpg| 2| The bearded man in the trolley is applauding to his fans .
8189395281.jpg| 0| A roller derby girl in full regalia - black helmet , tank top , pads , and four wheel skates - maintains her balance as she races down the track .
8190802361.jpg| 4| A boy on a scooter rolls by as two men photograph a skateboarder .
836768303.jpg| 4| Two children and a dog are in a bedroll .
840202638.jpg| 2| A rollerblade athlete takes a big jump while performing a trick .
8443156.jpg| 0| A child dressed in blue jeans with rolled cuffs and a pink hoodie waits outdoors at the foot of the stairs with an axe .
84514007.jpg| 0| A person is standing at the top of a large , rolling sand dune .
86120569.jpg| 0| A white wedding style cake topped with white roses sits atop a stainless steel table while a man decorates an egg shaped cake with a scroll pattern in the background .
95021247.jpg| 0| A woman is rolling up a large amount of wool on a tarp that is in front of an animal pen .
952262215.jpg| 2| A young girl in a pink jacket is carrying a rolling luggage bag
96399948.jpg| 4| two men roll a huge ball .
996089206.jpg| 1| A elderly man holds a can behind his back as he strolls by a beautiful flower market .
99679241.jpg| 0| A gray bird stands majestically on a beach while waves roll in .
997338199.jpg| 3| a woman behind a scrolled wall is writing
998845445.jpg| 1| A young man hanging over the side of a boat , which is in a like with fog rolling over a hill behind it .
