image_name| comment_number| comment
7725130978.jpg| 1| A member of the women 's Austrian beach volleyball team attempts a spike against China at the 2012 Olympics .
7734754954.jpg| 1| A man attempting to hit a pool ball , while other men watch .
7752899970.jpg| 1| An adult baseball player sliding onto the base while his opponent attempts to tag him .
7754828606.jpg| 0| A male volleyball player in red attempts a hit against two blockers in blue and white , during an Olympic indoor volleyball match .
7757242158.jpg| 0| Three men playing rugby on a green grass field chase the ball ; while number six of the team in black shirts attempts to make a tackle and has assistance coming from his teammate with red-hair , number thirty of the opposing team attempts to field the ball while other members of the teams look on in the background .
7757245162.jpg| 3| A defender attempts a tackle in rugby .
7778073672.jpg| 2| a female throws a frisbee while another attempts to block her toss .
77977382.jpg| 0| Seated in the company of adults , a little girl on a carpet attempts to place objects of different shapes onto cutouts on a board .
7812612114.jpg| 1| Two green shirted soccer players attempt to secure the soccer ball from a player dressed in white .
7812870472.jpg| 0| A stand full of people watch as the ref attempts to follow two players , the player to the left is number 12 and plays for a Canadian team which sport white colors , the other player ,  3 and wears lime green and light blue .
7863346994.jpg| 3| Men playing basketball , the guy with the ball is attempting a layup .
7920471750.jpg| 2| A player slides in to home as the catcher attempts to stop him and the umpire closely watches .
7998492801.jpg| 1| A football player attempts to run around an on coming tackler from the other team .
8081695451.jpg| 3| A baseman tags out a runner that is attempting to slide into the base .
8083076280.jpg| 1| Two male soccer players on opposing team attempt to jump and knock each other over .
8110271708.jpg| 3| A soccer player is attempting to score a goal .
8112722587.jpg| 3| A tennis player attempts a backhanded shot .
8126936141.jpg| 0| Two members of a volleyball team jump up in an attempt to block the ball that was just hit by the opposing team 's player .
8132535710.jpg| 3| A basketball is in progress with a man in white and gold attempting to block a shot from a man in black .
8170798749.jpg| 0| A person wearing a blue shirt attempts to catch a wave while surfing .
8173213463.jpg| 0| A man trying to stand in his motorcycle as he attempts for an incredible trick .
8198089950.jpg| 3| Singer on stage attempts to get the crowd involved at a concert .
8211471228.jpg| 0| A basketball player approaches the net in the air in an attempt to perform a slam dunk over the reach of his opponent .
8234387593.jpg| 0| A player in a white and red uniform goes for a layup , while the player with a red and black uniform blocks the attempted shot .
83334342.jpg| 0| A young woman in a turquoise , green and white bikini is attempting to hit a volleyball as several onlookers watch .
85519095.jpg| 2| The little boy lifts his leg and swings the bat in an attempt to hit the ball .
863901193.jpg| 2| A man attempting to fix a broken concrete wall .
897406883.jpg| 2| A toddler in dirty jeans attempts to pull a younger child in a wagon .
93307139.jpg| 1| A black-haired woman wearing glasses attempts to eat a pile of cookies .
950273886.jpg| 0| A man in a red shirt attempts to climb a rock .
963730324.jpg| 2| A young boy attempts to push the Walmart shopping cart for a man .
