image_name| comment_number| comment
5911782297.jpg| 1| A man wearing a traditional Indian costume demonstrates dance moves .
5930681458.jpg| 3| A contortionist is doing a move on stage for people .
5971287030.jpg| 2| A teen contemplates his move with his tokens at an arcade game .
5981613590.jpg| 2| A girl in red with a white tutu is performing a dance move while 6 other girls stand beside her .
6034236935.jpg| 3| A man in all black clothes does a breakdancing move .
6085363550.jpg| 1| A jubilant crowd dressed fabulously in purple red and yellow-gold move in step on a metropolitan street .
6118635937.jpg| 1| A game of Carcassonne is being played on a table while one guy considers his move .
6141300695.jpg| 0| A soccer goalie in red and green attempts to move the ball out of range of a player in red as the goalie has possession of it in his hands .
6175408029.jpg| 0| One chef with blue oven mittens on both hands and a chef hat on his head making room for food he just removed from the oven
6177158223.jpg| 1| Three men and a caddy play golf , getting ready to move onto the next hole .
6204719881.jpg| 0| In the foreground , a soccer player wearing orange and black moves to intercept two players wearing white uniforms as they run towards the camera in pursuit of the soccer ball while in the background a man in a blue soccer uniform looks on .
6208991202.jpg| 1| Two men making dance moves as a woman films the event in the living room of a house or apartment .
6307281128.jpg| 1| A man in black and white holding a woman dressed in pink doing a dance move .
6321472404.jpg| 1| The Houston Texans quarterback holds a football against the Minnesota Vikings while his running back moves towards the ball .
6333818443.jpg| 1| A girl wearing blue pants and a shirt with a hood is seen flying up above nearly two feet from the ground holding a glass which she has removed from the dishwasher .
6378330987.jpg| 1| Construction workers stand in a street attempting to move bricks .
6408404779.jpg| 0| Six athletic girls in knee pads move toward each other while spectators watch from their seats .
6431072589.jpg| 0| Person performing a move on a mountain bike with trees and hill behind him .
6444539497.jpg| 3| Men brushing ice to move the weight to the target .
6474645169.jpg| 2| A basketball player in white squats while a player in red moves toward him .
6476878653.jpg| 0| Two men are doing karate moves on each other as the younger students and others in the class observe .
6480373783.jpg| 1| A bicyclist sitting down with his bike which has one wheel removed from it .
6533917353.jpg| 3| Several kids practicing the same karate move .
6620094641.jpg| 0| Two combatants in a rugby stadium making a move on each other , one wearing green with ball and defended by ,  5 in the maroon colors .
6813886436.jpg| 0| Two joggers on opposite sides of a line of trees go down a road in fall , both dressed warmly while still in shorts to allow for freedom of movement .
6881643101.jpg| 1| A snowboarder takes flight while performing a freestyle move .
6887324285.jpg| 0| A man wearing a purple cap , yellow snow goggles , a periwinkle jacket and red backpack moves quickly through powdery snow near a winter tree .
6889322961.jpg| 0| Several children are practicing martial arts moves in a room with a red floor .
6910820943.jpg| 3| A defenseman moves in on his opponents during a professional football match .
6915657364.jpg| 1| A group of young boys look at the camera while a bulldozer moves earth in the background .
695100510.jpg| 3| A yellow bulldozer moves dirt in a rocky field .
6953548178.jpg| 2| A crowd of people watching as a large statue of a man is being moved .
6960188329.jpg| 2| Two guys working in a field with plants behind a tractor playing plants as it moves along .
699038320.jpg| 1| A man and a woman are performing karate moves in front of an audience .
7063636373.jpg| 4| The umpire is judging a baseball move to decide if there was a score or an out .
7099257151.jpg| 2| A soccer team is standing on the field waiting for their time to make a move .
7126888785.jpg| 1| A male skateboarder skates off the steps to make a trick move for the camera .
7188003.jpg| 0| An adventurous skier skillfully moved down the steep , snowy slope at a high rate of speed .
7277071054.jpg| 1| A breakdancer is showing off his moves for astonished younger boys .
7283335868.jpg| 3| A skater practices his moves on a sunny day near the water .
732001349.jpg| 4| A hiker has sat down to remove one of his shoes .
7393977570.jpg| 0| Two football players leap into the air as a player on the opposing team moves toward them .
74137268.jpg| 0| Two men wave to the camera during a winter snowfall and one is seated on a small riding lawn mower rigged to remove snow .
7422016352.jpg| 4| People in mid move while attending a dancing class .
7445213794.jpg| 0| A man in a white t-shirt and a trucker hat removes cookies from a cookie sheet at a cookie restaurant or kiosk .
7499699194.jpg| 1| A woman is participating in a workout class involving kickboxing-style movements .
7504941054.jpg| 3| Two men wearing black and white outfits are practicing a martial arts move .
7513836082.jpg| 2| A father and his daughter are riding a lawn mover down a street while dressed in American colors .
75553415.jpg| 4| A woman is throwing her hands up after a good bowling move .
7700079174.jpg| 0| A indoor girls volleyball match is behind help at the olympic games while one team performs a spike move .
7732302510.jpg| 0| A girl dives to hit a volleyball over a net while another moves into position to intercept .
7796487260.jpg| 0| A woman performing a dance move in an empty swimming pool with nike shoes on her feet .
7806900430.jpg| 1| Three female dancers are doing dance moves on stage of an auditorium .
7820686892.jpg| 1| Soccer player putting on moves that you thought could only happen in a video game .
7832183018.jpg| 3| The team swiftly moves their traditional boat down the river .
7863653456.jpg| 1| A man that has removed his shoes to kneel on a mat .
8022825509.jpg| 0| A woman in black athletic gear and a blue helmet tries to move past another woman in similar gear and a black helmet with a referee on each side of them
80282277.jpg| 1| A woman dressed in a pink jumpsuit is performing a martial arts or dance move in an outdoor covered area .
8178657114.jpg| 0| three guys are on the beach and one is doing some kind of move where is body is off the ground .
8238928026.jpg| 1| A cat is watching the movement of a young girl who is playing with a toy airplane .
8245366095.jpg| 0| A girl basketball player in a white jersey is in the process of making a move with the ball around an opposing player in a blue jersey .
8247042603.jpg| 0| Surfer performing one of his moves on a nice sunny day with a scene in the background .
86987116.jpg| 3| A man contemplates his next move as he remodels his space .
98492339.jpg| 1| A man and woman holding wooden polls and practicing martial arts moves in front of a crowd .
