image_name| comment_number| comment
1096800382.jpg| 2| Two people having a discussion sitting in a restaurant .
115125072.jpg| 0| Five Asian doctors in green hospital scrubs and masks having a discussion over what appears to be an ongoing operation .
1153857697.jpg| 4| Employees of a park discussing work .
120542286.jpg| 3| Two men are discussing sometime near a wall with some graffiti on it .
1364148267.jpg| 1| A man in an orange raincoat is discussing something with another man wearing work clothes near a sewer manhole .
1454439103.jpg| 4| Baseball pitcher and catcher discussing
1469138762.jpg| 0| Two woman are walking by discussing something seriously .
1516097777.jpg| 3| Several men on stage having a discussion .
158388874.jpg| 1| A representative of the Museum of Modern Art discussing something with a tourist or benefactor , while a woman in the background goes toward the exit .
170473787.jpg| 1| A cop is walking a crime dog to find something while paramedics discuss by their van .
175398811.jpg| 2| Two men having an intense discussion over drinks .
185961883.jpg| 4| Three men in a living room having a discussion .
1939402682.jpg| 1| 2 Men in a classroom , one standing and one sitting while participating in a discussion .
208025491.jpg| 3| Two men , one enjoying a beer , have a discussion .
2084851847.jpg| 3| Seven people sit at table in metal fold-up chairs discuss topic .
2127166904.jpg| 2| Four Walmart shoppers in a deep discussion in the grocery section .
2230140329.jpg| 2| Three gentle men having a discussion about the seminar they just attended in Florida .
2299867034.jpg| 0| Two women standing and having a heated discussion , with a group of men and women in the background standing together and talking .
2318744295.jpg| 2| People meeting and discussing different ideas while several people are on their computers .
2332806484.jpg| 1| Man and woman discussing a topic while sitting in chairs , a water bottle sitting on the table .
2347772881.jpg| 1| Two men in business suits are discussing a topic while standing up in front of a podium .
2367387854.jpg| 3| A woman sitting in chair discusses a topic into a microphone .
2408570692.jpg| 2| A group of woman discussing the artwork as they wait for the train .
241345596.jpg| 1| The Oklahoma Sooners football team discuss their game while fans cheer .
2425148763.jpg| 4| A classroom of students discussing lecture .
2447750378.jpg| 3| Men discuss something while in front of stand .
2493782805.jpg| 1| Two men in Fez 's have a discussion in an outdoor market .
2494520072.jpg| 2| Two women with short hair are discussing something .
252210274.jpg| 3| Three people discuss the setting up process for a social event .
252924535.jpg| 2| Two elderly men are discussing something out on a the sidewalk .
2534904279.jpg| 1| Four men and one women are discussing something together on a stage with microphones .
2537544551.jpg| 2| Three men are having a discussion in front of a marketplace .
2537755800.jpg| 1| Two construction workers have a discussion while on the work site .
2537824400.jpg| 2| Construction workers in neon orange vest and hard hats discussing .
2595568972.jpg| 2| People are standing and discussing in a road near a bus .
2638177115.jpg| 1| A few soldiers have a discussion while onlookers stand nearby .
264460711.jpg| 0| A group of men and women are having a discussion in a restaurant .
2661641497.jpg| 1| Two men have a discussion in front of a bedroom window while a woman lies asleep .
271572671.jpg| 4| Two men are discussing something .
2718184776.jpg| 3| A group of friends discussing what to do at the event .
2773744784.jpg| 2| Two men are having a discussion after a wedding .
"2815256108.jpg| 3| Two men discuss a sign that says "" Jesus or Hell "" ."
2849169944.jpg| 4| A group of women and a dog are discussing amongst each other
286084055.jpg| 2| One man and two women having a discussion over white wine
287465694.jpg| 3| Three men are discussing business plans .
2917463531.jpg| 1| At a naval yard , a man in a white Navy officer 's uniform is standing by two older men having a discussion .
294111300.jpg| 4| A man and woman hold a discussion near a microscope .
2941340576.jpg| 3| Three men are having a discussion behind a tow truck .
2957676092.jpg| 1| An Army officer discuss training with other Army personnel .
2957688236.jpg| 2| Three soldiers are having a discussion in front of a playground , while others look on .
2987232840.jpg| 4| a group sitting at a table discussing a subject .
2987593918.jpg| 2| Three Chinese women are discussing something .
2993318965.jpg| 3| Two women and a man are having a discussion at an event .
308859429.jpg| 1| Three construction workers discussing how a project should be started .
3097981044.jpg| 2| People sitting at a table filed with paperwork , having a discussion .
31326591.jpg| 4| Three person are discussing something .
3171402701.jpg| 3| An older couple discusses a vegetable .
3175887061.jpg| 0| Two male friends sit at table in a restaurant discussing bar camp , which one advertises with a small sign .
3197960343.jpg| 1| A college student is discussing while wearing a pair of goggles , as if he is a scientist .
3240475298.jpg| 1| Two men hold a discussion on a street curb while a yellow taxi drives past a chaotic background of advertising .
3253523210.jpg| 0| Three standing figures dressed in blue are having a discussion in an open gate by a building entrance .
3263182360.jpg| 0| A professionally dressed woman standing at a podium debating or discussing something of importance .
3313869283.jpg| 1| A black youth in a blue shirt engages in an animated discussion with other young people around a table .
3353295436.jpg| 1| Indian students working and in discussion in a classroom .
3433944385.jpg| 3| Several young men having a discussion around a table .
3434755676.jpg| 3| People are in a room discussing around a computer printer .
3443404125.jpg| 0| Two older men are having a discussion outdoors in an area with stone walls and floor .
3551834525.jpg| 4| A couple is having a discussion on the edge of a canal .
3576186562.jpg| 1| A group of women sit in chairs and have a discussion .
3579131288.jpg| 2| Two ladies discussing something while one holds a bag .
357924786.jpg| 3| Two women discussing at a red table in a restaurant .
3595795327.jpg| 0| Some school teachers are doing crafts and the others are discussing something in a colorful room .
360509186.jpg| 1| A group of college students sitting on a couch in a coffee shop discussing an exam they just took .
3620197503.jpg| 1| A coach and referee have a discussion while a baseball game is in progress .
375118300.jpg| 3| Two women both with scarfs on their head are discussing the day .
3770161255.jpg| 2| Two men in suits , one sitting and one standing , are having a discussion as they wait for public transportation .
3792020604.jpg| 1| A gentleman wearing a black shirt and brown ball cap is in a discussion with an older gentleman among a group of men .
3864680925.jpg| 0| Workers discussing a tough days events while having a smoke .
3944223391.jpg| 3| Two women discussing a topic at the library .
3972665750.jpg| 3| Indian women discussing their task on a dirt road .
3994980815.jpg| 2| Three adults finishing a meal and enjoying wine and discussion .
4033049067.jpg| 3| Two older men present photos and discuss their lives .
404591372.jpg| 4| Two firemen discuss their job .
4088598675.jpg| 3| A man and woman are having a discussion while military members look on .
4116937168.jpg| 0| Three young men gathered at a table with drinks having a discussion .
4126478893.jpg| 2| Grandparents are discussing their son 's future seriously .
4151679198.jpg| 3| Several girls are having a discussion after rollerskating .
421780367.jpg| 1| A tractor sit in over a pipe and running water , while three men stand by and discuss .
42359099.jpg| 0| A group of people stand on a sidewalk in the midst of a discussion .
4257593776.jpg| 3| Construction workers having a discussion by the tracks .
4267206607.jpg| 1| A man and a woman discussing something over drinks at a bar .
4274782458.jpg| 1| Bearded old man has discussion on trolley .
4367617589.jpg| 1| A group of people are gathering at a convention discussing things .
4378806339.jpg| 2| A group of women having a discussion .
4411079474.jpg| 4| Two men are having a discussion in a classroom .
4413167760.jpg| 0| A man in a white button up shirt , and a man in a brown button up shirt discussing something over a table of food .
445048612.jpg| 0| A man drops something , reaching for it while a woman in a beige blazer discusses an important topic .
4490660229.jpg| 3| A man discussing a story with a woman in a robe .
4493008657.jpg| 3| In a forest a man and a woman discuss something .
4514987995.jpg| 2| Two women and a man discuss notes in a classroom .
4525768834.jpg| 4| Two people having a discussion outside .
4530776624.jpg| 2| Two elderly people wearing coats , having a discussion outside .
455777014.jpg| 0| Two men , arms crossed , with brown and blue jackets are having a discussion on a corner with a graffiti covered building behind them .
4569656361.jpg| 2| A blond man and woman are having a discussion while smoking outdoors .
4589627804.jpg| 3| A lady and a man are discussing a binder .
4617732753.jpg| 1| A man in a red shirt and a man in a blue jacket discussing and pointing to a spot on a small potted tree .
4625380993.jpg| 1| two construction workers wearing orange safety vest are having a heated discussion .
46601243.jpg| 3| Two men having a discussion while holding beer .
4661596520.jpg| 0| A group of people in a reunion discussing a very important topic .
4661610976.jpg| 4| A public speaker discussing what needs to be changed .
4671423167.jpg| 4| Three young men discuss a sports match from the stands .
4686365380.jpg| 1| A group of 70 's or 80 's era Caucasian men and women seated and having a discussion .
4690244023.jpg| 0| On a sidewalk , apparently in a shopping district somewhere in Asia , young women in high-heeled shoes have a discussion , while other shoppers walk by .
4704942917.jpg| 0| A vendor and customer discussing products and pricing at a mall kiosk .
4711637472.jpg| 2| Two women sitting on steps having discussion .
4717481075.jpg| 1| These young ladies are sitting comfortable discussing their food or talking about the woman .
4718115322.jpg| 2| Women at outdoor hat stall discussing hats .
4751764329.jpg| 1| Many people wearing orange , silver , and yellow jackets have a discussion .
4752463128.jpg| 3| A group of people sit in a circle for a discussion .
4764080090.jpg| 0| A man and a woman are at an outdoor shopping area and discussing something .
477709663.jpg| 0| Two women are sitting in a home snacking on a vegetable tray and discussing the sculpture located behind one of their chairs .
4803787343.jpg| 3| Two men are deep in discussion next to a produce stand .
4813609768.jpg| 4| Two older people have a discussion on a street .
4817876923.jpg| 3| A group of cyclists discuss directions
4824240641.jpg| 0| A family discusses what to do next while standing at 5th and W 23rd .
4830850965.jpg| 0| A group of young girls hold hands while wearing colorful skirts while other women dance and smile around them with two men discussing something in the background .
4846324908.jpg| 3| Two young women discuss something while waiting .
4867368731.jpg| 3| A group of employees discussing something in a meeting .
488356951.jpg| 2| Asian man in red flowered shirt and hat in discussion with two other men
4915228657.jpg| 1| Some men appear to be discussing something on a boat or ship .
4944129313.jpg| 0| Five women are sitting in a greenhouse with desert succulent plants , possibly reading or discussing something together .
4954419612.jpg| 1| A group of three Asians standing in the middle of a big city discussing something .
4967237527.jpg| 1| Two men in camouflage pants stand in front of a blue piece of equipment discussing how to tie a rope .
5117317939.jpg| 3| A large group of people are gathered at a meeting discussing things .
5117920988.jpg| 0| Two men discussing business at a table in a seemingly crowded place .
5241430403.jpg| 3| Three men in hard hats are having a discussion on a boat .
5263339188.jpg| 2| Members of a construction team discussing an issue with management .
526995387.jpg| 4| Steve Jobs having a discussion with another man .
5380411758.jpg| 4| This man is discussing something .
5390483760.jpg| 1| Police and firemen discuss what to do about the overturned SUV lying in the snow .
539061478.jpg| 4| a woman discusses something with a older man at a table outside a restaurant .
5495428438.jpg| 3| A group of people sit and stand discussing yellow melons .
5789294140.jpg| 2| Here are five male students in a classroom having an informal discussion .
582653438.jpg| 2| Two women have a discussion in a mostly white , modernistic office .
5865511903.jpg| 1| Four black men are sitting down on a bench discussing something .
59032663.jpg| 1| 4 men are having a serious discussion at a desk .
6083302879.jpg| 3| Police officers having a discussion .
6147735412.jpg| 1| A woman and two men , that are dressed professionally , are having a discussion .
6338098558.jpg| 0| A lady dances in a polka dot dress and a head of flowers with a fan clasped in her hand while others are looking in a different direction with two men holding onto a ladder and others discussing .
6537150995.jpg| 3| Two older gentlemen having coffee or tea and a serious discussion .
6824701719.jpg| 4| Two kids discuss their woes around the dinner table .
6857646118.jpg| 1| Five firemen are on the roof of a house discussing the situation .
6901333.jpg| 3| Three men were involved in a light hearted discussion .
6917718093.jpg| 1| Several people are sitting at tables within a large classroom having a discussion .
6974871684.jpg| 3| An man in a white shirt is pointing to a woman 's notepad during a discussion .
7013217.jpg| 0| Two guys seem to be discussing something in front of a building that looks to have a rather eastern facade .
7099257151.jpg| 1| A referee in an international soccer match discussing a recent foul with players from each team .
76466808.jpg| 1| Two men standing at the nose of a British airways airplane in discussion .
7673295758.jpg| 1| A team of soccer players is huddled and having a serious discussion .
7787559618.jpg| 2| Two women are having a conversation while two men discuss something in the background .
82676249.jpg| 3| three men are having a discussion .
846070499.jpg| 3| A young woman with red-hair discusses something with a man holding a bag .
85600252.jpg| 2| Two men and a woman having a discussion at a street market .
