image_name| comment_number| comment
2468058000.jpg| 3| There is a man working on a billboard .
2469827608.jpg| 1| A redheaded woman works a booth for craftzine .com with colorful crafting materials .
2473018628.jpg| 2| Three people doing some sort of yard work that involves a tarp .
2474115124.jpg| 4| coworkers play video games on their break times .
247470362.jpg| 1| A man wearing a black sleeveless shirt doing construction work .
2475544216.jpg| 2| The man fell asleep during work or class .
24759839.jpg| 3| A seated man is working with his hands .
24767513.jpg| 1| Three construction workers working on the street .
24767778.jpg| 0| Several construction workers are standing at a construction site .
24772114.jpg| 0| A construction worker with a barbed wire tattoo and a white hard hat is bending over while a stack of bricks are on the wall behind him .
2480000122.jpg| 3| A rock sculptor working on a rock .
248151015.jpg| 0| A man wearing jeans , a tank-top , and a work glove is bent overlooking at a wheelbarrow .
248341940.jpg| 2| A worker cutting a stone with a power saw .
2483666380.jpg| 4| A woman works a loom holding a green comb
2489585777.jpg| 0| An older , balding man is sitting at computer with a reflective orange vest on in a work environment .
2491261614.jpg| 1| Three men inside a building working on a construction project .
2491265237.jpg| 1| A woman walking to work in front of a family on vacation .
2491572971.jpg| 1| A sanitation worker , carrying a trash bag & broom , on the sidewalk of a narrow , crowded street .
2494562446.jpg| 4| Two men are working on a small barge along a canal .
2496127886.jpg| 0| A construction worker trying to control traffic in one of the busiest construction sites .
2496523295.jpg| 3| A city worker pushing a mobile garbage bin .
2496713113.jpg| 0| A public worker is sweeping up a massive pile of trash in front of a monument at a city square .
2497934789.jpg| 3| Three workers out on the field playing .
2500467647.jpg| 0| A bearded man in a light blue shirt peers through a magnifier to work on something that rests on a white paper box .
2501232125.jpg| 2| A man and women wearing gloves work in the garden .
2504704808.jpg| 0| After an auto accident between the white van and the black car emergency crews work to make sure everyone is alright .
2506703854.jpg| 1| Two people working with something glass and electronic .
2508843920.jpg| 1| A group of cheerleaders working and planning some of their routines .
250906961.jpg| 0| A worker in a blue shirt is high up on the outside of a tall office building , cleaning the windows .
2514571664.jpg| 0| A woman with a blue apron on - a glass of wine at her side - working in the kitchen .
"25166900.jpg| 0| An African American woman donning a black t-shirt with the text "" your daily cup "" works behind the counter of a coffee shop ."
2517646066.jpg| 4| An elder dark-haired woman working with fabrics .
2519272882.jpg| 1| A female vendor dressed in a yellow work shirt with her back to the camera .
2525805067.jpg| 0| An outdoor art fair or exhibition where one artist is painting and displaying his work along with other artists outside a building .
2530468893.jpg| 1| There is a man in orange pants , orange jacket , and orange work hat walking down a hallway .
2531074685.jpg| 0| A man in a green shirt and white hat is working on a fan while a display of fans are on the ground in front of him .
2531794051.jpg| 1| Indian man sitting in the street doing some sort of metal working , tools around him .
2534352312.jpg| 1| Several workers doing various repairs and cleaning steps and statues on a monument .
2536772737.jpg| 1| A railroad work crew performs maintenance on railroad tracks .
2536781293.jpg| 0| A group of men working in an underground tunnel on some railroad tracks .
2536787269.jpg| 0| Two men wearing orange safety jackets working on repairing electrical lines in the tunnel underground .
2536792809.jpg| 0| Several workers in hard hats and orange vests are working along train tracks .
2536794507.jpg| 0| A group of construction workers watch a huge shovel at work .
2536799945.jpg| 0| A large number of railroad workers wearing day-glo orange vests and hard hats are standing on some railroad tracks .
2536808189.jpg| 1| A man in an orange vest is working with wires on a subway .
2536850983.jpg| 1| A team of five visible construction workers wearing yellow safety helmets and orange vests are at a train station area doing a job .
2536853135.jpg| 1| Two men in orange vests and hard hats work down in tunnels .
2536853263.jpg| 0| Two people with hard hats and orange vests are working .
2536863537.jpg| 1| A construction worker in a white hard hat and bright orange vest is washing a wall .
2536875357.jpg| 0| Six male workers , four with safety vests , are lifting a long object .
2536876757.jpg| 0| A man in a blue hat , blue jacket , and purple gloves , looks up at a giant piece of steel he is working on .
2536881159.jpg| 0| A construction worker in an orange vest is looking at a train tunnel with a Kennington sign on it .
2536889705.jpg| 0| These are construction workers with orange safety vests working on in a British Underground .
2536933695.jpg| 0| A happy construction worker stands , gazing at something , with his noise-reducing headphones on his helmet .
2536939367.jpg| 2| A worker is holding a yellow machine on an escalator .
2536943209.jpg| 0| A person in an orange jumpsuit with silver reflectors is working underneath a train .
2536946133.jpg| 1| two emergency response workers are putting blocks underneath a train .
2536950059.jpg| 0| The train worker checks to make sure that everything is okay before the train leaves the station .
2536957963.jpg| 1| Two male workers hauling off a piece of heavy off metal down a staircase .
2536965203.jpg| 1| Two workers wearing orange vests maneuver a load of material onto an escalator .
2536977405.jpg| 4| 2 worker men with white helmets and orange shirts .
2536978777.jpg| 0| A group of workers in orange safety vests and hard hats pose on top of a factory type building
2536985327.jpg| 0| Three people wearing fully protective equipment are working in an interior of a building , two on scaffolding , one on the floor .
2536985499.jpg| 0| Outdoor workers repair a sidewalk using a jackhammer in the United Kingdom .
2536991887.jpg| 0| Several workers in orange vests and white construction hats holding blue bags are working along side railroad tracks .
2536993581.jpg| 0| A group of construction workers wearing orange vests are working on a train station area .
2536995789.jpg| 4| Workmen are working in a stairwell .
2536998057.jpg| 4| A safety worker is checking the railway .
2537000363.jpg| 0| Railroad crew working on train car with orange safety vest and yellow hard hats .
2537002791.jpg| 3| A man demonstrating how a computer system works .
2537578924.jpg| 0| A masked steel worker in orange works on a piece of metal , yellow sparks flying .
2537580694.jpg| 0| Two workers in orange vests and hard hats are breaking up concrete with jackhammers .
2537584620.jpg| 0| Construction worker operation heavy machinery on a site next to a railroad and a train .
2537586970.jpg| 2| Warehouse workers standing near a loader .
2537592566.jpg| 1| City working performing maintenance on public transportation .
2537594884.jpg| 0| Helmeted , orange-vested workers from TubeLine work on a wooden bridge surrounded on one side by trees , and on the other by a fence and trench .
2537596840.jpg| 0| A man in an orange vest works near a blue-draped fence and black and orange wires .
2537601290.jpg| 0| a construction worker working on a railroad waring an orange shirt
2537611154.jpg| 0| Four men wearing orange vests and white helmets are working on a railway track .
2537615024.jpg| 0| Subway workers are working near the train tracks at the station .
2537616702.jpg| 0| A worker in an orange vest with a matching hard hat is walking with a blue folder at a train station .
2537620224.jpg| 1| A group of orange-clad workers surrounds a railroad track .
2537620898.jpg| 0| A large group of workers , dressed in blue with orange vests and hard hats , are standing around a large roll of wire .
2537624884.jpg| 0| Ten workers in hard hats and reflective jackets stand holding cable one in front of the other on a stairway .
253762507.jpg| 0| A subway worker stands next to a car with several garbage bags inside .
2537665596.jpg| 0| Some construction workers , there is concrete being mixed in wheelbarrows , they are building or repairing a wall , the wall is wet still .
2537678956.jpg| 0| A bunch of construction worker in orange working on a train station .
2537683592.jpg| 0| Construction workers applying siding to the inside of a tunnel .
2537692668.jpg| 0| Construction men wearing orange reflective vests work in a subway station .
2537697530.jpg| 1| Many people in orange jackets are working in the subway station .
2537702182.jpg| 0| A group of construction workers wearing orange vests are working along side of a train .
2537709684.jpg| 0| There is staging and men working on platform 2 at the Burnt Oak underground stop .
2537755800.jpg| 1| Two construction workers have a discussion while on the work site .
2537767592.jpg| 2| A maintenance working in an orange vest is looking at the doors of a bus or subway .
2537799272.jpg| 0| Three construction workers wearing orange working vests and white helmets performing work in a tunnel .
2537802214.jpg| 0| Several men in red reflective vests , helmets , and face masks work in an area under construction .
2537806838.jpg| 1| Men in orange vests and white hard hats stand on scaffolds working .
2537817814.jpg| 0| A group of construction workers wearing white hard hats , orange vests , and orange pants work at a site .
2537818182.jpg| 0| Men wearing orange and white reflective jacket are working to fix a railroad at night .
2537818472.jpg| 1| Construction equipment and workers completing a task at night .
2537819002.jpg| 1| A construction worker watches as a tractor dumps rocks onto a track .
2537824216.jpg| 0| A group of workers wearing bright orange jackets with reflective stripes , a man in the middle is holding a sign .
2537824400.jpg| 0| Three people wearing orange jackets talk near train tracks , while other people work in the background .
2540312065.jpg| 3| Three cooks work in a kitchen preparing food .
2541462585.jpg| 2| A man at his workplace with a hawk perched on his hand .
2541483099.jpg| 0| Men working wearing orange safety vests and hard hats in a hallway .
2541485875.jpg| 2| Workers in blue jumpsuits wave to the camera outside their place of work .
2542285730.jpg| 0| A construction worker is standing next to a yellow metal structure .
2542292902.jpg| 3| Two workers are checking a train door .
2542293294.jpg| 0| This is the image of two men who are doing cleaning work .
2542296804.jpg| 3| One technician in a blue shirt sits down at his station to begin work .
2542299880.jpg| 2| A man in an orange work suit performs maintenance .
2542304168.jpg| 0| A group of construction workers wearing orange and yellow hats , orange reflective vests , orange pants , and brown boots are standing at a subway stop .
2544192243.jpg| 0| One man wearing a green t-shirt and white hard hat working on a house and hammering a nail onto a piece of wood .
2548795330.jpg| 0| A group of construction workers in hard hats are working on a roof .
2549405357.jpg| 0| Two men are working together to hammer a small sign under a gold frog statue that is on the tree .
2550011909.jpg| 0| Three children look down at a sparkler firework .
2552419863.jpg| 3| This man is happy to show off his work .
2555536389.jpg| 0| A man in an orange work suit with safety goggles on , mixing chemicals for work .
2557059247.jpg| 1| An older man is doing artwork in an art studio .
25589701.jpg| 2| A construction worker walking across some train tracks .
2563482243.jpg| 0| A male utility worker wearing a ski mask , gloves and a yellow jacket , standing in a utility lift near the tops of trees and an electrical transformer .
2565302802.jpg| 0| Construction workers in orange and yellow vests with jeans work on a street .
2569653795.jpg| 2| Young male walking past a construction worker .
257180093.jpg| 1| A man with a large mustache watches the barber conduct his work through the mirror that faces him .
2573535658.jpg| 0| Children in blue shirts do homework around a large table .
2577736128.jpg| 0| A man , wearing a blue shirt , is wearing headphones and working with sound equipment .
2580174179.jpg| 1| A larger man in a leaf-printed shirt is working with his remote controlled airplane .
2580184589.jpg| 1| Four men are performing work in a dirt lot , near a building , using a dump truck .
2581218229.jpg| 1| A man on the telephone sitting at his computer at work with piles of paper stacked on the desk .
25817944.jpg| 0| Two construction workers are bent over and straddling a metal I-beam .
25818051.jpg| 0| Construction workers in hard hats working with heavy machinery on train tracks .
2594858432.jpg| 1| two workers look over a street , wearing orange vests written on in Hebrew .
2597824037.jpg| 3| A female worker is cleaning leaves off the street .
2598093366.jpg| 1| Several workers standing around wearing bright yellow shirts and hard hats .
2599600310.jpg| 2| Woman highlights work she has done on her notebook .
2599610484.jpg| 1| A young man with red-hair and a green shirt doing his homework at a table in the library .
2599908425.jpg| 0| A construction site with a worker in a green bandanna sitting down as he works on something .
2600229816.jpg| 2| Four young adults are working on an upside down bicycle in a park .
260148263.jpg| 0| A welder in protective clothing and mask works to weld together pieces of metal on a structure that is coming up out of a body of water .
2603743747.jpg| 2| Two shirtless men are working on a rooftop .
26067618.jpg| 0| Two workers wearing tools , boots , and hard hats are working on the steel beams of a structure .
2607097757.jpg| 0| Construction worker wearing a hard hat stands above hole while another construction worker stands with folded arms inside hole .
2607861348.jpg| 1| Fishermen work their nets closer to shore while a boat sits in the water connected to the nets .
2612171591.jpg| 1| A woman in a pink shirt painting the american flag currently working on the stars part of the flag .
261391148.jpg| 0| A construction worker is carrying two by fours , in front of a recently constructed wooden wall .
261627889.jpg| 2| Two workers spread cement onto a brick building .
261634569.jpg| 0| Two women are sitting on the ground working on a weaving project .
2616402277.jpg| 0| A man in a black jacket with a white stripe down the right arm working on something he is holding with both hands .
2616991671.jpg| 1| a man in a white shirt lines up his chisel as he completes his work as a small dog looks on .
2617155996.jpg| 4| Two men working with machinery .
2617242703.jpg| 2| Older man in full denim welds metal on workbench .
2617812188.jpg| 0| blond male sculptor working on a abstract art sculpture in studio .
261883591.jpg| 2| A worker looks off into the distance while a China Shipping crate sits behind him .
2619932923.jpg| 2| Men working with hoses and a large blue and white truck .
2623486961.jpg| 0| Three construction workers stand over a job site wearing ragged and tattered clothing while a man and woman pass behind them and a large pill of dirt and debris sit in front .
2623486975.jpg| 0| Construction workers are filling in a hole with concrete from a concrete truck with green stripes on the tank .
2623486983.jpg| 2| Two men are working with a cement mixer and pouring cement into a hole in a street .
2624979508.jpg| 0| A group of guys working together to build something .
2625959671.jpg| 4| A woman frustrated over some paperwork .
262842417.jpg| 0| A man with an orange hard hat sits anchored in a tree while working .
2633388235.jpg| 0| A lone construction worker , in a yellow safety vest , blue shirt and white hard hat , standing on top of a construction plank , a steel crane standing nearby .
2633396041.jpg| 1| construction workers appearing through a chain link fence .
2640101451.jpg| 4| A woman and a child sort through pages of artwork .
2641794279.jpg| 4| A Man riding his bike to work .
2642336024.jpg| 0| A construction worker pointing to an object or area not seen in photo .
2642624688.jpg| 1| Bird 's eye view of a city worker walking on the street .
2645241028.jpg| 1| One guy wearing black shirt sitting at table working on computer project .
2646345087.jpg| 2| A man in a red shirt works in a decrepit kitchen with green and white tiles .
2647132885.jpg| 1| A worker is constructing an artistic project .
2649216969.jpg| 1| A man on a bike riding home from a long day at work .
2653938322.jpg| 0| A boy wearing a red shirt is shooting fireworks off a breakwall into the water .
2653940812.jpg| 0| A man , in a green shirt , is attempting to light a firework near the water of a lake .
2655267135.jpg| 1| A person working for the city begins cutting down a tree .
2656110989.jpg| 3| A man sitting on a bench taking a break from construction work .
2656252763.jpg| 0| Three workmen wearing safety hats stand in front of a tractor designed for hauling a large tunnel tube .
2656941282.jpg| 2| A man working in a yard using power tools .
2657990027.jpg| 0| A construction worker holding a hammer rests against a wooden beam while wearing a yellow vest , cargo pants , and a hard hat .
2667242810.jpg| 1| a group of young men and small boys working on hobby like projects in a warm summer climate .
2671267709.jpg| 0| A woman in a multi-color shirt is sitting on the floor working with a white product .
267216971.jpg| 0| A man in a gray shirt works behind the counter at a fish market .
2674452595.jpg| 2| A man in a blue outfit works on a train .
267593659.jpg| 1| Two men in baseball hats and bright yellow shirts work behind a fence .
2676292940.jpg| 1| A little girl in a red dress is running from two fireworks with her tongue stuck out , and a firework in her hand .
2677296582.jpg| 0| A man works with some machinery on a subway car or train .
2678171436.jpg| 2| A bird 's eye view of a man in a white shirt working outside .
2678343915.jpg| 0| A metal worker , wearing a leather apron , red gloves , and a face mask , is grinding a weld flat .
2679015215.jpg| 1| A man with work gloves looking down as another man checks out something on the beach .
2683823978.jpg| 4| 2 girls are outside working on their bicycles
2685518281.jpg| 1| Three men are headed into a building on their way back to work .
2687672606.jpg| 1| A girl with Indian clothing on and henna on her hand goes through paperwork .
2688337844.jpg| 2| A worker wearing a blue lab coat and pink sweater reviews products .
268948449.jpg| 1| A man in a black jacket sitting at a work table fixing a typewriter .
2690016300.jpg| 3| Several children work on a project with painted shells .
2690274918.jpg| 0| While standing in a red kitchen , a man in a white shirt is mixing dressing in a large white bowl while a woman in a gray top is working at the counter behind him .
2697822530.jpg| 3| A group of ladies and men , working together to install a pipe underground .
2703515269.jpg| 0| A group of people , many in white coats , work in a laboratory .
2705102381.jpg| 1| Men are working in some vegetation beside a brick structure .
2705103785.jpg| 4| A group of young people working with the elderly .
2705922148.jpg| 1| A man holds a metal object while working in a basement .
2705922326.jpg| 3| Some workers cleaning a storefront .
2711709351.jpg| 2| A worker is cleaning the floor of a big outdoor fountain .
2715851150.jpg| 2| Two chinese men working in a restaurant .
271809294.jpg| 2| A maritime worker carries a rope from a large ship .
2720190418.jpg| 4| Two women work in a field picking plants .
272045297.jpg| 2| The restaurant worker looks outside of the door .
2723043293.jpg| 0| An elderly man , with a striped shirt , grins as he sits at his workbench .
2730560023.jpg| 0| At an outdoor event on a large table , several workers form an assembly line in which they prepare food , with many squeeze bottles and dispensers visible and a woman wearing plastic gloves in the foreground .
2735517817.jpg| 0| Three men sitting on the sidewalk up against the building , with piles of dirt and an orange cone indicating the work area .
2736264483.jpg| 0| A group of students work on a project , while world flags hang above their heads .
2736884820.jpg| 1| A construction worker uses a piece of electric machinery .
2737097000.jpg| 1| These are young adults who seem to be working together to protect the plants surrounding the white pole .
2737097126.jpg| 2| People working together to plant flowers .
2737098202.jpg| 0| A man and woman are working in a gated space between buildings .
2737409349.jpg| 0| A man is sitting in the green chair , talking on the phone , and working on the laptop , and there is construction site next to his building .
2740013516.jpg| 1| a group of workers on a boardwalk wearing fluorescent vests , holding light wands .
2741465534.jpg| 4| People are working at computers in a library .
2744321686.jpg| 3| Man looking over paperwork with a broken couch in front .
2745487323.jpg| 4| A formal band performing their works .
2746877062.jpg| 3| Two men working on a scaffold .
274797394.jpg| 2| Two smiling kitchen workers are mashing something .
2749124340.jpg| 4| A sleeping man relaxing after hard work .
2750709242.jpg| 1| Person working with an old-fashioned anvil that is sitting on a barrel .
2751612533.jpg| 0| The construction worker walks away from the work site to go home .
275162158.jpg| 0| A woman in a plaid shirt and green apron is working in a red tub
275171617.jpg| 1| Three people are sitting outside at a table with artwork leaning against it .
275172236.jpg| 2| A woman in a pink hat is working at an outside vendor .
275854401.jpg| 2| The men in white shirts take a break from working .
275909509.jpg| 0| Red shirted worker climbs ladder to peer into a container perched on a forklift .
275994851.jpg| 0| A man with two fireworks in his hands while a woman in a red cap with an arrow through her head stands to his right .
2763090857.jpg| 3| A woman smiling as she works a machine .
276388524.jpg| 2| A woman sitting in a restaurant , drinking coffee and doing some sort of paperwork .
2766926202.jpg| 2| Two children playing with fireworks in shallow water
2766954299.jpg| 0| Two older women , one in darker clothing and one in lighter clothing , gather up grain as they work on the field .
2771039423.jpg| 0| A man in a black shirt with a heart on it has glasses and works at a bookstore .
277167533.jpg| 1| A man and a woman appear to work at an Asian food vending booth .
2774095272.jpg| 0| Two men wearing gray shirts and red hats are working with cement .
2775549337.jpg| 2| People are pouring cement for the work .
2775745672.jpg| 1| A group of young men are carrying ladders and wearing tool pouches as they work on a house project .
2776334619.jpg| 1| Farm workers harvest celery on a bright , sunny day .
2778006073.jpg| 1| Several people working outside to construct a wood frame .
2778904898.jpg| 0| a large group of people working together to build a small structure at a small construction site .
2778965398.jpg| 1| Multiple construction workers hold up large slabs of wood .
2779332686.jpg| 0| Man in gray shirt looks through wall studs at a construction site with construction workers in the background .
2781018847.jpg| 0| Hard workers are enjoying their lunch break sitting in the shade against a building .
2781093465.jpg| 1| A man is working on the caboose of the red train .
2781537312.jpg| 0| A group of men women carrying carpentry tools stand around the framework of a house .
2781920563.jpg| 3| A hooded man working in a kiosk displays his wares .
2782065752.jpg| 0| Two men in white t-shirts and tool belts sit on frame work for a structure .
2786242106.jpg| 3| Small boy running through decorative brick work .
2787372148.jpg| 1| Five men stand outside and look like they are about to work .
2793770567.jpg| 1| A circus worker showing her talent in her pink and blue uniform .
2796023180.jpg| 3| Two men talking over work at a sowing machine .
279766384.jpg| 1| A shirtless man works on a project out on a cement patio with a river flowing in the background .
2799589359.jpg| 0| Two black guys , with hoes , are working a field , preparing it for farming or gardening .
2801146217.jpg| 2| Two people stand against a wall after a workout .
2803337740.jpg| 1| A man in a white shirt and gray pants is working in an outdoor clothing store .
2803374338.jpg| 3| A man in a white shirt is working at a food cart .
280614767.jpg| 2| A worker is mowing a yard with a weed whacker .
2807228428.jpg| 0| A man working on a roof the man is not wearing a shirt because it looks like a hot day .
2809218945.jpg| 0| A worker is wearing a orange jumpsuit stands near a blue hose , as he appears to be working on the job .
280940033.jpg| 2| A welder dressed in green at his work station
2815745115.jpg| 2| A carnival worker surrounded by stuffed animals .
281792349.jpg| 0| A woman with multicolored hair working in daycare has several children gathered while one of the children open a box wrapped in the comic section of the newspaper .
2822689563.jpg| 3| A news cast team works in front of the camera .
282481027.jpg| 0| A man wearing a hat is working at the construction site and smiling in the camera , and the other man is standing behind .
