image_name| comment_number| comment
2536004597.jpg| 0| A woman in a brown coat with a pink scarf looks pensive while talking on the phone in public .
2536850983.jpg| 4| A construction worker is talking on the phone in a train tunnel .
2536933695.jpg| 0| A happy construction worker stands , gazing at something , with his noise-reducing headphones on his helmet .
2537021135.jpg| 1| A balding man with glasses is holding a guitar and singing into a microphone next to his band mates .
2539357436.jpg| 0| A man in blue stands outside of a building whilst using the phone .
2539883133.jpg| 1| Three woman and one guy in front of a stage with one woman and the guy singing into microphones .
2540972205.jpg| 0| A large group of men in pale yellow silk shirts , one talking into a microphone .
2542296804.jpg| 0| Man with a blue shirt on sitting in a computer room with at least 13 monitors in front of him with several keyboards and phones with one microphone directly in front of his face .
254445389.jpg| 0| Man talks on phone while sharing food with a blond woman while another drinks Dasani Water .
2545915119.jpg| 0| Man walking while using his phone and woman with shorts on crossing street .
2546149002.jpg| 0| A white female , wearing a microphone from her ear to her mouth and using a facial expression for a performance , she is dressed is a red costume with a red turban .
2547273673.jpg| 1| An man wearing headphones observes an older man performing his guitar on a public street bench .
2549203985.jpg| 0| People dresses in business clothing are walking by while one man with a tie on is standing still and talking on his cellular phone .
2549946671.jpg| 0| A young boy is an orange shirt is outside holding a phone next to his ear .
2555039117.jpg| 0| A lady dressed in a vividly patterned dress is speaking via microphone .
2555511067.jpg| 0| Several people standing in a group talking on phones and looking upward .
2558512615.jpg| 0| A baby holds a cellphone and stares at the screen while pushing buttons .
25604966.jpg| 2| Four women dressed in orange sing into microphones and play drums .
2568234923.jpg| 0| A man in a yellow shirt is playing slide on an acoustic guitar on a stage with a microphone .
2572667907.jpg| 1| A woman in a green t-shirt speaks into a microphone .
2577736128.jpg| 0| A man , wearing a blue shirt , is wearing headphones and working with sound equipment .
2579572274.jpg| 0| A little girl is talking on a cellphone on the floor of a living room .
2581218229.jpg| 0| Man with glasses and gray hair , sitting at desk on telephone , with piles of paper and a orange coffee cup .
2581980255.jpg| 0| A man in a suit using his phone standing on the sidewalk as the subway tram goes by .
258275599.jpg| 0| Four men gather outside Famous Joe 's Pizza while a woman talking on a cellphone walks by .
2586533475.jpg| 1| A woman with a purse and luggage checks her cellphone on a city street .
2588093968.jpg| 0| a young girl in a pink skirt and shirt holds a pair of headphones or earmuffs .
2602827193.jpg| 0| Picture of two men playing in a band , one playing the drums and one playing a xylophone type of instrument , in a dark room with two unrecognizable people watching in the background .
2607097757.jpg| 1| A male construction worker in a yellow safety vest and orange safety hat with headphones , holds a platform of thin wood .
2617215392.jpg| 0| A man dressed in a black T-shirt is holding a cellphone .
2628745411.jpg| 1| A man in a pink short-sleeved shirt , standing in front of a microphone and playing his guitar .
2631392326.jpg| 0| With white headphones , a bearded young man in a yellow and black outfit rides a bike for SelektMail
2642475077.jpg| 0| A young blond woman wearing a hat and sunglasses talks on her cellphone .
2644430445.jpg| 0| The girl in sunglasses holds up her phone to take a picture of something .
2645175777.jpg| 0| A street vendor has a seat in the middle of his produce setup ; he is talking on a cellphone .
2646673527.jpg| 0| A younger boy wearing headphones with a microphone laughs with an older boy wearing a green t-shirt while looking at a computer screen .
264928854.jpg| 0| A man talks on a cellphone , while standing in front of a Dale Earnhardt , Jr. , display .
2652382453.jpg| 0| An elderly woman looking at her cellphone , and a young black man looking toward her .
2656749876.jpg| 0| A member of the clergy carries a blue bag in his hand and talks on the phone as he walks .
2664482879.jpg| 0| a person in jeans and a black coat talks on the phone while walking past a bus stop .
2669048370.jpg| 0| A girl in a blue shirt and glasses plays the clarinet in front of a microphone .
2675323741.jpg| 0| A dark-haired woman with a small star tattoo on her arm wears a gray t-shirt and jeans and checks her cellphone while sitting at a small table with a book and a cold drink .
2679382862.jpg| 0| a microphone is the vocal point , but there is a man with glasses holding a guitar , and in the background someone in a yellow shirt on the drum set .
2687089257.jpg| 0| 2 old timers playing musical instruments , a banjo and saxophone , while another man sits on a purple bench taking it all in .
2687229880.jpg| 1| A woman in a black-shirt is walking holding a silver cellphone .
2688936204.jpg| 0| A cowboy clown wearing a shirt with Tax on it , red suspenders , and a white cowboy hat talks into a wireless microphone .
2689829779.jpg| 1| Right leg in a brace , a young boy lies on the couch while using his cellphone .
2695085448.jpg| 0| A woman in a black dress crouching in front of a brick wall talking on a cellphone .
2710280476.jpg| 0| two children watch as a dog runs through a blue fenced course towards a person holding a scanner and microphone .
2715173880.jpg| 2| A lady in a white dress with a red purse is sitting on steps talking on a cellphone .
2716251485.jpg| 0| A man carrying an orange bag walks past two British style telephone boxes .
2735827522.jpg| 2| A singer on a stage is singing into a microphone .
2736169657.jpg| 0| A man with long gray hair while wearing a suit is tuning a instrument near some microphones on stands while having nearby musical equipment nearby and as the background .
2736200571.jpg| 2| A man playing a recorder into a microphone .
2737409349.jpg| 0| A man is sitting in the green chair , talking on the phone , and working on the laptop , and there is construction site next to his building .
2745487323.jpg| 0| A man plays the piano , while a second man plays a guitar and a third man plays the saxophone .
2749228652.jpg| 0| A man is holding a microphone and another man is playing a guitar and jumping on a stage .
27499590.jpg| 3| a sweaty guy singing into a microphone .
2750517549.jpg| 3| A man , standing on a ladder , takes a picture using a cellphone .
275169881.jpg| 0| A woman in a blue and black striped shirt shows her phone to a man wearing glasses and a blue and yellow plaid shirt in the middle of a street .
2753157857.jpg| 2| Woman plays clarinet in front of two microphones .
2753907028.jpg| 0| A man in white standing at a microphone in front of a lip up red backdrop .
2760650448.jpg| 0| A street performer is standing on his head on a brick street in front of a crowd while he is being filmed in front of a red telephone box .
276261357.jpg| 0| A young man wearing a blue jacket with a phone to his right ear , on his laps is a child with a pen in his right hand scribbling on a card , both are shielded by a frame .
276598014.jpg| 0| A male singer , dressed in a long purple pea coat , holding an electric guitar , singing into a microphone , while a male in sunglasses and wearing headphones , plays drums , with purple drapery hanging in the background .
2769270160.jpg| 1| A man is sitting inside of a mailbox with a phone in his hand .
2776593721.jpg| 0| A man with dark hair and mustache talks on his cellphone with a concerned look on his face , while looking at grapes and citrus fruit in front of him .
277930631.jpg| 0| A man in a red hat playing a guitar and singing into a microphone .
2797640772.jpg| 0| A saxophone player dressed in a blue sweatshirt and an accordion player entertain people on the street , including a pirate .
280007961.jpg| 3| A woman texts on her phone while surrounded by umbrellas .
2800842386.jpg| 1| A young woman is playing a black guitar in front of a microphone on stage .
2802479441.jpg| 0| A balding man using his cellphone stands in front of ornate rugs hanging from a wall .
28041138.jpg| 0| Man wearing a cotton gray tank top , straw hat and rope necklace singing into a microphone and playing a bass .
280435773.jpg| 0| A man at a podium standing behind his laptop with a microphone giving a presentation in front of a poster .
280899903.jpg| 0| A woman in a brown jacket with a large crown on her head talks on a cellphone .
2809396455.jpg| 0| There is a man in a striped shirt deep in concentration while in the background a woman is singing or talking into a microphone .
2822418176.jpg| 0| A man with noise-cancelling headphones in a black t-shirt is using a chainsaw to sculpt a bird out of a tree stump .
2824401212.jpg| 0| The woman in orange talks on a cellphone whist standing in front of the woman who is smoking a cigarette .
2825897091.jpg| 0| Many people sitting at a table looking at a computer screen and wearing headphones
283056265.jpg| 1| A man playing guitar and a woman singing into a microphone .
283146608.jpg| 0| A rock singer in a pink shirt and jeans with chains of beads is standing on the stage singing into the microphone .
2834409892.jpg| 0| A man wearing a black and white striped shirt on his phone , site next to a woman also on her phone on the Metro bus bench .
2837253011.jpg| 1| A man in an orange shirt is saying things into a microphone .
2837254541.jpg| 0| A woman with a red shirt and a large tattoo on her arm is playing a saxaphone .
2837640996.jpg| 0| A man wearing a green t-shirt sits with his legs on a ledge and talks on the phone .
2837886692.jpg| 0| A man in dreadlocks is singing closely into a microphone while fans gather in street .
2845084079.jpg| 0| A smiling woman in a white , yellow , and orange Adidas jackets speaks into reporters ' microphones .
2845246160.jpg| 0| A man in a red sweatshirt and a hat is looking at his phone while another man in black walks closer to him down the sidewalk .
285319526.jpg| 0| A man in a blue t-shirt with writing on it is speaking into a handheld system , and another man is sitting beside him with a megaphone in back of him .
286459527.jpg| 1| A young girl in a pink and white outfit is dancing on stage holding a microphone .
2864914377.jpg| 0| A man in a blue outfit wearing glasses listening to his headphones while sitting on a bench .
2866018225.jpg| 0| The man in a black shirt under green lights is holding a microphone .
2867459095.jpg| 0| A bald man in front of a microphone plays electric guitar under a spotlight .
2871691966.jpg| 0| A group of people sitting in an ornate church are focused on a clergyman speaking into a microphone .
2873484191.jpg| 0| a downtown city were a person is leaning up against a building while on his cellphone .
2877038014.jpg| 0| A well-seasoned jazz musician playing his saxophone performing at a local concert .
2881202981.jpg| 0| A man wearing a cowboy hat holds a cellphone and stands on the sidewalk while people walk around in the background .
2889113059.jpg| 1| Man works at microphone with a group of informally attired musicians under the lead of a conductor .
2889335946.jpg| 0| Two men operate a cement truck in the daytime , wearing white t-shirts and blue jeans , and one of them talking on a mobile phone .
2891924845.jpg| 0| A man and woman look to the right , the man is talking on a cellphone .
2891939693.jpg| 0| A man with a head bandage on is talking on the phone while a Lexus is in the background .
2894893895.jpg| 0| A dj with headphones on is moving knobs up and down on his dj equipment .
2900213085.jpg| 1| A lot of people are listening to a man with a microphone .
2906759254.jpg| 1| An artist wearing a red jacket and blue jeans painting on the street while wearing headphones .
2914091986.jpg| 1| Musician sings into a microphone while playing a guitar .
2918474117.jpg| 0| A man with long brown hair , wearing a dark jacket , brown graphic t-shirt , and blue jeans is talking on a cellphone while carrying a drum on his head .
2924312981.jpg| 0| A woman with earphones wearing a blue cap , gray jacket and black shorts is jogging down the street .
2937882774.jpg| 0| a girl wearing pair of red leggings and a wool dress walks by the window display of a store wearing her headphones looking carefree .
2938852531.jpg| 0| A woman in a jacket looking at her cellphone while reaching for a child .
2943772984.jpg| 0| A man is standing on the sidewalk under a blue and yellow umbrella , while a person in a yellow shirt is walking while talking on her cellphone .
2947274789.jpg| 0| a man in a green shirt and cap puts his hands on a table as he stands next to man wearing headphones around his neck .
2957679856.jpg| 0| A middle-aged man in a military uniform sits at a table in front of a small flag and microphone .
2969948674.jpg| 0| Man in black shirt with black guitar sings into a microphone surrounded by musical equipment .
2970162432.jpg| 0| A young woman with glasses sits at the end of a row of seats and speaks into a microphone .
2974587819.jpg| 3| men play saxaphones outside a building .
2978236380.jpg| 0| An older man is playing a guitar and singing into a microphone .
2984769753.jpg| 0| A closeup image shows a woman outdoors at night , wearing black gloves and a red knit hat , brandishing a white megaphone .
2988339083.jpg| 2| People stand against a wall , one guy wears headphones .
2993822651.jpg| 0| A gray-haired man sets up a new office with a desk built into the wall , a phone and a lamp .
299615023.jpg| 1| There are bright , multicolored lights and a man using a microphone at a party .
3004291093.jpg| 0| A person with lots of hair and a Pac-man jacket is making a phone call .
3006093003.jpg| 0| The man in glasses carrying an Obama poster is talking on a cellphone .
3009143779.jpg| 1| A man in a helmet bikes by a young lady with blond-hair checking her phone .
3010330230.jpg| 2| A man with a green jacket and headphones cutting grass .
3017482822.jpg| 0| A man listening to headphones is standing in front of a wall with American flags on it .
3019776218.jpg| 0| A young boy is looking into a silver cellphone while resting his light brown-haired head on top of a resting blond dog 's head .
3020218156.jpg| 0| Two men are on scaffolding as they paint above a storefront while a man on the sidewalk stands next to them talking on the phone .
3020581544.jpg| 0| A man with glasses and a yankees baseball cap is wearing headphones and watching something .
3024001901.jpg| 0| Wearing a white hard hat and green shirt , a bearded worker climbs up a power or telephone pole .
3027255132.jpg| 0| A man with dark colored hair is singing into a microphone .
3027458420.jpg| 0| A light-haired man wearing a white shirt grasps a microphone and appears to be singing with his eyes shut while flanked by two dark-haired men wearing dark shirts in a darkened room .
3028145992.jpg| 0| A woman in a white shirt and hat speaks to a large crowd of men and women using a megaphone .
3031792444.jpg| 0| A group of costumed adults , including a devil and a sorcerer , look on as a man dressed as a sea captain speaks into a microphone while standing next to a man in a brown suit who is holding a large fruit basket .
3042484940.jpg| 1| Two men taking a picture together with the phone of one of the men
3043051537.jpg| 0| A man wearing blue jeans , a striped shirt , a ball cap , and headphones sits on a bench on a public street , possibly waiting for a bus .
3043904009.jpg| 2| two men stand behind a table containing computers and microphones .
3048071554.jpg| 0| A boy with a yellow shirt on it sitting , holding an electric guitar , and singing into a microphone .
3049770416.jpg| 0| A man holds a microphone to his mouth , backlit by green lights .
3060666355.jpg| 0| a lady dressed in a red dress and wearing sunglasses is talking on the cellphone .
307000532.jpg| 0| Here is a picture of locals hanging out in front of a store , talking on the phone and making sure their graffiti sign does n't get tagged .
3072938154.jpg| 1| A man driving a yellow train next to a highway talks on his cellphone .
3082196097.jpg| 0| A man in a white shirt and tie sings into a microphone while a woman wearing a white shirt and tie plays the guitar at a concert .
3084711346.jpg| 3| A man next to a woman holding a megaphone .
308539953.jpg| 0| A man is standing on a stage behind a microphone while playing the guitar .
3085590738.jpg| 2| A white lady speaking into microphone .
3089862485.jpg| 1| A long-haired man stands at a microphone playing a pink Hello Kitty guitar .
3089881249.jpg| 0| A man is playing a green electric guitar while standing in front of a microphone .
3089992945.jpg| 1| Two guys play guitar behind another man while he sings into a microphone .
3091013719.jpg| 0| The singer in a band is singing into a microphone while the other members are playing their guitars and drums .
3091863100.jpg| 0| Holding the microphone with both hands , a man seems to be singing as a guitarist behind him plays a red guitar .
3094173565.jpg| 0| A man with tattoo 's on his arms is standing in front of a microphone playing guitar .
3094823646.jpg| 0| A bald man in a black jacket and black pants holding a microphone singing with a man in a black shirt and jeans playing an electric guitar on stage .
3094928020.jpg| 0| A guy wearing a black hoodie and sunglasses is speaking into a microphone , while a guy in a ski mask plays a guitar in the background .
3098463915.jpg| 0| A group of people are standing near microphones and singing from papers .
309954193.jpg| 0| A man in a black suit is walking up a street carrying an accordion file and a cellphone .
310277258.jpg| 1| A woman in a very very skimpy bikini takes her own picture with her cellphone .
3110840233.jpg| 2| A man in a santa hat playing the xylophone .
3112821789.jpg| 2| A man blows into an electrical instrument by a microphone .
3115901702.jpg| 0| A woman walks as she looks at her cellphone and others look on .
3129369905.jpg| 1| A man is asleep sitting up on a plane wearing headphones .
3139803996.jpg| 0| A man is in the background , looking at his phone , while a woman throws a football towards the camera , with her mouth partly open .
3142687558.jpg| 0| A woman in a dress talking on the phone while holding a dog leash .
314454989.jpg| 0| A man in a dark shirt playing a guitar while standing beside a microphone .
314544433.jpg| 1| A woman sitting in a restaurant talking on her cellphone .
314685044.jpg| 0| A woman is standing near a public phone outside a bookstore on a city street .
3158933877.jpg| 1| An older man dressed in a suit is standing behind a gold-fringed podium in front of a microphone .
3167800962.jpg| 0| A man wearing an identical light blue sweater to the man sitting next to him is using a cellular phone .
3174453534.jpg| 0| a slightly older picture of a mother and her newborn sitting next to the rotary dial phone
3178371973.jpg| 0| Three women sit on the subway ; one talks on the phone while the others read .
3186694070.jpg| 1| A male wearing headphones and standing in front of a microphone .
3188872184.jpg| 0| A man in tie , white shirt , and coat uses a cellphone across the street from an older building with a maroon canopy .
3197981073.jpg| 0| A young brown-haired woman plays her guitar and sings into a microphone .
3201115507.jpg| 0| A bearded man in a long-sleeve shirt is singing with a microphone .
320199844.jpg| 0| A man in a Santa Claus costume is sitting on a wooden chair holding a microphone and a stringed instrument .
3204734746.jpg| 0| An old man with a scruffy beard and white hard hat doing maintenance on a telephone pole .
3206058778.jpg| 0| A girl with ice skate sits on a fence checking her cellphone while her friend looks on .
3207925823.jpg| 0| A girl is sitting in a chair at the table with a cellphone raised to her ear .
3208417638.jpg| 0| A very large man in a jacket and woolen cap is talking on his cellphone while other pedestrians walk by him .
321365748.jpg| 0| A trio of young men sing with microphones .
322423746.jpg| 0| Several gentlemen are speaking into a microphone and the man in the glasses appears to be saying something funny .
3225025519.jpg| 0| A man holds a microphone in front of another man who is wearing a blue hat .
322811355.jpg| 0| A man wearing a pin-stripe shirt and eyeglasses converses on the telephone from his cubicle .
3232013957.jpg| 0| A black hooded man is using a magnifying glass to look at a booklet , while lying on a phone booth with a woman inside .
3232742853.jpg| 0| Male lead singer of a rock band on stage singing with microphone in hand as guitarist and drummer look on .
3233596490.jpg| 0| A man wearing a striped shirt is singing into a microphone as another man wearing a purple bandanna around his neck plays an electric guitar behind him .
3233683038.jpg| 0| A teenager with a purple bandanna around his neck plays the electric guitar and screams into a microphone .
3243591844.jpg| 1| a man with a microphone watches two children practicing sum wrestling .
3244632670.jpg| 0| The chef holds the microphone close to his mouth , as he removes the lid from the dish , exposing the cuisine inside .
3246788996.jpg| 0| Individuals in a terminal review transit information while one girl talks on her cellphone .
3247500085.jpg| 0| A young man in a black sweater plays a trumpet into a microphone .
3256043113.jpg| 0| a woman screams into a microphone with orange messy hair and green eyeshadow .
3258071770.jpg| 0| A brown-haired man with glasses is wearing a burgundy hooded sweatshirt while sitting at a dinner table checking his cellphone .
3258396041.jpg| 0| A man in a black jacket is holding a microphone toward a young girl with long brown hair .
3258397351.jpg| 2| A child being interviewed by a man with a microphone .
3262104654.jpg| 0| Elderly man plays saxophone in a white shirt and white hat sitting in a chair a booth .
3263182360.jpg| 1| A woman in a tan suit and red shirt speaks into microphones at a podium .
3268428191.jpg| 0| Several people in a crowd talking to each other with a guy in the background talking on a cellphone .
3269087421.jpg| 0| A man in a flowered shirt holds a microphone beside a violin player standing in a crowd of people .
3275627207.jpg| 2| A man talks on his cellphone as he walks down the street .
328322344.jpg| 0| One standing man and one seated man in a concrete block alley on cellphones , both wearing fitted caps and loose-fitting khaki clothing .
3285826301.jpg| 0| Woman just inside a building that looks like a garage , smoking a cigarette , with a cellphone in her right hand , nearby people are walking on the sidewalk in the city .
3285889990.jpg| 0| An old bearded man with long gray and light brown hair wearing a black cowboys hat , a black t-shirt , with a blue , white and red guitar strap around his head , standing in front of a microphone singing .
3299820653.jpg| 0| A man is standing behind a microphone looking at a sheet of paper while another man behind a microphone looks at him .
3300643106.jpg| 0| A man stands in front of a microphone wearing glasses and looking at a piece of paper .
3308612098.jpg| 0| A little boy about 3 years old is standing outdoors wearing large purple goggles , red earphones and a number 50 green and blue shirt .
3309092684.jpg| 0| A blond woman wearing a red shirt is singing into a microphone with a man wearing a black shirt and red tie .
3311659972.jpg| 0| Male wearing brown shirt holding a microphone with an expression of singing .
3311724634.jpg| 0| A woman is holding a toy snake , she is on stage with a guy speaking through a microphone , and a man in clown makeup holding a guitar .
331218808.jpg| 0| A tan-skinned man sitting in a chair with a bag under his arm , talking on a white phone .
3312455265.jpg| 0| A man wearing a red cap and shades , is singing into a microphone ," as he is playing a guitar that has "" Whatever it Takes "" written on it ."
3314850981.jpg| 2| A man with a blue shirt and black pants walking outside of a store talking on a cellphone .
331557517.jpg| 0| A young oriental woman wearing jeans , a blue jacket and white shirt is standing at a beach holding a camera or cellphone while shielding the sun from her eyes with one hand .
3318909297.jpg| 4| Men yell into a microphone .
3319737840.jpg| 0| A young man in a white t-shirt sings into a microphone while others play musical instruments in the background .
3320756943.jpg| 0| The people under the canopy are sitting on a bench ; the mother is taking a picture of a child with her cellphone .
3325186785.jpg| 0| A woman wearing headphones is performing aerobic exercise in a home setting on a piece of exercise equipment , with other exercise equipment visible in the background .
3327036826.jpg| 2| The lady and man wearing headphones while eating .
3331009729.jpg| 0| A woman wearing a blue coat walks and talks on her cellphone .
3331525712.jpg| 1| A woman with a microphone on a stage points the microphone at a man who is standing in the audience in front of her
3333039854.jpg| 0| Several men are gathered around musical instruments and a microphone .
3338474677.jpg| 1| A man on a bicycle sits at a stoplight with headphones on .
3345621370.jpg| 0| A man holding a microphone is flanked on either side by two people who are holding musical instruments .
