image_name| comment_number| comment
1000268201.jpg| 2| A little girl climbing the stairs to her playhouse .
1000523639.jpg| 0| Two people in the photo are playing the guitar and the other is poking at him .
1001773457.jpg| 1| A black dog and a tri-colored dog playing with each other on the road .
1002674143.jpg| 0| A small girl in the grass plays with fingerpaints in front of a white canvas with a rainbow on it .
1003420127.jpg| 0| A group of adults , inside a home , sitting on chairs arranged in a circle , playing a type of musical instruments .
1003428081.jpg| 0| Two women , both wearing glasses , are playing clarinets and an elderly woman is playing a stringed instrument .
1006452823.jpg| 3| 2 kids playing on a seesaw
1007320043.jpg| 0| A small child grips onto the red ropes at the playground .
1010673430.jpg| 1| Two young children eating a snack and playing in the grass .
1012150929.jpg| 0| A little boy plays with a Nintendo GameCube controller inside a McDonald 's .
1012212859.jpg| 3| White dog playing with a red ball on the shore near the water .
1012328893.jpg| 0| A group of people picnicking at picnic tables in front of a playground .
101669240.jpg| 1| A man in a hat is displaying pictures next to a skier in a blue hat .
1019077836.jpg| 3| a brown dog plays with the hose .
1020651753.jpg| 1| The white dog is playing in a green field with a yellow toy .
1024138940.jpg| 0| Two different breeds of brown and white dogs play on the beach .
1027149103.jpg| 0| A band is playing in front of an audience and the singer is wearing an orange shirt and has tattoos on his arm .
1030985833.jpg| 2| A black dog and a brown dog play with a red toy on a courtyard .
103106960.jpg| 1| A child in a red jacket playing street hockey guarding a goal .
1031973097.jpg| 4| Little boy wanting to play outside of fence .
1032122270.jpg| 2| Three dogs are playing on grassy hill with a blue sky .
1034985636.jpg| 0| A man with wild hair rocks a show playing a guitar center stage .
1035019794.jpg| 1| A girl playing softball hits the ball almost directly downwards
1035392784.jpg| 0| A man in black with long hair playing a guitar with stickers on it .
104285082.jpg| 0| A man with glasses is sitting a chair playing the oboe while a man in a purple shirt plays percussion and spectators look on .
1043910339.jpg| 0| A baseball player in red leaps into the air to avoid a player in blue , who is shortly behind him as he catches the ball , while other blue team members look on in the background .
1045124251.jpg| 3| A 30 somethings man playing with his phone on a subway train .
104763189.jpg| 3| Four children are smiling and playing on a bike
105223874.jpg| 0| A young child wearing a blue shirt and sandals playing with a red toy while sitting on the floor .
1053804096.jpg| 0| a girl with pigtails is playing in the ocean by the beach .
105493628.jpg| 0| White wine and appetizers on are displayed in an upscale restaurant .
1055623002.jpg| 1| A group of young children playing pillow fight on a bed .
1056198351.jpg| 1| Young boy with blond-hair playing with a mixer .
1056249424.jpg| 0| Two boys , one with a yellow and orange ball , play in some water in front of a field .
1056873310.jpg| 4| Two dogs playing on a beach .
10602072.jpg| 0| Two young girls are playing in the forest ; the younger one is climbing a short tree and is about 2 feet off the ground .
106490881.jpg| 1| The boy is playing on the shore of an ocean .
1066252238.jpg| 1| Three boys playing and biking with a pile of sand in the middle
1071201387.jpg| 1| Man in bright yellow vest displays bicycle safety information on street .
1072439304.jpg| 2| A boy playing for the Giants baseball team swinging at a baseball .
1075867198.jpg| 0| A man in a brown shirt and dark shorts plays on the beach with his two black dogs .
1080230428.jpg| 0| A male volleyball player in red trunks tries to block the shot of the opposing player during a professional volleyball game .
1087168168.jpg| 2| Two young kids are playing in the water on an inflated toy .
1087539207.jpg| 0| Several children playing on a Polaris vehicle outdoors .
109083036.jpg| 0| Six males playing a game in the sand with wooden paddles .
1091942526.jpg| 0| A woman is laughing as two small boys play around her and a small girl climbs up her back .
1093737381.jpg| 1| A woman in a blue dress stands with a chalk portrait of two children playing by a stream .
109380144.jpg| 2| A man sitting on the ground is playfully kicked by a young woman , while a man in the back observes .
1094462889.jpg| 0| A brown dog plays in a deep pile of snow .
1095476286.jpg| 1| A little boy playing in the water .
10956999.jpg| 0| Two men barbecuing on the grill with a little girl playing in background .
109608573.jpg| 4| A young boy sits by an outdoor stand displaying hats .
1096395242.jpg| 1| A little boy in orange shorts playing with a toy .
1097710887.jpg| 0| A very young girl playing with a bubble-blowing wand , holding a bottle of bubble solution and walking through a park or field .
1100214449.jpg| 2| A little boy is playfully jumping off the side of a fountain .
11026590.jpg| 3| A boy in goggles plays with a read-haired girl .
110269384.jpg| 0| A dark-haired woman in a green and white apron sits amid her outdoor display of flowers for sale on a city street .
110637863.jpg| 0| A rugby game being played , one man in a green jersey is being lifted up by his teammates with the ball , while a competitor in a red jersey is similarly lifted to tackle him .
1107246521.jpg| 0| A black dog playing fetch with a ball of rope .
1107507919.jpg| 0| There is a woman and man wearing orange shirts , playing instruments with sheet paper in front of them .
11079715.jpg| 0| A musician plays his electric guitar surrounded by sound equipment .
"110802332.jpg| 1| A hockey game is being played and a hockey player named "" David "" is trying to score against the goalie ."
111061041.jpg| 2| Two male tennis players conversing across the net on an outdoor court
111201721.jpg| 4| Two young children playing outside .
1112212364.jpg| 1| A baby is sitting on and playing with smooth rocks .
11131022.jpg| 0| Older man in a hat , yellow shirt and dress slacks playing in the sand with a young boy .
111413806.jpg| 0| A man and two women are playing a board game at a wooden table while drinking alcohol .
1115565519.jpg| 0| The little girl is playing with a toy in a public fountain .
111796099.jpg| 2| A game of tennis is shown with one of the female players about to hit the ball .
1117972841.jpg| 1| A brown dog playing in the sand .
1119015538.jpg| 3| A playful dog is running through the grass .
1122177096.jpg| 0| A man wearing a yellow shirt and tan pants plays golf outside while being watched by other people .
112459543.jpg| 1| Group of children playing soccer with body of water in the background .
1129704496.jpg| 2| Both dogs retrieve the play toy from the water .
1141643526.jpg| 1| In a crowd of young people at a bar , a man stands displaying the rock and roll sign .
114164952.jpg| 3| Two children play on the path in a park .
114474325.jpg| 0| Odd looking young adult playing around a large tree that has big roots .
1148095714.jpg| 1| A little boy in a suit jacket is playing with a ball .
114939325.jpg| 3| A young woman plays on a swing set while trees sway in the background .
114949897.jpg| 1| The man is holding the net for the boy playing baseball .
1151466868.jpg| 0| A young girl wears a shirt and shorts as she plays in the ocean 's surf .
1153704539.jpg| 0| a young girl wearing a blue shirt marching in a band playing a trumpet
1157215900.jpg| 4| An older asian woman displaying bread for sale
1159574340.jpg| 0| A child jumping into a lake in a wooded area while another child plays on the shore .
11610969.jpg| 1| People are gathered around and walking buy a display of clothing and other items .
1162606352.jpg| 0| An Asian woman and an African American woman are displaying their culinary dishes .
1164131282.jpg| 2| two dogs , playing in a field , wrestling with each other
1164765687.jpg| 1| A man playing with his dog on the blanket on the floor .
116626604.jpg| 1| A child smiles while playing with his life-size elmo toy .
11678931.jpg| 1| A group of young people are playing in a fountain of water .
1169307342.jpg| 0| A big brown dog plays with a smaller gray dog on the grass .
118647903.jpg| 0| Two soccer players , one wearing a white uniform and the other in red , try to reach the soccer ball first .
118667747.jpg| 0| There are three young boys playing in a public park with a red ball .
118717792.jpg| 0| A festival is going on right outside a lake , with several drummers in red shirts and a man on stilts playing the drums .
1187435567.jpg| 0| A small dog plays with a toy on top of a white blanket .
1187993157.jpg| 3| A young boy plays outdoors in the woods .
119082045.jpg| 0| A man and a woman locking arms ( wearing expensive clothing ) next to glass display ( perhaps retail stores ) on the sidewalk in an urban setting .
119364730.jpg| 0| A man with a determined look on his face holds a small wooden hammer while wearing a bib displaying a large red crab , another red crustacean held in his hand while another man sits and holds some food behind him .
1195966967.jpg| 0| A man playing a guitar and a man dancing are entertaining a couple sitting on a ledge by the street .
1196602179.jpg| 0| A woman ventriloquist is playing with her colorful green and red dragon in a beautiful garden backdrop .
1199847613.jpg| 2| Three couples in white clothes and swim caps play piggyback .
120058071.jpg| 4| Kids play around a statue bust outside .
120474559.jpg| 2| A man sitting , wearing a San Diego Padres hat plays on a keyboard .
1206506157.jpg| 0| Two dogs are playing rough in a green field of grass .
120764850.jpg| 4| Toddler playing with baby .
120778976.jpg| 3| Two men playing a sport with each other .
120889725.jpg| 2| Two people are sitting on a wall near a large display of cotton candy .
1212658333.jpg| 1| A child is playing in the street , doing a cartwheel .
1215318051.jpg| 0| Five adults are playing cards while sitting outside at a picnic table in their backyard .
121590361.jpg| 0| Two guys , one wearing a blue jacket and the other wearing a red jersey play the trumpet together .
1220401002.jpg| 0| Two young girls are playing and laughing in a green grassy yard .
1222322358.jpg| 0| A young boy in orange and white swings in a playground at a park .
12238723.jpg| 0| A man wearing sunglasses playing a silver guitar .
12243003.jpg| 0| Four people of all different walks to life share one park bench while one man plays the guitar .
1227655020.jpg| 1| A black dog and a brown dog playing in tall weeds .
1228304869.jpg| 0| The man in a red checkered shirt is having beer and playing frisbee in the park .
1229536824.jpg| 1| Three people are dressed in costumes and playing musical instruments .
122958692.jpg| 0| A man in white playing tennis is still in midair after jumping to hit the ball .
123101580.jpg| 0| Two girls are playing soccer and one is wearing a white shirt with green shorts showing the number 4 , while the other girl is wearing a red and white shirt .
1231348815.jpg| 2| Displaying a big smile and a thumbs up this man is holding up a carriage .
1232148178.jpg| 0| There is a little blond-hair girl with a green sweatshirt and a red shirt playing on a playground .
123314995.jpg| 1| A man in red shirt displays his fighting technique on another man in gray shirt .
123416768.jpg| 0| Three women at a shopping mall , one has a dog , one is on her cellphone , one is playing with her necklace .
1235455146.jpg| 0| An asian family is picnicking at the beach while others play in the water .
1237985362.jpg| 2| A woman with holding a young girl playing with bubbles at a picnic .
1238849490.jpg| 1| A woman playing a guitar in front of a group of people standing outside .
123889082.jpg| 0| Two dogs are playing in a grassy field ; one dog is biting the ear of the other dog .
123997871.jpg| 0| The woman lacrosse player in blue is about to catch the ball .
124145159.jpg| 1| A man in a white shirt sings into a microphone as he reads the words on a screen , while a balding man plays the drums .
1243798805.jpg| 2| A man with a beard and white bandannas is playing the guitar on the sidewalk .
1245194315.jpg| 3| A couple standing in front of a store display window .
1248357227.jpg| 3| Three children play near a placid lake in a wooded area .
1248940539.jpg| 0| Three little blond girls , two in blue , one in pink , play on a sunny beach .
1248953128.jpg| 0| A little girl in a colorful dress is playing with a blue and red soccer ball .
1250845715.jpg| 0| Two women sitting under a tent , one with shirt red-hair , dark clothes drinking and the other laying down playing the guitar in a green top and jean peddle pushers both barefoot .
1251716308.jpg| 0| A person with short hair and a scarf plays a strange-shaped instrument with a bow .
1252210354.jpg| 1| A young man playing nine ball billiards is aiming for the nine ball .
1252787177.jpg| 3| People walk by a display of underwear hanging in a stall .
1253264731.jpg| 4| Children playing in stopped motion
"1254659.jpg| 0| A sign that displays "" Mongolian BBQ "" shines above two employees in white shirts and caps and green aprons ."
1255504166.jpg| 1| A little boy is playing in the water with a beautiful sunset and mountains in the background .
1255599434.jpg| 1| Three children wearing swim trunks and no shirts play in the surf .
125635185.jpg| 0| Three children are playing outdoors , two of them on a metal barrel swing .
1257692349.jpg| 0| A varied crowd mills about ( or rough-houses ) on a public street , with lots of bicycles on display .
1259936608.jpg| 0| The two young girls , one wearing a skirt and the other wearing shorts , are playing in a bubbling fountain .
126042604.jpg| 1| Child playing on a playground , hanging from bars .
1262720546.jpg| 0| A young musician playing a small guitar and singing , while sitting in a white plastic chair .
1263126002.jpg| 0| Baby with blond pigtails in yellow room attempting to climb out of green playpen .
126378326.jpg| 0| Children are climbing and digging in the sand at a makeshift playground , which features a structure made from tires .
126594141.jpg| 2| A female soccer player crouches to put on her shoes .
12668600.jpg| 0| A young boy actively engaged in display model .
1269470943.jpg| 0| The little boy fell face first into the grass while playing football .
1271960365.jpg| 3| Two dogs are playing on a hardscape .
1273001772.jpg| 2| A group of young kids play in the water on a sunny day .
127488876.jpg| 3| Tree in the foreground , two men playing golf in the background .
127489408.jpg| 0| A woman in a blue shirt and pink sweater , with a slightly goofy expression , is sitting at a table where a game with miniature players and dice is being played .
127490019.jpg| 1| A woman wearing a blue shirt and hat with khaki shorts plays golf .
1279461814.jpg| 4| Two children playing in a church .
1280221720.jpg| 4| A little boy is playing with a mascot from Jelly Belly .
128128618.jpg| 1| A man playing a xylophone is seated next to a man playing the guitar .
128391889.jpg| 1| Kids play a game of ball with paddles at the water 's edge at the beach .
128395402.jpg| 1| A woman is riding her bike past a water fountain display .
1285067106.jpg| 1| The young Ohio baseball player contemplates his pitch .
1286408831.jpg| 3| A small boy climbing a backyard play set .
128706814.jpg| 0| A cartoon cutout of Snow White is standing in front of a store display window while a woman in a large hat is standing cross legged at the door .
1287166023.jpg| 0| A lone musician in black is on stage , playing an acoustic guitar and singing into a microphone .
128912885.jpg| 1| A white dog with a blue collar plays with a red ball .
1289625678.jpg| 2| A little girl in a pink top plays with a hoe in a hay bale .
1294431829.jpg| 1| A male in a red hat playing with a chainsaw on fire and a green ball in his hand in front of a crowd .
1294578091.jpg| 0| Standing man on phone with seated woman writing , near artist 's outdoor display .
129528391.jpg| 1| An accordion player wearing a heavy jacket , scarf and beanie standing by a yellow telephone pole .
1295476404.jpg| 0| A female harp player peers through the middle of her instrument while performing .
1295719054.jpg| 1| School children running through the play yard .
129846884.jpg| 0| A boy in blue jeans is playing with a toy car on the lawn .
129891931.jpg| 2| A toddler in a white onesie is playing a video game at an arcade .
1299459562.jpg| 0| Three boys in baggy bathing suits play in splashing water in front of a gray , block wall .
1301337349.jpg| 0| rugby player in white number 25 uniform jumps to catch ball as opponent in green number 29 tries to stop him .
130151401.jpg| 0| A man in a bright yellow shirt plays his guitar as another man plays the drums in the background .
1304100320.jpg| 0| Two dogs playing in a misty field filled with purple flowers
13051044.jpg| 0| Puppeteer wearing a purple sleeveless shirt showing off a puppet that looks like a black man with shades playing a saxophone .
1306038218.jpg| 0| Two soccer players , one from a team wearing red and the other wearing white , are both going for the soccer ball , while people on the bleachers watch .
130792536.jpg| 0| A young man and woman dressed in play chef 's hats are eating food at a table .
1308472581.jpg| 0| Girls with a blue bucket is playing and splashing in the ocean water .
1309330801.jpg| 4| The children are playing on the trampoline .
131114016.jpg| 0| Some children are playing on a trampoline , a boy in a red shirt is covering his face as he cries .
1312954382.jpg| 4| A girl in a green dress plays with a Hello Kitty balloon .
131624221.jpg| 0| A man in jeans and sandals sits outside near trees and a goose and plays a string instrument .
1316505120.jpg| 1| a man playing the guitar on an elevated stage in front an audience .
1318029076.jpg| 1| A young boy , arms and legs splayed wide , is leaping into the water on a rocky shoreline .
131840964.jpg| 3| Some kids playing near the street .
131853788.jpg| 0| A young boy is playing on a piece of playground equipment that features tires which he must step in and out of , while keeping his balance .
1322323208.jpg| 1| A small boy and girls are playing in the sand on the beach .
1327764519.jpg| 2| A man playing an exotic instrument is sitting in front of a Calvin Klein advertisement .
133267753.jpg| 0| Three street musicians wearing brown coats play the drums and trumpet in front of a store .
1332815795.jpg| 1| A little girl is swinging in a baby swing on the playground .
1332867233.jpg| 0| A young girl and boy in swimsuits happily play in the sand on a beach .
1333788342.jpg| 0| A young dark-haired boy wearing black and white checkered clothing is playing with a yellow toy boat in the shallow waters of a beach .
1334892555.jpg| 0| Two kids with helmets playing with Nerf swords while one looks on drinking from a plastic cup .
1336100240.jpg| 3| A small girl playing , on the sidewalk , with a stick .
133684581.jpg| 0| A man running in a marathon runs past 3 bagpipe players , and a drummer , all wearing a uniform
133905560.jpg| 2| A puppy plays with an adult dog in the snow .
134206.jpg| 0| The players of the baseball team are standing on the field , with many people watching from the stands .
1346051107.jpg| 0| Man playing musical instrument standing beside a yellow and red fire hydrant
134747073.jpg| 4| little girl playing on the beach at sunset
1348113713.jpg| 0| There are two small boys wearing ball caps , playing T-Ball in green grass with three adult men watching .
134829866.jpg| 0| An older man wearing glasses , a baseball cap , a white shirt and a red vest plays a tuba outside a building .
134857559.jpg| 0| A man is on stage singing and three people are playing guitars in front of a crowd .
1348891916.jpg| 4| A soaked dog is playing in the water .
1351594833.jpg| 0| A man in a yellow rain jacket is playing a musical instrument amidst black and white birds .
1351635108.jpg| 2| A man wearing a t-shirt and shorts is playing golf .
1352398363.jpg| 3| A dirty child plays in the house
1354131040.jpg| 2| Fisherman with his daily catch on display , his product is fresh .
1355703632.jpg| 0| Young girl playing softball with white house in background
1355833561.jpg| 0| A man in an orange jacket playfully tosses a small girl into the air on an empty stretch of beach on an overcast day .
135608578.jpg| 2| A group of children dance and play instruments under colored lights .
135613639.jpg| 4| Two kids , a girl and a boy playing together .
1362097957.jpg| 0| A woman sits in a chair under a tree and plays an acoustic guitar .
1362128028.jpg| 1| Three children squeeze into a plastic tub filled with water and play .
1362794608.jpg| 0| A man crawls through a playground plastic tube towards a little girl with red-hair .
1362851262.jpg| 2| man sitting in a wild life scene playing with a polar bear .
1362882269.jpg| 4| A man splashes playfully in a lake .
1362987900.jpg| 1| A man in a black hat sits by a tree and plays guitar .
1363343745.jpg| 3| People playing in the water with a water bike .
136358691.jpg| 0| Two men are sitting on the floor under a staircase playing guitars .
1365896144.jpg| 1| A woman in blue and purple clothing playing pool .
1371076688.jpg| 4| A silhouette of a kid playing on a beach .
137453681.jpg| 0| A group of young adolescents in yellow shirts play with colored food .
1377668044.jpg| 3| Man playing with a brown dog on a dirt path .
138043357.jpg| 0| One man sits inside and plays the banjo , there are trees behind him outside .
138235288.jpg| 3| A woman looking at wood items that are on display .
1386251841.jpg| 0| A woman is looking at a display case with three outfits on a backdrop of bright yellow .
1386964743.jpg| 1| a boy is playing with a camera whilst standing on a dirt track .
1388970365.jpg| 0| Three dogs , two black one brown , are playing in a grass field .
1390254777.jpg| 0| A street musician standing on stilts playing a tuba outside in front of a mural of people kissing .
1390860274.jpg| 0| A boy in an orange life vest plays on the shore with his net while his father in a red shirt and straw hat fishes .
139245992.jpg| 2| A man in jeans at the beach playing with a red ball .
139252428.jpg| 0| A woman and her daughter plays on the beach while the father watches in joy .
1393707375.jpg| 0| Two girls appear to be playing a very competitive chess game with each other .
1394276597.jpg| 1| A group of female musicians is playing in front of a building with an open instrument case in front of them .
1394599090.jpg| 4| A father and a child are playing in the pool
1394673080.jpg| 1| Two mimes are playing tug-of-war while a dog is running between them .
1394796089.jpg| 0| A band with saxophones and trombones are preparing to play music .
1395107023.jpg| 3| A young man playing with a public gaming console .
1395173766.jpg| 1| A group of women dressed in black playing musical instruments in front of a large building .
1395410911.jpg| 1| A man with a backpack stopping and looking at the display in the store .
1398957709.jpg| 0| A man wears a black cape in the parking lot of a building that has artwork displayed on the exterior .
1400091666.jpg| 0| A guy with long hair wearing a red shirt is playing guitar and smoking at the same time .
1400421768.jpg| 2| A man dressed in black is playing with a bar .
1401351228.jpg| 4| People looking at pictures on a display .
1402640441.jpg| 3| Young boy plays ball on the beach .
1402641725.jpg| 2| Four children playing in the sand at a beach .
1405005999.jpg| 4| Several girls are playing darts .
1405221276.jpg| 0| Two dogs are shaking off water while playing with a ball on the edge of a body of water .
1405650076.jpg| 2| A little boy is hiding underneath a table on the street that is displaying fruit .
14072289.jpg| 0| A man is showing a peace sign as he plays a game in a crowded room at a casino .
140732943.jpg| 1| A man with long hair and a beard plays a guitar .
1408677769.jpg| 1| A woman , dressed in a yellow blouse and black panties , is playing beach volleyball .
"1409041007.jpg| 0| A man in front of a "" KitchenAid "" display speaks to a group of people ."
1409801982.jpg| 1| A chef in white talks to guests about various tomato varieties over a display table of tomatoes and sauces .
141140165.jpg| 0| A young baseball player is pointing a finger in the face of a player on the other team .
1412318227.jpg| 0| A man wearing a green shirt with white stripes is playing the drums
1414520123.jpg| 0| A crew of chefs dressed in white proudly display an array of pastries .
1414779054.jpg| 0| A boy plays with outstretched arms on the sidewalk next to a cobblestone street .
1414820925.jpg| 3| A man in red swim trunks playing volleyball .
1415591512.jpg| 3| A girl is playing in the mud near a car .
141559699.jpg| 0| A little girl playing with a knob on a closet in a room and a little boy jumping on someone on a bed .
1417068537.jpg| 0| A man on the left speaks into a microphone , while a man on the right plays an unidentified instrument with a drum set in the background .
1417941060.jpg| 4| A baby plays with a young boys face .
142078565.jpg| 1| A man in a white shirt playing a black and white guitar .
1425013325.jpg| 0| Two dogs are playing with each other on a beach by the ocean .
1425069308.jpg| 0| Two dogs in a family room are playing , one is catching a ball in its mouth .
1425069590.jpg| 0| A small girl dressed in yellow wearing flip-flops climbing onto red playground equipment .
