image_name| comment_number| comment
50831436.jpg| 0| Two young men are playing a board game in the living room .
508335879.jpg| 0| A man wearing a blue cap with a white long-sleeve shirt and blue pants is playing golf .
508560560.jpg| 0| A man in a black shirt plays the guitar surrounded by drinks .
5086096800.jpg| 2| A boy crouching behind some small logs playing paintball .
5088801071.jpg| 1| Four men wearing T-shirts and playing musical instruments perform in a band .
508929192.jpg| 0| Three young boys playing badminton , with a fence in the background .
5091113794.jpg| 0| A man with a mustache and a black shirt is playing the saxophone .
509200598.jpg| 2| Two big black dogs play with each other in the grass .
509241560.jpg| 1| A group of children are playing near a statue .
5094276864.jpg| 0| A young boy in a blue football uniform is running with a football tucked under his arm as three other football players pursue him .
5094295894.jpg| 0| Three children in football uniforms of two different teams are playing football on a football field , while another player and an adult stand in the background .
509778093.jpg| 0| a brown and white dog has is playing with a white ball on the grass .
509985875.jpg| 1| A man in a collared shirt playing the trumpet on a street corner .
509985881.jpg| 1| A man in a black shirt is holding playing music on a street .
5105522629.jpg| 0| Three men , in front of microphones , are playing their guitars , in front of the man in the middle is a child 's xylophone .
5105885364.jpg| 1| A young man playing with two small children in a park or field , both of whom have bright red-hair .
510791586.jpg| 0| A young girl playing in the water with others watching in the background .
5108562132.jpg| 0| A woman is singing and playing the piano , at what appears to be a concert or event .
5109044966.jpg| 1| A little boy is wet from playing and screaming from the streaming water while holding a toy puppy .
5114288800.jpg| 1| A child is doing a handstand on a green lawn outside where several people are playing .
51145703.jpg| 3| Two women and a young man play a game around a table .
51148570.jpg| 0| Adults take a group of kids to an active outdoor area with lots of trees , where they watch a man play an ethnic instrument that he created .
5117317939.jpg| 1| Many tables displaying different national flags are assembled in a conference hall with people mingling or sitting .
511921542.jpg| 0| A tennis player with a blue headband and blue shirt , is hitting a tennis ball with a racket .
512031915.jpg| 0| A black puppy is playing with an orange on a carpeted floor .
512309690.jpg| 1| Woman wearing white , sitting in front of a stone wall , playing a string instrument .
512634877.jpg| 0| A dog wearing a harness is playing with red ball in a grassy area .
5135010022.jpg| 0| A man wearing glasses and a ragged costume is playing a Jaguar electric guitar and singing with the accompaniment of a drummer .
5135072759.jpg| 0| A man in a red coat and a fedora is playing a trumpet while fellow musicians sit nearby .
5138003138.jpg| 1| Two young women are playing volleyball , one has jumped into the air to hit the ball .
5140330069.jpg| 1| A group of people who look to be of all descents playing with some form of fireworks .
514073775.jpg| 1| Children play outside of a building trying to catch large bubbles .
5142968059.jpg| 0| A male musician dressed in black with a guitar pick in his mouth performs during a concert playing the guitar looking out at the crown with a back drop of a single stage light and Jumbo screens .
514320594.jpg| 3| The family play at the coast in the water .
5149869859.jpg| 3| Young Team of Basketball players winning the game .
515165357.jpg| 1| A man in a red t-shirt and khakis plays the hand drums for a crowd of people .
"5152631402.jpg| 0| Four people and three dogs are standing along a concrete planter near an intersection playing music in front of an open guitar case with a sign saying "" Traveling . """
5159056173.jpg| 3| The children are looking at the display in the museum .
516201581.jpg| 2| A band is outside playing cylindrical instruments .
516214924.jpg| 4| A dog playing with a ball .
516394876.jpg| 0| A person wearing a homemade storm trooper helmet looking at a display of candy .
5167341516.jpg| 2| A tattooed woman plays the guitar and sings while her band stands in the back .
516761840.jpg| 1| Two young girls wearing skirts are playing in a garden .
5169120032.jpg| 2| A family sitting around a table playing with iPads in the street
51691739.jpg| 1| A three-member band is playing on stage .
517102724.jpg| 2| A black dog plays around near a waterfall .
518144037.jpg| 0| A blond boy with a long purple Mohawk is playing the violin .
5181862374.jpg| 4| An infant plays in an inflatable pool toy .
5181863160.jpg| 0| A little boy wearing swim trunks plays in the ocean .
518602687.jpg| 1| A man sings into a microphone while playing an electric keyboard .
518789868.jpg| 3| A boy is playing in a dark theater near the stage .
5188555891.jpg| 0| An older man , who is sitting in front of a creek , is displaying root vegetables on three sacks .
519061891.jpg| 2| A small boy wearing a blue shirt plays in the kiddie pool .
519167484.jpg| 3| A girl in a pink dress plays with a hula hoop .
5192912743.jpg| 1| Two smaller children playing with a soccer ball with a rocky background .
519346101.jpg| 3| A young girl in brown pants trying to play tennis .
5196768578.jpg| 0| The little girl played happily in the snow while warmly bundled in a soft pink winter hat and mittens .
5197289352.jpg| 0| Football players in blue and yellow uniforms , with orange numbers , are trying to keep the ball from the approaching players , dressed in white uniforms with red numbers .
5199369569.jpg| 0| A young boy in an orange shirt considers how he can ride his bike and play kickball .
5207964886.jpg| 0| Children are playing doctor on an older woman , one is wearing a toy stethoscope , the other a red mickey mouse shirt .
5214515583.jpg| 0| Three men wearing leather apparel performing in a concert , two singing with microphones and the center artist playing the electric guitar , with lights shining on them , with large screen images behind them and a drum set in the background .
5214588693.jpg| 0| A football player in a gold helmet and white uniform crashes into another player in a gold and blue uniform .
5215150958.jpg| 2| A darkly dressed woman wearing glasses leans on the beverage display in a grocery store .
5217116.jpg| 0| A man is playing a guitar , while someone else is sitting at a drum set , and there is a baby sitting on the floor next to a keyboard .
5218165254.jpg| 0| Three men and one woman sit in a public area , in front of a map , playing music on guitars and drums .
5218695756.jpg| 0| A worker in a striped orange , gray , and white t-shirt hovers over a stand that is displaying different kinds of flat bread .
5220933373.jpg| 1| Two children inside a house standing on furniture , playing pirates .
522486784.jpg| 0| One brown and one mostly black dog are either playing or fighting .
522652105.jpg| 1| A little girl plays in a pit of colorful balls .
5227179820.jpg| 0| A blond-headed female child playing with toys on a purple surface .
5228334906.jpg| 1| A child wearing blue tee-shirt playing with an orange pinata without a blindfold .
5234416671.jpg| 1| A baby is lying on the floor playing with his toy truck .
5234657740.jpg| 1| A man who is playing electric guitar in front of a backdrop with planes .
5235619020.jpg| 1| A basketball player is taking a foul shot as his teammates and the opposing team watch .
5238123569.jpg| 0| A bearded male musician in a red flannel shirt is holding a microphone in front of a keyboard , while a female guitar player plays in the background .
5238492471.jpg| 3| An old guitar player without a shirt on is pointing , sweating .
5240342253.jpg| 0| A man playing guitar , a man playing the keyboard , and a woman singing are on a smokey-hazed stage .
524282699.jpg| 3| Two dogs playing on a rocky beach .
5243694558.jpg| 0| An older woman with a little girl toddler looking at a white and red dollhouse and playing with it .
5244864049.jpg| 0| A man in a white shirt playing a white guitar standing in front of a microphone with the light casting a somewhat reddish hue on his shirt
5246144737.jpg| 4| The kids are outside playing in the sunshine .
5246531712.jpg| 0| A street hockey team plays on an asphalt court cleared from a snowy landscape .
5247590430.jpg| 0| A woman in an oversized black shirt plays a black and red guitar in a musky room .
524862138.jpg| 1| A boy with a red hat noticeably shocked by the spinning of a playground toy .
5248756214.jpg| 0| A man , wearing a cap , is pushing a cart , on which large display boards are kept , on a road .
525538142.jpg| 1| Two boys are playing in the sand at a playground .
525544514.jpg| 1| A formally dressed man walking on a sidewalk , playing an acoustic guitar .
525649435.jpg| 0| A brown-haired man with glasses , playing a guitar in an apartment studio .
525944769.jpg| 0| A cello player and a violinist getting ready for their performance in an elegant room .
5265654043.jpg| 1| An injured football player on crutches , wearing a red white and blue uniform , looks towards the sky .
526619673.jpg| 1| A boy is playing a game with his friends .
5279140646.jpg| 4| One female and one male playing a game of bowling
528645220.jpg| 2| There children are outside playing , with two boys smiling and running .
52886928.jpg| 0| Three young men play a game of monopoly to pass time .
52898654.jpg| 2| Children playing Chinese hopscotch or something similar .
5291335711.jpg| 0| A little sitting down on a chair in front of a table wearing goggles and playing with some cylinders .
5291613581.jpg| 1| A very young boy is playing with a large yellow shovel around Christmas time .
5293561334.jpg| 3| a young person with short dark hair is playing a piano
5293561716.jpg| 0| An Asian boy in a brown jacket sitting at a black piano playing it .
5294552333.jpg| 4| Some men are playing ball on the beach .
5301963559.jpg| 0| Middle Eastern band , with the focus on the trumpet player .
5302864546.jpg| 0| People are playing instruments next to a piano while a person in a white coca-cola shirt watches .
530454257.jpg| 0| A little boy , in a camouflage jacket , looks at a display of many yellow rubber ducks .
5310484815.jpg| 0| Two little boys , one with blue pants and shirt , and the other with blue shirt and gray pants , are playing with Thomas the Train toys on a hardwood floor .
5311725126.jpg| 2| An older adult playing with a little boy in a lake with boats in the distance .
532131603.jpg| 3| A dog peeks out of a red play tunnel .
532396029.jpg| 0| A little girl with blond-hair is playing and splashing in a mud puddle .
532574313.jpg| 1| Little boy in orange shirt and black pants is playing in a park pond with his toy .
532999240.jpg| 0| A brown and white dog plays with a ball in the dirt .
5330052101.jpg| 0| Four men are playing dominoes and two of the men are wearing baseball caps .
5331830799.jpg| 2| A red lit stage with a guitarist and a drummer playing .
5335780437.jpg| 0| A brunette female in her early twenties wearing modern , rectangular glasses with black rims , points at some faintly visible scribbling on what looks like either a dry-erase board or a museum display of children 's scribbles .
5336013973.jpg| 1| Men from an Eastern nation playing volleyball in the sand .
533602654.jpg| 4| Two children play beneath a metal statue .
5337563702.jpg| 2| A young girl is playing with a toy octopus in front of her Christmas tree .
533854547.jpg| 2| Three children playing with a group of ducks .
5338568818.jpg| 0| three people play in the snow with a forest in the background .
5338988058.jpg| 0| Band playing in a dark room , with the center member singing and playing a red guitar ; keyboardist behind him to the left with another guitar player on the right .
5340461911.jpg| 1| A female basketball player in a white uniform is shooting a free throw .
5340490372.jpg| 2| A young child is jumping from one bed to another while 2 other children are playing .
5341071664.jpg| 0| Rival female basketball teams are playing a game in front of an audience at an indoor arena .
534200447.jpg| 3| Two girls playing catch on a lawn
5346389945.jpg| 3| A warmly dress child plays in a glacier .
534655560.jpg| 0| A little girl wearing a hat , playing surrounded by a wheelbarrow with wood in the background and a building .
5348464501.jpg| 0| A series of boats are anchored on a sandy beach with trees , while some kids play with the sand in front of them .
535123126.jpg| 0| Two dogs , both wearing collars , are playing with one another in the grass .
5352278538.jpg| 0| Someone is skateboarding while the other two boys are playing with small toys .
5352437063.jpg| 0| A person playing with a black dog outdoors on a snowy lane with trees in the background and blue skies above .
535529555.jpg| 3| Two dogs play with a Frisbee on the lawn .
5356236664.jpg| 0| A boy in a red plaid button-up shirt playing a guitar , with another boy playing an orange bass behind him , and another person playing a drum set .
53614287.jpg| 0| A boy wearing a shirt with the Simpsons character , Ralph Wiggum , plays a Nintendo DS with his sister .
5363903246.jpg| 0| A man in playing the guitar with a glare of the sun in the background .
5364849864.jpg| 1| A hockey player in a black jersey is going after the puck while being surrounded by hockey players in white jerseys .
5365075444.jpg| 3| Two children are playing with a bicycle .
5369771639.jpg| 0| Two male soccer players in lime green uniforms passing the ball to each other .
5371507831.jpg| 3| A young girl playing in a gutter on the side of a road .
537532165.jpg| 0| A child playing on the monkey bars at a playground with an adult present .
537579448.jpg| 1| A little girl in a pink hat is playing with a soccer ball .
5379229830.jpg| 0| A young woman in glasses swings on a child 's play set with the sun behind her at a park .
5381043783.jpg| 0| A street band consisting of four men is playing on the side of a street with a donation hat at their feet .
5381043991.jpg| 1| Band on a stage playing instruments and singing while crowd watches .
5381102989.jpg| 0| A group of musicians inside of a living room with white walls and brown rugs playing their music .
5381104643.jpg| 1| A woman in a purple shirt playing an instrument .
5385069995.jpg| 0| Four musicians playing reed instruments with one playing a clarinet and three playing saxophones , being watched by a young child on a bicycle .
5385135432.jpg| 1| Men in Scottish garb walk down the street , three playing drums and another playing the bagpipes .
5386097747.jpg| 0| A man playing the drums and a man sitting down behind him playing the guitar while outside at sunset .
539218410.jpg| 2| A man in blue shirt and pants stands in front of a large sign displaying a yak .
539493423.jpg| 0| A man is holding three things on fire in front of a child 's playground .
539493431.jpg| 0| The guy is holding a black stick in front of a playground .
53955170.jpg| 3| Two young girls are playing , one behind the other .
539659873.jpg| 2| Young girls having fun playing on a ribbon carousel .
539705321.jpg| 2| Two teams of children , one in red and the other in white , are playing soccer .
539744890.jpg| 0| A man holding a young boy so he can cross the monkey bars at the playground .
539750844.jpg| 2| A dog tries to play with a ball that is tossed to it .
539761097.jpg| 3| A young boy plays with a sleeping tan dog .
539801139.jpg| 0| A little boy playing in the water while its raining and an adult while an adult holds his hand
5398619523.jpg| 0| A group of 5 kids are dressed in winter apparel playing in the snow .
539881707.jpg| 0| A curly-haired man and a woman in a black tank top both play guitars and sing at a festival .
5403369219.jpg| 0| A small girl in a jean skirt and green shirt plays outside in the grass with an orange and white soccer ball .
5403632578.jpg| 2| A man in a green sweater and hat plays red upright bass on a city street .
5403972062.jpg| 3| young children playing in a green field of grass .
540604040.jpg| 0| A small child with a ponytail dressed in jean shorts and a pink and brown shirt climbs on a pole near wooden playground equipment .
5406927495.jpg| 1| A woman wearing a purple shirt plays a guitar on a crowded sidewalk .
5408820009.jpg| 1| A young girl with long brown hair and a red sled plays in the snow .
541046380.jpg| 4| Two young girls play together in a mall .
5412119890.jpg| 1| Asian-American little girl wearing blue jeans and a flowery shirt playing with a flower on the ground .
5415557808.jpg| 2| A marching band plays in a park .
5415557940.jpg| 1| A man sitting playing guitar and mouth piece at the same time .
5415761675.jpg| 2| A group of six children are about to play ping-pong .
5415762131.jpg| 0| Two men dressed in white are playing tennis in front of a small crowd .
5416571561.jpg| 0| Three children playing in a snowstorm , while a fourth child jumps from a small hill .
5416898306.jpg| 0| Two children playing on a black rope climbing toy with people eating at a restaurant behind them .
5423080316.jpg| 1| A young boy around the age of 13 is playing in the snow and has a snowshoe on his leg , and is running
542317719.jpg| 0| A young boy wearing a red coat is playing in a long tunnel .
542389533.jpg| 1| A group of African children display symbols written on chalkboards in the middle of a dirt field .
542714962.jpg| 1| Several young men are playing volleyball ; one is jumping .
542850900.jpg| 4| Young boy playing with rocks .
5428747894.jpg| 0| Three old women are in a hallway looking at items in glass display cases .
543102698.jpg| 1| A little boy in a red shirt plays with a park telescope while a girl in a pink skirt watches .
543291644.jpg| 2| A woman dancing with a bottle of water to the band playing behind her .
5433157092.jpg| 0| An Asian band , whose guitarist is shown near the right and those drummer is shown on the left , plays in a venue lit with blue rope lightning and a reddish cattle skull wall fixture .
543940240.jpg| 1| These children are playing on a trampoline outdoors .
544122267.jpg| 1| A girl in a green shirt is playing on a swing .
5442112383.jpg| 4| A small baby girl looking outside of the storefront window while she plays with her toys .
5452434213.jpg| 1| A boy in a red denim jacket plays in the sand with a flag in it .
5456046008.jpg| 0| This little girl , her blond-hair held back by a red band , sticks her tongue out playfully at the camera .
5460845581.jpg| 0| A basketball player in white takes a jump shot while a blue defender jumps to block his shot while teammates watch in the background .
5466266163.jpg| 4| Group of children play together .
5470620936.jpg| 0| A young man , wearing a T-shirt that says Joplin , plays the guitar in front of a large amplifier .
549520317.jpg| 2| The little boy has a red coat on as he plays outside .
5500138655.jpg| 0| Two older men in big jackets are playing a game of air hockey together .
5500695312.jpg| 3| Paper crafts on display for a small group of people on a snowy day .
5503955724.jpg| 0| Stretching high in the air , the player in the black shirt reaches for the football as the other stretches toward him to steal it away .
5506383509.jpg| 0| 4 kids playing , one in a red dress one in a pink shirt , one in a white shirt and a little boy with his arm through a green toy .
5506399373.jpg| 4| A group of kids playing on bicycles on a trial .
5506988830.jpg| 1| A group of small children horseplay while waiting outside a home .
5507087401.jpg| 3| A little boy is playing with a toy gun .
5511461225.jpg| 1| Two girls lay stomach-down in the grass while sharing headphones to an mp3 player .
5512062568.jpg| 0| A red-haired girl , wearing a gray shirt , is playing on a tire swing along with her friend , whom is wearing a pink shirt .
5518762083.jpg| 1| Two children play in the snow ; one is watching the other roll a gigantic snowball .
5518762299.jpg| 3| A little boy playing in a dogs bowl while the dog looks on .
5518763793.jpg| 1| Two boys , one wearing green , the other in yellow , are playing with sidewalk chalk , drawing pictures on the ground .
5519356022.jpg| 1| Two children , a male and a female , playing doctor and nurse , pretending to care for a baby .
5520203447.jpg| 1| Three guys , one playing the guitar , one playing the keyboard accordion and one playing the violin .
5523001543.jpg| 1| A man wearing a black jacket plays on his smartphone , while the little girl next to him wearing a scarf and blue jacket reads a book .
5526795355.jpg| 0| A man whose face has been painted silver with white stripes plays the violin while dressed in a red cloak and hat .
553918837.jpg| 1| A girl in pink slides down the slide at a playground .
5543458745.jpg| 1| A tattooed female guitar player wearing a purple dress hugs and kisses a young girl in a pink dress .
554774472.jpg| 0| Two children play in the water of an above-ground pool .
5549756426.jpg| 0| a man with long hair on stage playing an keyboard with a mic in front of him .
555014891.jpg| 0| A man with khaki clothes is sitting next to a large fruit display comprised mainly of watermelons .
5558170783.jpg| 4| Two kids playing in the snow .
5558777621.jpg| 0| A man in a hat and torn pants plays a violin while sitting on a bucket in front of large windows .
5561301943.jpg| 1| A grocer wearing a black and white apron stands in front of his display case in a market .
5563446889.jpg| 0| A group of people in a band while marching and playing their instruments in the streets entertaining others .
556568556.jpg| 2| A little kid plays on the swing at the playground .
5574382134.jpg| 3| Little girl playing with two rocks .
557721978.jpg| 1| Girl playing in a puddle with her bare feet .
5582659196.jpg| 1| Two men , one in red and one in blue , playing a sport in a grassy area .
5583005407.jpg| 0| A group of people playing cricket outside among ornate stonework pavilions .
5583674969.jpg| 0| A man in a suit is playing a musical instrument on stage with lighted background .
5583837367.jpg| 1| Two ladies , one dressed in purple and one in blue , are playing London Bridges outside with a group of children .
5586190109.jpg| 3| A college group of students playing a game of Jenga .
5587932348.jpg| 2| A woman dressed in cosplay outside showing off for the camera .
5589693661.jpg| 0| A young adult woman is standing next to a display in a candy store .
559102835.jpg| 0| Two boys are playing with a soccer ball on a sports field .
5594417687.jpg| 0| A soccer player standing on the soccer field has his eyes trained on the soccer ball .
5602731697.jpg| 4| A group of men are carrying playground equipment .
5602737557.jpg| 0| 3 people ( 2 male 1 female ) are replacing the wood chips at a playground , using wheelbarrows .
560278886.jpg| 0| The soccer player in the checked shirt is moving the ball pursued by the players on the other team .
5610848512.jpg| 3| The boy is playing a game of volleyball on the beach .
5611391594.jpg| 1| Two men playing ball , one white one black , with the black one leaping towards the right side of the frame .
5611717202.jpg| 0| A variety of adults and children are sitting around a table with many Nintendo DSes attached to the table and also playing them .
561199893.jpg| 0| A man wearing sunglasses , a black shirt and gray jeans is playing guitar on stage with a band .
561204294.jpg| 0| Six children are playing a board game accompanied with cups and are facing toward the left of the camera while the Asian boy is grinning at the camera and a girl and a grown man are talking in the back .
5614228719.jpg| 0| A man dressed in a traditional Native American attire is playing an instrument native to his people .
5614715384.jpg| 1| A happy woman quite stands in front of a business that displays a closed sign and looks very animated .
5615654150.jpg| 4| A woman is dressed up like playing cards for some type of parade .
"5615711650.jpg| 2| Two women playing in front of a door labeled "" The Castle Keep "" ."
5620724486.jpg| 0| A young lady with wild blond-hair is playing the electric guitar on the stage .
5621180809.jpg| 0| Four children in bathing suits play on a beach lined with rock and foliage , while other people are visible in the background .
5621600104.jpg| 1| A soccer player in a red uniform is about to kick the ball .
562588230.jpg| 2| A little girl plays in a blow up pool .
5626262792.jpg| 0| Band members on a stage and playing guitars jump in the air to entertain a crowd of fans .
5626622789.jpg| 0| Two actors , playing Jasmine and Aladdin , sit on the magic carpet as they act out scenes from Aladdin .
5629300.jpg| 1| A little boy is playing with a ball while sitting on a rug that is on the grass .
5629464725.jpg| 0| A band playing a live performance with a guitarist , bassist , and drummer all in black shirts .
5633758879.jpg| 0| A gray-haired man is playing an accordion while squatting against a cement wall with a crowd of people in the background .
563508330.jpg| 0| Two women playing musical instruments ; one plays violin and the other play a wind instrument .
5635975939.jpg| 0| An artist is depicted singing into her microphone with her drummer anxiously waiting to play in the background .
5637994240.jpg| 0| A young boy plays with the contents of a pantry and a cash register , pretending he runs a grocery store .
